"2";"en: angličtina";"FIC: beletrie";"NOV: próza";"X: neuvedeno";"X: neuvedeno";"<s> Někoho Drakova přemrštěná arogance a sebestředné usměvavé kouzlo mohou přitahovat";"všemu navzdory ,";"“ zavolala za ní Diana . </s><s> „ Taková dívka si"
"2";"cs: čeština";"NMG: publicistika";"LEI: volnočasová publicistika";"X: neuvedeno";"INT: zajímavosti ze světa";"bohatý na zmíněný vitamin . </s><s> Céčko rovnou do žíly </s><s> Všem";"studiím navzdory ale";"pověst céčka neutrpěla a jeho obliba stoupá . </s><s> A současnému"
"2";"nl: nizozemština";"FIC: beletrie";"NOV: próza";"X: neuvedeno";"X: neuvedeno";"námi citronový odér … chtěl jsem ji utěšit , sám";"sobě navzdory —";"přes svou chladnost mě dojímala , byla ve své samomluvě"
"2";"cs: čeština";"FIC: beletrie";"VER: poezie";"X: neuvedeno";"X: neuvedeno";"<s> co během přednášky nachodí šest až osm kilometrů </s><s> svejm jaterním";"kruhům navzdory";"</s>  <s> Všichni kolem mě maj kruhy pod očima </s><s> Kruhy pod očima"
"2";"cs: čeština";"NMG: publicistika";"NEW: tradiční publicistika";"X: neuvedeno";"NTW: celostátní tisk";"okamžikem letošní kampaně pro něj nebyla řeč v americkém Kongresu";"Obamovi navzdory ani";"skandálky kolem jeho domácnosti . </s><s> Ve skutečnosti to byla zpráva"
"2";"cs: čeština";"FIC: beletrie";"COL: kratší próza";"X: neuvedeno";"X: neuvedeno";"<s> Měli s Jackem vlastně jediný plán . </s><s> Být spolu . </s>  <s>";"Všem navzdory .";"</s>  <s> A když to náhle nešlo , nevěděla , co má"
"2";"en: angličtina";"FIC: beletrie";"NOV: próza";"X: neuvedeno";"X: neuvedeno";"dost pravděpodobná možnost , a naučil jsem se fungovat tomu";"vědomí navzdory .";"</s>  <s> Jenže to , co mi ukázala Marieke – to bylo"
"2";"cs: čeština";"NMG: publicistika";"NEW: tradiční publicistika";"X: neuvedeno";"NTW: celostátní tisk";"operace společně odjedou do Londýna , kde se vezmou ,";"válce navzdory .";"</s>  <s> Jejich rodinné štěstí ale netrvá dlouho … </s><s> Více informací :"
"2";"cs: čeština";"NMG: publicistika";"NEW: tradiční publicistika";"X: neuvedeno";"NTW: celostátní tisk";"a nezodpovědnosti Západu . </s><s> Právě vám znovu vyšla kniha Všem";"sráčům navzdory ,";"věnovaná válce v Jugoslávii . </s><s> Nestává se často , aby"
"2";"cs: čeština";"NMG: publicistika";"NEW: tradiční publicistika";"X: neuvedeno";"REG: regionální tisk";"je při tom bývalý asistent Radoslava Látala Roman Vojvodík . </s>  <s>";"Starostovi navzdory";"</s>  <s> sedm dní očima šéfredaktora </s><s> Kvůli osobní nevraživosti znojemského starosty vůči"
"2";"cs: čeština";"NMG: publicistika";"NEW: tradiční publicistika";"X: neuvedeno";"NTW: celostátní tisk";"udržet oborové kvality , součástí normalizace , nebo vznikala spíše";"jí navzdory ?";"</s>  <s> Jak to chcete považovat za vzdor , když to tehdejší"
"2";"cs: čeština";"NMG: publicistika";"NEW: tradiční publicistika";"X: neuvedeno";"NTW: celostátní tisk";". </s><s> Barbar často zakopne a spadne , jde vlastní cestou";"ostatním navzdory ,";"občas sám musí do něčeho ( někoho ? ) kopnout"
"2";"cs: čeština";"NMG: publicistika";"LEI: volnočasová publicistika";"X: neuvedeno";"INT: zajímavosti ze světa";"v čele země , kam se prodral - všem slovním";"hrátkám navzdory -";"jako jasný pučista . </s><s> Místo toho se jen horko těžko"
"2";"cs: čeština";"NMG: publicistika";"LEI: volnočasová publicistika";"X: neuvedeno";"LIF: životní styl";". </s><s> Celestina , Nikki a Maritza se snaží studovat nepříznivému";"osudu navzdory .";"</s>  <s> Francouzské Marie Claire vyprávěly o naději , že večer budou"
"2";"cs: čeština";"NMG: publicistika";"NEW: tradiční publicistika";"X: neuvedeno";"NTW: celostátní tisk";"po zasedání poslaneckého klubu předseda občanských demokratů Petr Fiala . </s>  <s>";"Klausovi navzdory";"</s>  <s> V tu chvíli už bylo jasné , že – soudě"
"2";"cs: čeština";"NFC: oborová literatura";"SCI: odborná literatura";"HUM: humanitní vědy";"LAN: filologie";"vrátí / Stačí zavřít víčka / Zatnout zuby všem a";"všemu navzdory /";"On se vrátí / vysadí mě na koníčka / Přece"
"2";"de: němčina";"FIC: beletrie";"NOV: próza";"X: neuvedeno";"X: neuvedeno";"negři tančí za doprovodu hot jazzu “ . </s><s> Všem publicistickým";"útokům navzdory ovšem";"Flemming a Mackey - Twins smějí vystupovat dlouho . </s><s> Na"
"2";"cs: čeština";"FIC: beletrie";"VER: poezie";"X: neuvedeno";"X: neuvedeno";"<s> To Jen Já Sám Tu Ještě Jednou : Jsem A";"Všemu Navzdory ,";"Ach </s><s> JáSám : </s><s> — JáSám A JáSám ! — </s><s> Já"
"2";"en: angličtina";"NFC: oborová literatura";"MEM: memoáry, autobiografie";"MEM: memoáry, autobiografie";"MEM: memoáry, autobiografie";"k tomu jen chabé dispozice . </s><s> Naše činnost se rozvinula";"mně navzdory a";"především jako výsledek celé řady neočekávaných událostí a setkání i"
"2";"cs: čeština";"NFC: oborová literatura";"PRO: profesní literatura";"SSC: sociální vědy";"ECO: ekonomie, obchod, logistika";"Tsiprase , stejně jako komentář , proč by – tomu";"všemu navzdory –";"nebylo dobré Řeky z eura vyhodit . </s><s> Jen tak na"
"2";"es: španělština";"FIC: beletrie";"NOV: próza";"X: neuvedeno";"X: neuvedeno";"bludném kruhu . </s><s> Děkuji ti , že tu jsi ,";"všemu navzdory .";"“ </s><s> „ Bože , lásko , co jen s námi"
"2";"cs: čeština";"FIC: beletrie";"VER: poezie";"X: neuvedeno";"X: neuvedeno";"jistoty . </s><s> Tak dosud žiju opodál mimo logiku času a";"všemu navzdory .";"</s>  <s> Ano , i mne cosi uráží na té nemístné touze"
"2";"cs: čeština";"FIC: beletrie";"COL: kratší próza";"X: neuvedeno";"X: neuvedeno";"ramenou . </s><s> Zavřela oči , odhodlaná užít si ten moment";"všemu navzdory .";"</s>  <s> Za zavřenými víčky si představila , že je to Jack"
"2";"cs: čeština";"FIC: beletrie";"NOV: próza";"X: neuvedeno";"X: neuvedeno";"ale ostatní přátelé tátovi zůstanou . </s><s> Blízcí a důvěrní ,";"době navzdory .";"</s>  <s> Aspoň jednoho takového kdybych dnes měl , napadlo mě . </s>"
"2";"cs: čeština";"NFC: oborová literatura";"POP: populárně naučná literatura";"ITD: interdisciplinární";"ITD: interdisciplinární";"existovaly , některé sice zanikly , ale jiné dokázaly udržet";"všem navzdory dobrou";"kvalitu . </s><s> Nicméně po roce 2000 zjevně vstupujeme do éry"
"2";"cs: čeština";"NFC: oborová literatura";"SCI: odborná literatura";"HUM: humanitní vědy";"ANT: antropologie, etnografie";"ten prožitek , když něco běží mimo zkostnatělý režim ,";"jemu navzdory ,";"na protest proti němu : zažíttuatmosféru . </s><s> Nadšení tisíců lidí"
"2";"cs: čeština";"FIC: beletrie";"NOV: próza";"X: neuvedeno";"X: neuvedeno";"v boji je lepší , než polykat kapsle s jedem";"gestapu navzdory .";"</s>  <s> Aspoň pro vojáky . </s><s> Může být něco před půl sedmou"
"2";"cs: čeština";"NMG: publicistika";"NEW: tradiční publicistika";"X: neuvedeno";"NTW: celostátní tisk";"juniorek . </s><s> Porodnice posílají mimina do ústavů místo pěstounům . </s>  <s>";"Zákonu navzdory";"</s>  <s> Zoufalé matky , které se rozhodnou vzdát se svého dítěte"
"2";"cs: čeština";"NFC: oborová literatura";"SCI: odborná literatura";"HUM: humanitní vědy";"ANT: antropologie, etnografie";"však postavili na odpor a kněze v potyčce zranili . </s>  <s>";"Duchovnímu navzdory nařídil";"rychtář Wilhelm postavit strom znovu . 697 Kořeny obyčeje tví"
"2";"cs: čeština";"NMG: publicistika";"LEI: volnočasová publicistika";"X: neuvedeno";"SPO: sport";"jediným zástupcem klubu z hlavního města , který byl důležitému";"triumfu navzdory poněkud";"rozladěn . </s><s> Během rozhovorů s hráči pronesl své přání předseda"
"2";"cs: čeština";"NMG: publicistika";"NEW: tradiční publicistika";"X: neuvedeno";"NTW: celostátní tisk";"agresivně se Rusko chová na globální politické scéně ? </s><s> Právě";"tomu navzdory .";"</s>  <s> Právě teď . </s><s> Politické chování Ruska mi nemůže zabránit v"
"2";"cs: čeština";"NMG: publicistika";"NEW: tradiční publicistika";"X: neuvedeno";"NTW: celostátní tisk";"více zemí , někdy na hraně schengenských pravidel , jindy";"jim navzdory .";"</s>  <s> A samo Rakousko jen deset dní před sporem s Maďary"
"2";"cs: čeština";"FIC: beletrie";"NOV: próza";"X: neuvedeno";"X: neuvedeno";"věci začnou dít v souladu s Namim , a nikoliv";"jemu navzdory ?";"</s>  <s> Že by přece jen bylo možné , aby měl úplně"
"2";"cs: čeština";"NMG: publicistika";"LEI: volnočasová publicistika";"X: neuvedeno";"INT: zajímavosti ze světa";") tím , že z nich vytvoří lidské srdce . </s>  <s>";"Hranicím navzdory totiž";"tvoří společný organismus , v jehož rámci nedokáže jedna část"
"2";"cs: čeština";"FIC: beletrie";"VER: poezie";"X: neuvedeno";"X: neuvedeno";"smrt je trpělivost , trvání – ještě nějaký čas –";"sobě navzdory .";"</s>  <s> ( 8 . 9 . 2004 ) </s><s> Honila mě dnes"
"2";"cs: čeština";"NMG: publicistika";"NEW: tradiční publicistika";"X: neuvedeno";"NTW: celostátní tisk";"radikální myšlenkou budovy jako showroomu prezentujícího krajní možnosti betonu . </s>  <s>";"Předpisům navzdory tak";"vznikla monolitická stavba – tedy žádné sofistikované vícevrstvé stěny ,"
"2";"en: angličtina";"FIC: beletrie";"NOV: próza";"X: neuvedeno";"X: neuvedeno";"že něco udělal správně . </s><s> A možná k tomu došlo";"jemu navzdory .";"</s>  <s> Díval se z kuchyňského okna , jak odjíždějí , a"
"2";"es: španělština";"FIC: beletrie";"NOV: próza";"X: neuvedeno";"X: neuvedeno";"exilu ; ale Pellegrini si byl sám sebou jistý a";"kritikům navzdory snil";"o tom , že jednou bude trénovat v Premier League"
"2";"en: angličtina";"FIC: beletrie";"NOV: próza";"X: neuvedeno";"X: neuvedeno";"takových podmínkách odmítají lovit i chodit , a když se";"mužstvu navzdory vydá";"Cavendish ven sám , vrátí se o hodinu později s"
"2";"cs: čeština";"NMG: publicistika";"NEW: tradiční publicistika";"X: neuvedeno";"NTW: celostátní tisk";"velké vzdálenosti , protilodními a protiletadlovými raketami i – drsnému";"klimatu navzdory –";"tisíci vojáky . </s><s> Pro Rusy je to dlouhodobá investice . </s>"
"2";"en: angličtina";"FIC: beletrie";"NOV: próza";"X: neuvedeno";"X: neuvedeno";"dojít ještě dál . </s><s> Po pěti nebo šesti odbočkách se";"kompasu navzdory úplně";"ztratí . </s><s> A už si je docela jistej , že"
"2";"cs: čeština";"NFC: oborová literatura";"POP: populárně naučná literatura";"SSC: sociální vědy";"LAW: právo";"slova odkudsi ze svých útrob , jak je vrhala nepřátelskému";"světu navzdory :";"</s>  <s> „ Chtěla mě dostat do hrobu – a to se"
"2";"en: angličtina";"FIC: beletrie";"NOV: próza";"X: neuvedeno";"X: neuvedeno";"Brownleeho neuvěřitelné smůle a o své touze se hlavně a";"všemu navzdory dostat";"v pořádku domů . </s><s> Je vyčerpaný , ale nespí ,"
"2";"cs: čeština";"NFC: oborová literatura";"POP: populárně naučná literatura";"HUM: humanitní vědy";"PHI: filozofie, náboženství";", „ aby dějiny nepřekročily odpoledne Velkého pátku “ . </s>  <s>";"Jim navzdory však";"do tmy zrady , viny , bolesti a smrti ,"
"2";"cs: čeština";"FIC: beletrie";"NOV: próza";"X: neuvedeno";"X: neuvedeno";"voněl za všech okolností ! </s><s> Hynek by se voněl každé";"tragédii navzdory !";"</s>  <s> Jeho vůně , to je její přístav . </s><s> Všechny vůně"
"2";"cs: čeština";"NMG: publicistika";"LEI: volnočasová publicistika";"X: neuvedeno";"SCT: společenský život";". </s><s> Obdivuji ho čím dál víc ! "" </s><s> JEZDÍ TRABANTEM";"VŠEM NAVZDORY";"</s>  <s> Ne každý svůj sen uskuteční , ovšem no novinář a"
"2";"cs: čeština";"NMG: publicistika";"LEI: volnočasová publicistika";"X: neuvedeno";"SPO: sport";", Bayern ) a znovu se třese na finále . </s>  <s>";"Těžkostem navzdory .";"</s>  <s> Odvetu čtvrtfinále rozhodl až gól z kontroverzní penalty v 97"
"2";"cs: čeština";"NMG: publicistika";"NEW: tradiční publicistika";"X: neuvedeno";"REG: regionální tisk";"zůstane i v budoucnu , všemu navzdory , opakuji ,";"všemu navzdory ,";"součástí Evropské unie , Severoatlantické aliance , zkrátka západního civilizačního"
"2";"en: angličtina";"NFC: oborová literatura";"SCI: odborná literatura";"HUM: humanitní vědy";"HIS: historie, biografie";"čekal mnoho let na probuzení duše , „ jež se";"všemu navzdory zdálo";"být pravděpodobnější na straně postupu vstříc budoucnosti a na straně"
"2";"cs: čeština";"NMG: publicistika";"NEW: tradiční publicistika";"X: neuvedeno";"NTW: celostátní tisk";"dioses ( Rozhovory s bohy ) , je tudíž láska";"válce navzdory .";"</s>  <s> Příběh , který podle autora vychází ze „ tří skutečných"
"2";"cs: čeština";"FIC: beletrie";"NOV: próza";"X: neuvedeno";"X: neuvedeno";"na to , že jsme si tu krásnou oázu vytvořili";"všem navzdory .";"</s>  <s> Navzdory rušné silnici před domem , pokáleným chodníkům , všudypřítomným"
"2";"cs: čeština";"NMG: publicistika";"NEW: tradiční publicistika";"X: neuvedeno";"REG: regionální tisk";"věřím , že naše země zůstane i v budoucnu ,";"všemu navzdory ,";"opakuji , všemu navzdory , součástí Evropské unie , Severoatlantické"
"2";"cs: čeština";"NMG: publicistika";"LEI: volnočasová publicistika";"X: neuvedeno";"HOU: bydlení, zahrada, hobby";"prospěla víc než zázemí místa silně orientovaného na design . </s>  <s>";"DIKTÁTU NAVZDORY";"</s>  <s> Široké portfolio Aisslingerovy tvorby zahrnuje především nábytek do soukromých a"
"2";"en: angličtina";"FIC: beletrie";"COL: kratší próza";"X: neuvedeno";"X: neuvedeno";", aby sem lezl , peskoval se Arlen , ale";"slunci navzdory se";"narovnal v zádech . </s><s> Přes šaty měl tenký bílý hábit"
"2";"cs: čeština";"NMG: publicistika";"LEI: volnočasová publicistika";"X: neuvedeno";"INT: zajímavosti ze světa";"<s> Alespoň se tak zdá podle egyptských servilních médií , která";"realitě navzdory budují";"vládci pověst novodobého vševědoucího faraona . </s><s> Je nepopiratelné , že"
"2";"cs: čeština";"NMG: publicistika";"NEW: tradiční publicistika";"X: neuvedeno";"NTW: celostátní tisk";"1 USD 24,433 </s><s> V . BRITÁNIE 1 GBP 31,617 </s><s> LÁSKA";"VÁLCE NAVZDORY";"</s>  <s> NOVÝ FILM EMIRA KUSTURICI JE JAKO BALKÁNSKÝ KROJ PROTKÁN TŘEŠTIVOSTÍ"
"2";"cs: čeština";"NMG: publicistika";"LEI: volnočasová publicistika";"X: neuvedeno";"MIX: společnost";"smutným paradoxem , že v 21 . století se zdravému";"rozumu navzdory přepravují";"tisíce kontejnerů na kamionech nikoli po dálnici , která je"
"2";"cs: čeština";"NFC: oborová literatura";"PRO: profesní literatura";"SSC: sociální vědy";"POL: politika, vojenství";"více šetřit na nadcházející hubenější roky , nebo naopak tomu";"všemu navzdory nadále";"investovat , co se ještě dá ? </s><s> Před dvěma roky"
"2";"cs: čeština";"FIC: beletrie";"COL: kratší próza";"X: neuvedeno";"X: neuvedeno";"<s> Když jsem se už druhou hodinou bezúspěšně snažil usnout ,";"únavě navzdory ,";"pustil jsem si nahrávku od Raisy a Tonraqa o jejích"
"2";"es: španělština";"FIC: beletrie";"NOV: próza";"X: neuvedeno";"X: neuvedeno";"harmonicky . </s><s> Dnes už vím , že všem porážkám a";"utrpení navzdory ,";"byl můj život krásný . </s><s> Ty totiž prožíváme všichni . </s>"
"2";"cs: čeština";"NMG: publicistika";"LEI: volnočasová publicistika";"X: neuvedeno";"LIF: životní styl";"tamní mladí dokumentaristé , kteří se soustředí na každodenní život";"válce navzdory .";"</s>  <s> OBNOVA PRAŽSKÉHO HRADU 1918 - 1929 </s><s> JAK VYPADALA PROMĚNA CENTRA"
"2";"cs: čeština";"NMG: publicistika";"NEW: tradiční publicistika";"X: neuvedeno";"NTW: celostátní tisk";"víkendu zvolí Blattera do svého čela i popáté , všem";"skandálům navzdory ,";"přitom musel počítat . </s><s> I základní znalosti aritmetiky bohatě postačily"
"2";"cs: čeština";"NFC: oborová literatura";"PRO: profesní literatura";"NAT: přírodní vědy";"AGR: zemědělství, chovatelství";"proměnit v příkladná hospodářství , která se opět a možná";"někomu navzdory stávají";"neodmyslitelnou součástí českého venkova , "" uzavírá předseda ASZ ČR"
"2";"en: angličtina";"FIC: beletrie";"COL: kratší próza";"X: neuvedeno";"X: neuvedeno";"zjišťovat , že je nestálý a netrpělivý , své klidné";"povaze navzdory .";"</s>  <s> Chodila bruslit v čase , kdy býval vzhůru . </s><s> Představoval"
"2";"cs: čeština";"FIC: beletrie";"VER: poezie";"X: neuvedeno";"X: neuvedeno";"že by prázdno hladu radši uvítal , než aby trval";"sobě navzdory .";"</s>  <s> Trýznivý sen </s><s> Zdá se mi občas trýznivý sen , že"
"2";"en: angličtina";"FIC: beletrie";"SCR: drama";"X: neuvedeno";"X: neuvedeno";"… ale i volnost , která mi , všem domácím";"pracím navzdory ,";"dovolovala zkoumat svět kolem sebe a případně si vymýšlet svět"
"2";"cs: čeština";"NMG: publicistika";"NEW: tradiční publicistika";"X: neuvedeno";"REG: regionální tisk";"FOTO / MAFRA </s><s> Vila se stala památkou . </s><s> Městu i";"silnici navzdory";"</s>  <s> Ministerstvo kultury rozhodlo , že vilu v prachatické Nádražní ulici"
"2";"cs: čeština";"NMG: publicistika";"LEI: volnočasová publicistika";"X: neuvedeno";"LIF: životní styl";"nejistota a móda reaguje snahou cítit se dobře právě celkové";"situaci navzdory .";"</s>  <s> Oblečení , které vás donutí pořádně se vyparádit a vyrazit"
"2";"cs: čeština";"NMG: publicistika";"LEI: volnočasová publicistika";"X: neuvedeno";"SCT: společenský život";"to tu bude vždycky . </s><s> Lidé se tím budou cpát";"mně navzdory .";"“ </s><s> Zdeněk Pohlreich </s><s> Říká se , že až Češi stvořili"
"2";"en: angličtina";"FIC: beletrie";"NOV: próza";"X: neuvedeno";"X: neuvedeno";", že to rozhodnutí bylo její a že je učinila";"jemu navzdory .";"</s>  <s> Kate má neodbytné podezření , že jí manipuluje , stále"
"2";"cs: čeština";"NMG: publicistika";"NEW: tradiční publicistika";"X: neuvedeno";"NTW: celostátní tisk";"Hercegovině byl válečným zpravodajem . </s><s> Napsal mimo jiné knihy Všem";"sráčům navzdory aneb";"Válka , o které nechcete nic vědět ( 1996 ,"
"2";"ru: ruština";"FIC: beletrie";"COL: kratší próza";"X: neuvedeno";"X: neuvedeno";". </s><s> Bezbřehé ničemnictví ruského života . </s><s> Kdy se život odehrává";"životu navzdory .";"</s>  <s> Kdy je zoufalství povzneseno do výšin hrdinských skutků a celonárodní"
"2";"cs: čeština";"NFC: oborová literatura";"PRO: profesní literatura";"NAT: přírodní vědy";"MED: lékařství";"jsou lidé , kteří „ zajetým “ kolejím a veřejnému";"mínění navzdory chtějí";"věci dělat jinak a posouvat tak péči dopředu . </s><s> Dnes"
"2";"cs: čeština";"NMG: publicistika";"NEW: tradiční publicistika";"X: neuvedeno";"NTW: celostátní tisk";"od 15 . 00 . </s><s> Online reportáž na . </s><s> Postup";"porážce navzdory Český";"tým ( v bílém Satoranský ) s Řeky sice prohrál"
"2";"cs: čeština";"NMG: publicistika";"NEW: tradiční publicistika";"X: neuvedeno";"NTW: celostátní tisk";"v něm zřejmě pokračovatele vize jednotného jugoslávského státu , politické";"realitě navzdory .";"</s>  <s> Debata doprovázející cenu pro Handkeho nastolila zásadní otázku . </s><s> Má"
"2";"cs: čeština";"FIC: beletrie";"NOV: próza";"X: neuvedeno";"X: neuvedeno";"výsměchu nenávistné , puritánské společnosti , i ona vychová Agnes";"všem navzdory .";"</s>  <s> Agnes je její perla . </s><s> Černá perla . </s><s> 25 </s><s> V"
"2";"pl: polština";"FIC: beletrie";"COL: kratší próza";"X: neuvedeno";"X: neuvedeno";"špatnou pověst . </s><s> Bere energii . </s><s> Drtí . </s><s> Je postavena";"lidem navzdory .";"“ </s><s> U vchodu do Muzea současného umění vítá návštěvníky bílý"
"2";"cs: čeština";"FIC: beletrie";"COL: kratší próza";"X: neuvedeno";"X: neuvedeno";"<s> A lezli . </s><s> Dobývali skály : jakoby času a všemu";"zlému navzdory .";"</s>  <s> Byla tu třeba věž Kobyla , jejíž podoba nemá nikde"
"2";"en: angličtina";"FIC: beletrie";"NOV: próza";"X: neuvedeno";"X: neuvedeno";"bude mít především se svým bratrem Darem , který je";"všemu navzdory stále";"přesvědčen , že všichni Caveovi si své prokletí a příšernou"
"2";"cs: čeština";"FIC: beletrie";"VER: poezie";"X: neuvedeno";"X: neuvedeno";"<s> Nic než proud . </s><s> Prudce kupředu a v tom už";"sobě navzdory ,";"strmě proti svému toku . </s><s> Ze svého opaku síly dorážejí"
"2";"cs: čeština";"NMG: publicistika";"LEI: volnočasová publicistika";"X: neuvedeno";"SPO: sport";"po pauze . </s><s> I v Plzni to nebylo špatné ,";"prohře navzdory ,";"“ připomínal . </s><s> „ Sedlo si to . </s><s> Výborná práce"
"2";"cs: čeština";"NMG: publicistika";"NEW: tradiční publicistika";"X: neuvedeno";"NTW: celostátní tisk";"jako ten vzdálený svět za oceánem , globalizaci a všeobjímajícímu";"internetu navzdory .";"</s>  <s> West v téže písni tvrdí , že pro ďábla pracoval"
"2";"cs: čeština";"NMG: publicistika";"LEI: volnočasová publicistika";"X: neuvedeno";"MIX: společnost";"“ NEBO „ OMEZOVÁNÍ OSOBNÍ SVOBODY “ . </s><s> SCÉNÁŘ 1 </s>  <s>";"ZÁKONU NAVZDORY";"</s>  <s> Zpřísnění právní kvalifikace pojmu znásilnění toho změní jen málo a"
"2";"cs: čeština";"NMG: publicistika";"NEW: tradiční publicistika";"X: neuvedeno";"NTW: celostátní tisk";"Babiš </s><s> ministr financí na konferenci Fórum českého stavebnictví </s><s> DONALD TUSK";"POLSKU NAVZDORY";"</s>  <s> Předsedou Evropské rady bude zítra s největší pravděpodobností znovu zvolen"
"2";"cs: čeština";"NMG: publicistika";"NEW: tradiční publicistika";"X: neuvedeno";"NTW: celostátní tisk";"během krize snižují . </s><s> Proč tedy úspory rostou nízkým úrokovým";"sazbám navzdory ?";"</s>  <s> Pomiňme , že asi třetině Čechů po zaplacení běžných nákladů"
"2";"cs: čeština";"NMG: publicistika";"NEW: tradiční publicistika";"X: neuvedeno";"NTW: celostátní tisk";"Schengenu , jak evropská pravidla velí , Německo – evropským";"pravidlům navzdory –";"uzavřelo hranici uvnitř schengenského systému . </s><s> Každý ví , že"
"2";"cs: čeština";"NMG: publicistika";"NEW: tradiční publicistika";"X: neuvedeno";"NTW: celostátní tisk";"straně síly . </s><s> Borat , Ali G i Bruno byli";"všemu navzdory pozitivními";"postavami , které divák mohl mít rád . </s><s> Nové identity"
"2";"cs: čeština";"NMG: publicistika";"LEI: volnočasová publicistika";"X: neuvedeno";"INT: zajímavosti ze světa";"z jeho gumáků vždy utahoval , Aldridge je zarytě nosil";"všem navzdory :";"prostě se v nich cítil pohodlně , zdály se nezničitelné"
"2";"cs: čeština";"NFC: oborová literatura";"PRO: profesní literatura";"SSC: sociální vědy";"ECO: ekonomie, obchod, logistika";"a především tato čísla znamenají více peněz pro vydavatele . </s>  <s>";"APPLU NAVZDORY";"</s>  <s> Každopádně to vypadá , že Facebook pomalu , ale jistě"
"2";"cs: čeština";"FIC: beletrie";"VER: poezie";"X: neuvedeno";"X: neuvedeno";"Hory , Člověk Mizí , </s><s> Mraky Tam Vlají Jak Prapory";"Všemu Navzdory ,";"</s>  <s> A Smrtelník Si Žádá Nové Mízy Z Hořců A Vřesovišť"
"2";"cs: čeština";"NMG: publicistika";"NEW: tradiční publicistika";"X: neuvedeno";"NTW: celostátní tisk";"Benjaminova sběratelská praxe buržoazním výdobytkem „ falešného vědomí “ . </s>  <s>";"Marxistům navzdory však";"Benjamin tvrdí , že právě sběratelství je čistou manifestací lidského"
"2";"cs: čeština";"NMG: publicistika";"LEI: volnočasová publicistika";"X: neuvedeno";"INT: zajímavosti ze světa";"sofistikovaná , dovedou kaloni to samé , co netopýři . </s>  <s>";"Učebnicím navzdory .";"</s>  <s> Létající lišky </s><s> Kaloni patří spolu s netopýry do řádu letounů"
"2";"cs: čeština";"NMG: publicistika";"LEI: volnočasová publicistika";"X: neuvedeno";"LIF: životní styl";"tradičně zabývá mezilidskými vztahy , na něž nahlíží nejen všem";"trapasům navzdory s";"humorem , ale hlavně s všechápající láskou , kterou chová"
"2";"cs: čeština";"NMG: publicistika";"NEW: tradiční publicistika";"X: neuvedeno";"REG: regionální tisk";"a jednatřicetiletý ofenzivní hráč byl přeřazen do béčka . </s><s> VÝHRA";"KAUZE NAVZDORY .";"</s>  <s> Tohle se stalo ještě před důležitým soubojem proti Liberci . </s>"
"2";"cs: čeština";"NFC: oborová literatura";"POP: populárně naučná literatura";"ITD: interdisciplinární";"ITD: interdisciplinární";"ani samotného hnízda a vyplení je zuřivým obránkyním a jejich";"žihadlům navzdory .";"</s>  <s> Jarní hnízda , ve kterých se krčí jen královna a"
"2";"cs: čeština";"NMG: publicistika";"NEW: tradiční publicistika";"X: neuvedeno";"NTW: celostátní tisk";", se zdržel pouhý jeden den . </s><s> Zelený byznys kvete";"policii navzdory";"</s>  <s> Spektakulární zásah proti provozovatelům growshopů je z české mapy nevymazal"
