"2";"en: angličtina";"FIC: beletrie";"NOV: próza";"X: neuvedeno";"X: neuvedeno";"<s> Někoho Drakova přemrštěná arogance a sebestředné usměvavé kouzlo mohou přitahovat";"všemu navzdory ,";"“ zavolala za ní Diana . </s><s> „ Taková dívka si"
"2";"cs: čeština";"NMG: publicistika";"NEW: tradiční publicistika";"X: neuvedeno";"NTW: celostátní tisk";"je , že to nejspíš není díky škole , ale";"škole navzdory .";"</s>  <s> LN Radikální kritici současné podoby vzdělávání často používají slovo „"
"2";"fr: francouzština";"FIC: beletrie";"NOV: próza";"X: neuvedeno";"X: neuvedeno";"ne nějaký mocenský panák . </s><s> Skončil na pozici velitele sám";"sobě navzdory ,";"jen díky výsledkům a skvělému hodnocení . </s><s> Kasdan se několikrát"
"2";"cs: čeština";"NFC: oborová literatura";"PRO: profesní literatura";"NAT: přírodní vědy";"AGR: zemědělství, chovatelství";"PŘEDPOVĚDI DALŠÍHO PŘEŽITÍ LIDSTVA NA ÚZEMÍ ČESKÉ REPUBLIKY . </s><s> VŠEM";"KALAMITÁM NAVZDORY ,";"SKUTEČNÝM I SMYŠLENÝM , ZEMĚDĚLCI SE MUSELI „ POCHLAPIT “"
"2";"cs: čeština";"NMG: publicistika";"NEW: tradiční publicistika";"X: neuvedeno";"NTW: celostátní tisk";"ve své době vydávalo skvělé umělecké plody – tvrdým politickým";"poměrům navzdory .";"</s>  <s> Fuková byla svébytná osobnost , která se dokázala prosadit ,"
"2";"cs: čeština";"NFC: oborová literatura";"PRO: profesní literatura";"FTS: formální a technické vědy";"TEC: technika";"navrhuje pálit nehořlavé odpady . </s><s> Recyklace má být stále Popelkou";"Evropě navzdory “";". </s><s> CHYBU JE TŘEBA OPRAVIT </s><s> Pokud tedy chceme jako Česká"
"2";"es: španělština";"FIC: beletrie";"NOV: próza";"X: neuvedeno";"X: neuvedeno";"označit za lásku . </s><s> Byla to přitažlivost , pociťovaná prakticky";"všemu navzdory ,";"snad výzva , dokonce by mohlo jít o lehkou zamilovanost"
"2";"cs: čeština";"NMG: publicistika";"NEW: tradiční publicistika";"X: neuvedeno";"NTW: celostátní tisk";"své občany k veřejnému blahu , třebas i násilím a";"jim navzdory ,";"se vzdal jakékoliv snahy a rodinu a manželství spíše rozeštvává"
"2";"cs: čeština";"NMG: publicistika";"NEW: tradiční publicistika";"X: neuvedeno";"NTW: celostátní tisk";"tam ale byl , dalo by se říct , sobě";"samému navzdory .";"</s>  <s> Jeho angažovanost neplynula u něj ze společenské ambice a dravosti"
"2";"sv: švédština";"FIC: beletrie";"NOV: próza";"X: neuvedeno";"X: neuvedeno";"i o větší část své váhy , ale ležel tam";"všemu navzdory ,";"naplněný zuřivostí a civěl do zdi tak dlouho , dokud"
"2";"cs: čeština";"NMG: publicistika";"NEW: tradiční publicistika";"X: neuvedeno";"REG: regionální tisk";"Ludvík už ale vzkázal , že festival žije dál ,";"starostovi navzdory .";"</s>  <s> Vojtěch Smola , </s><s> aktuální fotografie a videa na </s><s> Jihovýchodní křídlo"
"2";"da: dánština";"FIC: beletrie";"NOV: próza";"X: neuvedeno";"X: neuvedeno";"<s> Milion je spousta peněz , ale oni to zvládnou . </s>  <s>";"Všemu navzdory .";"</s>  <s> Isabela už byla mimo hru . </s><s> To bylo z Ráchelina"
"2";"cs: čeština";"NFC: oborová literatura";"POP: populárně naučná literatura";"HUM: humanitní vědy";"LAN: filologie";"uklidňovat fakt , že dobrá literatura bude vznikat i líným";"médiím navzdory .";"</s>  <s> Zhruba řečeno je celé dílo kombinací hyperrealistického líčení autorova života"
"2";"ru: ruština";"FIC: beletrie";"COL: kratší próza";"X: neuvedeno";"X: neuvedeno";"hlavě rodí často : A co kdyby všeho nechal a";"všemu navzdory jen";"pil a pil ? </s><s> A v takové situaci se ocitl"
"2";"cs: čeština";"NMG: publicistika";"NEW: tradiční publicistika";"X: neuvedeno";"NTW: celostátní tisk";"může dokázat , pak Sláma k nim rozhodně – slepičímu";"humoru navzdory –";"patří . </s><s> WWW . </s><s> RESPEKT . </s><s> CZ / AUDIO </s><s> Možná"
"2";"ru: ruština";"FIC: beletrie";"NOV: próza";"X: neuvedeno";"X: neuvedeno";"nebo rozkoší deviantního sexu pod železnou pěstí tyranie a této";"tyranii navzdory .";"</s>  <s> Přece jen jsem vojenský pilot , honěný v otázkách taktiky"
"2";"cs: čeština";"NMG: publicistika";"NEW: tradiční publicistika";"X: neuvedeno";"NTW: celostátní tisk";"po čtrnáctiprocentní zisk v prosinci . </s><s> Největším faktorem růstu byl";"analytikům navzdory Donald";"Trump . </s><s> Co u amerických akcií čekat letos ? </s><s> Je"
"2";"cs: čeština";"FIC: beletrie";"COL: kratší próza";"X: neuvedeno";"X: neuvedeno";"<s> Možná ale zhrubla teprve po rozchodu se Slotou , kdy";"jemu navzdory založila";"vlastní národní stranu a bývalý parťák ji začal v médiích"
"2";"en: angličtina";"FIC: beletrie";"NOV: próza";"X: neuvedeno";"X: neuvedeno";"moc , což v něm probudilo téměř nesnesitelnou frustraci . </s>  <s>";"Všemu navzdory se";"však Necivilno upnulo k představě nezávislosti a odlišnosti . </s><s> Považovalo"
"2";"cs: čeština";"NMG: publicistika";"NEW: tradiční publicistika";"X: neuvedeno";"NTW: celostátní tisk";"dlužníci naučili s exekucemi žít . </s><s> Umějí se lépe uživit";"exekucím navzdory a";"zvykají si na nezdaněné příjmy a platby v hotovosti mimo"
"2";"cs: čeština";"NMG: publicistika";"NEW: tradiční publicistika";"X: neuvedeno";"NTW: celostátní tisk";"ostatní orgány našeho státu . </s><s> JAN POPELKA , starosta </s><s> Amerika";"Evropě navzdory";"</s>  <s> Donald Trump rozehrál několik partií , které mají podle jeho"
"2";"cs: čeština";"NMG: publicistika";"NEW: tradiční publicistika";"X: neuvedeno";"NTW: celostátní tisk";"vypiplal výraznou , specificky českou odnož nového cirkusu . </s><s> Hnědnoucí";"epoše navzdory vnesl";"do ní právě na Letní Letné i výraznou africkou sociální"
"2";"cs: čeština";"NMG: publicistika";"NEW: tradiční publicistika";"X: neuvedeno";"NTW: celostátní tisk";"“ </s><s> Krásně řečeno , Eugene ... pardon , Joshi . </s>  <s>";"TOTALITĚ NAVZDORY Stála";"na pódiu vedle Jana Wericha , Luciana Pavarottiho či Plácida"
"2";"pl: polština";"NFC: oborová literatura";"MEM: memoáry, autobiografie";"MEM: memoáry, autobiografie";"MEM: memoáry, autobiografie";"tím , že se od ní dokážu nějak odrazit a";"jí navzdory opěvovat";"hmatatelné formy , skoro jako vyzrálý Cézanne . </s><s> 25 ."
"2";"en: angličtina";"FIC: beletrie";"COL: kratší próza";"X: neuvedeno";"X: neuvedeno";"chovám podezření , že své nejlepší kousky stvořili spíš svému";"zlozvyku navzdory než";"jeho zásluhou . </s><s> Jediný hmatatelný materiál , který kdy díky"
"2";"cs: čeština";"FIC: beletrie";"NOV: próza";"X: neuvedeno";"X: neuvedeno";"o dalším postupu a udělá to tak , všem očividným";"překážkám navzdory .";"</s>  <s> „ Předpokládám , že až se zítra dostaneme na pevninu"
"2";"cs: čeština";"FIC: beletrie";"NOV: próza";"X: neuvedeno";"X: neuvedeno";"vždy představovala nejvýkonnější hnací motor její motivace — udělat něco";"Nejvyššímu navzdory ,";"dokázat mu , že pravdu mám já ; jejich přátelství"
"2";"cs: čeština";"NMG: publicistika";"NEW: tradiční publicistika";"X: neuvedeno";"NTW: celostátní tisk";"trochu jako exportovat české sovy do Atén . </s><s> Rozumný krok";"pravici navzdory";"</s>  <s> Konzervativci mohou slavit . </s><s> Posvátný institut rodiny byl včera výrazně"
"2";"de: němčina";"FIC: beletrie";"NOV: próza";"X: neuvedeno";"X: neuvedeno";"sem a tam . </s><s> Podívej se : Plavala jsem mořské";"krávě navzdory .";"</s>  <s> Plavala jsem ! </s><s> Jsem jediný člověk na bohem prokletém světě"
"2";"cs: čeština";"NMG: publicistika";"LEI: volnočasová publicistika";"X: neuvedeno";"SPO: sport";"Ten zápas je pro mě nejdůležitější vzpomínkou . </s><s> Všem získaným";"trofejím navzdory ,";"“ řekl Čech . </s><s> „ V tu chvíli mi došlo"
"2";"cs: čeština";"NMG: publicistika";"NEW: tradiční publicistika";"X: neuvedeno";"NTW: celostátní tisk";"do těchto strategických debat dobrým partnerem . </s><s> Animozitám veřejnosti vůči";"Polákům navzdory .";"</s>  <s> V příštím roce bude k nasazení kdekoli na světě připravena"
"2";"cs: čeština";"FIC: beletrie";"NOV: próza";"X: neuvedeno";"X: neuvedeno";"zedníků , kteří zalepili – pro věčnou Boží slávu a";"komunistům navzdory –";"alespoň to nejhorší , když jim při opravě kravína nebo"
"2";"fr: francouzština";"FIC: beletrie";"NOV: próza";"X: neuvedeno";"X: neuvedeno";". </s><s> Žluklému pachu krve , dívčinu šílenství a hlavně sobě";"samému navzdory to";"Marca dojímá . </s><s> Díval se na něj takhle vůbec kdy"
"2";"cs: čeština";"NMG: publicistika";"NEW: tradiční publicistika";"X: neuvedeno";"NTW: celostátní tisk";"Nizozemec Remon Vos . </s><s> Akciové trhy letos rostou . </s><s> Obchodním";"válkám navzdory";"</s>  <s> Světovým burzám se v dosavadním průběhu roku 2019 daří . </s>"
"2";"cs: čeština";"NMG: publicistika";"NEW: tradiční publicistika";"X: neuvedeno";"NTW: celostátní tisk";"<s> Odvětví s takzvanou rychlou módou se totiž daří všem geopolitickým";"krizím navzdory .";"</s>  <s> A třeba obrat španělské skupiny Inditex , největšího maloobchodního prodejce"
"2";"cs: čeština";"NFC: oborová literatura";"POP: populárně naučná literatura";"SSC: sociální vědy";"LAW: právo";"pomáhá jedincům či společnostem dosahovat pomocí tohoto řádu ( či";"jemu navzdory )";"jejich cílů . </s><s> Sám o sobě , bez klienta ,"
"2";"cs: čeština";"FIC: beletrie";"VER: poezie";"X: neuvedeno";"X: neuvedeno";"lopaty mlýnů do šiku . </s><s> A neštěkl pes . </s><s> Nissan </s>  <s>";"Čemu navzdory";"</s>  <s> v širokoplecé aleji ? </s><s> Za nějakou vsí jsem tě milovala </s>"
"2";"cs: čeština";"NMG: publicistika";"LEI: volnočasová publicistika";"X: neuvedeno";"INT: zajímavosti ze světa";"obrovské sochy z ledu . </s><s> AFGHÁNSKÉ CYKLISTKY : KRÁLOVNY SILNIC";"VŠEMU NAVZDORY";"</s>  <s> Členky afghánského reprezentačního týmu ženské silniční cyklistiky nešlapou jen proti"
"2";"cs: čeština";"NMG: publicistika";"LEI: volnočasová publicistika";"X: neuvedeno";"LIF: životní styl";"najít cestu , na níž může zažít něco pozitivního ,";"okolnostem navzdory ,";"“ radí Amy Morin . </s><s> 6 On mě bouchl ! </s>"
"2";"fr: francouzština";"FIC: beletrie";"NOV: próza";"X: neuvedeno";"X: neuvedeno";"se její stav bude dál zlepšovat , s čímž doktor";"všemu navzdory počítal";", ubohé děcko si nebude nic pamatovat . </s><s> Nanejvýš se"
"2";"cs: čeština";"NMG: publicistika";"NEW: tradiční publicistika";"X: neuvedeno";"REG: regionální tisk";"vždycky dosahují v případě dohody než při nějakém tlačení ideje";"všem navzdory .";"</s>  <s> V minulém období jsem se vlastně teprve seznamoval s komunální"
"2";"cs: čeština";"FIC: beletrie";"NOV: próza";"X: neuvedeno";"X: neuvedeno";"šířila bílá stužka mořské pěny , téměř fosforeskující , a";"tmě navzdory jasně";"viditelná . </s><s> Jenže teď tma ustupovala . </s><s> Měsíc byl ještě"
"2";"cs: čeština";"NFC: oborová literatura";"POP: populárně naučná literatura";"SSC: sociální vědy";"PSY: psychologie";"řečeno , jak účelně pracovat se svými klienty a pacienty";"jí navzdory .";"</s>  <s> Jednu poučku mám ale pořád pohotově . </s><s> Vezměme si třeba"
"2";"cs: čeština";"NMG: publicistika";"LEI: volnočasová publicistika";"X: neuvedeno";"SCT: společenský život";"a charitou je tedy čím dál pevnější , „ blbé";"náladě “ navzdory .";"</s>  <s> I my jsme šťastní , že můžeme být součástí dobrých"
"2";"cs: čeština";"NMG: publicistika";"NEW: tradiční publicistika";"X: neuvedeno";"NTW: celostátní tisk";", jde ale o běh na poměrně dlouhou trať . </s>  <s>";"Nejistotám navzdory ,";"nabízí se paralela s valdštejnským „ závisti navzdory “ –"
"2";"cs: čeština";"NMG: publicistika";"LEI: volnočasová publicistika";"X: neuvedeno";"LIF: životní styl";". </s><s> Sportovní podprsenka , adidas , 1099 Kč 4 . </s>  <s>";"SLUNCI NAVZDORY Kšiltovka";"z jarní running kolekce s reflexním pásem bude stínit a"
"2";"cs: čeština";"NMG: publicistika";"LEI: volnočasová publicistika";"X: neuvedeno";"MIX: společnost";", které mohou vrozené dispozice zesilovat nebo zeslabovat . </s><s> Prostě";"vědě navzdory bude";"zřejmě pořád tak trochu platit to stokrát omílané , že"
"2";"it: italština";"FIC: beletrie";"NOV: próza";"X: neuvedeno";"X: neuvedeno";"honili své klobouky ; bosé děti , jak si ,";"zimě navzdory ,";"hrály na plachetnice s hadry , jimiž se normálně přikrývaly"
"2";"cs: čeština";"NMG: publicistika";"LEI: volnočasová publicistika";"X: neuvedeno";"INT: zajímavosti ze světa";"řemeslné výrobky i nejrůznější suvenýry či oděvy . </s><s> 3 Masovému";"turismu navzdory Takhle";"nějak musely vypadat známější thajské ostrovy před přibližně třiceti lety"
"2";"cs: čeština";"NMG: publicistika";"NEW: tradiční publicistika";"X: neuvedeno";"NTW: celostátní tisk";"exekutoři hýčkaní . </s><s> I Messi mezi ně patří , úternímu";"kiksu navzdory .";"</s>  <s> „ Až dostaneme možnost penalty příště , Messi bude mít"
"2";"cs: čeština";"NMG: publicistika";"NEW: tradiční publicistika";"X: neuvedeno";"NTW: celostátní tisk";"nepředvídatelným elementem . </s><s> A prosazují v ní své zájmy dosavadním";"spojencům navzdory .";"</s>  <s> Evropa včetně nás to musí vzít na vědomí . </s><s> Po"
"2";"es: španělština";"FIC: beletrie";"NOV: próza";"X: neuvedeno";"X: neuvedeno";"s kostnatými obličeji zbrocenými potem a slzami , kteří se";"všemu navzdory usmívají";", aby jí poskytli útěchu . </s><s> Úsměvy chudých v Indii"
"2";"cs: čeština";"NFC: oborová literatura";"SCI: odborná literatura";"HUM: humanitní vědy";"MUS: hudba";"stejnému závěru došla například Vlasta Reittererová ve studii „ Festival";"všemu navzdory (";"O nových hudebních spolcích mezi dvěma válkami ) “ ,"
