"3";"en: angličtina";"FIC: beletrie";"NOV: próza";"X: neuvedeno";"X: neuvedeno";"chlapa tak pohltila . </s><s> Vím , že jsem byla pár";"měsíců mimo a";"že se poslední dobou všechno točí jenom kolem mě . </s>"
"3";"en: angličtina";"FIC: beletrie";"SCR: drama";"X: neuvedeno";"X: neuvedeno";"kapesníkem na tváři , pak postupně nemůže udržet smích .. </s><s>";"Hlasy mimo :";"„ Dobrou noc paní Crawfordová ' ap . </s><s> { Bettiina"
"3";"cs: čeština";"NMG: publicistika";"NEW: tradiční publicistika";"X: neuvedeno";"REG: regionální tisk";"stavby se budou odehrávat na dálnici D46 . </s><s> Jde o";"rekonstrukce mimo -";"úrovňových křižovatek v úseku Prostějov - jih u Žešova a"
"3";"cs: čeština";"NFC: oborová literatura";"POP: populárně naučná literatura";"FTS: formální a technické vědy";"TEC: technika";", neboť se shodná pouzdra mohou používat pro několik různých";"ráží ( mimo .";"223 Rem zejména 300 BLK , 6,5 </s><s> mm Grendel nebo"
"3";"cs: čeština";"NFC: oborová literatura";"POP: populárně naučná literatura";"FTS: formální a technické vědy";"ICT: výpočetní technika";"aby šly z každé antény signály jiným směrem a uplatnilo";"se MIMO .";"</s><s> Tak také zaručíte , že se k přijímači dostane alespoň"
"3";"cs: čeština";"NMG: publicistika";"NEW: tradiční publicistika";"X: neuvedeno";"NTW: celostátní tisk";", druhou v oslabení </s><s> Mountfield i včera postrádal čtyři zraněné";"útočníky , mimo jsou";"stále Cingel , Dragoun , Červený a Radovan Pavlík . </s>"
"3";"cs: čeština";"NMG: publicistika";"NEW: tradiční publicistika";"X: neuvedeno";"REG: regionální tisk";"zakončit . </s><s> A tak v 54 . </s><s> Malec pálil z";"vápna mimo ,";"v 56 . opět hosté nemířili přesně . </s><s> Srbice pak"
"3";"cs: čeština";"NMG: publicistika";"NEW: tradiční publicistika";"X: neuvedeno";"NTW: celostátní tisk";", že to byla náhoda . </s><s> Dáte první nebo dvě";"rány mimo ,";"ale pak to najedou jde , “ usmál se Jan"
"3";"cs: čeština";"NMG: publicistika";"NEW: tradiční publicistika";"X: neuvedeno";"NTW: celostátní tisk";"povolení a požadavky politiků ze sedmé městské části jsou podle";"něj „ mimo časově";", ekonomicky i místně “ . </s><s> Obě strany ovšem zdůrazňují"
"3";"cs: čeština";"FIC: beletrie";"COL: kratší próza";"X: neuvedeno";"X: neuvedeno";"šel k Halutzovi do kanceláře . </s><s> Předtím jsi byl několik";"měsíců mimo .";"“ </s><s> „ Ale … co svalová atrofie ? </s><s> Pokud jsem"
"3";"cs: čeština";"NMG: publicistika";"LEI: volnočasová publicistika";"X: neuvedeno";"SPO: sport";"své možnosti , hlavičku Vatajelua do středu branky a střelu";"Doležala mimo .";"</s><s> Na výrazné šance 2 : 2 , na góly 0"
"3";"cs: čeština";"NFC: oborová literatura";"SCI: odborná literatura";"HUM: humanitní vědy";"PHI: filozofie, náboženství";"textech J . - P . Sartra či Alberta Camuse";"se mimo -";"lidské bytí jeví zároveň jako ne - lidské , jako"
"3";"en: angličtina";"NFC: oborová literatura";"POP: populárně naučná literatura";"SSC: sociální vědy";"REC: sport, rekreace, hobby";"okraje kalíšku se přisaje k děložnímu hrdlu a zabrání protékání";"krve mimo .";"</s><s> Kalíšek pojme až 60 ml tekutiny , takže ho většina"
"3";"cs: čeština";"NFC: oborová literatura";"POP: populárně naučná literatura";"FTS: formální a technické vědy";"ICT: výpočetní technika";"co je to vlastně ten stream . </s><s> Jde především o";"funkci MIMO ,";"neboli vícenásobný vstup a vícenásobný výstup , která se dočkala"
"3";"en: angličtina";"FIC: beletrie";"NOV: próza";"X: neuvedeno";"X: neuvedeno";"? “ </s><s> „ Ne . </s><s> Promiň . </s><s> Jen jsem byla";"chvíli mimo .";"“ </s><s> Děvče ji obdařilo dalším úsměvem , tentokrát trochu veselejším"
"3";"en: angličtina";"NFC: oborová literatura";"SCI: odborná literatura";"HUM: humanitní vědy";"HIS: historie, biografie";"žádné nástroje , jak si uvedená kritéria vynutit u lidí";"stojících mimo ,";"a rozhodně v tomto směru nedosahovala úspěchu . </s><s> Za druhé"
"3";"cs: čeština";"NMG: publicistika";"NEW: tradiční publicistika";"X: neuvedeno";"REG: regionální tisk";". </s><s> Nechť až praxe ukáže , zda byli tvůrci podob";"terminálů mimo .";"</s><s> V nejhorším případě nám zůstane brblání u piva . </s><s> Odměnou"
"3";"cs: čeština";"FIC: beletrie";"NOV: próza";"X: neuvedeno";"X: neuvedeno";"místech , ve strmých roklích , někde dočista zastrčené ,";"zavalené , mimo .";"</s><s> Připadala si tak občas v uličkách rychlíků s vozíkem plným"
"3";"cs: čeština";"FIC: beletrie";"NOV: próza";"X: neuvedeno";"X: neuvedeno";"“ </s><s> „ Tři dny . “ </s><s> „ Byl jsem celou";"dobu mimo ?";"“ </s><s> „ Na chvíli jste se probudil . “ </s><s> „"
"3";"cs: čeština";"NMG: publicistika";"LEI: volnočasová publicistika";"X: neuvedeno";"SPO: sport";"střely na branku / do tyče 8 / 0 5";"střely mimo 5";"4 rohy 4 </s><s> GÁBOR KIRÁLY si sice umazal své skvostné"
"3";"fr: francouzština";"FIC: beletrie";"NOV: próza";"X: neuvedeno";"X: neuvedeno";"se nedalo vyhnout , raději řekla , že má nějakou";"schůzku mimo .";"</s><s> Věděla , že pro ostatní je přijatelnější dřívější odchod jako"
"3";"cs: čeština";"FIC: beletrie";"COL: kratší próza";"X: neuvedeno";"X: neuvedeno";"1876 založen „ chryzantémový řád “ , který se udílí";"za mimo -";"řádné zásluhy . </s><s> V posledních desetiletích se u nás staly"
"3";"en: angličtina";"NFC: oborová literatura";"POP: populárně naučná literatura";"HUM: humanitní vědy";"MUS: hudba";"co ne . </s><s> To co bychom potřebovali , je nechat";"mozek mimo ,";""" vysvětloval George . </s><s> I Want To Tell You ,"
"3";"cs: čeština";"NFC: oborová literatura";"PRO: profesní literatura";"FTS: formální a technické vědy";"TEC: technika";"v úseku žst . </s><s> Řikonín až žst . </s><s> Vlkov u";"Tišnova ( mimo )";"v délce necelých 11 km , svým charakterem je rekonstrukcí"
"3";"cs: čeština";"NMG: publicistika";"NEW: tradiční publicistika";"X: neuvedeno";"REG: regionální tisk";"s názvem Jak sluníčko přišlo na zem v podání klaunského";"divadla MIMO ,";"mladé potěší vystoupení hudební formace Boutique , oblíbená kapela Legendy"
"3";"cs: čeština";"NMG: publicistika";"LEI: volnočasová publicistika";"X: neuvedeno";"LIF: životní styl";"mou výzkumnou skupinu , ale pořád si chci držet tuhle";"nadstavbu mimo .";"</s><s> I s rizikem toho , že se ukáže , že"
"3";"cs: čeština";"NFC: oborová literatura";"PRO: profesní literatura";"FTS: formální a technické vědy";"ICT: výpočetní technika";"mobilního signálu je možno k AirCard 785 dokoupit tenkou externí";"anténu MIMO Antenna";"a dosáhnout tak až o 50 % vyšší citlivosti a"
"3";"cs: čeština";"NMG: publicistika";"LEI: volnočasová publicistika";"X: neuvedeno";"LIF: životní styl";"pomůcku , a to instituci levobočků : když někde zplodili";"dítě mimo ,";"třeba se služkou , tak se to prakticky nepočítalo . </s>"
"3";"cs: čeština";"NMG: publicistika";"NEW: tradiční publicistika";"X: neuvedeno";"NTW: celostátní tisk";"uplynulé půlstoletí a ženy ve volených úřadech hlav států či";"vlád ( mimo zůstali";"nevolení panovníci , jinak by díky Alžbětě II . suverénně"
"3";"en: angličtina";"FIC: beletrie";"SCR: drama";"X: neuvedeno";"X: neuvedeno";"pak začneš , třeba jen jednou , budeš v tu";"ránu mimo a";"na sračku , bude to rodeo , ne , Thomasi"
"3";"cs: čeština";"NFC: oborová literatura";"PRO: profesní literatura";"FTS: formální a technické vědy";"TEC: technika";"h v úseku Chotoviny ( mimo ) – Sudoměřice u";"Tábora ( mimo )";". </s><s> Projektové řešení stavby bylo v průběhu zpracování projektu částečně"
"3";"en: angličtina";"FIC: beletrie";"NOV: próza";"X: neuvedeno";"X: neuvedeno";"přesně jak jsem očekával , zareagoval na to povýšené zlehčování";"malé mimo zemšfanky";", když použila termínu ' nesmyslný ' . </s><s> Ten měl"
"3";"cs: čeština";"NMG: publicistika";"NEW: tradiční publicistika";"X: neuvedeno";"REG: regionální tisk";"odhadu lékařů má být Bořuta se zraněním v dolní části";"těla mimo přibližně";"měsíc . </s><s> Do Liberce naopak míří obránce Tomáš Hanousek ,"
"3";"cs: čeština";"FIC: beletrie";"COL: kratší próza";"X: neuvedeno";"X: neuvedeno";", “ přerušil ho Ligen . </s><s> „ Byl jsi pět";"let mimo .";"</s><s> A já nevěděl , jak tě z toho dostat ."
"3";"en: angličtina";"NFC: oborová literatura";"POP: populárně naučná literatura";"NAT: přírodní vědy";"PHY: fyzika";"a dostanete nesmysl – odpověď , která je o 120";"řádů mimo .";"</s><s> To neznamená , že temná hmota a energie jsou jakýmisi"
"3";"cs: čeština";"NFC: oborová literatura";"POP: populárně naučná literatura";"FTS: formální a technické vědy";"ICT: výpočetní technika";"práce se světlem detailů , 7 horší kresba , dostatek";"detailů , mimo ,";"ale často barevně zbytečně viditelně šumí 5 </s><s> plynulé , bez"
"3";"cs: čeština";"NMG: publicistika";"NEW: tradiční publicistika";"X: neuvedeno";"REG: regionální tisk";"projekt manažer Velehradu dětem . </s><s> Nabitý program ! </s><s> Klauni Klaunského";"divadla MIMO pobaví";"mini diskem a na své si přijdou i milovníci pohádek"
"3";"en: angličtina";"FIC: beletrie";"COL: kratší próza";"X: neuvedeno";"X: neuvedeno";"přátelé a údolí lásky , obklíčena slovy , o jednu";"dobu mimo .";"</s><s> Proč píšeme ? </s><s> Rozburácí se chór . </s><s> Protože nemůžeme jen"
"3";"cs: čeština";"NMG: publicistika";"LEI: volnočasová publicistika";"X: neuvedeno";"LIF: životní styl";". </s><s> Berete zpětně svoji nemoc , kdy jste byla skoro";"rok mimo ,";"jako nějaký zásadní zlom ? </s><s> Bylo vám třiatřicet – Kristova"
"3";"cs: čeština";"NMG: publicistika";"NEW: tradiční publicistika";"X: neuvedeno";"REG: regionální tisk";"liga , nároky jsou větší a já jsem byl půl";"roku mimo .";"</s><s> Jak probíhala jednání s Náchodem ? </s><s> Šlo vše hladce ? </s>"
"3";"en: angličtina";"FIC: beletrie";"NOV: próza";"X: neuvedeno";"X: neuvedeno";"rovnou se vrhneš do hry , když jsi byl skoro";"rok mimo ?";"“ </s><s> Rty zašeptám udivené rok ? </s><s> Michael pokrčí rameny . </s>"
"3";"cs: čeština";"NFC: oborová literatura";"POP: populárně naučná literatura";"SSC: sociální vědy";"ECO: ekonomie, obchod, logistika";"mýty a příběhy byly nezávislé na historickém čase , odehrávaly";"se mimo .";"</s><s> A do třetice , tyto kultury věřily , že zlatý"
"3";"cs: čeština";"FIC: beletrie";"SCR: drama";"X: neuvedeno";"X: neuvedeno";"a učesaný . ) </s><s> SAMUEL GOLDWYN </s><s> Celý den jsem z";"toho mimo .";"</s><s> Měl jsem mít dnes v knihovně besedu s dětmi . </s>"
"3";"cs: čeština";"NMG: publicistika";"NEW: tradiční publicistika";"X: neuvedeno";"NTW: celostátní tisk";"nyní už sehraní parťáci v barvách Gaziantepsporu . </s><s> Messi tři";"týdny mimo ,";"zase ho zradilo tříslo </s><s> BARCELONA / PRAHA – Zhruba tři"
"3";"en: angličtina";"FIC: beletrie";"NOV: próza";"X: neuvedeno";"X: neuvedeno";"Ten nikam nepůjde . </s><s> Díky mému kouzlu bude po zbytek";"noci mimo .";"“ </s><s> „ Má dar , stejně jako i ostatní ,"
"3";"cs: čeština";"NFC: oborová literatura";"PRO: profesní literatura";"FTS: formální a technické vědy";"TEC: technika";"VRT jen na 65 mílovém ( 105 km ) úseku";"Madera ( mimo )";"- Corcoran , nicméně zanedlouho byl ICS rozšířen více na"
"3";"cs: čeština";"NMG: publicistika";"LEI: volnočasová publicistika";"X: neuvedeno";"SCT: společenský život";"s časem , “ přidal jeho manažer Paska . </s><s> Čtvrt";"roku mimo ,";"to znamená na začátku května zpět v akci . </s><s> A"
"3";"cs: čeština";"NMG: publicistika";"NEW: tradiční publicistika";"X: neuvedeno";"NTW: celostátní tisk";"kávu . </s><s> Oba muži byli i přesto podle něj dlouhou";"dobu „ mimo “";", protože sprej je zasáhl zblízka . </s><s> iDNES . cz"
"3";"fr: francouzština";"FIC: beletrie";"NOV: próza";"X: neuvedeno";"X: neuvedeno";". </s><s> Ale zatím se ode mě držte dál , držte";"se mimo .";"</s><s> Nechci nakazit ani vás , ani nikoho jiného z kriminálky"
"3";"en: angličtina";"FIC: beletrie";"NOV: próza";"X: neuvedeno";"X: neuvedeno";". </s><s> „ Vypadá to , že ten chlap bude pár";"dní mimo ,";"“ dodal vampýr a zadíval se na mě pozorněji . </s>"
"3";"cs: čeština";"NMG: publicistika";"LEI: volnočasová publicistika";"X: neuvedeno";"SCT: společenský život";"kvalifikaci na Islandu 12 . června . </s><s> Nejprve se říkalo";"měsíc mimo ,";"pak dalších 5 týdnů . </s><s> V srpnu přišla operace a"
"3";"en: angličtina";"FIC: beletrie";"NOV: próza";"X: neuvedeno";"X: neuvedeno";"se nic měnit nemusí . </s><s> Tom je pravděpodobně až do";"března mimo ,";"kvůli tomu kotníku . “ </s><s> „ Pracuju na Carlosovi ,"
"3";"de: němčina";"FIC: beletrie";"NOV: próza";"X: neuvedeno";"X: neuvedeno";"“ „ Jsem mimo . </s><s> Zatím . “ </s><s> „ Jak";"mimo ? “ „ Mimo .";"</s><s> Neptej se , je to dost složitý . </s><s> Sama ještě"
"3";"cs: čeština";"NFC: oborová literatura";"POP: populárně naučná literatura";"SSC: sociální vědy";"ECO: ekonomie, obchod, logistika";"jaksi volně přeloženo , vyškrtnutý den , den pryč ,";"den mimo .";"</s><s> Při seznamování s jedním mým současným kamarádem jsem se jej"
"3";"cs: čeština";"NFC: oborová literatura";"ADM: administrativa";"ADM: administrativa";"ADM: administrativa";"musí být mimo PÚ ) . </s><s> V případě zahrání brankáře";"rukou mimo pok";". území následuje PK . </s><s> Při úmyslné „ malé domů"
"3";"en: angličtina";"FIC: beletrie";"NOV: próza";"X: neuvedeno";"X: neuvedeno";". </s><s> Proto tak vyvádím . </s><s> Vím , že jsem někdy";"kapku ... mimo .";"“ </s><s> „ Myslíš s tím sexem ? “ Zastavila jsem"
"3";"de: němčina";"NFC: oborová literatura";"MEM: memoáry, autobiografie";"MEM: memoáry, autobiografie";"MEM: memoáry, autobiografie";"bariéru odporu , ba dokonce otevřeného nepřátelství . </s><s> Zaparkovali jsme";"auto mimo ,";"na nestřeženém místě . </s><s> Naši asistenti už byli vyčerpaní po"
"3";"cs: čeština";"NMG: publicistika";"NEW: tradiční publicistika";"X: neuvedeno";"REG: regionální tisk";"tenis celý život , a proto bylo tak těžké ocitnout";"se mimo ,";"“ popsal . </s><s> Úlevu mu přinesla až letošní operace . </s>"
"3";"cs: čeština";"NMG: publicistika";"LEI: volnočasová publicistika";"X: neuvedeno";"SPO: sport";"tomu vezmete ještě zranění Joff reyho Lauvergneho , máme čtyři";"hráče mimo ,";"“ přiznal pro oficiální web Euroligy trenér Željko Obradovič . </s>"
"3";"cs: čeština";"NFC: oborová literatura";"MEM: memoáry, autobiografie";"MEM: memoáry, autobiografie";"MEM: memoáry, autobiografie";"Pedagogická fakulta UP Olomouc ) . </s><s> V roce 1949 přerušil";"pro mimo -";"řádné pracovní vytížení a zhoršení zdravotního stavu dálkové studium na"
"3";"de: němčina";"FIC: beletrie";"NOV: próza";"X: neuvedeno";"X: neuvedeno";"nový život na ostrově , mou devizou bylo „ držet";"se mimo “";". </s><s> „ Možná bere drogy , “ řekla Antje . </s>"
"3";"cs: čeština";"NMG: publicistika";"LEI: volnočasová publicistika";"X: neuvedeno";"SPO: sport";"střely na branku / do tyče 4 / 0 8";"střely mimo 0";"11 rohy 2 </s><s> NESPOKOJENÝ Ronaldo , proti Islandu počítal se"
"3";"cs: čeština";"NMG: publicistika";"NEW: tradiční publicistika";"X: neuvedeno";"NTW: celostátní tisk";"a toalety . </s><s> Podle Adámka bylo jediným schůdným řešením umístit";"je mimo .";"</s><s> „ Budova památníku , kterou chceme uvést do původního stavu"
"3";"en: angličtina";"FIC: beletrie";"NOV: próza";"X: neuvedeno";"X: neuvedeno";"se mnou mluví žena , která čeká dítě , dívá";"se mimo ,";"aby dítě nebylo tak škaredé jako já . “ </s><s> Odvrátil"
