"1";"cs: čeština";"NFC: oborová literatura";"POP: populárně naučná literatura";"FTS: formální a technické vědy";"ICT: výpočetní technika";"cenu domény . </s><s> CZ . </s><s> Nově přijde ročně na 145";"korun bez DPH";", místo dosavadních 125 Kč . </s><s> V současnosti je takových"
"1";"cs: čeština";"NFC: oborová literatura";"PRO: profesní literatura";"FTS: formální a technické vědy";"TEC: technika";"bez daně , v roce 2016 ještě méně 894 700";"korun bez DPH";". </s><s> Nové modernizované provedení pro letošní rok však už přesahuje"
"1";"cs: čeština";"NMG: publicistika";"NEW: tradiční publicistika";"X: neuvedeno";"NTW: celostátní tisk";"elektroinstalace slabo a silnoproudu . </s><s> Celková hodnota je 13 milionů";"korun bez DPH";". </s><s> Nově také v České Lípě Nové prostory ale budou"
"1";"cs: čeština";"NMG: publicistika";"NEW: tradiční publicistika";"X: neuvedeno";"NTW: celostátní tisk";"a bojová vozidla ( BVP 2 ) za 743 miliónů";"korun bez DPH";"od vsetínské zbrojovky ZVI . </s><s> Důvodem je , že její"
"1";"cs: čeština";"NMG: publicistika";"NEW: tradiční publicistika";"X: neuvedeno";"NTW: celostátní tisk";"Markéta Růtová . </s><s> Návratnost investice v hodnotě zhruba 11,5 milionu";"korun bez DPH";"se předpokládá za tři roky . </s><s> ROPID organizuje hromadnou dopravu"
"1";"cs: čeština";"NFC: oborová literatura";"POP: populárně naučná literatura";"FTS: formální a technické vědy";"ICT: výpočetní technika";"k tomu nejlevnějšímu vůbec . </s><s> Pokud se spokojíte se sledováním";"filmů bez HD";"rozlišení , za kompletní přístup k videotéce zaplatíte 8 eur"
"1";"cs: čeština";"NMG: publicistika";"NEW: tradiční publicistika";"X: neuvedeno";"NTW: celostátní tisk";"v praxi , funguje to ) . </s><s> Potěší i možnost";"rezervace bez storno";"poplatků – když vám do cesty náhodou něco přijde ,"
"1";"cs: čeština";"NFC: oborová literatura";"POP: populárně naučná literatura";"FTS: formální a technické vědy";"ICT: výpočetní technika";"můžete počítat s týdenní výdrží ( výrobce udává 9 dní";"provozu bez GPS";") . </s><s> Baterie se dobíjí prostřednictvím dodaného kabelu USB ,"
"1";"cs: čeština";"NMG: publicistika";"NEW: tradiční publicistika";"X: neuvedeno";"REG: regionální tisk";"427 udělených hlasů . </s><s> Nabídková cena nepřekročila 1 500 000";"korun bez DPH";". </s><s> Zahrnuje montáže a instalaci , pronájem , demontáž a"
"1";"cs: čeština";"NMG: publicistika";"NEW: tradiční publicistika";"X: neuvedeno";"NTW: celostátní tisk";", ačkoliv směrem k němu Hrad vysílá kritiku za utvoření";"koalice bez ANO";". </s><s> „ Souhlasím s tím , že s prezidentem musí"
"1";"cs: čeština";"NMG: publicistika";"NEW: tradiční publicistika";"X: neuvedeno";"NTW: celostátní tisk";"dvě ošetřovatelky . </s><s> Cena vozu byla stanovena na 760 tisíc";"korun bez DPH";", Praha by uhradila jen část . </s><s> Jenomže návrh se"
"1";"cs: čeština";"NFC: oborová literatura";"SCI: odborná literatura";"SSC: sociální vědy";"REC: sport, rekreace, hobby";"maličkostmi . </s><s> Skladba tréninku začíná odpovídat tréninku výkonnostních nebo vrcholových";"sportovců bez TP";". </s><s> Vývoj tréninku atleta s TP v závislosti na etapách"
"1";"cs: čeština";"NMG: publicistika";"NEW: tradiční publicistika";"X: neuvedeno";"NTW: celostátní tisk";"a dosud žádné se v dějinách neobešlo bez krveprolití a";"válek , bez velmi";"hluboké ekonomické a kulturní krize . </s><s> Obě vrstvy obyvatelstva ,"
"1";"cs: čeština";"NFC: oborová literatura";"PRO: profesní literatura";"NAT: přírodní vědy";"MED: lékařství";"ale ten se neujal ) . </s><s> Jennerovi byla terminologie malého";"národa ( bez impact";"faktoru ) málo nóbl , a protože aspiroval se svými"
"1";"cs: čeština";"NFC: oborová literatura";"PRO: profesní literatura";"FTS: formální a technické vědy";"TEC: technika";"a 1 . 4401 a systém Smartpress pak jedinečnou koncepcí";"spojů bez O";"- kroužku – umí s jistotou zaručit bezvadnou funkčnost po"
"1";"cs: čeština";"NMG: publicistika";"NEW: tradiční publicistika";"X: neuvedeno";"REG: regionální tisk";"milionů korun . </s><s> Přitom původní projekt počítal s částkou 198";"milionů bez DPH";"</s><s> „ V tuto chvíli platí termíny určené krajským úřadem ,"
"1";"cs: čeština";"NFC: oborová literatura";"PRO: profesní literatura";"FTS: formální a technické vědy";"TEC: technika";"Hochtief připadá 40 procent zakázky v celkové hodnotě 5,28 miliardy";"korun bez DPH";", M - Silnice mají na starosti zbývající pětinu kontraktu"
"1";"cs: čeština";"NFC: oborová literatura";"PRO: profesní literatura";"FTS: formální a technické vědy";"TEC: technika";"připočtení žlutozelených prvků opláštění , soch a střešních dílů různých";"rozměrů ( bez asi";"2 200 spojovacích trnů ) je počet prvků 2 450"
"1";"cs: čeština";"NMG: publicistika";"NEW: tradiční publicistika";"X: neuvedeno";"NTW: celostátní tisk";"lhůtu firmu pro třetí subjekt snadno založí za cenu 5500";"korun bez DPH";". </s><s> Tato cena je stanovena ministerskou vyhláškou a platí bez"
"1";"cs: čeština";"NMG: publicistika";"NEW: tradiční publicistika";"X: neuvedeno";"NTW: celostátní tisk";"stavbu nesežene dost prostředků – celkem má stát 46,4 miliardy";"korun bez DPH";". </s><s> „ Je to nejdražší možná varianta , “ poznamenal"
"1";"cs: čeština";"NMG: publicistika";"LEI: volnočasová publicistika";"X: neuvedeno";"MIX: společnost";"na topení a ohřev teplé užitkové vody zhruba 32 tisíc";"korun bez DPH";"za předpokladu , že je dům zateplen pouze základním způsobem"
"1";"cs: čeština";"NFC: oborová literatura";"SCI: odborná literatura";"SSC: sociální vědy";"SOC: sociologie";"si myslet , že dělají vědu . </s><s> Ale jít do";"terénu bez předem";"připraveného konceptu znamená , jít tam slepí jako králíčci . </s>"
"1";"cs: čeština";"NFC: oborová literatura";"SCI: odborná literatura";"NAT: přírodní vědy";"MED: lékařství";"se s následujícím vdechem ke snímači dostává čerstvá směs z";"okruhu , bez CO2";", křivka strmě klesá opět k bazální linii na konci"
"1";"cs: čeština";"NMG: publicistika";"NEW: tradiční publicistika";"X: neuvedeno";"NTW: celostátní tisk";". </s><s> Pokryje větší část celkových nákladů ve výši 594 tisíc";"korun bez DPH";". </s><s> Práce by měly skončit v letošním roce . </s><s> Lokalita"
"1";"cs: čeština";"NFC: oborová literatura";"POP: populárně naučná literatura";"FTS: formální a technické vědy";"ICT: výpočetní technika";"jsem byl mile překvapený , jak moc klesl počet nepodařených";"hovorů , bez VoLTE";"se totiž fallback do nižších sítí nepodaří vždy . </s><s> U"
"1";"cs: čeština";"FIC: beletrie";"VER: poezie";"X: neuvedeno";"X: neuvedeno";"do </s><s> sněhu bože ty víš hledám samostatný </s><s> neprůchozí pokoj bez";"vánic bez";"</s><s> ostrých kamenů na dně hledám víru naději les </s><s> hledám zrcadlo"
"1";"cs: čeština";"NMG: publicistika";"NEW: tradiční publicistika";"X: neuvedeno";"NTW: celostátní tisk";"na Vizovicku začal sloužit motoristům . </s><s> Stavba za 187 miliónů";"korun bez DPH";"má vyřešit problémy se silnicí úzkou pro kamióny a s"
"1";"cs: čeština";"NMG: publicistika";"NEW: tradiční publicistika";"X: neuvedeno";"NTW: celostátní tisk";"2019 . </s><s> Za desetiletou správu plánuje stát zaplatit 29 miliard";"korun bez DPH";". </s><s> Úředníci však očekávají , že se konečnou cenu podaří"
"1";"cs: čeština";"NMG: publicistika";"NEW: tradiční publicistika";"X: neuvedeno";"NTW: celostátní tisk";"do Německa . </s><s> Katody údajně nakoupil při obchodování uvnitř Evropské";"unie bez DPH";"a bez DPH je rovněž do stejné unijní země prodal"
"1";"cs: čeština";"NMG: publicistika";"NEW: tradiční publicistika";"X: neuvedeno";"REG: regionální tisk";"celková kapacita dvora . </s><s> Odhadovaná částka investice činí jedenáct milionů";"korun bez DPH";". </s><s> Provoz sběrného dvora by měl být i nadále pro"
"1";"cs: čeština";"NFC: oborová literatura";"POP: populárně naučná literatura";"ITD: interdisciplinární";"ITD: interdisciplinární";"realizoval jako komentovaný seriál , který sestával ze sekvence samostatných";"polí bez vnitropanelových";"promluv , s textovými komentáři veršem či prózou pod jednotlivými"
"1";"cs: čeština";"NMG: publicistika";"NEW: tradiční publicistika";"X: neuvedeno";"NTW: celostátní tisk";"<s> V současnosti prochází rozsáhlou přestavbou za více než 1,3 miliardy";"korun bez DPH";". </s><s> Dosud je hotova hrubá stavba obou pavilonů J a"
"1";"cs: čeština";"NMG: publicistika";"NEW: tradiční publicistika";"X: neuvedeno";"NTW: celostátní tisk";"odbočuje k Pravčické bráně . </s><s> „ Cesta se za 7,5";"milionu bez DPH";"opraví až k rozcestí celá a od něj směrem k"
"1";"cs: čeština";"NMG: publicistika";"NEW: tradiční publicistika";"X: neuvedeno";"NTW: celostátní tisk";"pozmění se využité efekty . </s><s> Ohňostroj bude stát kolem milionu";"korun bez DPH";"a jako každoročně začne 1 . ledna v 18 ."
"1";"cs: čeština";"NFC: oborová literatura";"POP: populárně naučná literatura";"FTS: formální a technické vědy";"ICT: výpočetní technika";"položek nepřeložených položek </s><s> správce souborů , poznámky , záznamník zbytečností";"zvuku , bez 8";"utility aplikace pro týkající práci s se telefonem , nadstavby"
"1";"cs: čeština";"NFC: oborová literatura";"POP: populárně naučná literatura";"FTS: formální a technické vědy";"TEC: technika";"v tomto případě se částečně liší grafika a funkce u";"televizorů bez a";"se systémem webOS . </s><s> ( Ukázky přibližují přehrávače modelů s"
"1";"cs: čeština";"NMG: publicistika";"LEI: volnočasová publicistika";"X: neuvedeno";"MIX: společnost";"měli půjčený , je na prodej za 8 201 773";"korun bez DPH";", což činí něco přes 9,9 miliónu s daní . </s>"
"1";"cs: čeština";"NFC: oborová literatura";"SCI: odborná literatura";"NAT: přírodní vědy";"MED: lékařství";"podstoupit metody asistované reprodukce s preimplantační diagnostikou a tím narození";"dítěte bez thalasemie";". </s><s> Z hlediska populačního potom snížení výskytu této choroby . </s>"
"1";"cs: čeština";"NMG: publicistika";"LEI: volnočasová publicistika";"X: neuvedeno";"SCT: společenský život";"Císařský palác či purkrabství hradu Karlštejn . </s><s> Oprava za 104,5";"milionu bez DPH";"potrvá od září do října 1922 . </s><s> Nový šéf policistů </s>"
"1";"cs: čeština";"NFC: oborová literatura";"PRO: profesní literatura";"FTS: formální a technické vědy";"TEC: technika";"vařená vejce , bramborový salát a velikonoční pečivo . </s><s> Test";"párků bez strojně";"odděleného masa </s><s> Před pár roky si nás , osm redaktorů"
"1";"cs: čeština";"NMG: publicistika";"NEW: tradiční publicistika";"X: neuvedeno";"REG: regionální tisk";"Tyršova , kde oprava bude stát přes sedm set tisíc";"korun bez DPH";". </s><s> Děti vystřídají obrazy </s><s> Sobotka – V rámci festivalu Šrámkova"
"1";"cs: čeština";"NMG: publicistika";"NEW: tradiční publicistika";"X: neuvedeno";"NTW: celostátní tisk";"barvami najednou . </s><s> Cena nové tiskárny začíná na 55 000";"korun bez DPH";". </s><s> Trilab míří pouze na firemní zákazníky , mezi které"
"1";"cs: čeština";"NMG: publicistika";"NEW: tradiční publicistika";"X: neuvedeno";"NTW: celostátní tisk";"však tvrdí , že při své firmě pořídil pět dodávek";"katod bez DPH";"a stejný počet bez DPH prodal . </s><s> „ Veškeré transakce"
"1";"cs: čeština";"NMG: publicistika";"NEW: tradiční publicistika";"X: neuvedeno";"NTW: celostátní tisk";"na zkoumání kolektivního svědomí , tématu paměti , viny a";"pomsty bez příliš";"konkrétních politických asociací . </s><s> Ishiguro si navíc svět středověku zjevně"
"1";"cs: čeština";"NMG: publicistika";"NEW: tradiční publicistika";"X: neuvedeno";"NTW: celostátní tisk";"o prázdninách . </s><s> „ Rekonstrukce bude stát zhruba 3,4 milionu";"korun bez DPH";", “ uvedla mluvčí magistrátu Šárka Charousková . </s><s> Ulice ,"
"1";"cs: čeština";"NFC: oborová literatura";"POP: populárně naučná literatura";"FTS: formální a technické vědy";"ICT: výpočetní technika";"k článkům . </s><s> To mimochodem umožňuje použít programy i u";"počítačů bez DVD";"mechanik . </s><s> Seznam dat ke stažení najdete na s50 ("
"1";"cs: čeština";"NMG: publicistika";"NEW: tradiční publicistika";"X: neuvedeno";"REG: regionální tisk";"probíhat příprava . </s><s> Celkové náklady na akci jsou zhruba 150";"tisíc bez DPH";", dodavatelem prací bude firma Služby Šulc s . r"
"1";"cs: čeština";"NMG: publicistika";"NEW: tradiční publicistika";"X: neuvedeno";"NTW: celostátní tisk";"240 metrů . </s><s> Investice by v tomto případě činila 596";"milionů bez DPH";". </s><s> Třetí varianta v částce 734 milionů bez DPH je"
"1";"cs: čeština";"NMG: publicistika";"NEW: tradiční publicistika";"X: neuvedeno";"NTW: celostátní tisk";"DPH , v případě společného oddlužení manželů maximálně šest tisíc";"korun bez DPH";". </s><s> Nová úprava insolvenčního zákona by předem naváděla lidi k"
"1";"cs: čeština";"NFC: oborová literatura";"PRO: profesní literatura";"FTS: formální a technické vědy";"TEC: technika";"dodatečných úsporných opatření . </s><s> Celková investice projektu byla 16,9 milionu";"korun bez DPH";". </s><s> Významná část byla vynaložena na výměnu zhruba tisíce kusů"
"1";"cs: čeština";"NMG: publicistika";"NEW: tradiční publicistika";"X: neuvedeno";"NTW: celostátní tisk";"club Kotelna v Litomyšli rekonstruovala toalety . </s><s> Potřebných 260 tisíc";"korun bez DPH";"platilo město , neboť budova je městským majetkem . </s><s> „"
"1";"cs: čeština";"NMG: publicistika";"NEW: tradiční publicistika";"X: neuvedeno";"REG: regionální tisk";"dala firma Kočí , a to za cenu 840 tisíc";"korun bez DPH";". </s><s> Písečtí radní budou na svém dnešním jednání mimo jiné"
"1";"en: angličtina";"NFC: oborová literatura";"POP: populárně naučná literatura";"SSC: sociální vědy";"REC: sport, rekreace, hobby";"<s> Ale neměly by být procentuálně vyšší , než velikost počátečního";"banku bez ante";"; měly by být o trochu menší . </s><s> Řekněme ,"
"1";"cs: čeština";"NMG: publicistika";"NEW: tradiční publicistika";"X: neuvedeno";"NTW: celostátní tisk";"známé pražské Studio Najbrt . </s><s> Město vyšlo na 300 tisíc";"korun bez DPH";". </s><s> A téměř okamžitě poté , co radnice zveřejnila podobu"
"1";"cs: čeština";"NMG: publicistika";"NEW: tradiční publicistika";"X: neuvedeno";"REG: regionální tisk";"korun je hotová , dokončit ho má za 8,8 milionu";"korun bez DPH";"dílna Roberta Ponči z Krnova . </s><s> Jako vítěze soutěže ji"
"1";"cs: čeština";"NFC: oborová literatura";"SCI: odborná literatura";"NAT: přírodní vědy";"MED: lékařství";"let byly zjištěny 1 – 2 cysty u 2,1 %";"pacientů bez PCHLAD";". </s><s> Na druhou stranu – pokud jsou 1 – 2"
"1";"cs: čeština";"NFC: oborová literatura";"PRO: profesní literatura";"FTS: formální a technické vědy";"ICT: výpočetní technika";"zdroj osvětlení LED pro </s><s> okamžité skenování * Automatická detekce šíře";"dokumentu bez";"</s><s> nutnosti ručního zadávání rozměru * Optimised thickness adjustment controller ("
"1";"cs: čeština";"NMG: publicistika";"NEW: tradiční publicistika";"X: neuvedeno";"NTW: celostátní tisk";"činnosti . </s><s> Nejvýše přípustná cena je stanovena na 14 miliónů";"korun bez DPH";". </s><s> FOTO </s><s> STŘET TRAMVAJE A TROLEJBUSU . </s><s> Ke střetu tramvají"
"1";"cs: čeština";"NMG: publicistika";"NEW: tradiční publicistika";"X: neuvedeno";"REG: regionální tisk";"do konce června . </s><s> Náklady na stavbu činí 66 milionů";"korun bez DPH";". </s><s> PŘEKVAPENÍ . </s><s> Při odstraňování nánosů starých maleb v pěti"
"1";"cs: čeština";"NMG: publicistika";"NEW: tradiční publicistika";"X: neuvedeno";"NTW: celostátní tisk";"ceny včetně DPH . </s><s> Obec ji chtěla uhradit jen z";"částky bez DPH";". </s><s> Podle soudců se jedná o majetkovou daň , a"
"1";"cs: čeština";"NMG: publicistika";"NEW: tradiční publicistika";"X: neuvedeno";"NTW: celostátní tisk";"do konce ledna . </s><s> Náklady na proměnu činí 26 miliónů";"korun bez DPH";". </s><s> I okolí stanice podzemní dráhy C Ládví působí dnes"
"1";"en: angličtina";"FIC: beletrie";"NOV: próza";"X: neuvedeno";"X: neuvedeno";"planetě . </s><s> A teď se chci dostat až do konce";"hry Bez .";"</s><s> Dalšího . </s><s> Přerušování . “ </s><s> A skoro to zvládli . </s>"
"1";"cs: čeština";"FIC: beletrie";"VER: poezie";"X: neuvedeno";"X: neuvedeno";"<s> se hraje fotbal každý večer stejné </s><s> utkání </s><s> bez gólů bez";"karet bez";"</s><s> přestávky všechno špatně přitisknu </s><s> dlaň ke sklu mám plán bude </s>"
"1";"ro: rumunština";"FIC: beletrie";"SCR: drama";"X: neuvedeno";"X: neuvedeno";"naše . </s><s> Paula : Hovno . </s><s> Rolando : Bez velkých";"slov … bez …";"bez … </s><s> Maria : Je mi sedmadvacet a mám tři"
"1";"cs: čeština";"NMG: publicistika";"NEW: tradiční publicistika";"X: neuvedeno";"NTW: celostátní tisk";"strany stejně jako TOP 09 nekomentují , jak velké šance";"koalice bez ANO";"má . </s><s> „ Jednali jsme s TOP 09 o různých"
"1";"cs: čeština";"NFC: oborová literatura";"SCI: odborná literatura";"NAT: přírodní vědy";"BIO: biologie";"2 . tergit se třemi světlými tomentovými skvrnami ; zadeček";"samců bez modravě";"kovového lesku ; šp1t hostiteli jsou vosíci ( Polistes )"
"1";"cs: čeština";"NMG: publicistika";"LEI: volnočasová publicistika";"X: neuvedeno";"SCT: společenský život";". </s><s> Přes 300 milionů půjde do aut </s><s> Až 318 milionů";"korun bez DPH";"rozfofruje Státní fond pro dopravní infrastrukturu za nákup 734 služebních"
"1";"cs: čeština";"NMG: publicistika";"NEW: tradiční publicistika";"X: neuvedeno";"NTW: celostátní tisk";"místa . </s><s> Celkem za to radnice zaplatí necelých 25 milionů";"korun bez DPH";", přičemž prostřednictvím Regionálního operačního programu Severozápad na to dostane"
"1";"cs: čeština";"NMG: publicistika";"NEW: tradiční publicistika";"X: neuvedeno";"REG: regionální tisk";"ostrovskou nemocnici už nutností a stálo ji zhruba osm milionů";"korun bez DPH";". </s><s> Sprostě nadával kolemjdoucím a fackoval je </s><s> Ostrov – Jako"
"1";"cs: čeština";"NFC: oborová literatura";"PRO: profesní literatura";"SSC: sociální vědy";"ECO: ekonomie, obchod, logistika";"opakování > Únor 2016 15 + 15 – 54 </s><s> Pořadí";"opakování bez Titul";"Kanál Datum Začátek Konec Tisíce Tisíce </s><s> 19 MS v biatlonu"
"1";"cs: čeština";"NMG: publicistika";"NEW: tradiční publicistika";"X: neuvedeno";"NTW: celostátní tisk";"na východě a jihu se nedá zastavit jen během nočních";"jednání , bez opravdu";"drahého vyzbrojení se neobejdeme . </s><s> A pak to , co"
"1";"cs: čeština";"NMG: publicistika";"NEW: tradiční publicistika";"X: neuvedeno";"NTW: celostátní tisk";". </s><s> Minimální výše měsíčního nájmu je stanovena na deset tisíc";"korun bez DPH";". </s><s> Praha 4 má v květnu rozhodnout o vítězném návrhu"
"1";"cs: čeština";"NMG: publicistika";"NEW: tradiční publicistika";"X: neuvedeno";"NTW: celostátní tisk";", budou kondoři královští . </s><s> Voliéra bude stát 16,5 miliónu";"korun bez DPH";". </s><s> „ Kondoři budou mít v nové voliéře mnohem větší"
"1";"cs: čeština";"NMG: publicistika";"NEW: tradiční publicistika";"X: neuvedeno";"NTW: celostátní tisk";"stojících cestujících . </s><s> „ Tramvaje byly pořízeny za téměř 176";"miliónů bez DPH";"a 85 procent šlo z unijních peněz . </s><s> Zbytek nákladů"
"1";"cs: čeština";"NMG: publicistika";"NEW: tradiční publicistika";"X: neuvedeno";"NTW: celostátní tisk";"91,562 tuny tzv . nadbilančních kalů za cenu 429 miliónů";"korun bez DPH";". </s><s> Odtěžit a odvézt kaly ze tří ropných lagun musí"
"1";"cs: čeština";"NFC: oborová literatura";"POP: populárně naučná literatura";"FTS: formální a technické vědy";"ICT: výpočetní technika";"však samozřejmě nemůže natahovat do nekonečna . </s><s> Proto u levných";"volantů bez force";"feedbacku najdete pouze rozsah otočení o 270 ° . </s><s> Na"
"1";"cs: čeština";"NMG: publicistika";"NEW: tradiční publicistika";"X: neuvedeno";"NTW: celostátní tisk";"se zapojila fakulta informatiky a managementu hradecké univerzity do projektu";"škol Bez PET";"lahví a nabízí studentům alternativu k balené vodě . </s><s> Studenti"
"1";"cs: čeština";"NFC: oborová literatura";"POP: populárně naučná literatura";"FTS: formální a technické vědy";"TEC: technika";"hodnotou totiž patří mezi jejich nejčastější objekty . </s><s> Při nákupu";"vozu bez křišťálově";"průzračné historie proto bedlivý pozor ! </s><s> Opatrnost ovšem žádá volba"
"1";"cs: čeština";"NFC: oborová literatura";"SCI: odborná literatura";"SSC: sociální vědy";"REC: sport, rekreace, hobby";"s TP se v dnešní době dostává na úroveň tréninku";"osob bez TP";". </s><s> Můžeme vysledovat i podobný historický vývoj , kde od"
"1";"cs: čeština";"NMG: publicistika";"NEW: tradiční publicistika";"X: neuvedeno";"NTW: celostátní tisk";"nebudou procházet zákony . </s><s> Ke „ stojedničce “ případné Babišovy";"vlády bez ČSSD";"a s trvající podporou komunistů schází osm hlasů . </s><s> Patnáct"
"1";"cs: čeština";"NMG: publicistika";"NEW: tradiční publicistika";"X: neuvedeno";"REG: regionální tisk";"duben příštího roku a jeho stavba vyjde na sto milionů";"korun bez DPH";". </s><s> Marie Kurzová ze společnosti REFLECTA Facility , která bude"
"1";"cs: čeština";"NFC: oborová literatura";"PRO: profesní literatura";"SSC: sociální vědy";"POL: politika, vojenství";"1026 R , při jehož nákupu teď ušetříte 55 000";"korun bez DPH";"! </s><s> Akce platí až do 10 . října a nejlepší"
"1";"cs: čeština";"NMG: publicistika";"NEW: tradiční publicistika";"X: neuvedeno";"NTW: celostátní tisk";"zvítězila i v opakované soutěži . </s><s> Firma má dostávat 290";"korun bez DPH";"za každý přestupek . </s><s> Vedení města kvůli tomu kritizovala nejen"
"1";"cs: čeština";"NMG: publicistika";"NEW: tradiční publicistika";"X: neuvedeno";"REG: regionální tisk";"Sadka za cenu za kalendářní rok ve výši 35 450";"korun bez DPH";", “ píše se v usnesení Rady města . </s><s> Babybox"
"1";"cs: čeština";"NMG: publicistika";"NEW: tradiční publicistika";"X: neuvedeno";"REG: regionální tisk";"nový nakladač Locust 903 , jehož cena činí 979 tisíc";"korun bez DPH";". </s><s> „ Předpokládaná cena byla jeden milion korun , přihlásili"
"1";"cs: čeština";"NFC: oborová literatura";"PRO: profesní literatura";"FTS: formální a technické vědy";"TEC: technika";"prací v území dlouhém asi 20 kilometrů je 789 milionů";"korun bez DPH";". </s><s> První skrývku archeologové udělali u Světí nedaleko Hradce Králové"
"1";"cs: čeština";"NMG: publicistika";"NEW: tradiční publicistika";"X: neuvedeno";"NTW: celostátní tisk";"celkové náklady na tyto úseky odhadují celkem na 1,8 miliardy";"korun bez DPH";", část by měly pokrýt evropské dotace . </s><s> Díky dálnici"
"1";"cs: čeština";"NFC: oborová literatura";"POP: populárně naučná literatura";"FTS: formální a technické vědy";"ICT: výpočetní technika";"% směrovému výraznější kříži odezva chybí 7 analogové výrazné spouště";"odezvy bez 7";"bez výtek 10 pro směrový snadné kříž procházení by měl"
"1";"en: angličtina";"FIC: beletrie";"COL: kratší próza";"X: neuvedeno";"X: neuvedeno";". </s><s> Omamné . </s><s> Famózní . </s><s> Rozhodně nedoporučuji zkoušet funkci bleskového";"startu bez vhodně";"nastavené opěrky hlavy . </s><s> Jinak skončíte v nemocnici s hyperextenzí"
"1";"cs: čeština";"NMG: publicistika";"NEW: tradiční publicistika";"X: neuvedeno";"REG: regionální tisk";". </s><s> Na zakázku , jejíž hodnota je zhruba šest milionů";"korun bez DPH";", totiž žádná nabídka nepřišla . </s><s> Podle informací Zdeňka Krejsy"
"1";"cs: čeština";"NMG: publicistika";"LEI: volnočasová publicistika";"X: neuvedeno";"MIX: společnost";"<s> Nahoru i dolů v pohodě </s><s> Obrázek vlevo zachycuje rozjezd do";"kopce bez hill";"- hold systému – vůz sjíždí ze svahu . </s><s> Na"
"1";"cs: čeština";"NMG: publicistika";"NEW: tradiční publicistika";"X: neuvedeno";"NTW: celostátní tisk";"desetiletého tendru na svoz odpadu . </s><s> Jeho hodnota je 12,8";"miliardy bez DPH";", vyplývá z oznámení ve věstníku veřejných zakázek . </s><s> Na"
"1";"cs: čeština";"NFC: oborová literatura";"PRO: profesní literatura";"SSC: sociální vědy";"EDU: pedagogika";"i v koordinaci zrakového a sluchového vnímání . </s><s> Porucha osvojování";"čtení bez „";"zjevného důvodu “ jako je snížení rozumových schopností , nedostatek"
