"1";"fr: francouzština";"FIC: beletrie";"NOV: próza";"X: neuvedeno";"X: neuvedeno";"domu . </s><s> Tři zasklená okna z drobných čtverečků , mírně";"zbarvených do šafránově";"žluté barvy , vedou do parku . </s><s> Místnost zaplavuje jemné"
"1";"cs: čeština";"NMG: publicistika";"LEI: volnočasová publicistika";"X: neuvedeno";"SCT: společenský život";"Kometě aspoň ušetřil rozpočet , “ kývl a zalitoval odchodu";"Kempného do KHL";". </s><s> Špatný čas </s><s> A třetí Lojzův argument ? </s><s> „ Asi"
"1";"cs: čeština";"NMG: publicistika";"LEI: volnočasová publicistika";"X: neuvedeno";"SCT: společenský život";"byly při duelu Uruguay – Egypt poloprázdné , stojí 550";"dolarů do (";"12 200 Kč ) , asi není leckdo překonal strach"
"1";"cs: čeština";"NMG: publicistika";"LEI: volnočasová publicistika";"X: neuvedeno";"SCT: společenský život";". </s><s> Za 20 let jen polovina vojáků </s><s> PRAHA – Od";"vstupu do NATO";"ubyla ministerstvu obrany polovinu vojáků a civilních zaměstnanců . </s><s> Zatímco"
"1";"cs: čeština";"NMG: publicistika";"LEI: volnočasová publicistika";"X: neuvedeno";"SCT: společenský život";"12 dní </s><s> 3 KROKY K PLNÉ POHYBLIVOSTI </s><s> bez operování kovových";"prvků do kyčli";"a kolen . </s><s> Jak to funguje ? </s><s> Systematické užívání nového"
"1";"cs: čeština";"NMG: publicistika";"LEI: volnočasová publicistika";"X: neuvedeno";"SPO: sport";"<s> Všichni tím dávají najevo ochotu vyslyšet v případě nepostupu jejich";"klubů do play";"off jarní volání o pomoc . </s><s> Po kempu mladých extraligových"
"1";"cs: čeština";"NMG: publicistika";"LEI: volnočasová publicistika";"X: neuvedeno";"SPO: sport";"úspěchů , nedokázal prosadit v zahraničí . </s><s> Na mistrovství světa";"hráčů do 20";"let ve Spojených arabských emirátech v roce 2003 zanechal z"
"1";"cs: čeština";"NMG: publicistika";"LEI: volnočasová publicistika";"X: neuvedeno";"SPO: sport";"i přes vysoké ambice ocitli čeští hokejisté na mistrovství světa";"hráčů do 18";"let . </s><s> Pouhé čtyři body získané v základní skupině jim"
"1";"cs: čeština";"NMG: publicistika";"LEI: volnočasová publicistika";"X: neuvedeno";"SPO: sport";"svěřenci </s><s> HAPPY END </s><s> Posílen vítězstvím , které zaručilo čtvrtfinále MS";"hráčů do 20";"let , vstupuje český hokej do posledního dne roku 2017"
"1";"cs: čeština";"NMG: publicistika";"LEI: volnočasová publicistika";"X: neuvedeno";"SPO: sport";"Mnichov či Inter Milán , působil v roli brankářské jedničky";"týmu do 16";"let , který došel až do finále , kde Salcburk"
"1";"cs: čeština";"NMG: publicistika";"LEI: volnočasová publicistika";"X: neuvedeno";"SPO: sport";"čtvrt hodiny za vítězem . </s><s> Carapaz , jenž vede pořadí";"jezdců do 25";"let , nastoupil v závěrečném táhlém stoupání necelé dva kilometry"
"1";"cs: čeština";"NMG: publicistika";"LEI: volnočasová publicistika";"X: neuvedeno";"SPO: sport";"velkoklubů . </s><s> Čtyřiadvacetiletý slávistický stožár nastoupil v probíhající sezoně včetně";"reprezentace do 43";"zápasů a odehrál v nich 3848 minut . </s><s> Jeho porovnání"
"1";"cs: čeština";"NMG: publicistika";"LEI: volnočasová publicistika";"X: neuvedeno";"SPO: sport";"jestli a jak zvládl přechod mezi dospělé . </s><s> top 10";"hráčů do 20";"let </s><s> 1 . Martin Nečas útočník zápasy 64 body 52"
"1";"cs: čeština";"NMG: publicistika";"LEI: volnočasová publicistika";"X: neuvedeno";"SPO: sport";". </s><s> Připomenu , o co jde . </s><s> Členové hokejové reprezentace";"Slovenska do 20";"let a část slovenské veřejnosti útočí na trenéra Bokroše kvůli"
"1";"cs: čeština";"NMG: publicistika";"LEI: volnočasová publicistika";"X: neuvedeno";"INT: zajímavosti ze světa";"z minulých let , které totálně šláply vedle ... </s><s> Z";"Bratislavy do vídně";"za 8 minut </s><s> Bratislava byla vybrána mezi města , kde"
"1";"cs: čeština";"NMG: publicistika";"LEI: volnočasová publicistika";"X: neuvedeno";"INT: zajímavosti ze světa";"DOX v Praze je kurátorem výstavy Před očima : Příběhy";"Iráku ( do 8";". 1 . 2018 ) „ Příběh Samíra a jeho"
"1";"cs: čeština";"NMG: publicistika";"LEI: volnočasová publicistika";"X: neuvedeno";"INT: zajímavosti ze světa";"nebo píší počítačové kódy a po třicítce inkasují ze svých";"aktiv , do Engineeru";"ještě nedorazily . </s><s> Nicméně Peter byl lapen . </s><s> Když ho"
"1";"cs: čeština";"NMG: publicistika";"LEI: volnočasová publicistika";"X: neuvedeno";"INT: zajímavosti ze světa";"v Severní Karolíně chování 24 lemuřích mláďat ve věku od";"tří do 30";"měsíců . </s><s> Sledovali je , jak si hrají , vzájemně"
"1";"cs: čeština";"NMG: publicistika";"LEI: volnočasová publicistika";"X: neuvedeno";"MIX: společnost";"<s> Pasažéři jednoho z letů americké společnosti Delta Air Lines ze";"Seattlu do Salt";"Lake City nevěřili svým očím , když zjistili , že"
"1";"cs: čeština";"NMG: publicistika";"LEI: volnočasová publicistika";"X: neuvedeno";"MIX: společnost";"oklepat a znovu a znovu naskakoval plný výbušné energie a";"optimismu do neskutečně";"zamotané a místy už téměř ztracené bitvy o Brazílii . </s>"
"3";"cs: čeština";"NFC: oborová literatura";"POP: populárně naučná literatura";"FTS: formální a technické vědy";"ICT: výpočetní technika";"na to </s><s> 1 Instalace a aktivace </s><s> Pro instalaci plné verze";"programu Do Your";"Data Recovery Professional budete potřebovat licenční kód , který získáte"
