"1";"fr: francouzština";"FIC: beletrie";"NOV: próza";"X: neuvedeno";"X: neuvedeno";"domu . </s><s> Tři zasklená okna z drobných čtverečků , mírně";"zbarvených do šafránově";"žluté barvy , vedou do parku . </s><s> Místnost zaplavuje jemné"
"1";"en: angličtina";"FIC: beletrie";"NOV: próza";"X: neuvedeno";"X: neuvedeno";". </s><s> Nahrazeny v roce 1966 filtry Upjohn o kapacitě záchytnosti";"organismů do 1";"mikronu . </s><s> Při použití trojnásobné vrstvy membrán o jednotkové záchytnosti"
"1";"en: angličtina";"FIC: beletrie";"NOV: próza";"X: neuvedeno";"X: neuvedeno";"se okamžitě nezačneš chovat slušně , dokopu tě na půl";"cesty do Dalstroje";"já sám . </s><s> A vezmu si na to tvoji vlastní"
"1";"cs: čeština";"FIC: beletrie";"NOV: próza";"X: neuvedeno";"X: neuvedeno";"naložených cennostmi a penězi uprchl za ranního rozbřesku 1 .";"ledna do Santo";"Dominga a odtud na Madeiru . </s><s> Chtěl ji prý koupit"
"1";"cs: čeština";"FIC: beletrie";"NOV: próza";"X: neuvedeno";"X: neuvedeno";"Guevara zapojil do kubánského protibatistovského odboje . </s><s> Jen motiv jejich";"vstupu do guerrily";"byl rozdílný . </s><s> Idealista , lékař Guevara hledal cestu k"
"1";"de: němčina";"FIC: beletrie";"NOV: próza";"X: neuvedeno";"X: neuvedeno";"dvě hodiny později již hlavní bojová linie probíhala přímo podél";"železnice do Heiligenbeilu";". </s><s> Kulomety střílely z úkrytů v pancéřovaných vagonech . </s><s> V"
"1";"en: angličtina";"FIC: beletrie";"NOV: próza";"X: neuvedeno";"X: neuvedeno";"článků , fotografií , náčrtků , tisků a map ,";"rozdělených do abecedně";"řazených oddílů , počínaje heslem Almásy v horní zásuvce první"
"1";"da: dánština";"FIC: beletrie";"NOV: próza";"X: neuvedeno";"X: neuvedeno";"<s> „ Přikázal mu , aby jel jedním konkrétním vlakem z";"Kodaně do Korsøru";"a čekal na světelné znamení . </s><s> Musel si sednout do"
"1";"en: angličtina";"FIC: beletrie";"NOV: próza";"X: neuvedeno";"X: neuvedeno";". divize nigerijské armády , která sídlí u silnice z";"Enugu do Onitshy";"mezi vesnicemi Abagana a Udi . </s><s> Zde vyprávění o červencových"
"1";"en: angličtina";"FIC: beletrie";"NOV: próza";"X: neuvedeno";"X: neuvedeno";"zvládl za jednu noc dva lety s vlastním strojem z";"Cotonou do Uli";"a bezpečně se vrátil . </s><s> Další dva zkušební lety byly"
"1";"es: španělština";"FIC: beletrie";"NOV: próza";"X: neuvedeno";"X: neuvedeno";"Sexapokalypsa o turné po rozličných kinech celého světa , z";"Cannes do San";"Franciska , z Tokia do New Yorku . </s><s> Na pozvánce"
"1";"en: angličtina";"FIC: beletrie";"NOV: próza";"X: neuvedeno";"X: neuvedeno";"tedy od řeky , a vinuly se po obou stranách";"údolí do Fogas";"a Picarets . </s><s> Mezi nimi žádná jiná cesta nevedla a"
"1";"en: angličtina";"FIC: beletrie";"NOV: próza";"X: neuvedeno";"X: neuvedeno";"<s> Ten Američan bydlí pořád v Manoir . </s><s> Vrátil se z";"výletu do Nevers";", tvrdí , že tam hledal duby na sudy . </s>"
"1";"sv: švédština";"FIC: beletrie";"NOV: próza";"X: neuvedeno";"X: neuvedeno";"Kostariky ? “ </s><s> „ Ne , nejdřív se vydal do";"Mexika , do Playa";"del Carmen , kde se seznámil s Adelitou Riverovou . </s>"
"1";"es: španělština";"FIC: beletrie";"NOV: próza";"X: neuvedeno";"X: neuvedeno";"šňůra světel a on měl náhle pocit , že u";"silnice do Eberswalde";"zahlédl mrtvého klokana . </s><s> Až se vrátí do Valparaísa ,"
"1";"en: angličtina";"FIC: beletrie";"NOV: próza";"X: neuvedeno";"X: neuvedeno";"je zkratka . </s><s> Před třema generacema mejch předků přicestoval z";"Polska do USA";"Krzys Szczerba . </s><s> Lidi v Americe nevěděli , co si"
"1";"en: angličtina";"FIC: beletrie";"NOV: próza";"X: neuvedeno";"X: neuvedeno";"1965 se Felek Szczerba se svojí rodinou přestěhoval zpátky do";"Iowy , do Ealingu";", kde Felek přijal místo ve výzkumnejch laboratořích McKeonovejch závodů"
"1";"en: angličtina";"FIC: beletrie";"NOV: próza";"X: neuvedeno";"X: neuvedeno";"<s> Byly to děti různého věku , od čtyř nebo pěti";"let do přibližně";"patnácti . </s><s> A honily krysy . </s><s> Některé z nich mlátily"
"1";"en: angličtina";"FIC: beletrie";"NOV: próza";"X: neuvedeno";"X: neuvedeno";"stech metrech narazil na velice podobnou scenérii , tentokrát u";"vchodu do Ramady";": další hosté opalující se na řadách lehátek , hotelový"
"1";"no: norština";"FIC: beletrie";"NOV: próza";"X: neuvedeno";"X: neuvedeno";"teorii , že se členové sekty nacházejí někde kolem trati";"vedoucí do Vestfoldského";"kraje . </s><s> Proč Søren Plantenstedt opustil Oslo hned po masakru"
"1";"cs: čeština";"FIC: beletrie";"NOV: próza";"X: neuvedeno";"X: neuvedeno";"bytě mluví už zase běžnou rychlostí mluvy o cestě z";"Hrušovan do B";". , o tom , jak se dá brodit řekou"
"1";"en: angličtina";"FIC: beletrie";"NOV: próza";"X: neuvedeno";"X: neuvedeno";"to , co dělají všichni nejistí lidé — strhávám téma";"rozhovoru do důvěrně";"známého teritoria . </s><s> A tím jsem já . </s><s> Celé odpoledne"
"1";"en: angličtina";"FIC: beletrie";"NOV: próza";"X: neuvedeno";"X: neuvedeno";"nevyprávěl , neznala ani příběh sňatku rodičů , ani jejich";"odchodu do Middlewoodu";", a přece všechnu tu bolest cítila , hlubokou a"
"1";"ru: ruština";"FIC: beletrie";"NOV: próza";"X: neuvedeno";"X: neuvedeno";"slavnostní : skládala se z 2D fotografií a předmětů ,";"zasazených do zbytečně";"masivních ocelových rámů a navíc uložených do pevných skleněných schránek"
"1";"cs: čeština";"FIC: beletrie";"NOV: próza";"X: neuvedeno";"X: neuvedeno";"Dylan ( opět dárek od Terezy , tentokrát suvenýr z";"cesty do Glasgow";"; ještě že dcera tak ráda cestuje ! ) desku"
"1";"en: angličtina";"FIC: beletrie";"NOV: próza";"X: neuvedeno";"X: neuvedeno";"vidět , a navíc ve velmi příjemné společnosti . </s><s> Během";"letu do New";"Yorku obsadil vedlejší místo jeho oficiální ochránce , dozorce ,"
"1";"cs: čeština";"FIC: beletrie";"NOV: próza";"X: neuvedeno";"X: neuvedeno";"<s> Rok před maturitou pošlou rodiče Lízu o prázdninách do východoněmeckého";"Saska , do Glauchau";"k Else a Franzovi , aby si zlepšila němčinu . </s>"
"1";"en: angličtina";"FIC: beletrie";"NOV: próza";"X: neuvedeno";"X: neuvedeno";"se na růst příjmů ! </s><s> Proto venture kapitalisté nalili tolik";"peněz do HubSpotu";"a věří , že HubSpot bude při vstupu na burzu"
"1";"en: angličtina";"FIC: beletrie";"NOV: próza";"X: neuvedeno";"X: neuvedeno";", právě v té době jsem se měl stěhovat z";"Bostonu do Los";"Angeles a strávit tam několik měsíců jako spoluautor třetí řady"
"1";"en: angličtina";"FIC: beletrie";"NOV: próza";"X: neuvedeno";"X: neuvedeno";"nákladním člunu s uhlím , plavit se jako blbec z";"Middlesbrough do Cleethorpes";"a zase zpátky . </s><s> Nikdo z těch , kdo přežili"
"1";"en: angličtina";"FIC: beletrie";"NOV: próza";"X: neuvedeno";"X: neuvedeno";"“ zeptala jsem se . </s><s> „ Zajel jsem na pár";"dní do Deer";"Lodge . “ </s><s> „ Do té věznice ? “ </s><s> Přikývl"
"1";"en: angličtina";"FIC: beletrie";"NOV: próza";"X: neuvedeno";"X: neuvedeno";"v obličeji , který snad ani nemrkal , stál u";"dveří do Zatořiných";"komnat . </s><s> „ Chápeš snad , proč jsem Erikovi přikázala"
"1";"cs: čeština";"FIC: beletrie";"NOV: próza";"X: neuvedeno";"X: neuvedeno";"a hlavně , co máme v plánu . “ </s><s> Zbytek";"cesty do Damíru";", který se rozkládal kolem průsečíku východní hrany Náměstí svobody"
"1";"cs: čeština";"FIC: beletrie";"COL: kratší próza";"X: neuvedeno";"X: neuvedeno";"Herbert Dillinger se stal hrdinou . </s><s> Když odvezli mrtvolu jednatřicetiletého";"zločince do Mooresvillu";", kde žili jeho rodiče , a vystrojili mu pohřeb"
"1";"cs: čeština";"FIC: beletrie";"COL: kratší próza";"X: neuvedeno";"X: neuvedeno";"luxusním parníku Bremen , který plul na pravidelné lince z";"Hamburku do New";"Yorku a zpět . </s><s> Jméno tohoto muže se v protokolech"
"1";"en: angličtina";"FIC: beletrie";"COL: kratší próza";"X: neuvedeno";"X: neuvedeno";"obleku opilý , opilý ! </s><s> A tak jsem šel místo";"toho do Guadalajara";"Refritería , zahrál na kytaru a zazpíval čtyři písničky ,"
"1";"cs: čeština";"FIC: beletrie";"COL: kratší próza";"X: neuvedeno";"X: neuvedeno";"<s> Prý ho to napadlo při psaní projevu k oslavám vstupu";"Slovenska do EU";"a navrhl změnu . </s><s> Protože však při tolika povinnostech na"
"1";"cs: čeština";"FIC: beletrie";"COL: kratší próza";"X: neuvedeno";"X: neuvedeno";"jsme odletěli . </s><s> Hned druhý den jsme mířili autem z";"Johannesburgu do Kruger";"parku , což je vlastně zoologická zahrada , ale velká"
"1";"ru: ruština";"FIC: beletrie";"COL: kratší próza";"X: neuvedeno";"X: neuvedeno";"si krásný byt , okamžitě vyrazit do divadla , do";"cukrárny , do …";"inu , atakdále . </s><s> Shrábl nějaké peníze a vyrazil do"
"1";"cs: čeština";"FIC: beletrie";"COL: kratší próza";"X: neuvedeno";"X: neuvedeno";"a sevřel fantomovou paži jako ve svěráku . </s><s> Z místa";"dotyku do Mayweatherova";"těla vystřelila bolest horší , než když mu zmrzačenou ruku"
"1";"cs: čeština";"FIC: beletrie";"COL: kratší próza";"X: neuvedeno";"X: neuvedeno";", lidi ho mají rádi a on potom odjede do";"Turecka do sul";". “ Nedopověděl . </s><s> Zasloužilý milicionář Davídek vyskočil a křikl"
"1";"cs: čeština";"FIC: beletrie";"COL: kratší próza";"X: neuvedeno";"X: neuvedeno";". </s><s> Znamená to vytáhnout člun z vody a dojet osm";"kilometrů do Boswell";", ale přece jsem nezaplatila deset dolarů pro nic za"
"1";"cs: čeština";"FIC: beletrie";"COL: kratší próza";"X: neuvedeno";"X: neuvedeno";"svého národa , “ měla říct Dornová . </s><s> Ode dne";"zatčení do 18";". února 1952 byla Jetty Dornová ve vyšetřovací vazbě . </s>"
"1";"cs: čeština";"FIC: beletrie";"COL: kratší próza";"X: neuvedeno";"X: neuvedeno";"si na víně , které jí otrok neustále doléval ze";"džbánu do jedované";"olověné nádoby . </s><s> „ Snad si nemyslíš , že …"
"1";"cs: čeština";"NFC: oborová literatura";"SCI: odborná literatura";"HUM: humanitní vědy";"ANT: antropologie, etnografie";". </s><s> Nebo dokonce na ( zdánlivě paradoxním ) začleňováním zbojnických";"uskupení do nechvalně";"proslulých divokých pomocných vojenských sborů deli na osmanské straně či"
"1";"en: angličtina";"NFC: oborová literatura";"SCI: odborná literatura";"HUM: humanitní vědy";"PHI: filozofie, náboženství";"s platformou , která se využívala k vrhání obětí a";"obětin do cenote";"( obr . </s><s> III . 09 . 14 ) . </s>"
"1";"cs: čeština";"NFC: oborová literatura";"SCI: odborná literatura";"HUM: humanitní vědy";"HIS: historie, biografie";"odkud teprve budou posíláni na posice . “ </s><s> Vstup bývalého";"důstojníka do čs";". vojska byl však podmíněn ztrátou hodnosti nebo hodností jednoročního"
"1";"cs: čeština";"NFC: oborová literatura";"SCI: odborná literatura";"HUM: humanitní vědy";"HIS: historie, biografie";"počtu 17 mužů se skupina emisařů rozšířila v průběhu podzimního";"náboru do čs";". vojska roku 1917 o dobrovolné emisaře z řad slovenských"
"1";"cs: čeština";"NFC: oborová literatura";"POP: populárně naučná literatura";"HUM: humanitní vědy";"HIS: historie, biografie";"za samostatnost Slovenska vyslovovala samozřejmě i většina slovenských emigrantských organizací";"sdružených do Svetového";"kongresu Slovákov ( SKS ) , ačkoliv ani v této"
"1";"cs: čeština";"NFC: oborová literatura";"POP: populárně naučná literatura";"HUM: humanitní vědy";"HIS: historie, biografie";"ani možnosti , ani personální vybavení . </s><s> Zapojení Slovenské národopisné";"společnosti do NSČ";"mělo nicméně kopírovat vztah SAV a ČSAV , a to"
"1";"cs: čeština";"NFC: oborová literatura";"POP: populárně naučná literatura";"HUM: humanitní vědy";"HIS: historie, biografie";"1992 a mohlo by dojít i k návratu vysloveně profederálních";"sil do SNR";"a FS . </s><s> V takovém případě se rýsovala alespoň teoretická"
"1";"en: angličtina";"NFC: oborová literatura";"POP: populárně naučná literatura";"HUM: humanitní vědy";"HIS: historie, biografie";"roce 620 , ještě před přesídlením jeho muslimské komunity z";"Mekky do Medíny";"v roce 622 . </s><s> Podle rané muslimské interpretace byla „"
"1";"de: němčina";"NFC: oborová literatura";"POP: populárně naučná literatura";"HUM: humanitní vědy";"HIS: historie, biografie";"Sutzkevera , bylo ještě před zřízením ghetta , tedy od";"července do 6";". září 1941 , zabito 12 000 Židů . 89"
"1";"cs: čeština";"NFC: oborová literatura";"SCI: odborná literatura";"HUM: humanitní vědy";"MUS: hudba";"Dechový orchestr Mohelnice zlaté pásmo v krajské soutěži středních dechových";"orchestrů ( do 36";"hudebníků ) v Bílovci , čímž získal možnost účinkovat na"
"1";"en: angličtina";"NFC: oborová literatura";"POP: populárně naučná literatura";"HUM: humanitní vědy";"MUS: hudba";"a vytvoření nezávislé společnosti . </s><s> Výsledkem byly proudy mladých lidí";"směřujících do San";"Franciska , centra květinového hnutí . </s><s> FBI ten rok zaznamenala"
"1";"fr: francouzština";"NFC: oborová literatura";"POP: populárně naučná literatura";"HUM: humanitní vědy";"MUS: hudba";"konce . </s><s> Na dva dlouhé měsíce , od 28 .";"září do 26";". listopadu , zastavuje veškerou svou činnost a pobývá se"
"1";"cs: čeština";"NFC: oborová literatura";"SCI: odborná literatura";"HUM: humanitní vědy";"LAN: filologie";"interpretovi , zda bude sledovat úsilí kritika vytvořit obraz sebe";"sama do „";"nadčasových normativních paradigmat lidství “ , nebo bude sledovat pouze"
"1";"cs: čeština";"NFC: oborová literatura";"SCI: odborná literatura";"HUM: humanitní vědy";"LAN: filologie";"ani kamera ) . </s><s> Pokračuje rovněž vyjadřování pomocí sdělení jakoby";"rozložených do více";"replik ( viz též výše , 3 . 2 ."
"1";"cs: čeština";"NFC: oborová literatura";"POP: populárně naučná literatura";"HUM: humanitní vědy";"LAN: filologie";"rodiny , emigroval přes Švýcarsko do Francie a později během";"války do USA";", kde konvertoval ke katolicismu . </s><s> Do češtiny byl nejvýznamnější"
"1";"cs: čeština";"NFC: oborová literatura";"POP: populárně naučná literatura";"HUM: humanitní vědy";"LAN: filologie";"Ťin-pchingem sbratřil až nečekaně , načež se blíží cesta čínského";"prezidenta do USA";", zatímco sám Tillerson namísto na summit NATO míří do"
"1";"cs: čeština";"NFC: oborová literatura";"SCI: odborná literatura";"HUM: humanitní vědy";"ART: umění, architektura";"<s> 75 Pražský student ; Josef Max , 1847 </s><s> 76 Portál";"průchodu do 2";". nádvoří </s><s> 77 Mříž nadsvětlíku portálu </s><s> 78 Pamětní deska Bohuslava"
"1";"cs: čeština";"NFC: oborová literatura";"SCI: odborná literatura";"SSC: sociální vědy";"ECO: ekonomie, obchod, logistika";"a jejich souvislosti s novými prvními úspěchy , přenesení nových";"principů do vnitrofirmení";"legislativy - vnitřních předpisů , odměňování v souladu s dosahovanýnmi"
"1";"cs: čeština";"NFC: oborová literatura";"PRO: profesní literatura";"SSC: sociální vědy";"ECO: ekonomie, obchod, logistika";"ukázat své dovednosti v průběhu kvalifikačního kola od 1 .";"května do 21";". srpna 2015 . </s><s> Jejich počet , který předčil loňský"
"1";"cs: čeština";"NFC: oborová literatura";"PRO: profesní literatura";"SSC: sociální vědy";"ECO: ekonomie, obchod, logistika";"<s> Národní kolo pro Českou republiku bude probíhat od 1 .";"května do 21";". srpna 2015 a je otevřeno pro stávající i potenciální"
"1";"cs: čeština";"NFC: oborová literatura";"PRO: profesní literatura";"SSC: sociální vědy";"ECO: ekonomie, obchod, logistika";"jiných částech byli zaměstnanci přizváni do společného rozhodování s možností";"zapojení do CSR";"programů atd . </s><s> „ Kombinací podobných intervencí , směřovaných ke"
"1";"cs: čeština";"NFC: oborová literatura";"PRO: profesní literatura";"SSC: sociální vědy";"ECO: ekonomie, obchod, logistika";"verze vozu byla přizpůsobena specifickým potřebám dalších trhů , včetně";"varianty do extrémně";"nízkých teplot pro ruský trh , flex - fuel modelu"
"1";"cs: čeština";"NFC: oborová literatura";"PRO: profesní literatura";"SSC: sociální vědy";"ECO: ekonomie, obchod, logistika";"<s> Dodavatelé obchodních řetězců se v posledních letech dostávají z logistického";"hlediska do stále";"složitější situace . </s><s> Řetězce požadují krátký reakční čas , rychlé"
"1";"cs: čeština";"NFC: oborová literatura";"PRO: profesní literatura";"SSC: sociální vědy";"ECO: ekonomie, obchod, logistika";"Tuchoměřicích . </s><s> Co bylo vaší největší motivací pro stěhování distribučního";"centra do Jiren";"? </s><s> Naše rozhodnutí bylo založené na proměně naší distribuční mapy"
"1";"cs: čeština";"NFC: oborová literatura";"PRO: profesní literatura";"SSC: sociální vědy";"ECO: ekonomie, obchod, logistika";"firma narazila na řadu nečekaných obtíží . </s><s> Plynulou cestu z";"Prahy do Stutgartu";"narušily až dlouhé kolony v tomto německém městě . </s><s> Jako"
"1";"cs: čeština";"NFC: oborová literatura";"PRO: profesní literatura";"SSC: sociální vědy";"ECO: ekonomie, obchod, logistika";"určité činnosti za zasílatele , například obstarání svozu a rozvozu";"zboží do a";"z terminálu v zahraničí a podobně . </s><s> Pokud to neodporuje"
"1";"es: španělština";"NFC: oborová literatura";"SCI: odborná literatura";"SSC: sociální vědy";"POL: politika, vojenství";"kdo z organizace odejdou . </s><s> Podle Berta Klandermanse klade proces";"vstupu do dobře";"zorganizovaného společenského hnutí jisté požadavky , mezi nimiž musíme zdůraznit"
"1";"cs: čeština";"NFC: oborová literatura";"SCI: odborná literatura";"SSC: sociální vědy";"POL: politika, vojenství";"<s> S ohledem na to je třeba přistupovat i k zařazení";"stran do von";"Beymeho typologie stranických rodin . </s><s> Sám von Beyme sice všechny"
"1";"cs: čeština";"NFC: oborová literatura";"SCI: odborná literatura";"SSC: sociální vědy";"LAW: právo";"čtyř obětí Prešovského krvavého soudu , který od 5 .";"března do 12";". září 1687 odsoudil k surové smrti na popravišti ,"
"1";"cs: čeština";"NFC: oborová literatura";"SCI: odborná literatura";"SSC: sociální vědy";"LAW: právo";"zpětné vazby . </s><s> Nevhodná zpětná vazba může některé účastníky od";"zapojení do moot";"courtu odradit a celkově snížit motivaci týmu . </s><s> Proto je"
"1";"cs: čeština";"NFC: oborová literatura";"POP: populárně naučná literatura";"SSC: sociální vědy";"LAW: právo";"dohodě nedojde do 24 měsíců od nabytí účinnosti novely vodního";"zákona ( do 1";". ledna 2016 ) , může se vlastník služebného pozemku"
"1";"cs: čeština";"NFC: oborová literatura";"POP: populárně naučná literatura";"SSC: sociální vědy";"LAW: právo";"petici stálo ? </s><s> Naše petiční akce trvala od 24 .";"srpna do 25";". září 1997 , za tu dobu se podařilo nashromáždit"
"1";"cs: čeština";"NFC: oborová literatura";"SCI: odborná literatura";"SSC: sociální vědy";"PSY: psychologie";"je tedy podkladem impulsivity a anatomicky je lokalizovaný do laterálního";"hypothalamu , do fasciculus";"longitudinalis telencephali a do laterálních septálních jader ( Faber ,"
"1";"cs: čeština";"NFC: oborová literatura";"SCI: odborná literatura";"SSC: sociální vědy";"REC: sport, rekreace, hobby";"umístěn vedle první dráhy ve vzdálenosti 50 m od cílové";"čáry , do 2,0";"m od okraje běžeckého oválu a ve výšce 1,22 m"
"1";"cs: čeština";"NFC: oborová literatura";"SCI: odborná literatura";"SSC: sociální vědy";"REC: sport, rekreace, hobby";"pohybu hráčů dokola , kdy se soustředíme pouze na vyhození";"míče do vzduch";"a jeho následné zachycení do padáku . </s><s> Pohyb hráčů :"
"1";"cs: čeština";"NFC: oborová literatura";"SCI: odborná literatura";"SSC: sociální vědy";"REC: sport, rekreace, hobby";"regulovat soutěžení sportovců s TP s cílem co největšího začlenění";"sportovců do co";"nejmenšího počtu skupin , tak aby při soutěžích nebylo 40"
"1";"cs: čeština";"NFC: oborová literatura";"POP: populárně naučná literatura";"SSC: sociální vědy";"REC: sport, rekreace, hobby";"do zásoby zeleninový vývar a pak už jen vykouzlete 5";"polévek do 30";"minut . </s><s> DÝŇOVÝ KRÉM S KARI </s><s> 4 porce PŘÍPRAVA :"
"1";"cs: čeština";"NFC: oborová literatura";"SCI: odborná literatura";"SSC: sociální vědy";"EDU: pedagogika";"možné se však soustředit , zkoušet rozptýlení překonávat , z";"ponoru do příliš";"lidského se vzpínat k otevřenosti , k onomu "" vyššímu"
"1";"cs: čeština";"NFC: oborová literatura";"SCI: odborná literatura";"SSC: sociální vědy";"EDU: pedagogika";". Bessotha ( 1989 a ) se jedná o pohled";"učitelů do „";"vnitřku “ školy , bez ohledu na působení jejího prostředí"
"1";"cs: čeština";"NFC: oborová literatura";"SCI: odborná literatura";"SSC: sociální vědy";"EDU: pedagogika";"nepřesných či zavádějících informací . </s><s> Vedené rozhovory trvaly od 30";"minut do 45";"minut . </s><s> Na dokumenty jsme nahlíželi prostřednictvím okruhů základních a"
"1";"cs: čeština";"NFC: oborová literatura";"SCI: odborná literatura";"SSC: sociální vědy";"EDU: pedagogika";"a mladšího školního věku , konkrétně v rozmezí od 35";"měsíců do 84";"měsíců . </s><s> Stanoveným kritériem výběru byla diagnóza poruchy autistického spektra"
"1";"cs: čeština";"NFC: oborová literatura";"PRO: profesní literatura";"SSC: sociální vědy";"EDU: pedagogika";"od maminky do prostředí mateřské školy nebo ze známého prostředí";"školky do „";"velké školy “ , na ně má mnohem větší dopad"
"1";"cs: čeština";"NFC: oborová literatura";"PRO: profesní literatura";"SSC: sociální vědy";"EDU: pedagogika";"do 4 let dvakrát denně čajovou lžičku , od 4";"let do 7";"let 3 x denně čajovou lžičku a starším dětem 1"
"1";"cs: čeština";"NFC: oborová literatura";"SCI: odborná literatura";"NAT: přírodní vědy";"BIO: biologie";") . </s><s> Úzká propojení mezi druhy demonstrují obtíže pronikání nežádoucích";"druhů do „";"funkčních skupin “ ( KÖRNER 1994 ) , protože jednotlivé"
"1";"cs: čeština";"NFC: oborová literatura";"SCI: odborná literatura";"NAT: přírodní vědy";"BIO: biologie";"<s> Zahrnuje tedy jednak informaci o přírodním pozadí - přirozené diferenciaci";"území do relativně";"homogenních přírodních krajinných jednotek - a dále informaci o současném"
"1";"cs: čeština";"NFC: oborová literatura";"SCI: odborná literatura";"NAT: přírodní vědy";"BIO: biologie";"<s> Studie vycházela z datového souboru 20 468 fytocenologických snímků ,";"klasifikovaných do 32";"biotopů ( Obr . 346 ) . </s><s> Fytocenologické snímky obsahovaly"
"1";"cs: čeština";"NFC: oborová literatura";"SCI: odborná literatura";"NAT: přírodní vědy";"BIO: biologie";"s pokryvností stromového patra 25 – 65 % a výškou";"stromů do 10";"m ; výjimkou nejsou ani křovité porosty o výšce 2"
"1";"cs: čeština";"NFC: oborová literatura";"POP: populárně naučná literatura";"NAT: přírodní vědy";"BIO: biologie";"za trest . </s><s> V Limě všichni žasli nad cílem mé";"cesty : „ Do Pucallpy";", panáčku ?! </s><s> Ale tam je prales , nekulturno ,"
"1";"cs: čeština";"NFC: oborová literatura";"POP: populárně naučná literatura";"NAT: přírodní vědy";"BIO: biologie";"<s> Prospekci nových lokalit a těžbu urychlilo v roce 1789 zahrnutí";"uhlí do tzv";". horního regálu . </s><s> Znamenalo to , že těžit mohl"
"1";"en: angličtina";"NFC: oborová literatura";"POP: populárně naučná literatura";"NAT: přírodní vědy";"PHY: fyzika";"skončila další série pozorování jeho týmu . </s><s> Během letu z";"Honolulu do San";"Franciska poprvé v životě použil palubní telefon , zavolal kolegům"
"1";"cs: čeština";"NFC: oborová literatura";"PRO: profesní literatura";"NAT: přírodní vědy";"GEO: geografie, geologie";"který je dostupný z . </s><s> Organizátory je přislíbeno také převedení";"zvuku do MP3";", aby na chytrých telefonech a přehrávačích mohl profesor Švambera"
"1";"cs: čeština";"NFC: oborová literatura";"PRO: profesní literatura";"NAT: přírodní vědy";"GEO: geografie, geologie";"<s> 2016 , se především jedná o problematiku doplnění parcel zjednodušené";"evidence do SGI";"( 3 . 2 . 1 ) , ale „"
"1";"cs: čeština";"NFC: oborová literatura";"PRO: profesní literatura";"NAT: přírodní vědy";"GEO: geografie, geologie";"že grafické okno má , na rozdíl od běžně dostupného";"Nahlížení do KN";", zvětšený rozměr na max . 1920 x 1200 pixelů"
