"1";"fr: francouzština";"FIC: beletrie";"NOV: próza";"X: neuvedeno";"X: neuvedeno";"domu . </s><s> Tři zasklená okna z drobných čtverečků , mírně";"zbarvených do šafránově";"žluté barvy , vedou do parku . </s><s> Místnost zaplavuje jemné"
"1";"cs: čeština";"NMG: publicistika";"NEW: tradiční publicistika";"X: neuvedeno";"NTW: celostátní tisk";"Coopera z Teorie velkého třesku jako představitele Aspergerova syndromu (";"patřícího do PAS";") . </s><s> Pro ty , kteří mají větší povědomí o"
"1";"cs: čeština";"NMG: publicistika";"NEW: tradiční publicistika";"X: neuvedeno";"NTW: celostátní tisk";"didaktických testů společné části maturitní zkoušky zpřístupní centrum Cermat ředitelům";"škol do 15";". května . </s><s> Nejpozději následujícího pracovního dne po zpřístupnění výsledků"
"1";"cs: čeština";"NMG: publicistika";"NEW: tradiční publicistika";"X: neuvedeno";"NTW: celostátní tisk";"době potěší české příznivce . </s><s> Od této středy 17 .";"srpna do 9";". září odehraje patnáct koncertů v rámci Kousek štěstí tour"
"1";"cs: čeština";"NMG: publicistika";"NEW: tradiční publicistika";"X: neuvedeno";"NTW: celostátní tisk";"<s> Od té doby brněnská továrna dodala 1,3 milionu kusů svých";"strojů do 136";"zemí světa . </s><s> Koho zajímá podrobná historie světoznámých traktorů ,"
"1";"cs: čeština";"NMG: publicistika";"NEW: tradiční publicistika";"X: neuvedeno";"NTW: celostátní tisk";"dva roky a Plzeňský kraj soutěží s regiony s počtem";"obyvatel do 1,5";"milionu . </s><s> Slavnostní předání cen se uskutečnilo na veletrhu nemovitostí"
"1";"cs: čeština";"NMG: publicistika";"NEW: tradiční publicistika";"X: neuvedeno";"NTW: celostátní tisk";". </s><s> Ceny jsou odlišené podle délky trvání vstupenky , možnosti";"vstupu do VIP";"zón a podobně . </s><s> Hlavně česky Votvírák nabízí každoročně směsici"
"1";"cs: čeština";"NMG: publicistika";"NEW: tradiční publicistika";"X: neuvedeno";"NTW: celostátní tisk";"té doby došlo přinejmenším ke třem výrazným posunům . </s><s> Zasahování";"Bruselu do vcelku";"podružných záležitostí začalo nápadně kontrastovat s bezradností ohledně událostí ,"
"1";"cs: čeština";"NMG: publicistika";"NEW: tradiční publicistika";"X: neuvedeno";"NTW: celostátní tisk";"úvahy , jako že „ srbský národ je jeden od";"Kninu do Kovina";"( město v Srbsku na hranicích s Rumunskem ) a"
"1";"cs: čeština";"NMG: publicistika";"NEW: tradiční publicistika";"X: neuvedeno";"NTW: celostátní tisk";"<s> Zde se vlaková doprava zastaví v období od 21 .";"března do 18";". června příštího roku . </s><s> Po skončení stavebních prací se"
"1";"cs: čeština";"NMG: publicistika";"NEW: tradiční publicistika";"X: neuvedeno";"NTW: celostátní tisk";"podnikatele a řemesla . </s><s> Neprošly ani návrhy na zavedení několika";"výjimek do EET";". </s><s> Lidovci například neuspěli s požadavkem na výjimku pro farmářské"
"1";"cs: čeština";"NMG: publicistika";"NEW: tradiční publicistika";"X: neuvedeno";"NTW: celostátní tisk";"neochota posunout věci do finále , “ popsal Sobotka peripetie";"návratu do NHL";". </s><s> Předělaná smlouva Po uzavření tříletého kontraktu s Omskem měl"
"1";"cs: čeština";"NMG: publicistika";"NEW: tradiční publicistika";"X: neuvedeno";"NTW: celostátní tisk";"zdrojů Pavlína Šmatolánová . </s><s> Na dobu určitou Ve věkové skupině";"zaměstnanců do 29";"let je smluv na dobu určitou 15 procent . *"
"1";"cs: čeština";"NMG: publicistika";"NEW: tradiční publicistika";"X: neuvedeno";"NTW: celostátní tisk";"pro založení přirozené vlhké louky . </s><s> Tím dosáhneme rychlejšího návratu";"lokality do co";"nejpřirozenější přírodní podoby , “ vysvětlila Fišerová . </s><s> Na novinky"
"1";"cs: čeština";"NMG: publicistika";"NEW: tradiční publicistika";"X: neuvedeno";"NTW: celostátní tisk";", reprízy „ pojedou “ každý den od 24 .";"srpna do 2";". září a pak ještě 7 . , 8 ."
"1";"cs: čeština";"NMG: publicistika";"NEW: tradiční publicistika";"X: neuvedeno";"NTW: celostátní tisk";"stejným bodovým ziskem jako osmá Slovanka . </s><s> Tedy na hraně";"postupu do play";"off . </s><s> Naposledy prohrály v Brně na Rosničce s BK"
"1";"cs: čeština";"NMG: publicistika";"NEW: tradiční publicistika";"X: neuvedeno";"NTW: celostátní tisk";"<s> Podle Chovance je potřeba řešit případný příchod dalších deseti tisíc";"zaměstnanců do ČR";"tak , jak to prý požadují a plánují zaměstnavatelé ,"
"1";"cs: čeština";"NMG: publicistika";"NEW: tradiční publicistika";"X: neuvedeno";"NTW: celostátní tisk";"dat vypočítala náklady na vzdělávání jednotlivých žáků ve věku od";"šesti do 15";"let a zkombino - vala propočty s kupní sílou a"
"1";"cs: čeština";"NMG: publicistika";"NEW: tradiční publicistika";"X: neuvedeno";"NTW: celostátní tisk";"30 miliónů korun . </s><s> Na pořízení obědů pro děti od";"tří do 15";"let , jejichž rodiče nemají na zaplacení stravování , by"
"1";"cs: čeština";"NMG: publicistika";"NEW: tradiční publicistika";"X: neuvedeno";"NTW: celostátní tisk";"zpět . </s><s> Transport nafty začal loni v říjnu . </s><s> Dopravu";"paliva do ČR";"zajišťuje Čepro , smluvním dopravcem je ČD Cargo . </s><s> Náklady"
"1";"cs: čeština";"NMG: publicistika";"NEW: tradiční publicistika";"X: neuvedeno";"NTW: celostátní tisk";"to právě převážně věk matky . </s><s> Úspěšnost IVF je 50";"procent do 35";"let a pět procent nad 43 let – během osmi"
"1";"cs: čeština";"NMG: publicistika";"NEW: tradiční publicistika";"X: neuvedeno";"NTW: celostátní tisk";"Nikola Nosková získala bronzovou medaili v časovce na mistrovství Evropy";"žen do 23";"let v Brně . </s><s> Prvenství vybojovala na trati 23 km"
"1";"cs: čeština";"NMG: publicistika";"NEW: tradiční publicistika";"X: neuvedeno";"NTW: celostátní tisk";", zda jsem holubice , nebo jestřáb , mě od";"nástupu do ČNB";"rozesmávají . </s><s> Jednou mohu být pro zvyšování sazeb , jindy"
"1";"cs: čeština";"NMG: publicistika";"NEW: tradiční publicistika";"X: neuvedeno";"NTW: celostátní tisk";"konzultace a dotazy k návrhu plánu . </s><s> Od 15 .";"června do 26";". července pak budou odborníci připraveni konzultovat každý všední den"
"1";"cs: čeština";"NMG: publicistika";"NEW: tradiční publicistika";"X: neuvedeno";"NTW: celostátní tisk";"před velrybou , v dubnu , poslal přes Facebook 60";"dolarů do velmi";"sympatické společnosti 4 Ocean ( myšleno asi „ Pro Oceán"
"1";"cs: čeština";"NMG: publicistika";"NEW: tradiční publicistika";"X: neuvedeno";"NTW: celostátní tisk";"a občerstvení . </s><s> Rodiče za takovou oslavu zaplatí od šestnácti";"set do zhruba";"tří tisíc korun . </s><s> Kromě zábavních center si rodiče pronajímají"
"1";"cs: čeština";"NMG: publicistika";"NEW: tradiční publicistika";"X: neuvedeno";"NTW: celostátní tisk";"do veřejnosti zpřístupněných bývalých vojenských újezdů . </s><s> Od 1 .";"dubna do 31";". října lze už druhým rokem jízdní kola přepravovat i"
"1";"cs: čeština";"NMG: publicistika";"NEW: tradiční publicistika";"X: neuvedeno";"NTW: celostátní tisk";"totiž příliš vysoké . </s><s> Finálové projekty budou vystaveny na náměstí";"Svobody do 9";". listopadu , poté se výstava přesune na Malinovského náměstí"
"1";"cs: čeština";"NMG: publicistika";"NEW: tradiční publicistika";"X: neuvedeno";"NTW: celostátní tisk";"o dalším pokračování tohoto projektu v nové situaci vstupu minoritního";"akcionáře do CEFC";"Europe , “ dodal Bednář . </s><s> Čtyřicetiletá historie </s><s> CITIC Group"
"1";"cs: čeština";"NMG: publicistika";"NEW: tradiční publicistika";"X: neuvedeno";"NTW: celostátní tisk";"stranu , když rozpočítáme dotace podle jednotlivých let od českého";"vstupu do EU";", tak tvoří pouze kolem 1,3 procenta ročního hrubého domácího"
"1";"cs: čeština";"NMG: publicistika";"NEW: tradiční publicistika";"X: neuvedeno";"NTW: celostátní tisk";". </s><s> Zájem o zlato podpořily nákupy centrálních bank a příliv";"investic do burzovně";"obchodovaných fondů ETF zaměřených na zlato . </s><s> Vyplývá to ze"
"1";"cs: čeština";"NMG: publicistika";"NEW: tradiční publicistika";"X: neuvedeno";"NTW: celostátní tisk";", před rokem se zasadil o vydání ruského hackera Jevgenije";"Nikulina do USA";". </s><s> V kauze Huawei a v otázce kybernetické bezpečnosti se"
"1";"cs: čeština";"NMG: publicistika";"NEW: tradiční publicistika";"X: neuvedeno";"NTW: celostátní tisk";", že se jich bojíme . “ </s><s> Za práva afghánských";"žen Do Ji";". hlavy přijede také afghánská politička a spisovatelka Fawzia Koofiová"
"1";"cs: čeština";"NMG: publicistika";"NEW: tradiční publicistika";"X: neuvedeno";"NTW: celostátní tisk";"/ 2017 zastupuje Rudá hvězda Kunlun . </s><s> Slavnostní oznámení jejího";"vstupu do KHL";"proběhlo v červnu 2016 za přítomnosti ruského prezidenta Vladimira Putina"
"1";"cs: čeština";"NMG: publicistika";"NEW: tradiční publicistika";"X: neuvedeno";"NTW: celostátní tisk";", pokusily se přejít řeku Sakarya a od 23 .";"srpna do 13";". září 1921 zde svedly rozhodující a pro sebe ve"
"1";"cs: čeština";"NMG: publicistika";"NEW: tradiční publicistika";"X: neuvedeno";"NTW: celostátní tisk";"“ uvedla Pudilová . </s><s> Čtyřiadvacetiletá bojovnice bude poprvé od svého";"vstupu do UFC";"bojovat v muší váhové kategorii do 57 kilogramů , která"
"1";"cs: čeština";"NMG: publicistika";"NEW: tradiční publicistika";"X: neuvedeno";"NTW: celostátní tisk";"začne postupně oteplovat . </s><s> Celkově bude období od 13 .";"května do 9";". června teplotně slabě podprůměrné a srážkově průměrné . </s><s> Nejvíce"
"1";"cs: čeština";"NMG: publicistika";"NEW: tradiční publicistika";"X: neuvedeno";"NTW: celostátní tisk";". </s><s> Na trase C musí cestující počítat od 29 .";"června do 7";". července s výlukou mezi stanicemi Pražského povstání a Kačerov"
"1";"cs: čeština";"NMG: publicistika";"NEW: tradiční publicistika";"X: neuvedeno";"NTW: celostátní tisk";"něco by se ujalo . </s><s> Nedávno jste se vrátil z";"Eura do 19";"let . </s><s> Můžete se podělit o svoje dojmy z něj"
"1";"cs: čeština";"NMG: publicistika";"NEW: tradiční publicistika";"X: neuvedeno";"NTW: celostátní tisk";"Endála a Ivana Lytvynova , který je na mistrovství světa";"hráčů do 20";"let . </s><s> „ Uvidíme , jestli se nám třeba nevrátí"
"1";"cs: čeština";"NMG: publicistika";"NEW: tradiční publicistika";"X: neuvedeno";"NTW: celostátní tisk";"účtu Richee nabízí roční sazbu ve výši 1,5 procenta u";"zůstatků do 300";"tisíc korun , zůstatek nad tento limit je pak úročen"
"1";"cs: čeština";"NMG: publicistika";"NEW: tradiční publicistika";"X: neuvedeno";"NTW: celostátní tisk";"Jak však ukázaly výsledky průzkumu , i u skupiny nejmladších";"respondentů do 26";"let má tuto zkušenost více než polovina z nich ,"
"1";"cs: čeština";"NMG: publicistika";"NEW: tradiční publicistika";"X: neuvedeno";"NTW: celostátní tisk";"Andrej Babiš . </s><s> Hong Kong : Za protesty vězení </s><s> Od";"osmi do 16";"měsíců ve vězení si má odsedět sedm organizátorů hongkongských masových"
"1";"cs: čeština";"NMG: publicistika";"NEW: tradiční publicistika";"X: neuvedeno";"NTW: celostátní tisk";"k orálnímu sexu v blíže neurčené době od 23 .";"října do 7";". listopadu 2017 , kdy ji pozval do bytu k"
"1";"cs: čeština";"NMG: publicistika";"NEW: tradiční publicistika";"X: neuvedeno";"NTW: celostátní tisk";"cyrilometodějská teologická fakulta , která přijímá přihlášky od 17 .";"června do 31";". července . </s><s> „ Zájemci se mohou hlásit na bakalářské"
"1";"cs: čeština";"NMG: publicistika";"NEW: tradiční publicistika";"X: neuvedeno";"NTW: celostátní tisk";"traktu a přilehlém okolí pražské Betlémské kaple od 11 .";"září do 10";". října . </s><s> Mezi autory budou například Alena Šrámková ,"
"1";"cs: čeština";"NMG: publicistika";"NEW: tradiční publicistika";"X: neuvedeno";"NTW: celostátní tisk";"návštěvníci obdivovat v Galerii Vystaveno na třídě ČSA v Hradci";"Králové do 8";". prosince . </s><s> Vláda plánuje investice za pět bilionů </s><s> Vláda"
"1";"cs: čeština";"NMG: publicistika";"NEW: tradiční publicistika";"X: neuvedeno";"NTW: celostátní tisk";". </s><s> Ať už šlo o vydání údajného ruského hackera Jevgenije";"Nikulina do USA";", vyhošťování ruských špionů nebo varování , že plánovaná jaderná"
"1";"cs: čeština";"NMG: publicistika";"NEW: tradiční publicistika";"X: neuvedeno";"NTW: celostátní tisk";"<s> Karel Srp ( jde o syna stejnojmenného bývalého šéfa Jazzové";"sekce ) do GHMP";"nastoupil už v roce 1987 a v letech 2005 –"
"1";"cs: čeština";"NMG: publicistika";"NEW: tradiční publicistika";"X: neuvedeno";"REG: regionální tisk";"kraji vyfotili a natočili asi stovku dětí ve věku od";"sedmi do 18";"let a pak filmy a fotografie dodávali zahraničním klientům . </s>"
"1";"cs: čeština";"NMG: publicistika";"NEW: tradiční publicistika";"X: neuvedeno";"REG: regionální tisk";"vzestupu . </s><s> Zdena Blašková , která sice už přestoupila z";"Prachatic do SK";"Dobré , ale přesto zůstává srdcem Jihočeškou , obsadila na"
"1";"cs: čeština";"NMG: publicistika";"NEW: tradiční publicistika";"X: neuvedeno";"REG: regionální tisk";"tie-breaku finále skončila pouť softbalistek Snails Kunovice na mistrovství republiky";"juniorek do 19";"let . </s><s> Výběr kouče Pavla Křiváka vybojoval v Praze i"
"1";"cs: čeština";"NMG: publicistika";"NEW: tradiční publicistika";"X: neuvedeno";"REG: regionální tisk";"na jejich čin ministr vnitra Chovanec následně program přijímání křesťanských";"uprchlíků do ČR";"pozastavil . </s><s> Škola bude muset peníze na azylanty vrátit </s><s> Ačkoliv"
"1";"cs: čeština";"NMG: publicistika";"NEW: tradiční publicistika";"X: neuvedeno";"REG: regionální tisk";"sdělila největší osobnost olomouckého výběru . </s><s> Právě Kobylík , mistr";"Evropy do 21";"let z roku 2002 , který prošel francouzskou , německou"
"1";"cs: čeština";"NMG: publicistika";"NEW: tradiční publicistika";"X: neuvedeno";"REG: regionální tisk";"Expozice v Alžbětiných lázních bude k vidění od 16 .";"září do 30";". října 2016 . </s><s> Otevřeno denně kromě pondělí 9 ."
"1";"cs: čeština";"NMG: publicistika";"NEW: tradiční publicistika";"X: neuvedeno";"REG: regionální tisk";"hod . – VÁLKA NA UKRAJINĚ . </s><s> Přednáška . </s><s> Galerie";"Kaple do 24";". listopadu – EVA KOŤÁTKOVÁ . </s><s> Galerie Sýpka do 18"
"1";"cs: čeština";"NMG: publicistika";"NEW: tradiční publicistika";"X: neuvedeno";"REG: regionální tisk";"– Kvůli zhotovování nové plynové přípojky bude od 1 .";"července do 5";". července neprůjezdná část jindřichohradecké ulice Mládežnické . </s><s> „ Jedná"
"1";"cs: čeština";"NMG: publicistika";"NEW: tradiční publicistika";"X: neuvedeno";"REG: regionální tisk";"Kampě uskuteční v druhé polovině roku , od 11 .";"srpna do 12";". listopadu . </s><s> Broušené ozdoby z Preciosy ozdobí také kolekci"
"1";"cs: čeština";"NMG: publicistika";"NEW: tradiční publicistika";"X: neuvedeno";"REG: regionální tisk";"lokalitě pod firmou Osiva , mají rozlohu od 880 metrů";"čtverečních do 1090";"metrů . </s><s> Jak starosta dodal , stanovit vyvolávací cenu za"
"1";"cs: čeština";"NMG: publicistika";"NEW: tradiční publicistika";"X: neuvedeno";"REG: regionální tisk";"<s> · Zaměstnavatel roku 2018 do 5000 zaměstnanců : Kategorie Zaměstnavatel";"roku do 5000";"zaměstnanců oceňuje středně velké společnosti , které mají obvykle výrazné"
"1";"cs: čeština";"NMG: publicistika";"NEW: tradiční publicistika";"X: neuvedeno";"REG: regionální tisk";"veřejné služby , rekordních 241 milionů korun za bezplatnou dopravu";"dětí do 6";"let a slevy pro studenty a zdravotně postižené . </s><s> V"
"1";"cs: čeština";"NMG: publicistika";"NEW: tradiční publicistika";"X: neuvedeno";"REG: regionální tisk";"první den domácího mistrovství Evropy v silniční cyklistice juniorů a";"jezdců do 23";"let slaví Česjuniorů ká republika medaili . </s><s> V časovce žen"
"1";"cs: čeština";"NMG: publicistika";"NEW: tradiční publicistika";"X: neuvedeno";"REG: regionální tisk";"uskuteční o měsíc dřív , a to od 29 .";"května do 2";". června 2019 s názvem J & T Banka Ostrava"
"1";"cs: čeština";"NMG: publicistika";"NEW: tradiční publicistika";"X: neuvedeno";"REG: regionální tisk";"branou do uzavřené části městyse Karlštejn přenesou do doby dávno";"minulé , do 14";". století Otce vlasti . </s><s> Bohatý dvoudenní program potěší malé"
"1";"cs: čeština";"NMG: publicistika";"NEW: tradiční publicistika";"X: neuvedeno";"REG: regionální tisk";"uživí , “ pravil s úsměvem Ondřej Nemrava nejlepší sportovec";"Kunovic do 15";"let . </s><s> VÍTĚZNÝ HATTRICK </s><s> A kdo byl nominován mezi dospěláky"
"1";"cs: čeština";"NMG: publicistika";"NEW: tradiční publicistika";"X: neuvedeno";"REG: regionální tisk";"Mnichově si to zopakovala a Adamovská skončila ve starší kategorii";"dívek do 18";"let šestá . </s><s> „ Už jen vejít se do první"
"1";"cs: čeština";"NMG: publicistika";"NEW: tradiční publicistika";"X: neuvedeno";"REG: regionální tisk";"délka trati 4,8 km , přihlášky do pátku 12 .";"října do 20";"hodin přes přihlašovací formulář na . cz , přihlásit se"
"1";"cs: čeština";"NMG: publicistika";"NEW: tradiční publicistika";"X: neuvedeno";"REG: regionální tisk";". 10 . </s><s> Konopí – minulost i budoucnost – Zámek";"Kinských , do 11";". 11 . </s><s> Ať žije republika ! – Výstava představující"
"1";"cs: čeština";"NMG: publicistika";"NEW: tradiční publicistika";"X: neuvedeno";"REG: regionální tisk";"Malinová na čáslavském Čeplově budou v termínu jsou 18 .";"února do 15";". dubna uzavřeny . </s><s> Důvodem uzavírky je rekonstrukce plynovodu a"
"1";"cs: čeština";"NMG: publicistika";"NEW: tradiční publicistika";"X: neuvedeno";"REG: regionální tisk";". </s><s> Výstava v Chodském hradu Kdy : od 5 .";"dubna do 12";". května Kde : Chodský hrad , Domažlice Co :"
"1";"cs: čeština";"NMG: publicistika";"NEW: tradiční publicistika";"X: neuvedeno";"REG: regionální tisk";", na kterou nikdo nedosáhl . </s><s> Domácí neměli vyjma přímého";"kopu do 25";". minuty nic , a tak jim hosté pomohli chybou"
"1";"cs: čeština";"NMG: publicistika";"NEW: tradiční publicistika";"X: neuvedeno";"REG: regionální tisk";"úřad podle něj vyhověl žádosti Milevského kraje a prodloužil splatnost";"úhrady do 31";". ledna roku 2020 . </s><s> Zmíněnou částku ale společnost nemá"
"1";"cs: čeština";"NMG: publicistika";"NEW: tradiční publicistika";"X: neuvedeno";"REG: regionální tisk";"Váňa , Nedachlebice OSŽ - MA , zákaz výkonu všech";"funkcí do 6";". 10 . 2019 , § 50 / 3 ,"
"1";"cs: čeština";"NMG: publicistika";"NEW: tradiční publicistika";"X: neuvedeno";"REG: regionální tisk";"Zlatá Pecka Chrudim , který se uskuteční od 25 .";"srpna do 2";". září a vedle Chrudimi zavítá i do Pardubic ,"
"1";"cs: čeština";"NMG: publicistika";"NEW: tradiční publicistika";"X: neuvedeno";"REG: regionální tisk";". </s><s> A to během otvírací doby Květné zahrady od 8";"hodin do 18";". 30 hodin . </s><s> Hokejky , puky a šikana </s><s> Modrožluté"
"1";"cs: čeština";"NMG: publicistika";"NEW: tradiční publicistika";"X: neuvedeno";"REG: regionální tisk";"fotografií Mariana Siedlaczka a Mariana Palowského z cesty do New";"Yorku do 31";". 8 . v kavárně a čítárně Avion . </s><s> KRUHY"
"1";"cs: čeština";"NMG: publicistika";"NEW: tradiční publicistika";"X: neuvedeno";"REG: regionální tisk";"a jeho obyvatelé odvlečeni do koncentračních táborů . </s><s> Památník životické";"tragédie do 14";". 1 . 2020 FILMOVÉ KOMEDIE A ROMANTIKA – výstava"
"1";"cs: čeština";"NMG: publicistika";"NEW: tradiční publicistika";"X: neuvedeno";"REG: regionální tisk";"čísle 727 838 248 ( je třeba ji udělat do";"pátku do 17";": 00 ) . </s><s> Vstupné : děti do 6 let"
"1";"cs: čeština";"NMG: publicistika";"NEW: tradiční publicistika";"X: neuvedeno";"REG: regionální tisk";"Šik , který stejně jako Hruška také stojí za postupem";"Baníku do Chance";"ligy . </s><s> Na střídavých startech bude Stadionu pomáhat další šestice"
"1";"cs: čeština";"NMG: publicistika";"NEW: tradiční publicistika";"X: neuvedeno";"REG: regionální tisk";"prací bude probíhat ve vstupních prostorách knihovny od 3 .";"října do 30";". října 2019 . </s><s> Výtvarná dílna – Skládání z papíru </s>"
"1";"cs: čeština";"NMG: publicistika";"NEW: tradiční publicistika";"X: neuvedeno";"REG: regionální tisk";"00 – 17 : 00 v 1 . </s><s> patře sokolovského";"zámku ( do 15";". září ) . </s><s> VÝSTAVA Lesy kolem nás – Vyhodnocení"
"1";"cs: čeština";"NMG: publicistika";"NEW: tradiční publicistika";"X: neuvedeno";"REG: regionální tisk";"a ilustrace . </s><s> Výstava se bude konat v atriu městské";"knihovny ( do 8";". prosince ) . </s><s> Loketští rodáci – Výstava , která"
"1";"cs: čeština";"NMG: publicistika";"LEI: volnočasová publicistika";"X: neuvedeno";"HOU: bydlení, zahrada, hobby";"stavby a vyhrajte pobyt ve srubu ! </s><s> Od 21 .";"února do 2";". března můžete hlasovat pro nejlepší stavby v anketě Dřevěná"
"1";"cs: čeština";"NMG: publicistika";"LEI: volnočasová publicistika";"X: neuvedeno";"HOU: bydlení, zahrada, hobby";"udělat radost ! </s><s> V objednávce zadejte kód : KREATIV </s><s> Platnost";"kódu : do 31";". 12 . 2018 Omezení : neplatí na již zlevněné"
"1";"cs: čeština";"NMG: publicistika";"LEI: volnočasová publicistika";"X: neuvedeno";"HOU: bydlení, zahrada, hobby";"i zábavu . </s><s> V objednávce zadejte kód : KREATIV Platnost";"kódu : do 31";". 12 . 2018 Platí na vše bez omezení . </s>"
"1";"cs: čeština";"NMG: publicistika";"LEI: volnočasová publicistika";"X: neuvedeno";"HOU: bydlení, zahrada, hobby";"<s> 100 let československé architektury představí pražský Mánes od 15 .";"září do 10";". října . </s><s> Co budu dneska šít ? </s><s> Když si"
"1";"cs: čeština";"NMG: publicistika";"LEI: volnočasová publicistika";"X: neuvedeno";"LIF: životní styl";", CONCORD AIR SAFE , 2690 Kč , </s><s> Od první";"jízdy do asi";"12 let , JOIE Every Stage , 5770 Kč ,"
"1";"cs: čeština";"NMG: publicistika";"LEI: volnočasová publicistika";"X: neuvedeno";"LIF: životní styl";"namleté pistáciové ořechy . </s><s> PLACATÉ KULIČKY SE SLANÝM KARAMELEM </s><s> DOBA";"PŘÍPRAVY : DO 1";"HODINY </s><s> POTŘEBUJETE ( na 25 až 30 kousků ) :"
"1";"cs: čeština";"NMG: publicistika";"LEI: volnočasová publicistika";"X: neuvedeno";"LIF: životní styl";"WEST můžete obdivovat v pražské Leica Gallery od 14 .";"září do 19";". listopadu . </s><s> Z výstavy děl mladých sklářů </s><s> Manželé Lobkowiczovi </s>"
"1";"cs: čeština";"NMG: publicistika";"LEI: volnočasová publicistika";"X: neuvedeno";"LIF: životní styl";". </s><s> Pečte 30 minut při 180 ° C . </s><s> DOBA";"PŘÍPRAVY : DO 1";"HODINY DOBA PEČENÍ : 30 MINUT </s><s> MASOVÉ RAGÚ POD </s><s> BRAMBOROVOU"
"1";"cs: čeština";"NMG: publicistika";"LEI: volnočasová publicistika";"X: neuvedeno";"LIF: životní styl";"<s> Nejkrásnější by bylo využít velkého vodního trigonu od 30 .";"května do 3";". června . </s><s> 9 . – 12 . dubna se"
"1";"cs: čeština";"NMG: publicistika";"LEI: volnočasová publicistika";"X: neuvedeno";"LIF: životní styl";"tělem i duší s přezdívkou Ouřa . </s><s> Cílem tréninků u";"dětí do 12";"let je především naučit se pohybovat a osvojit si základní"
"1";"cs: čeština";"NMG: publicistika";"LEI: volnočasová publicistika";"X: neuvedeno";"LIF: životní styl";"“ </s><s> HOROSKOP </s><s> CO MŮŽETE OČEKÁVAT V TÝDNU OD 26 . </s><s>";"SRPNA DO 1";". </s><s> ZÁŘÍ ? </s><s> VÍCE NA HOROSKOPY . </s><s> BLESK . </s><s> CZ </s>"
"1";"cs: čeština";"NMG: publicistika";"LEI: volnočasová publicistika";"X: neuvedeno";"LIF: životní styl";"třeba přes Tuicars . com ) , nebo Pugliabusem z";"letiště do Matery";"( od tří eur na osobu , jednosměrně ) . </s>"
"1";"cs: čeština";"NMG: publicistika";"LEI: volnočasová publicistika";"X: neuvedeno";"LIF: životní styl";", prostor s výjimečným geniem loci , od 19 .";"července do 10";". srpna rozezní moderní gospely , slavné operní árie ,"
"1";"cs: čeština";"NMG: publicistika";"LEI: volnočasová publicistika";"X: neuvedeno";"SCT: společenský život";"je u konce . </s><s> Trenér Jakub Dovalil končí u reprezentačního";"týmu do 21";"let . </s><s> Šéf svazu Pelta a člen výkonnéhoného výboru Paclík"
"1";"cs: čeština";"NMG: publicistika";"LEI: volnočasová publicistika";"X: neuvedeno";"SCT: společenský život";"<s> Fotbal </s><s> Záložník Kamil Vacek přestoupil za necelých 7 milionů ze";"Sparty do Piastu";"Gliwice , kde hostoval . </s><s> Pavel Krmaš dovedl jako kapitán"
