"1";"en: angličtina";"FIC: beletrie";"NOV: próza";"X: neuvedeno";"X: neuvedeno";"v Londýně , ale ... "" </s><s> "" Bylo těžký sehnat";"stůl v Propheteers";"? "" přeruším ho . </s><s> "" Ne , vůbec ne"
"1";"cs: čeština";"NMG: publicistika";"LEI: volnočasová publicistika";"X: neuvedeno";"INT: zajímavosti ze světa";"místními či tramvají bez nich . </s><s> Jedeme na venkov </s><s> Pátý";"den v KLDR";", co tak zavolat domů ? </s><s> Můžete , jistě ,"
"3";"en: angličtina";"FIC: beletrie";"NOV: próza";"X: neuvedeno";"X: neuvedeno";"“ </s><s> Sammy nevěřil vlastním uším . </s><s> „ Dycky de vo";"to v -";"vyhrát . “ </s><s> * </s><s> Když se před pár měsíci Dooley"
"3";"cs: čeština";"FIC: beletrie";"NOV: próza";"X: neuvedeno";"X: neuvedeno";"do jejich přízně . </s><s> Měla bys mu dát jméno začínající";"na V ,";"poněvadž Venuše na něj shlíží s obzvláštním zalíbením . “ </s>"
"3";"cs: čeština";"FIC: beletrie";"VER: poezie";"X: neuvedeno";"X: neuvedeno";"maminka STVOŘIT MALOU TRAVIČKU JE TĚŽŠÍ - NEŽ ZBOŘIT KAMENNÝ";"DŮM ( V .";"V . Rozanov ) </s><s> Píšu Ti že sem koupila husu"
"3";"cs: čeština";"NFC: oborová literatura";"SCI: odborná literatura";"HUM: humanitní vědy";"PHI: filozofie, náboženství";"to nejdůležitější , totiž záměr soupeře . </s><s> 139 Zájemce odkazuji";"na V .";"Knapp , Teorie práva , a J . Sokol ,"
"3";"cs: čeština";"NFC: oborová literatura";"SCI: odborná literatura";"HUM: humanitní vědy";"MUS: hudba";", kdyby se jim od vlastního jejich pastýře , skrze";"milostivé V [";"aší ] kn [ ížecí ] M [ ilosti ]"
"3";"cs: čeština";"NFC: oborová literatura";"SCI: odborná literatura";"HUM: humanitní vědy";"LAN: filologie";"její popis a rozbor vycházím z prací filologických . </s><s> Po";"výzkumech V .";"Flajšhanse aj . z počátku 20 . století prohloubil a"
"3";"cs: čeština";"NFC: oborová literatura";"SCI: odborná literatura";"SSC: sociální vědy";"EDU: pedagogika";"jde především o údaje o dospělých handicapovaných lidech . </s><s> Ve";"stadiu V .";", VI . , VII . jde již o výpovědi"
"3";"cs: čeština";"NFC: oborová literatura";"SCI: odborná literatura";"NAT: přírodní vědy";"BIO: biologie";"podélně střechovitě lomený , krátce odstále ochlupený ; letová perioda";"konec V .";"až IX . ; obývá výhřevná , výslunná stanoviště na"
"3";"en: angličtina";"NFC: oborová literatura";"POP: populárně naučná literatura";"NAT: přírodní vědy";"AGR: zemědělství, chovatelství";", každá tři metry dlouhá ; jídlo bylo umístěno ve";"špičce V .";"</s><s> Obr . </s><s> Originál str . 167 </s><s> Dokud psi byli sami"
"3";"cs: čeština";"NFC: oborová literatura";"PRO: profesní literatura";"FTS: formální a technické vědy";"TEC: technika";"probíhalo při dodržení správných kořenových mezer , přípravy svarových hran";"pro V ,";"HV , Y , HY - svary a provedení kvalitních"
"3";"cs: čeština";"NFC: oborová literatura";"PRO: profesní literatura";"FTS: formální a technické vědy";"TEC: technika";"<s> V letech 2008 až 2012 působil jako obchodní ředitel ve";"firmě V .";"V . S . s . r . o . </s>"
"3";"cs: čeština";"NFC: oborová literatura";"MEM: memoáry, autobiografie";"MEM: memoáry, autobiografie";"MEM: memoáry, autobiografie";"skypu s Lídou ( 18 . října 2013 ) : </s><s>";"V : V Bozoum";"to není kdovíjaké . </s><s> Odešel plukovník Yahya , prý se"
"3";"cs: čeština";"NMG: publicistika";"LEI: volnočasová publicistika";"X: neuvedeno";"SPO: sport";"Mordoru s názvem AHL nedostane . </s><s> Zapsal se dobře . </s><s>";"RUTTA V NHL";"Pittsburgh 10 : 1 </s><s> góly 0 asistence 1 střely 1"
"3";"cs: čeština";"NMG: publicistika";"LEI: volnočasová publicistika";"X: neuvedeno";"SPO: sport";"18 . 30 </s><s> sázka ( doma : V V V";"V V -";"venku : P P P V V ) 1 Petrohrad"
"3";"cs: čeština";"NMG: publicistika";"LEI: volnočasová publicistika";"X: neuvedeno";"SPO: sport";": P R R P P – celkově : V";"V V P";"R ) Sázka : 2 Experti hovoří o tom ,"
