"1";"cs: čeština";"NFC: oborová literatura";"PRO: profesní literatura";"FTS: formální a technické vědy";"TEC: technika";"u dvoulitru ( 380 N . m v širokém rozsahu";"otáček od 1";"950 do 4 500 min - 1 ) , resp"
"1";"cs: čeština";"NFC: oborová literatura";"PRO: profesní literatura";"FTS: formální a technické vědy";"TEC: technika";"ve sklopném i pevném provedení a může nabídnout přepravní objemy";"nástaveb od 22";"do 54 m3 ( nesklopné ) , sklopné pak v"
"1";"cs: čeština";"NFC: oborová literatura";"PRO: profesní literatura";"FTS: formální a technické vědy";"TEC: technika";"možnosti pro aplikace speciální stavební chemie – povrchově aplikovaných inhibitorů";"koroze od Master";"Builders Solutions společnosti BASF , která dokáže dlouhodobě stabilizovat betonové"
"1";"cs: čeština";"NFC: oborová literatura";"PRO: profesní literatura";"FTS: formální a technické vědy";"TEC: technika";"výrobků od 175 českých potravinářů a značkou DĚTSKÁ CHUŤOVKA 114";"potravin od 66";"výrobců - a to už je určitě slušný výběr pro"
"1";"cs: čeština";"NFC: oborová literatura";"PRO: profesní literatura";"FTS: formální a technické vědy";"TEC: technika";"názvem PRIMA . </s><s> Tato úprava rozšířuje nabídku povrchových úprav betonových";"tašek od KM";"BETA a hlavně představuje další posun v kvalitě . </s><s> Novou"
"1";"cs: čeština";"NFC: oborová literatura";"POP: populárně naučná literatura";"FTS: formální a technické vědy";"TEC: technika";"SUPERBU ( OD 10 . 3 . ) </s><s> CENÍK NOVÉHO";"SUPERBU ( OD 10";". 3 . ) </s><s> Jozef Kabaň </s><s> Současný šéfdesignér mladoboleslavské automobilky"
"1";"cs: čeština";"NFC: oborová literatura";"POP: populárně naučná literatura";"FTS: formální a technické vědy";"TEC: technika";"Ivy Pazderkové ( od 15 . července ) či Leoše";"Mareše ( od 7";". září ) . </s><s> Programovým cílem nové televize není jen"
"1";"cs: čeština";"NFC: oborová literatura";"POP: populárně naučná literatura";"FTS: formální a technické vědy";"TEC: technika";"vozů bylo dosaženo 27 . října , největší týdenní 5570";"vozů od 5";". prosince ... </s><s> Automobily Cadillac patřily s cenami 4986 až"
"1";"cs: čeština";"NFC: oborová literatura";"POP: populárně naučná literatura";"FTS: formální a technické vědy";"TEC: technika";"kampaň 1 . dubna a nabídne v ní třeba čistění";"klimatizace od 399";"Kč nebo pylový filtr za 404 Kč . </s><s> Vedle toho"
"1";"cs: čeština";"NFC: oborová literatura";"POP: populárně naučná literatura";"FTS: formální a technické vědy";"TEC: technika";"tak jízdní stabilitu zejména na kluzkém povrchu . </s><s> Na základě";"údajů od 25";"různých senzorů systém průběžně vyhodnocuje záběr jednotlivých kol a upravuje"
"1";"cs: čeština";"NFC: oborová literatura";"POP: populárně naučná literatura";"FTS: formální a technické vědy";"TEC: technika";", převod řízení 14 : 1 ; kola z lehkých";"slitin od 6,5";"J x 16 ; pneumatiky od 205 / 60 R"
"1";"cs: čeština";"NFC: oborová literatura";"PRO: profesní literatura";"FTS: formální a technické vědy";"ICT: výpočetní technika";"450 L - E do aplikací na ochranu rukou a";"prstů od 150";"mm ( 5,9 palce ) do 1950 mm ( 76,7"
"1";"cs: čeština";"NFC: oborová literatura";"PRO: profesní literatura";"FTS: formální a technické vědy";"ICT: výpočetní technika";"vytištěna již za 8 vteřin . </s><s> Podporována je široká škála";"médií , od A6";"až po A3 + ( 329 × 483 mm )"
"1";"cs: čeština";"NFC: oborová literatura";"POP: populárně naučná literatura";"FTS: formální a technické vědy";"ICT: výpočetní technika";"intenzivní výuky fotografování určené i pro úplné začátečníky , včetně";"dětí od 9";"let . </s><s> RÁDI PŘI svých dovolených navštěvujete zajímavá místa ? </s>"
"1";"cs: čeština";"NFC: oborová literatura";"POP: populárně naučná literatura";"FTS: formální a technické vědy";"ICT: výpočetní technika";"DPH ) : pro jednoho uživatele zdarma , pro více";"uživatelů od 199";"Kč / uživatele a měsíc </s><s> Současné ERP : Inteligence ,"
"1";"cs: čeština";"NFC: oborová literatura";"POP: populárně naučná literatura";"FTS: formální a technické vědy";"ICT: výpočetní technika";"<s> Zatímco se tedy na velkých trikových filmech ( např .";"těch od Marvelu";") píše scénář , VFX studia už obcházejí vybrané lokace"
"1";"cs: čeština";"NFC: oborová literatura";"POP: populárně naučná literatura";"FTS: formální a technické vědy";"ICT: výpočetní technika";"komponenty a samotnou kostru se snadno dostanete na cenu ojeté";"Felicie . od 20";"000 Kč Googlujte : Open Sim Wheel , OSW assembled"
"1";"cs: čeština";"NFC: oborová literatura";"POP: populárně naučná literatura";"FTS: formální a technické vědy";"ICT: výpočetní technika";", zda pustíte death metalovou palbu nebo něžné brnkání do";"kytary od Iron";"& Wine , hudba je plná detailů . </s><s> I v"
"1";"cs: čeština";"NFC: oborová literatura";"SCI: odborná literatura";"ITD: interdisciplinární";"ITD: interdisciplinární";"skupiny LEHI ( Lochamej Cherut Jisrael – Bojovníci za svobodu";"Izraele ) od Etzelu";". </s><s> LEHI byla nazývána také Sternův gang po svém zakladateli"
"1";"cs: čeština";"NFC: oborová literatura";"MEM: memoáry, autobiografie";"MEM: memoáry, autobiografie";"MEM: memoáry, autobiografie";"všech nádorů mají vlastní kód . </s><s> Jejich četnost dokumentuje rozsah";"kódů – od 8010";"/ 1 po 9989 / 1 . </s><s> Číslo za lomítkem"
"1";"en: angličtina";"NFC: oborová literatura";"MEM: memoáry, autobiografie";"MEM: memoáry, autobiografie";"MEM: memoáry, autobiografie";"pořád se usmívala . </s><s> Protože měla snad milion pantoflí a";"sandálů od Birkenstocka";", někteří kluci z obchodního centra jí říkali „ dívka"
"1";"it: italština";"NFC: oborová literatura";"MEM: memoáry, autobiografie";"MEM: memoáry, autobiografie";"MEM: memoáry, autobiografie";"“ </s><s> V této staré sestře máme před očima celou historii";"komunity od San";"Vito po Grottaferratu . </s><s> Matka Immacolata Scalvini vstoupila v roce"
"1";"en: angličtina";"NFC: oborová literatura";"MEM: memoáry, autobiografie";"MEM: memoáry, autobiografie";"MEM: memoáry, autobiografie";"hrom – po měsíci se na účtu sešlo 2,4 milionu";"dolarů od 9";"522 přispěvatelů . </s><s> Bylo jasné , že přišel čas založit"
"1";"he: hebrejština";"NFC: oborová literatura";"MEM: memoáry, autobiografie";"MEM: memoáry, autobiografie";"MEM: memoáry, autobiografie";". </s><s> Oblast Tulkarm , dva úzké pásy izraelské země 17";"kilometrů od Netanji";". </s><s> Fakt , že jsou si hranice vzájemně na dohled"
"1";"cs: čeština";"NFC: oborová literatura";"MEM: memoáry, autobiografie";"MEM: memoáry, autobiografie";"MEM: memoáry, autobiografie";"autohavárii , vnímal jsem to jako důsledek dohledu různých mocenských";"sil od CIA";"po satelity . </s><s> Zřetelně jsem cítil , že i mě"
"1";"cs: čeština";"NFC: oborová literatura";"ADM: administrativa";"ADM: administrativa";"ADM: administrativa";"přízemí – firma General Bottlers za účelem skladování dílů výčepní";"techniky od 1";". 7 . 2009 </s><s> místnost vedle kadeřnictví – p ."
"1";"cs: čeština";"NFC: oborová literatura";"ADM: administrativa";"ADM: administrativa";"ADM: administrativa";"<s> Přihlášky : na nebo v den konání závodu v kanceláři";"závodu od 11";". 00 hodin . </s><s> Startovní čísla se vydávají nejpozději 30"
"1";"cs: čeština";"NFC: oborová literatura";"ADM: administrativa";"ADM: administrativa";"ADM: administrativa";"nedostatky . </s><s> Zpráva o výsledku přezoumání byla zveřejněna na ÚD";"obce od 1";". 4 . 2015 do 15 . 4 . 2015"
"1";"cs: čeština";"NFC: oborová literatura";"ADM: administrativa";"ADM: administrativa";"ADM: administrativa";", Karel Vrzal st . </s><s> Předsedající seznámil zastupitele s návrhem";"smlouvy od fa";". WATT s . r . o . , se"
"1";"cs: čeština";"NMG: publicistika";"NEW: tradiční publicistika";"X: neuvedeno";"NTW: celostátní tisk";"se politické vedení země staralo a kultivovalo policejně bezpečnostní systém";"státu od 11";". září 2001 . </s><s> V roce 2004 proběhly ve Vojenském"
"1";"cs: čeština";"NMG: publicistika";"NEW: tradiční publicistika";"X: neuvedeno";"NTW: celostátní tisk";"zůstane jen bance . </s><s> Jde o důsledek postupného oddělování pojišťovací";"části od ING";"Group , jehož první etapa proběhla loni v létě vstupem"
"1";"cs: čeština";"NMG: publicistika";"NEW: tradiční publicistika";"X: neuvedeno";"NTW: celostátní tisk";"smlouvu , která garantovala po dobu 15 let centru 1650";"pacientů od VZP";"ročně , což je kšeft bratru za 16 miliard korun"
"1";"cs: čeština";"NMG: publicistika";"NEW: tradiční publicistika";"X: neuvedeno";"NTW: celostátní tisk";"slavíka . </s><s> Citron </s><s> Klub Masters of Rock Zlín 28 .";"listopadu od 20";"hodin </s><s> ZLÍNSKÝ KRAJ </s><s> Volby 1990 : nepolitici jdou do boje </s>"
"1";"cs: čeština";"NMG: publicistika";"NEW: tradiční publicistika";"X: neuvedeno";"NTW: celostátní tisk";"v duchu nostalgie i bujarých oslav . * Obývák Václava";"Havla od 12";"do 19 hodin na Národní třídě u Národního divadla bude"
"1";"cs: čeština";"NMG: publicistika";"NEW: tradiční publicistika";"X: neuvedeno";"NTW: celostátní tisk";"tisících obchodních místech v rámci slevového programu Sphere . </s><s> Držitelé";"kreditek od RB";"mohou také získat až 50procentní slevy u obchodníků s programem"
"1";"cs: čeština";"NMG: publicistika";"NEW: tradiční publicistika";"X: neuvedeno";"NTW: celostátní tisk";"takového už vůbec ne . </s><s> Šanci stát se lapačem pravicových";"odpadlíků od ANO";", budou - li nějací , by tak mohla mít"
"1";"cs: čeština";"NMG: publicistika";"NEW: tradiční publicistika";"X: neuvedeno";"NTW: celostátní tisk";"fungují v dnešních běžných autech . </s><s> Jde například o hlídače";"odstupu od vpředu";"jedoucího vozidla , respektive jízdy v pruzích , systém čtoucí"
"1";"cs: čeština";"NMG: publicistika";"NEW: tradiční publicistika";"X: neuvedeno";"NTW: celostátní tisk";"<s> Pokud chce porazit Zemana , musí být kandidátem modro-zelené koalice";"voličů , od ODS";"po Stranu zelených . </s><s> Vycházíme z toho , že voliči"
"1";"cs: čeština";"NMG: publicistika";"NEW: tradiční publicistika";"X: neuvedeno";"NTW: celostátní tisk";"v Turecku . </s><s> V létě by tak mělo přitéct do";"Turecka od EU";"přes 1,4 miliardy eur . </s><s> Komise tím plní dohodu s"
"1";"cs: čeština";"NMG: publicistika";"NEW: tradiční publicistika";"X: neuvedeno";"NTW: celostátní tisk";"je multidisciplinární přístup manažerů . </s><s> Musí prokázat přesah znalostí a";"dovedností od IT";", technologie , výroby a logistiky až po chápání finančních"
"1";"cs: čeština";"NMG: publicistika";"NEW: tradiční publicistika";"X: neuvedeno";"NTW: celostátní tisk";"vrací ke galeristovi Larrymu Gagosianovi , který provozuje síť šestnácti";"galerií od New";"Yorku po Hongkong . </s><s> Podle deníku New York Times tak"
"1";"cs: čeština";"NMG: publicistika";"NEW: tradiční publicistika";"X: neuvedeno";"NTW: celostátní tisk";"a moravští vinaři bohatství svých vinných sklepů . </s><s> Až do";"neděle od 10";"do 21 . 30 zde bude více než 20 stánků"
"1";"cs: čeština";"NMG: publicistika";"NEW: tradiční publicistika";"X: neuvedeno";"NTW: celostátní tisk";"se jede v úterý 7 . června . </s><s> Na startu";"mužů od 18";". 25 hodin s tradičním sjezdem ze Zámeckých schodů nebudou"
"1";"cs: čeština";"NMG: publicistika";"NEW: tradiční publicistika";"X: neuvedeno";"NTW: celostátní tisk";"vidění v Diecézním muzeu . </s><s> Otevřeno je od pondělí do";"soboty od 10";"do 17 hodin , základní vstupné je 60 Kč . </s>"
"1";"cs: čeština";"NMG: publicistika";"NEW: tradiční publicistika";"X: neuvedeno";"NTW: celostátní tisk";"kruhovém sále jihočeských zastupitelů na krajském úřadě začne čtyřicítka nejmladších";"řešitelů od 2";". do 5 . třídy soutěžit od 8 hodin ,"
"1";"cs: čeština";"NMG: publicistika";"NEW: tradiční publicistika";"X: neuvedeno";"NTW: celostátní tisk";"se dnešní YMCA snaží navázat . </s><s> V úterý 14 .";"listopadu od 18";"hodin vystoupí v Paláci YMCA Kristina Váňová , ředitelka Památníku"
"1";"cs: čeština";"NMG: publicistika";"NEW: tradiční publicistika";"X: neuvedeno";"NTW: celostátní tisk";"z Číny ? </s><s> Náš design umožňuje použít čtyři druhy jaderného";"paliva – od CGN";", CNNC , Westinghouse a Arevy . </s><s> Všechno jsou to"
"1";"cs: čeština";"NMG: publicistika";"NEW: tradiční publicistika";"X: neuvedeno";"NTW: celostátní tisk";"přednáškového bloku , který se uskuteční v pondělí 16 .";"října od 18";"hodin v zasedací místnosti č . 200 Filozofické fakulty Univerzity"
"1";"cs: čeština";"NMG: publicistika";"NEW: tradiční publicistika";"X: neuvedeno";"NTW: celostátní tisk";"ho měla zajímat zpráva o referendu v nějaké vesnici osmdesát";"kilometrů od New";"Yorku . </s><s> Odpověď : Je to místo , kde by"
"1";"cs: čeština";"NMG: publicistika";"NEW: tradiční publicistika";"X: neuvedeno";"NTW: celostátní tisk";"letos zahájí svou už desátou sezonu , kdy bude během";"léta , od 19";". června do 14 . září , objíždět Prahu . </s>"
"1";"cs: čeština";"NMG: publicistika";"NEW: tradiční publicistika";"X: neuvedeno";"NTW: celostátní tisk";"Karvinští na hřiště čtrnáctého Slovácka . </s><s> V sobotu 30 .";"září od 17";"hodin je tak znovu čeká záchranářská bitva . </s><s> To ,"
"1";"cs: čeština";"NMG: publicistika";"NEW: tradiční publicistika";"X: neuvedeno";"NTW: celostátní tisk";"přízraků ( 2015 ) se tak setkáme s tématem nebezpečí";"hrozícího od „";"východních “ hord . </s><s> Tematiku hrozby nepřizpůsobivých cizáků autor rozvinul"
"1";"cs: čeština";"NMG: publicistika";"NEW: tradiční publicistika";"X: neuvedeno";"NTW: celostátní tisk";"v pražské Lucerně , který proběhne v pondělí 19 .";"března od 19";". 00 hodin . </s><s> Oslava proběhne i s jeho hosty"
"1";"cs: čeština";"NMG: publicistika";"NEW: tradiční publicistika";"X: neuvedeno";"NTW: celostátní tisk";"telefonů čínské značky a 129 modemů . </s><s> Policejní prezidium Výčet";"zařízení od Huaweie";"čítá 36 mobilů , čtyři síťové infrastruktury , 35 diskových"
"1";"cs: čeština";"NMG: publicistika";"NEW: tradiční publicistika";"X: neuvedeno";"NTW: celostátní tisk";"umělec Mat Collishaw platí za hvězdu domácí i světové výtvarné";"scény od 90";". let . </s><s> Jeho snímek Bullet Hole přibližující ránu sekáčkem"
"1";"cs: čeština";"NMG: publicistika";"NEW: tradiční publicistika";"X: neuvedeno";"NTW: celostátní tisk";"kasino není ve vyloučené lokalitě a je víc než 50";"metrů od památkově";"chráněného kostela svatého Josefa . </s><s> Firma rozhodnutí cítí jako diskriminaci"
"1";"cs: čeština";"NMG: publicistika";"NEW: tradiční publicistika";"X: neuvedeno";"NTW: celostátní tisk";"5 do 50 kilometrů , pro cyklisty připravili organizátoři pět";"tras od 21";"do 52 kilometrů . </s><s> Policie dopadla dealera drog </s><s> Přerov </s><s> Až"
"1";"cs: čeština";"NMG: publicistika";"NEW: tradiční publicistika";"X: neuvedeno";"NTW: celostátní tisk";"<s> Oběd v samoobslužných restauracích přímo v zahradě pak pořídíte bez";"polévky od 100";"Kč na osobu , dětská porce pak stojí zpravidla polovinu"
"1";"cs: čeština";"NMG: publicistika";"NEW: tradiční publicistika";"X: neuvedeno";"NTW: celostátní tisk";"o 133 obžalovaných . </s><s> Kromě 84 doživotí vynesl také tresty";"vězení od 15";"do 17 let . </s><s> Ankara ze zosnování puče viní imáma"
"1";"cs: čeština";"NMG: publicistika";"NEW: tradiční publicistika";"X: neuvedeno";"NTW: celostátní tisk";"rezignace gradují . </s><s> Část známých se rozhodla zachránit svět sbíráním";"vršků od PET";"lahví a tříděním plastu . </s><s> Jak zdravě reagovat na strašidelnou"
"1";"cs: čeština";"NMG: publicistika";"NEW: tradiční publicistika";"X: neuvedeno";"NTW: celostátní tisk";", jež vyrábí mimo jiné proteinové tyčinky obsahující syrovátku z";"mléka od volně";"se pasoucích krav . </s><s> Společnost Coca-Cola HBC se sídlem ve"
"1";"cs: čeština";"NMG: publicistika";"NEW: tradiční publicistika";"X: neuvedeno";"NTW: celostátní tisk";"<s> Náměstek ostravského hejtmana oznámil , že se v části Moravskoslezského";"kraje od 9";". června změní jízdní řády autobusů . </s><s> Na Opavsku bude"
"1";"cs: čeština";"NMG: publicistika";"NEW: tradiční publicistika";"X: neuvedeno";"NTW: celostátní tisk";"vybrala jako náhradní bojiště , na něž chtěla svést pozornost";"voličů od poněkud";"nepřehledné i nepříliš poutavé bitvy o ministra kultury . </s><s> Oranžovým"
"1";"cs: čeština";"NMG: publicistika";"NEW: tradiční publicistika";"X: neuvedeno";"NTW: celostátní tisk";"různé počítačové i mobilní aplikace . </s><s> Mezi ty nejoblíbenější podle";"průzkumu od Předvýběr";". cz patří Skype či WhatsApp . </s><s> Za klíčové nástroje"
"1";"cs: čeština";"NMG: publicistika";"NEW: tradiční publicistika";"X: neuvedeno";"NTW: celostátní tisk";"celý život . </s><s> Měla ráda návštěvníky , vyprávěla o generacích";"přírodovědců od 20";". let . </s><s> Zejména měla vzpomínky na profesora Komárka ,"
"1";"cs: čeština";"NMG: publicistika";"NEW: tradiční publicistika";"X: neuvedeno";"NTW: celostátní tisk";"vztah k náboženství . </s><s> Expozice je otevřená od úterý do";"neděle od 10";"do 12 a od 13 do 16 hodin . </s><s> Madetě"
"1";"cs: čeština";"NMG: publicistika";"NEW: tradiční publicistika";"X: neuvedeno";"NTW: celostátní tisk";"<s> Zatím se všechny zápasy třetího kola budou hrát 25 .";"října od 16";". 30 . </s><s> Karvinští vítězně rozjeli sérii derby v extralize"
"1";"cs: čeština";"NMG: publicistika";"NEW: tradiční publicistika";"X: neuvedeno";"NTW: celostátní tisk";". </s><s> Ohňostroj ozáří náměstí J . M . Marků posledního";"prosince od 19";"hodin . </s><s> Ve většině měst již mají program vyzkoušený z"
"1";"cs: čeština";"NMG: publicistika";"NEW: tradiční publicistika";"X: neuvedeno";"NTW: celostátní tisk";". </s><s> Další utkání čeká pardubické basketbalisty v neděli 5 .";"ledna od 18";"hodin na palubovce ústecké Slunety . </s><s> Momentky z derby Vlevo"
"1";"cs: čeština";"NMG: publicistika";"NEW: tradiční publicistika";"X: neuvedeno";"NTW: celostátní tisk";". </s><s> Slavnostní zahájení výstavy se uskuteční v pondělí 21 .";"ledna od 10";"hodin v konferenčním centru výstaviště Černá louka . </s><s> Součástí zahájení"
"1";"cs: čeština";"NMG: publicistika";"NEW: tradiční publicistika";"X: neuvedeno";"NTW: celostátní tisk";"z nejúspěšnějších evropských kapel vystoupí již tuto sobotu 22 .";"června od 20";". 00 v Českých Budějovicích . </s><s> Německá skupina Scooter s"
"1";"cs: čeština";"NMG: publicistika";"NEW: tradiční publicistika";"X: neuvedeno";"NTW: celostátní tisk";"v Hluboké nad Vltavou , který se koná 15 .";"prosince od 14";"hodin . </s><s> V podvečer pak návštěvníci také společně rozsvítí na"
"1";"cs: čeština";"NMG: publicistika";"NEW: tradiční publicistika";"X: neuvedeno";"REG: regionální tisk";"filmu Alice Nellis Andílek na nervy V neděli 21 .";"června od 18";"hodin , koncertní síň Trojice Joan DeVee Dixon , varhany"
"1";"cs: čeština";"NMG: publicistika";"NEW: tradiční publicistika";"X: neuvedeno";"REG: regionální tisk";"Antonio Lizana Group ( ESP ) V neděli 19 .";"července od 18";"hodin , koncertní síň Trojice Operní a operetní galavečer Koncert"
"1";"cs: čeština";"NMG: publicistika";"NEW: tradiční publicistika";"X: neuvedeno";"REG: regionální tisk";"v rámci Mezinárodní pěvecké dílny 2015 V neděli 19 .";"července od 17";"hodin , Palackého sady Divadlo Bodi Jaroměř – pohádkový podvečer"
"1";"cs: čeština";"NMG: publicistika";"NEW: tradiční publicistika";"X: neuvedeno";"REG: regionální tisk";"v rámci prevence . </s><s> Koná se v knihovně 8 .";"června od 18";"hodin . </s><s> Dvojutkání žáků a mužů ve Stratově </s><s> Stratov –"
"1";"cs: čeština";"NMG: publicistika";"NEW: tradiční publicistika";"X: neuvedeno";"REG: regionální tisk";"piv . </s><s> SEMILSKO j Sedmihorské léto Kdy : 18 .";"června od 20";"hodin Kde : Sedmihorky , areál motelu Even </s><s> Vstupné :"
"1";"cs: čeština";"NMG: publicistika";"NEW: tradiční publicistika";"X: neuvedeno";"REG: regionální tisk";"KP atletických družstev mužů a žen se koná 14 .";"června od 13";"hodin v České Lípě . </s><s> 2 . kolo KP družstev </s>"
"1";"cs: čeština";"NMG: publicistika";"NEW: tradiční publicistika";"X: neuvedeno";"REG: regionální tisk";". </s><s> Zahajovací koncert festivalu se uskuteční v neděli 7 .";"června od 16";". 00 hodin . </s><s> Poté se rozběhne do dalších 14"
"1";"cs: čeština";"NMG: publicistika";"NEW: tradiční publicistika";"X: neuvedeno";"REG: regionální tisk";"partnerem je Kladenský deník , začíná v sobotu 13 .";"června od 13";"hodin vernisáží , při které budou návštěvníci svědky představení nového"
"1";"cs: čeština";"NMG: publicistika";"NEW: tradiční publicistika";"X: neuvedeno";"REG: regionální tisk";"Klatovech , kam můžete během června zavítat od pondělí do";"pátku od 12";"do 19 hodin a o víkendu od 10 do 19"
"1";"cs: čeština";"NMG: publicistika";"NEW: tradiční publicistika";"X: neuvedeno";"REG: regionální tisk";"řež americké občanské války se odehraje v sobotu 3 .";"října od 13";"hodin na bojišti Obecního parku na Lipině ve Zbraslavicích . </s>"
"1";"cs: čeština";"NMG: publicistika";"NEW: tradiční publicistika";"X: neuvedeno";"REG: regionální tisk";"dětmi v klubu Pinocchio Dědice na tuto neděli 15 .";"února od 9";"do 12 hodin Setkání s tancem a kreativní tvorbou ."
"1";"cs: čeština";"NMG: publicistika";"NEW: tradiční publicistika";"X: neuvedeno";"REG: regionální tisk";"na místě bývalé obce Vernéřov . </s><s> Lokalita je zhruba pět";"kilometrů od lázeňsky";"využívaných pramenů v Klášterci . </s><s> Firma Benteler se zabývá výrobou"
"1";"cs: čeština";"NMG: publicistika";"NEW: tradiční publicistika";"X: neuvedeno";"REG: regionální tisk";". října : KAŠPÁREK A PRINCEZNA </s><s> – Divadelní asociace Marky";"Míkové – od 15";"hodin v kině . </s><s> TÁBOR Neděle 16 . října : </s>"
"1";"cs: čeština";"NMG: publicistika";"NEW: tradiční publicistika";"X: neuvedeno";"REG: regionální tisk";"- obrazy žáků ZŠ a MŠ Šafaříkova </s><s> úterý 15 .";"listopadu od 17";". 00 </s><s> Cestopisná beseda na téma Írán </s><s> Tomáš Šulaj skončil"
"1";"cs: čeština";"NMG: publicistika";"NEW: tradiční publicistika";"X: neuvedeno";"REG: regionální tisk";". </s><s> Jihlavská Dukla hraje dnes , v pátek 4 .";"března , od 18";". hodin v havířovské K & K Pneu aréně ,"
"1";"cs: čeština";"NMG: publicistika";"NEW: tradiční publicistika";"X: neuvedeno";"REG: regionální tisk";"SBŠ Ostrava . </s><s> Startovat bude 88 chlapeckých a 65 dívčích";"družstev od U10";"až po U19 z celé ČR , Slovenska , Slovinska"
"1";"cs: čeština";"NMG: publicistika";"NEW: tradiční publicistika";"X: neuvedeno";"REG: regionální tisk";"rachot zemětřesení , “ připomněl jihlavský duchovní Oldřich Med zápisky";"faráře od sv";". Jakuba někdy kolem roku 1790 . </s><s> Kněží toho času"
"1";"cs: čeština";"NMG: publicistika";"NEW: tradiční publicistika";"X: neuvedeno";"REG: regionální tisk";"spotřebu pod 5 l / 100 km a u naftových";"verzí od 3,4";"l / 100 km . </s><s> U výkonnějších verzí nebo s"
"1";"cs: čeština";"NMG: publicistika";"NEW: tradiční publicistika";"X: neuvedeno";"REG: regionální tisk";". </s><s> Malé i velké návštěvníky přivítají ve čtvrtek 8 .";"prosince od 9";"do 16 . 30 hodin také v pelhřimovské základní škole"
"1";"cs: čeština";"NMG: publicistika";"NEW: tradiční publicistika";"X: neuvedeno";"REG: regionální tisk";"přichystali bohatý program , který startuje v pátek 16 .";"září od 19";"hodin na Žižkově náměstí . </s><s> Tam se postupně představí táborské"
"1";"cs: čeština";"NMG: publicistika";"NEW: tradiční publicistika";"X: neuvedeno";"REG: regionální tisk";"Frýdkem - Místkem je na pořadu ve čtvrtek </s><s> 18 .";"února od 18";"hodin . </s><s> 9 . SG Brno 16 0 0 1"
"1";"cs: čeština";"NMG: publicistika";"NEW: tradiční publicistika";"X: neuvedeno";"REG: regionální tisk";". </s><s> Nadaní umělci předvedou svůj talent v pátek 19 .";"února od 18";"hodin v novojičínském Beskydském divadle , vstupné je v předprodeji"
"1";"cs: čeština";"NMG: publicistika";"NEW: tradiční publicistika";"X: neuvedeno";"REG: regionální tisk";"inscenace šumperského hereckého souboru mají diváci ve středu 24 .";"února od 17";"hodin nebo v pátek 26 . února od 10 hodin"
"1";"cs: čeština";"NMG: publicistika";"NEW: tradiční publicistika";"X: neuvedeno";"REG: regionální tisk";". Denisova . </s><s> Přerov ( Popovice ) , ulice U";"Zahradnictví , od 29";". 3 . do 31 . 7 . – úplná"
