"1";"cs: čeština";"NMG: publicistika";"NEW: tradiční publicistika";"X: neuvedeno";"NTW: celostátní tisk";"žalobě u Evropského soudního dvora v Lucemburku . </s><s> 14,6 miliardy";"korun bez DPH";"zaplatí Česko za dvanáct vrtulníků z USA . </s><s> Nové mýtné"
"1";"cs: čeština";"NMG: publicistika";"LEI: volnočasová publicistika";"X: neuvedeno";"SCT: společenský život";"její výroba . </s><s> „ Přišlo to zhruba na 45 tisíc";"korun bez DPH";". </s><s> Sestava měla výkon od 50 až do 200 wattů"
"1";"cs: čeština";"NMG: publicistika";"NEW: tradiční publicistika";"X: neuvedeno";"REG: regionální tisk";"ze strany 1 </s><s> České dráhy vyjednaly obchod za 190 milionů";"korun bez DPH";". </s><s> Nyní bude záležet hlavně na Zastupitelstvu Olomouckého kraje ,"
"1";"cs: čeština";"NMG: publicistika";"NEW: tradiční publicistika";"X: neuvedeno";"NTW: celostátní tisk";"korun bez DPH . </s><s> Od začátku července platí 123 000";"korun bez DPH";"za den . </s><s> Za každou vydanou kartu navíc Operátor od"
"1";"en: angličtina";"FIC: beletrie";"NOV: próza";"X: neuvedeno";"X: neuvedeno";"mi naznačujete , že se někdo mohl potopit do padesátimetrové";"hloubky bez …";"“ </s><s> „ Já nemluvil o padesáti metrech . </s><s> Mluvil jsem"
"1";"cs: čeština";"NMG: publicistika";"NEW: tradiční publicistika";"X: neuvedeno";"NTW: celostátní tisk";"téměř 2,5 kilometru . </s><s> Výstavba bariér vyjde na 120 miliónů";"korun bez DPH";", má skončit v červenci . </s><s> Projekt realizuje Správa Národního"
"1";"cs: čeština";"FIC: beletrie";"COL: kratší próza";"X: neuvedeno";"X: neuvedeno";", nápověď , co ? </s><s> Tedy na str . 162";"Rozhovorů bez konca";"je odstavec začínající takto : „ A tam ako v"
"1";"cs: čeština";"NMG: publicistika";"NEW: tradiční publicistika";"X: neuvedeno";"NTW: celostátní tisk";"jsou dobíjecí stanice pro elektromobily . </s><s> Náklady byly 54,5 milionu";"korun bez DPH";". </s><s> Zhruba z poloviny bude parkoviště sloužit pro veřejnost ,"
"1";"cs: čeština";"NFC: oborová literatura";"POP: populárně naučná literatura";"FTS: formální a technické vědy";"ICT: výpočetní technika";"přesné 8 vyrovnaný , zkreslení přesný u všech zvuk ,";"žánrů bez 10";"zastřenější bez výrazného vokály , méně zkreslení basů , 8 </s>"
"1";"cs: čeština";"NMG: publicistika";"NEW: tradiční publicistika";"X: neuvedeno";"REG: regionální tisk";"Stříbrného jezera , která celá podle odhadu vyjde na 122";"milionů bez DPH";", má trvat osmnáct měsíců . </s><s> TATO nová lávka spojí"
"1";"cs: čeština";"NMG: publicistika";"NEW: tradiční publicistika";"X: neuvedeno";"NTW: celostátní tisk";"ale nebude nárokovat proplacení licenčního poplatku ve výši 30 tisíc";"korun bez DPH";". </s><s> Opakovat už by se tak neměla situace z června"
"1";"cs: čeština";"NMG: publicistika";"NEW: tradiční publicistika";"X: neuvedeno";"NTW: celostátní tisk";"<s> Za opravy a přístavbu zaplatí Lanškroun více než 140 milionů";"korun bez DPH";". </s><s> Město je uhradí z úvěru 160 milionů , který"
"1";"cs: čeština";"NMG: publicistika";"NEW: tradiční publicistika";"X: neuvedeno";"NTW: celostátní tisk";". </s><s> Úsek je dlouhý 10,6 kilometru a za 933,2 milionu";"korun bez DPH";"ho staví firma Eurovia . </s><s> Hotový má být na jaře"
"1";"cs: čeština";"NMG: publicistika";"NEW: tradiční publicistika";"X: neuvedeno";"NTW: celostátní tisk";"v délce 15,5 kilometru přijde na více než 2,7 miliardy";"korun bez DPH";"a hotova by měla být v roce 2022 . </s><s> Firmy"
"1";"cs: čeština";"NFC: oborová literatura";"POP: populárně naučná literatura";"FTS: formální a technické vědy";"ICT: výpočetní technika";", spíše samotné platformy X570 a týká se to všech";"výrobců bez";"</s><s> rozdílu . </s><s> VERDIKT 8,6 kvalita a rozvržení výbava a funkce"
"1";"cs: čeština";"NFC: oborová literatura";"SCI: odborná literatura";"SSC: sociální vědy";"REC: sport, rekreace, hobby";", uvědomit , jaké jiné znalosti než ze sportovního tréninku";"osob bez TP";"potřebuje k vytvoření struktury tréninku : </s><s> základní znalosti atletického tréninku"
"1";"cs: čeština";"NFC: oborová literatura";"POP: populárně naučná literatura";"FTS: formální a technické vědy";"ICT: výpočetní technika";"v podstatě počítač s operačním systémem Android . </s><s> Omezená ochrana";"dat bez RAID";"konfigurace </s><s> Majitelé NAS serverů s jedním pevným diskem se musí"
"1";"cs: čeština";"NMG: publicistika";"NEW: tradiční publicistika";"X: neuvedeno";"NTW: celostátní tisk";"deseti záchranářských vrtulníků Sokol v příštích šesti letech asi miliardu";"korun bez DPH";". </s><s> Ministerstvo obrany zároveň připravuje generální opravu osmi z nich"
"1";"cs: čeština";"NMG: publicistika";"NEW: tradiční publicistika";"X: neuvedeno";"REG: regionální tisk";"v centru města . </s><s> Počáteční investice činila zhruba 765 tisíc";"korun bez DPH";", on-line dohled přijde podnik na 80 tisíc a za"
"1";"cs: čeština";"NMG: publicistika";"NEW: tradiční publicistika";"X: neuvedeno";"NTW: celostátní tisk";"inženýrských sítí . </s><s> Předpokládaná hodnota zakázky je přibližně 105 milionů";"korun bez DPH";". </s><s> O zajímavou zakázku na historické památce se mohou zájemci"
"1";"cs: čeština";"NMG: publicistika";"NEW: tradiční publicistika";"X: neuvedeno";"REG: regionální tisk";"1 . máje uzavřená pro tramvajovou dopravu </s><s> 72 715 000";"korun bez DPH";"stála oprava třídy 1 . máje </s><s> 402 metrů měří levá"
"1";"cs: čeština";"NMG: publicistika";"NEW: tradiční publicistika";"X: neuvedeno";"NTW: celostátní tisk";"dokončením , i když vlastní oprava ( za dvě miliardy";"korun bez DPH";") ještě nezačala . </s><s> Projekt lze dodatečně změnit znovu . </s>"
"1";"cs: čeština";"NMG: publicistika";"NEW: tradiční publicistika";"X: neuvedeno";"NTW: celostátní tisk";"odchod do opozice . </s><s> Předseda hnutí ANO Andrej Babiš utvoření";"koalice bez ANO";"označil za podvod na voličích a považuje ji za nekorektní"
"1";"cs: čeština";"NMG: publicistika";"LEI: volnočasová publicistika";"X: neuvedeno";"SCT: společenský život";"by stavit , se poprvé v životě šla bít do";"klece bez o";"podpory milovaného táty . </s><s> Sympatická slovenská novinářka je jednou ze"
"1";"cs: čeština";"NMG: publicistika";"LEI: volnočasová publicistika";"X: neuvedeno";"HOU: bydlení, zahrada, hobby";"plocha : 110,92 m2 Obestavěný prostor : 681,83 m3 Cena";"stavebnice bez DPH";": 486 000 Kč </s><s> DŮM VELA 115 </s><s> Dispozice : 4"
"1";"cs: čeština";"NFC: oborová literatura";"SCI: odborná literatura";"SSC: sociální vědy";"EDU: pedagogika";"že usilovala o změnu předmětu a kurikula v aplikaci alternativních";"postupů bez jasně";"formulované změny svého paradigmatu . </s><s> Pracuje s novými fakty ,"
"1";"cs: čeština";"NMG: publicistika";"NEW: tradiční publicistika";"X: neuvedeno";"NTW: celostátní tisk";"DPH . </s><s> Průměrná cena za metr čtvereční byla 43 200";"korun bez DPH";". </s><s> V roce 2013 to bylo 2 455 000 korun"
"1";"cs: čeština";"NMG: publicistika";"NEW: tradiční publicistika";"X: neuvedeno";"NTW: celostátní tisk";"ČR Vlastní stavba nového institutu přišla na zhruba 380 milionů";"korun bez DPH";". </s><s> Celkové náklady projektu činí 567 milionů . </s><s> V rozpočtu"
"1";"cs: čeština";"NFC: oborová literatura";"PRO: profesní literatura";"FTS: formální a technické vědy";"ICT: výpočetní technika";"ceny okolo 19 tisíc bez DPH , resp . 23";"tisíc bez DPH";". </s><s> TS - 831 X svou konfigurací vyhoví mnoha menším"
"1";"cs: čeština";"NMG: publicistika";"NEW: tradiční publicistika";"X: neuvedeno";"NTW: celostátní tisk";"Sedláčkovy ulice byla zahájena v září 2017 . </s><s> Stála 25,3";"milionu bez DPH";". </s><s> Investory akce jsou Plzeň , vodárna a společnost Innogy"
"1";"cs: čeština";"NMG: publicistika";"NEW: tradiční publicistika";"X: neuvedeno";"NTW: celostátní tisk";"denně a při nasazení vrtulníku bude ministerstvo platit 15 950";"korun bez DPH";"za hodinu . </s><s> Dvoumilionový limit už by prý měl vystačit"
"1";"cs: čeština";"NMG: publicistika";"NEW: tradiční publicistika";"X: neuvedeno";"REG: regionální tisk";"– Rekonstrukce chodníků a vjezdů za dva a půl milionu";"korun bez DPH";"v ulici Českých bratří potrvá do poloviny července . </s><s> V"
"1";"cs: čeština";"NMG: publicistika";"NEW: tradiční publicistika";"X: neuvedeno";"NTW: celostátní tisk";". </s><s> Co bychom si počali bez knih , filmů a";"seriálů , bez umně";"vystavěných příběhů a vykreslených obrazů . </s><s> Na tom , že"
"1";"cs: čeština";"NFC: oborová literatura";"PRO: profesní literatura";"NAT: přírodní vědy";"AGR: zemědělství, chovatelství";"byl vydán zvláštní císařský patent proti přechovávání a přijímání cizích";"poddaných bez tzv";". výhostného listu . </s><s> Vrchnosti přiznávaly poddaným poměrně rozsáhlé dědické"
"1";"cs: čeština";"NFC: oborová literatura";"SCI: odborná literatura";"SSC: sociální vědy";"SOC: sociologie";"s úbytkem pracovních míst ve vnitřních městech , zanechala centra";"měst bez lépe";"situovaných obyvatel , bez služeb , s upadající infrastrukturou a"
"1";"cs: čeština";"NMG: publicistika";"NEW: tradiční publicistika";"X: neuvedeno";"NTW: celostátní tisk";"oceňující firmy liší . </s><s> Jedna odhaduje náklady ve výši 98";"milionů bez DPH";", druhá ve výši 146 milionů bez DPH . </s><s> V"
"1";"cs: čeština";"NMG: publicistika";"NEW: tradiční publicistika";"X: neuvedeno";"NTW: celostátní tisk";". </s><s> „ Nabídková cena na odkup pozemků přesahuje 379 milionů";"korun bez DPH";", “ dodal Martin Itterheim . </s><s> RiseSun chce investovat </s><s> Firma"
"1";"cs: čeština";"NMG: publicistika";"NEW: tradiční publicistika";"X: neuvedeno";"NTW: celostátní tisk";"úřad řízení zastavil . </s><s> Kvůli zakázce za zhruba 120 milionů";"korun bez DPH";", na jejíž většinu má město přislíbenu evropskou dotaci ,"
"1";"cs: čeština";"NMG: publicistika";"NEW: tradiční publicistika";"X: neuvedeno";"REG: regionální tisk";"zateplení . </s><s> „ V letošním roce tak bude prostavěno 69";"milionů bez DPH";". </s><s> Celkem rekonstrukce vyjde na 291 880 114 korun bez"
"1";"cs: čeština";"NMG: publicistika";"NEW: tradiční publicistika";"X: neuvedeno";"NTW: celostátní tisk";"jen čtyři patra a zvýšení bylo možné jen díky razítku";"úředníků , bez řádně";"projednané změny územního plánu a bez vědomí lidí bydlících v"
"1";"cs: čeština";"NMG: publicistika";"NEW: tradiční publicistika";"X: neuvedeno";"NTW: celostátní tisk";"stejné firmě . </s><s> Celkem ale stála rekonstrukce téměř 23 milionů";"korun bez DPH";", čímž překročila zákonem daný limit pro zakázky malého rozsahu"
"1";"cs: čeština";"FIC: beletrie";"NOV: próza";"X: neuvedeno";"X: neuvedeno";"prostředí miniaturního bytu , bez tatínkova zatápění před odchodem do";"práce , bez maminkou";"udržovaného tepla v pokojích , aby netrpěly podzimním chladem . </s>"
"1";"cs: čeština";"NMG: publicistika";"NEW: tradiční publicistika";"X: neuvedeno";"NTW: celostátní tisk";"vrtulníků </s><s> Vláda odklepla nákup tuctu amerických vrtulníků za 14,6 miliardy";"korun bez DPH";". </s><s> Ministr obrany Lubomír Metnar ( ANO ) ji o"
"1";"cs: čeština";"NMG: publicistika";"NEW: tradiční publicistika";"X: neuvedeno";"REG: regionální tisk";"společnost Strabag , která realizaci zvládla za 2 158 800";"korun bez DPH";". </s><s> Dotace z programu přeshraniční spolupráce by měla pokrýt 90"
"1";"bn: bengálština";"FIC: beletrie";"NOV: próza";"X: neuvedeno";"X: neuvedeno";", vy jste přece jako naše vlastní rodina . </s><s> Kromě";"toho , bez Bhubanešvarí";", která je pro Lalitu jako vlastní matka , by"
"1";"cs: čeština";"NMG: publicistika";"NEW: tradiční publicistika";"X: neuvedeno";"NTW: celostátní tisk";"výsledkům výběrového řízení nikdo neodvolá , dílo za 10,6 miliónu";"korun ( bez DPH";") , které kinu zajistí bezbariérový přístup , vymění elektroinstalaci"
"1";"cs: čeština";"NFC: oborová literatura";"POP: populárně naučná literatura";"SSC: sociální vědy";"REC: sport, rekreace, hobby";"limonáda Nakrájejte semínek , třtinovým zalijte vodou , oslaďte kousek";"okurky bez cukrem";", citronu a lístek přidejte plátek máty . </s><s> čerstvá limonáda"
"1";"cs: čeština";"NMG: publicistika";"NEW: tradiční publicistika";"X: neuvedeno";"NTW: celostátní tisk";"úpravy křižovatky , které přišly na více než 116 milionů";"korun bez DPH";", se loni postaralo konsorcium stavebních firem ALPINE Bau a"
"1";"cs: čeština";"NMG: publicistika";"NEW: tradiční publicistika";"X: neuvedeno";"NTW: celostátní tisk";". </s><s> „ Naše tržby v minulém roce přesáhly 200 milionů";"korun bez DPH";", což znamená více než dvojnásobný meziroční růst , “"
"1";"cs: čeština";"NFC: oborová literatura";"SCI: odborná literatura";"SSC: sociální vědy";"PSY: psychologie";"vydán , ocitá se ve stavu bezmocné úzkosti , neutuchajícího";"stresu bez (";"biologické ) možnosti obrany , tj . bez možnosti zareagovat"
"1";"cs: čeština";"NMG: publicistika";"NEW: tradiční publicistika";"X: neuvedeno";"NTW: celostátní tisk";"předání neoprávněného profitu v dosud nezjištěné výši z ceny zadané";"zakázky ( bez DPH";") za předem získané neveřejné informace a podklady na úkor"
"1";"cs: čeština";"NFC: oborová literatura";"PRO: profesní literatura";"NAT: přírodní vědy";"GEO: geografie, geologie";"náspy apod . ) , a to podle zadání posudku";"bud bez ,";"anebo i za účasti žalobců , žalovaných a jejich právních"
"1";"cs: čeština";"FIC: beletrie";"VER: poezie";"X: neuvedeno";"X: neuvedeno";"DUINU </s><s> Slyšíš se z dálky trhané jak vlak , z";"dálky bez";"</s><s> vzdáleností . </s><s> Tak se vše jmenuje , když jsi tu </s>"
"1";"cs: čeština";"NMG: publicistika";"NEW: tradiční publicistika";"X: neuvedeno";"NTW: celostátní tisk";"<s> Celý projekt obnovy hráze a výpusti vyšel na 41,7 milionu";"korun bez DPH";". </s><s> Velký Pařezitý rybník je známý svou velmi čistou vodou"
"1";"cs: čeština";"NMG: publicistika";"NEW: tradiční publicistika";"X: neuvedeno";"NTW: celostátní tisk";"miliónu korun bez DPH , u nemocnice pak necelý milión";"korun bez DPH";". </s><s> „ Součástí dohody je i zřízení speciální telefonní linky"
"1";"cs: čeština";"NMG: publicistika";"NEW: tradiční publicistika";"X: neuvedeno";"REG: regionální tisk";"ředitel PMŠ Patrik Tomáš Pavlíček . </s><s> Oprava za 155 milionů";"korun bez DPH";"počítá s obnovou interiéru a zastaralých technologií . </s><s> Plovárna je"
"1";"cs: čeština";"NMG: publicistika";"NEW: tradiční publicistika";"X: neuvedeno";"NTW: celostátní tisk";"další deklamaci uklízejí . </s><s> Obdiv k protagonistkám nemůže zastřít dojem";"chaosu bez jednoticí";"linie . </s><s> Ani úryvky z duchaplných úvah v programovém letáku"
"1";"cs: čeština";"NMG: publicistika";"NEW: tradiční publicistika";"X: neuvedeno";"NTW: celostátní tisk";"v neobvyklém složení . </s><s> Kometa nasadila do zápasu pouze šest";"zadáků – bez zdravotně";"indisponovaného Tomáše Bartejse , ale také bez americké posily Jacka"
"1";"cs: čeština";"NMG: publicistika";"NEW: tradiční publicistika";"X: neuvedeno";"REG: regionální tisk";"i návštěvníky . </s><s> Cena stavby by neměla přesáhnout 65 milionů";"korun bez DPH";", “ vyjmenovala . </s><s> Stadion má být podle studie určený"
"1";"en: angličtina";"FIC: beletrie";"COL: kratší próza";"X: neuvedeno";"X: neuvedeno";"to zaplatila životem . </s><s> „ Jestli se vrátíš do Brayanova";"Zlata bez Stasy";"a svého dítěte , tak nejsi chlap , "" řekl"
"1";"fr: francouzština";"NFC: oborová literatura";"SCI: odborná literatura";"HUM: humanitní vědy";"HIS: historie, biografie";"sektor nemohl prosperovat bez jasných obchodních předpisů , bez čestných";"tribunálů , bez nepříliš";"zatěžujících administrativních formalit a bez průhlednosti při řízení podniků . </s>"
"1";"cs: čeština";"NMG: publicistika";"NEW: tradiční publicistika";"X: neuvedeno";"NTW: celostátní tisk";"a rozvíjejících se ekonomik začalo souběžně posilovat . </s><s> Prognóza celosvětového";"růstu bez EU";"zůstává stejná jako v zimě . </s><s> „ Růst ve světě"
"1";"cs: čeština";"NMG: publicistika";"NEW: tradiční publicistika";"X: neuvedeno";"NTW: celostátní tisk";"<s> V roce 2018 vyhrála výběrové řízení s cenou čtyři miliony";"korun bez DPH";", druhý uchazeč v pořadí byl o 1,6 milionu dražší"
"1";"cs: čeština";"NMG: publicistika";"NEW: tradiční publicistika";"X: neuvedeno";"NTW: celostátní tisk";"18 . </s><s> Obě stavby vyjdou dohromady na zhruba 7,7 miliardy";"korun bez DPH";". </s><s> Pusopiska ráda lyžuje a potápí se </s><s> Barbora Sedláčková vinou"
"1";"cs: čeština";"NMG: publicistika";"NEW: tradiční publicistika";"X: neuvedeno";"REG: regionální tisk";". </s><s> Podle zadávací dokumentace je předpokládaná hodnota zakázky 6,4 milionu";"korun bez DPH";", obci by mohla </s><s> s financováním pomoci dotace . </s><s> Zakázku"
"1";"en: angličtina";"FIC: beletrie";"NOV: próza";"X: neuvedeno";"X: neuvedeno";"<s> Pořád jsem měl evropské rysy , ale ty má spousta";"Mexičanů bez indio";"předků . </s><s> Pracoval jsem na půl úvazku pro její agenturu"
"1";"cs: čeština";"NFC: oborová literatura";"PRO: profesní literatura";"FTS: formální a technické vědy";"TEC: technika";"úseku Rybí – MÚK Rychaltice je vysoutěžena za 2,07 miliardy";"korun bez DPH";", polovinu nákladů přitom zaplatí EU prostřednictvím Operačního programu Doprava"
"1";"cs: čeština";"NMG: publicistika";"NEW: tradiční publicistika";"X: neuvedeno";"NTW: celostátní tisk";"míry opravnou zkoušku za svou roli v někdejším odmítnutí radarové";"základny – bez ČSSD";"by bylo Babišovo současné vládnutí mnohem ostřeji pod vlivem komunistů"
"1";"cs: čeština";"NFC: oborová literatura";"PRO: profesní literatura";"FTS: formální a technické vědy";"TEC: technika";"uznatelným nákladem je reklamní nebo propagační předmět do hodnoty 500";"korun bez DPH";", který je opatřen jménem firmy nebo její ochrannou známkou"
"1";"cs: čeština";"NMG: publicistika";"NEW: tradiční publicistika";"X: neuvedeno";"NTW: celostátní tisk";". </s><s> „ Celková předpokládaná cena zakázky je přes pět miliónů";"korun bez DPH";", “ doplnil Levý , podle něhož radnice požádala o"
"1";"cs: čeština";"NFC: oborová literatura";"PRO: profesní literatura";"FTS: formální a technické vědy";"TEC: technika";"bez DPH . </s><s> Cena druhé etapy byla vysoutěžena za 417";"milionů bez DPH";", tato částka se ovšem navýšila . </s><s> Například loňský zápas"
"1";"cs: čeština";"NFC: oborová literatura";"SCI: odborná literatura";"SSC: sociální vědy";"REC: sport, rekreace, hobby";"m , 400 m ) i splnění limitů na závody";"atletů bez TP";". </s><s> To vše vede k profesionalizaci a tím k propracovanému"
"1";"cs: čeština";"NFC: oborová literatura";"POP: populárně naučná literatura";"FTS: formální a technické vědy";"TEC: technika";") a výběr se stejně řeší na obrazovce . </s><s> Majitele";"televizorů bez „";"smart “ funkcí by to jistě potěšilo . </s><s> Přehrávání fotografií"
"1";"cs: čeština";"NFC: oborová literatura";"POP: populárně naučná literatura";"NAT: přírodní vědy";"GEO: geografie, geologie";") , kde bývají uchovány zbytky měkkotělých organizmů , čili";"organizmů bez anorganicky";"inkrustovaného skeletu . </s><s> Z kambria je známo několik takových lokalit"
"1";"cs: čeština";"NFC: oborová literatura";"SCI: odborná literatura";"SSC: sociální vědy";"PSY: psychologie";"a zvyklá spolu spolupracovat . </s><s> Tato odvaha vstoupit do prostoru";"dramaterapie bez předem";"připraveného programu byla velmi užitečná pro prohloubení vztahu s klienty"
"1";"cs: čeština";"NFC: oborová literatura";"SCI: odborná literatura";"SSC: sociální vědy";"ECO: ekonomie, obchod, logistika";"vyhodnotí bonitu odběratele jako svého potenciálního dlužníka ( v případě";"faktoringu bez regeresu";") . </s><s> Banky se snaží mj . zajistit si bankovní"
"1";"cs: čeština";"NMG: publicistika";"NEW: tradiční publicistika";"X: neuvedeno";"REG: regionální tisk";"dotačních titulech . </s><s> Rozpočet je zatím stanoven na pět milionů";"korun bez DPH";", “ dodal Miroslav Rauch . </s><s> Nejspokojenější pacienti jsou v"
"1";"cs: čeština";"NMG: publicistika";"NEW: tradiční publicistika";"X: neuvedeno";"NTW: celostátní tisk";"smluv dodala službu O2 AntiDDoS Advanced za bratru 182 tisíc";"korun bez DPH";". </s><s> Těžko říct , o jakou službu se konkrétně jedná"
"1";"cs: čeština";"NMG: publicistika";"NEW: tradiční publicistika";"X: neuvedeno";"NTW: celostátní tisk";"alespoň jednoho plánu integrovaného rozvoje města v ceně 700 milionů";"korun bez DPH";". </s><s> Tato podmínka však byla podle antimonopolního úřadu diskriminační . </s>"
"1";"cs: čeština";"NMG: publicistika";"NEW: tradiční publicistika";"X: neuvedeno";"NTW: celostátní tisk";"<s> Práce naplánované na tento rok budou stát asi deset miliónů";"korun bez DPH";". </s><s> „ Pro financování investic do zimního stadiónu se snažíme"
"1";"cs: čeština";"NMG: publicistika";"NEW: tradiční publicistika";"X: neuvedeno";"NTW: celostátní tisk";"mimořádný příspěvek . </s><s> „ Cena jednoho se pohybuje okolo 7,5";"milionu bez DPH";", “ uvedl Rybák . </s><s> Okolnostmi tragického úmrtí pacientky se"
"1";"cs: čeština";"NMG: publicistika";"NEW: tradiční publicistika";"X: neuvedeno";"NTW: celostátní tisk";", která nemá postranní úmysly . </s><s> Argumentuje přímo , bez";"vytáček , bez „";"podprahových “ vzkazů . </s><s> Snaží se jít po smyslu díla"
"1";"cs: čeština";"NFC: oborová literatura";"SCI: odborná literatura";"NAT: přírodní vědy";"MED: lékařství";"ohledem na okolnosti představují i další protokoly na bázi kontinuálního";"fluorouracilu bez nebo";"s oxaliplatinou , jako jsou například kontinuální FU / FA"
"1";"cs: čeština";"NMG: publicistika";"NEW: tradiční publicistika";"X: neuvedeno";"REG: regionální tisk";"pro město Rakovník firma z Prahy za téměř 284 tisíc";"korun bez DPH";". </s><s> V rámci opravy a rozšíření sběrného dvora vzniknou také"
"1";"cs: čeština";"NMG: publicistika";"NEW: tradiční publicistika";"X: neuvedeno";"REG: regionální tisk";"dvou spádových stupňů , která vyšla na téměř třináct milionů";"korun bez DPH";". </s><s> Psali jsme před 10 lety </s><s> Měsíc po zavedení povinnosti"
"1";"cs: čeština";"NMG: publicistika";"NEW: tradiční publicistika";"X: neuvedeno";"NTW: celostátní tisk";"nad soutěží není malá a přijde Budějovice na 792 tisíc";"korun bez DPH";". </s><s> Určitou komplikací , jak radní připouštějí , je fakt"
"1";"cs: čeština";"NFC: oborová literatura";"SCI: odborná literatura";"SSC: sociální vědy";"PSY: psychologie";"aktuální potřebě klientů a vstupují do volné improvizace , tedy";"intervence bez předem";"pevně dané struktury . </s><s> Přesto však lze napříč těmito odlišnými"
"1";"cs: čeština";"NMG: publicistika";"NEW: tradiční publicistika";"X: neuvedeno";"REG: regionální tisk";"Kubota GZD 15 . </s><s> „ Cena sekačky činí 349 500";"korun bez DPH";", “ doplnil místostarosta . </s><s> Domažlické technické služby jsou příspěvkovou"
"1";"cs: čeština";"NFC: oborová literatura";"SCI: odborná literatura";"NAT: přírodní vědy";"MED: lékařství";"u nemocných s CKD proti 83 ml / min u";"nemocných bez CKD";". </s><s> Ve velké populační studii analyzující vliv mírného snížení eGF"
"1";"cs: čeština";"NMG: publicistika";"NEW: tradiční publicistika";"X: neuvedeno";"NTW: celostátní tisk";"korun . </s><s> Vybudování infocentra tak přijde na zhruba 38 milionů";"korun bez DPH";". </s><s> Evropská dotace , o kterou město požádalo a jejíž"
"1";"cs: čeština";"NFC: oborová literatura";"PRO: profesní literatura";"SSC: sociální vědy";"EDU: pedagogika";"procesu ČMOS PŠ bude prosazovat a podporovat : </s><s> odborné řízení";"školství bez politicky";"motivovaných vlivů ; zlepšení úrovně odborného vzdělávání a přípravy ;"
"1";"cs: čeština";"NMG: publicistika";"LEI: volnočasová publicistika";"X: neuvedeno";"HOU: bydlení, zahrada, hobby";". Jako rukávy . </s><s> Různě široké kožešinové lemy na rukávech";"kabátů - bez";"</s><s> těch se teď nejspíš neobejdete . </s><s> Ať už budou jakkoli"
"1";"cs: čeština";"NFC: oborová literatura";"SCI: odborná literatura";"NAT: přírodní vědy";"MED: lékařství";"<s> Za normální situace je člověk schopen plynulého pozorování pohybujícího se";"cíle bez sakadických";"pohybů . </s><s> Pohledový ( tzv . gaze hold ) nystagmus"
