"1";"cs: čeština";"NMG: publicistika";"LEI: volnočasová publicistika";"X: neuvedeno";"MIX: společnost";"statečnost . </s><s> HAVEL VE ŠVAŇĎÁKU </s><s> Švandovo divadlo , 10 .";"září od 19";"hodin , vstupné 250 korun Konec léta je ve Švandově"
"1";"cs: čeština";"NMG: publicistika";"LEI: volnočasová publicistika";"X: neuvedeno";"MIX: společnost";"v sobotu . </s><s> LADRONKA FEST </s><s> Park Ladronka , 15 .";"září od 11";"hodin , vstupné zdarma Největší festival volnočasových aktivit ve střední"
"1";"cs: čeština";"NMG: publicistika";"LEI: volnočasová publicistika";"X: neuvedeno";"MIX: společnost";"Kč . </s><s> Rezervace předem . </s><s> Choboty a drápy Na polovinu";"srpna – od 10";". do 12 . srpna – připadá Světový den slonů"
"1";"cs: čeština";"NMG: publicistika";"LEI: volnočasová publicistika";"X: neuvedeno";"MIX: společnost";"<s> Druhý ročník Vegan burger festivalu se chystá na 21 .";"dubna od 10";"hodin před Cross Clubem v Praze 7 . </s><s> Ochutnat bude"
"1";"cs: čeština";"NMG: publicistika";"LEI: volnočasová publicistika";"X: neuvedeno";"MIX: společnost";"– Spálovský slalom na Kamenici – se uskuteční 21 .";"dubna od 9";"do 16 hodin v Plavech . </s><s> Na místě se představí"
"1";"cs: čeština";"NMG: publicistika";"LEI: volnočasová publicistika";"X: neuvedeno";"MIX: společnost";"vědců je nyní na světě používáno zhruba sedm tisíc různých";"jazyků – od rychle";"mizejících řečí amazonských indiánů až po velké světové jazyky . </s>"
"1";"cs: čeština";"NMG: publicistika";"LEI: volnočasová publicistika";"X: neuvedeno";"MIX: společnost";". </s><s> ACOUSTICSESSIONANEB FOLK JE DOBRÝ Kdy : sobota 23 .";"února od 20";"do 23 . 30 hodin Kde : Kavárna kina Varšava"
"1";"cs: čeština";"NMG: publicistika";"LEI: volnočasová publicistika";"X: neuvedeno";"MIX: společnost";"DK Metropol , České Budějovice Kdy : sobota 23 .";"února od 20";"hodin Už potřetí zajišťuje produkčně zajišťuje Jihočeské divadlo ples města"
"3";"cs: čeština";"NFC: oborová literatura";"POP: populárně naučná literatura";"HUM: humanitní vědy";"HIS: historie, biografie";"důvodů nečekané exekuce byl uplacený útěk či utajený odjezd několika";"příslušníků OD po";"zrušení ghetta – dostali se i s rodinami za hranice"
