"1";"cs: čeština";"NMG: publicistika";"NEW: tradiční publicistika";"X: neuvedeno";"REG: regionální tisk";"dnech . </s><s> Domažličtí zastupitelé rozhodli , že částka 12,6 milionu";"korun bez DPH";", která byla ušetřena při rekonstrukci bazénu , bude použita"
"1";"cs: čeština";"NMG: publicistika";"NEW: tradiční publicistika";"X: neuvedeno";"NTW: celostátní tisk";"rozebrána úmyslně . </s><s> Prochází generální rekonstrukcí za zhruba 2,67 miliónu";"korun ( bez DPH";") tak , aby příští rok mohla v obnoveném hávu"
"1";"cs: čeština";"NFC: oborová literatura";"SCI: odborná literatura";"NAT: přírodní vědy";"MED: lékařství";"29 % diabetiků s kardiální autonomní neuropatií oproti 6 %";"diabetiků bez KAN";"( Ziegler , 1994 ) . </s><s> Vyvolávající příčinou je asi"
"1";"cs: čeština";"NFC: oborová literatura";"SCI: odborná literatura";"NAT: přírodní vědy";"MED: lékařství";"se jak u pacientů s OH , tak i u";"pacientů bez OH";", a to nezávisle na koexistující arteriální hypertenzi a terapii"
"1";"cs: čeština";"NFC: oborová literatura";"PRO: profesní literatura";"FTS: formální a technické vědy";"TEC: technika";", rozvaděče , čerpadla atd . ) , tak z";"nich bez velmi";"dobré erudice , znalostí a metodik nepostavíte výkonný , přesný"
"1";"cs: čeština";"NFC: oborová literatura";"POP: populárně naučná literatura";"SSC: sociální vědy";"PSY: psychologie";"dodávají , že tzv . volný svazek , bez manželského";"slibu , bez veřejně";"deklarovaného závazku , je přece jen „ volnější “ než"
"1";"cs: čeština";"NMG: publicistika";"LEI: volnočasová publicistika";"X: neuvedeno";"LIF: životní styl";"uviděl v zrcadle kulatý . </s><s> Po třiceti letech a tisícovkách";"sklapovaček , bez anolini";"( plněné těstoviny z Piacenzy , kde se narodil )"
"1";"cs: čeština";"NMG: publicistika";"NEW: tradiční publicistika";"X: neuvedeno";"NTW: celostátní tisk";"předseda KDU - ČSL Pavel Bělobrádek navrhl menšinovou vládu změti";"demokratů bez ANO";", zato podporovanou ANO . </s><s> Dokonalým řešením kvadratury kruhu se"
"1";"cs: čeština";"NFC: oborová literatura";"SCI: odborná literatura";"HUM: humanitní vědy";"ANT: antropologie, etnografie";"<s> Jakkoli se nelze pro praktický chod </s><s> společnosti ( alespoň evropského";"typu ) bez snadno";"přehlédnutelných předpisů o dobrém a zlém obejít , je příznakem"
"1";"cs: čeština";"NMG: publicistika";"NEW: tradiční publicistika";"X: neuvedeno";"NTW: celostátní tisk";"skupiny Alphabet , dostala stala povolení ke komerčnímu mu provozu";"taxislužby bez ez";"řidiče . </s><s> Jedná se o vůbec ec první povolení k"
"1";"cs: čeština";"NFC: oborová literatura";"POP: populárně naučná literatura";"FTS: formální a technické vědy";"ICT: výpočetní technika";"dlouhý numerického Shift , střední velký blok , Enter ,";"bloku bez 8";"</s><s> bez příslušenství 0 textilní obal , spona 8 kláves k"
"1";"en: angličtina";"NFC: oborová literatura";"POP: populárně naučná literatura";"FTS: formální a technické vědy";"MAT: matematika";"žurnálu Statistical Science Berry uvedl , že „ náhodné přiřazování";"terapie bez ECMO";"pacientům , jako tomu bylo ve Wareově studii , je"
"1";"cs: čeština";"NMG: publicistika";"NEW: tradiční publicistika";"X: neuvedeno";"NTW: celostátní tisk";"výše nájemného , minimální částka byla stanovena na 649 306";"korun bez DPH";"za rok . </s><s> Povodí Vltavy nakonec soutěž zrušilo a rozhodlo"
"1";"cs: čeština";"NMG: publicistika";"NEW: tradiční publicistika";"X: neuvedeno";"NTW: celostátní tisk";"potrvají do konce příštího roku a vyžádají si 82,9 milionu";"korun bez DPH";". </s><s> Uzavření mostu nepříznivě zasáhlo do života 1 500 obyvatel"
"1";"cs: čeština";"NMG: publicistika";"NEW: tradiční publicistika";"X: neuvedeno";"NTW: celostátní tisk";"terasy a sociálního zařízení za bezmála dva a půl miliónu";"korun bez DPH";". </s><s> „ První etapu jsme dokončili loni a zahrnovala přestavbu"
"1";"cs: čeština";"NMG: publicistika";"NEW: tradiční publicistika";"X: neuvedeno";"REG: regionální tisk";"se přihlásila jedna firma , která nabídla cenu 840 tisíc";"korun bez DPH";". </s><s> Písek – Průchod z Heydukovy ulice do Palackého sadů"
"1";"cs: čeština";"NFC: oborová literatura";"PRO: profesní literatura";"NAT: přírodní vědy";"AGR: zemědělství, chovatelství";"také o úpravě agrotechnických postupů ve vztahu k sestavení krmných";"dávek bez GM";"krmiv . </s><s> Jedním z témat bylo využití nových technologií sklizně"
"1";"cs: čeština";"NMG: publicistika";"NEW: tradiční publicistika";"X: neuvedeno";"NTW: celostátní tisk";"přes den , odměna za držení pohotovosti je 25 400";"korun bez DPH";"denně a při nasazení vrtulníku bude ministerstvo platit 15 950"
"1";"cs: čeština";"NMG: publicistika";"NEW: tradiční publicistika";"X: neuvedeno";"NTW: celostátní tisk";"v Palackého ulici ŘSD přijde na tři miliony 281 tisíc";"korun bez DPH";". </s><s> O této úpravě se v Přerově mluví už dvacet"
"1";"cs: čeština";"NMG: publicistika";"NEW: tradiční publicistika";"X: neuvedeno";"NTW: celostátní tisk";"výnos ze všech parkovišť činí zhruba dva až 2,5 milionu";"korun bez DPH";", “ uvedla mluvčí frýdeckomístecké radnice Jana Matějíková . </s><s> V"
"1";"cs: čeština";"NMG: publicistika";"NEW: tradiční publicistika";"X: neuvedeno";"NTW: celostátní tisk";"stop a jedna taková jízda stojí podle starosty 18 tisíc";"korun bez DPH";". </s><s> „ Zpoplatnit stopu jako v jiných státech by bylo"
"1";"cs: čeština";"NFC: oborová literatura";"POP: populárně naučná literatura";"ITD: interdisciplinární";"ITD: interdisciplinární";". </s><s> Provozovat v nouzi staré auto s karburátorem bez všech";"vymožeností ( bez lambda";"sondy apod . ) Kontrolovat kvalitu uloženého benzinu a vytvořit"
"1";"cs: čeština";"NMG: publicistika";"NEW: tradiční publicistika";"X: neuvedeno";"NTW: celostátní tisk";"by za ně ministerstvo podle předpokladů zaplatilo až 1,498 miliardy";"korun bez DPH";". </s><s> Mladí mají partnera , ale bydlí sami </s><s> Poptávka po"
"1";"cs: čeština";"NMG: publicistika";"NEW: tradiční publicistika";"X: neuvedeno";"NTW: celostátní tisk";". </s><s> „ Cena tepla se v Brně zvýší o 4,5";"procenta bez DPH";". </s><s> Domácnosti připojené na centrální zásobování teplem však toto opatření"
"1";"cs: čeština";"NFC: oborová literatura";"POP: populárně naučná literatura";"ITD: interdisciplinární";"ITD: interdisciplinární";"vedoucí k otylosti byla u nich vyšší než u transgenních";"myší bez TRPV1";". </s><s> Ukázalo se , že právě tuky vyřazují receptory TRP"
"1";"cs: čeština";"NMG: publicistika";"NEW: tradiční publicistika";"X: neuvedeno";"NTW: celostátní tisk";"uších . </s><s> Cena za to všechno je přibližně 28 tisíc";"eur bez DPH";", tedy zhruba 700 tisíc korun . </s><s> Nadšení z odpadků </s>"
"1";"en: angličtina";"NFC: oborová literatura";"POP: populárně naučná literatura";"SSC: sociální vědy";"REC: sport, rekreace, hobby";"nevykážete . </s><s> Koncept č . 19 : Nedorovnávejte do zabezpečeného";"banku bez velmi";"dobré kombinace . </s><s> Zabezpečený bank je takový , v němž"
"1";"cs: čeština";"NMG: publicistika";"NEW: tradiční publicistika";"X: neuvedeno";"NTW: celostátní tisk";"“ upozornil . </s><s> Znalecký posudek stanovil částku přes 2,8 miliónu";"korun bez DPH";"na celý komplet , firma Kapucín ho městu nabídla za"
"1";"cs: čeština";"NMG: publicistika";"NEW: tradiční publicistika";"X: neuvedeno";"NTW: celostátní tisk";"Praha od začátku provozu Lítačky zaplatila Operátorovi ICT 14,8 milionu";"korun bez DPH";". </s><s> Od začátku července platí 123 000 korun bez DPH"
"1";"cs: čeština";"NFC: oborová literatura";"POP: populárně naučná literatura";"FTS: formální a technické vědy";"TEC: technika";"verze ( s menší pamětí ) pak vyjde na 350";"eur bez DPH";"( cca 11 500 Kč i s daní , bez"
"1";"cs: čeština";"NMG: publicistika";"NEW: tradiční publicistika";"X: neuvedeno";"REG: regionální tisk";"bez DPH . </s><s> Celkem rekonstrukce vyjde na 291 880 114";"korun bez DPH";". </s><s> Zahájena bude 2 . července a potrvá do 31"
"1";"cs: čeština";"NMG: publicistika";"NEW: tradiční publicistika";"X: neuvedeno";"REG: regionální tisk";"vysoká , když základní varianta začíná na částce 261 tisíc";"korun bez DPH";". </s><s> Takovou reakci budete mít vždycky . </s><s> Neříkám , že"
"1";"cs: čeština";"NFC: oborová literatura";"SCI: odborná literatura";"SSC: sociální vědy";"PSY: psychologie";", neboť se spoléhali na ochrannou funkci ABS ; řidiči";"vozů bez ABS";"pak údajně řídili opatrněji , protože se v nebezpečných situacích"
"1";"cs: čeština";"NMG: publicistika";"NEW: tradiční publicistika";"X: neuvedeno";"NTW: celostátní tisk";"<s> Se základním motorem začíná cena vozu na částce 541 000";"korun bez DPH";". </s><s> Hyundai H - 1 Van je jednoduše pojatý model"
"1";"cs: čeština";"NMG: publicistika";"NEW: tradiční publicistika";"X: neuvedeno";"NTW: celostátní tisk";", doprovodných služeb , demontáže a úklidu zaplatí zhruba 4,5";"milionu bez DPH";". </s><s> Radnice Prahy 8 otevře 25 . listopadu ledovou plochu"
"1";"cs: čeština";"NFC: oborová literatura";"PRO: profesní literatura";"NAT: přírodní vědy";"MED: lékařství";"sobě apod . ) a poctivá snaha o výuku mladších";"kolegů bez málo";"sebevědomé a neimponující obavy z možné budoucí konkurence nesou ovoce"
"1";"cs: čeština";"NFC: oborová literatura";"POP: populárně naučná literatura";"SSC: sociální vědy";"LAW: právo";"Nelze připustit , aby volání na číslo 112 z mobilního";"telefonu bez SIM";"karty byla vyloučena z působnosti tohoto ustanovení , “ shrnul"
"1";"cs: čeština";"NMG: publicistika";"NEW: tradiční publicistika";"X: neuvedeno";"NTW: celostátní tisk";"by podle zadání tendru měla vyjít na maximálně 73 milionů";"korun bez DPH";", “ uvedl mluvčí magistrátu Vít Hofman . </s><s> Cílem veřejné"
"1";"cs: čeština";"NFC: oborová literatura";"ADM: administrativa";"ADM: administrativa";"ADM: administrativa";"nabídky tato dílčí kritéria : </s><s> kritérium váha kritéria </s><s> celková výše";"nákladů bez DPH";"v případě úspěšné aukce 70 % celková výše nákladů bez"
"1";"cs: čeština";"NMG: publicistika";"NEW: tradiční publicistika";"X: neuvedeno";"REG: regionální tisk";"<s> Půl kilometru se opraví v ulici Dukelská za půl milionu";"korun bez DPH";". </s><s> Téměř sedm set metrů nového chodníku vznikne také v"
"1";"cs: čeština";"NMG: publicistika";"NEW: tradiční publicistika";"X: neuvedeno";"REG: regionální tisk";"milionů korun . </s><s> Přitom původní projekt počítal s částkou 198";"milionů bez DPH";"</s><s> „ Nadjezd je výjimečný právě svojí konstrukcí podpěr , která"
"1";"cs: čeština";"NFC: oborová literatura";"SCI: odborná literatura";"SSC: sociální vědy";"REC: sport, rekreace, hobby";". Při závodech v drahách platí stejná pravidla jako u";"sportovců bez TP";". </s><s> V závodech nad 400 m nesmí sportovec při předjíždění"
"1";"cs: čeština";"NFC: oborová literatura";"SCI: odborná literatura";"NAT: přírodní vědy";"MED: lékařství";". </s><s> BED se u diabetické populace vyskytuje častěji než u";"pacientů bez DM";", i když jeho prevalence se v rámci specifických výzkumných"
"1";"cs: čeština";"NFC: oborová literatura";"PRO: profesní literatura";"FTS: formální a technické vědy";"TEC: technika";"snížila , protože technologický postup se zjednodušil . </s><s> Další výhodou";"fólie bez pokovu";"je větší prostup světla než u trojskla a především má"
"1";"cs: čeština";"NFC: oborová literatura";"POP: populárně naučná literatura";"FTS: formální a technické vědy";"TEC: technika";"začít prodávat ještě během léta , aktuální cena je 430";"eur bez DPH";"( po zdanění tedy půjde o více než 14 000"
"1";"cs: čeština";"NMG: publicistika";"NEW: tradiční publicistika";"X: neuvedeno";"NTW: celostátní tisk";". </s><s> Suverénně největší český e-shop měl loni obrat 25 miliard";"korun bez DPH";", meziročně vzrostl o 19,3 procenta . </s><s> Alzu vlastní holdingová"
"1";"cs: čeština";"NFC: oborová literatura";"SCI: odborná literatura";"SSC: sociální vědy";"PSY: psychologie";"pak způsobují situace , kdy se objeví pouze implicitní část";"vzpomínky bez „";"explicitního děje “ jako v případě mazlící se matky popsané"
"1";"cs: čeština";"NFC: oborová literatura";"SCI: odborná literatura";"HUM: humanitní vědy";"LAN: filologie";"pracovat s jednodušší podobou strukturních stromů , se syntaktickými zápisy";"vět bez nonterminálních";"symbolů a s poměrně malým počtem uzlů . </s><s> Pro teorii"
"1";"cs: čeština";"NFC: oborová literatura";"SCI: odborná literatura";"HUM: humanitní vědy";"ART: umění, architektura";"“ a „ pokrčeného otupeného akantu “ ) , jakožto";"něčeho bez vývojově";"pokrokových či specificky českých motivů , protože „ se vyskytuje"
"1";"cs: čeština";"NMG: publicistika";"NEW: tradiční publicistika";"X: neuvedeno";"NTW: celostátní tisk";"by měly být nižší . </s><s> Cena nového elektrobusu byla 13,1";"milionu bez DPH";", přičemž 85 procent nákladů uhradila EU . </s><s> Víc než"
"1";"cs: čeština";"NMG: publicistika";"NEW: tradiční publicistika";"X: neuvedeno";"REG: regionální tisk";"kdy vstoupíme do roku 2020 , vyjít na 200 tisíc";"korun bez DPH";". </s><s> KAM DÁL NA ŠKOLU ? </s><s> V TŘINCI se opět"
"1";"cs: čeština";"NMG: publicistika";"NEW: tradiční publicistika";"X: neuvedeno";"NTW: celostátní tisk";"by byl hodně blízko , zejména když je jediným z";"vedení bez „";"politické “ práce . </s><s> Místopředsedové Roman Onderka a Jaroslav Foldyna"
"1";"cs: čeština";"NFC: oborová literatura";"PRO: profesní literatura";"FTS: formální a technické vědy";"TEC: technika";"vzdálenostech po cca 120 mm a na téměř celou šířku";"stěny ( bez 50";"mm ) . následně je do otvorů vpravena infuzní směs"
"1";"cs: čeština";"NMG: publicistika";"NEW: tradiční publicistika";"X: neuvedeno";"REG: regionální tisk";". </s><s> V době odstávky bude možné požádat o vydání občanského";"průkazu bez strojově";"čitelných údajů s dobou platnosti 1 měsíc , za jehož"
"1";"en: angličtina";"FIC: beletrie";"NOV: próza";"X: neuvedeno";"X: neuvedeno";"se obrátila ke Kate . </s><s> „ Radši bych jela do";"nemocnice bez Jules";". </s><s> A Sebastian je bohužel , samozřejmě , v Římě"
"1";"cs: čeština";"NMG: publicistika";"NEW: tradiční publicistika";"X: neuvedeno";"NTW: celostátní tisk";"<s> Z toho stát Kapschi a jeho subdodavatelům zaplatil 16,3 miliardy";"korun bez DPH";". </s><s> Klíčové body jednání o budoucnosti mýta : </s><s> 9 ."
"1";"cs: čeština";"NMG: publicistika";"NEW: tradiční publicistika";"X: neuvedeno";"REG: regionální tisk";"nakonec se stavba vysoutěžila za 1 . 686 . 275";"korun bez DPH";". </s><s> Pro obec , která se na akci podílí třiceti"
"1";"cs: čeština";"NMG: publicistika";"NEW: tradiční publicistika";"X: neuvedeno";"REG: regionální tisk";"<s> Infrastrukturu by v průmyslové zóně měla zajistit za 53 milionů";"korun bez DPH";"společnost Strabag . </s><s> Listopad </s><s> Díky švýcarskočeské spolupráci vzniká ve Městě"
"1";"cs: čeština";"NMG: publicistika";"NEW: tradiční publicistika";"X: neuvedeno";"NTW: celostátní tisk";", která loni podle údajů celní správy dosáhla 19,7 milionu";"hektolitrů ( bez nealko";"piv ) , však mají tito nejmenší výrobci zhruba jen"
"1";"cs: čeština";"NMG: publicistika";"NEW: tradiční publicistika";"X: neuvedeno";"NTW: celostátní tisk";"ze silných předvolebních témat loni na podzim . </s><s> Kritici současného";"stavu bez „";"architektonického dohledu “ nejčastěji používali jako argumenty nepovedené zateplení kina"
"1";"cs: čeština";"NMG: publicistika";"NEW: tradiční publicistika";"X: neuvedeno";"NTW: celostátní tisk";"třetí a umožňuje DSA létat až do limitu dva miliony";"korun bez DPH";", přičemž podmínky jsou stejné jako dosud : DSA zajišťuje"
"1";"cs: čeština";"NMG: publicistika";"NEW: tradiční publicistika";"X: neuvedeno";"NTW: celostátní tisk";", že v případě projekčních nákladů ve výši 200 milionů";"korun bez DPH";"měla podle první smlouvy s povodím dosáhnout spoluúčast města třiceti"
"1";"cs: čeština";"NMG: publicistika";"NEW: tradiční publicistika";"X: neuvedeno";"REG: regionální tisk";"už schválilo zhotovitele občerstvení . </s><s> Za 4 miliony 900 tisíc";"korun bez DPH";"ho postaví firma SVS 2000 . </s><s> Jak uvedla primátorka Karlových"
"1";"cs: čeština";"NMG: publicistika";"NEW: tradiční publicistika";"X: neuvedeno";"NTW: celostátní tisk";"CZ – o písemné zdůvodnění způsobu stanovení mimořádně nízké nabídkové";"ceny bez DPH";"u některých dílčích cenových položek , “ uvedl mluvčí ÚOHS"
"1";"cs: čeština";"NMG: publicistika";"NEW: tradiční publicistika";"X: neuvedeno";"REG: regionální tisk";"inženýrských sítí . </s><s> Práce by měly vyjít na dva miliony";"korun bez DPH";". </s><s> ZAČAL FESTIVAL JÍDLA </s><s> DALŠÍ ROČNÍK oblíbeného Grand Restaurant Festivalu"
"1";"cs: čeština";"NFC: oborová literatura";"POP: populárně naučná literatura";"FTS: formální a technické vědy";"TEC: technika";"335 km / h . </s><s> Cena začíná na 465 000";"euro ( bez DPH";") . </s><s> V klasickém , ale moderně podaném pojetí je"
"1";"cs: čeština";"NFC: oborová literatura";"SCI: odborná literatura";"SSC: sociální vědy";"REC: sport, rekreace, hobby";"postavení ukážeme při výkladu techniky vrhu jednou rukou z čelného";"postavení bez i";"s rotací trupu se zapojením dolních končetin do pohybu . </s>"
"1";"cs: čeština";"NFC: oborová literatura";"SCI: odborná literatura";"SSC: sociální vědy";"LAW: právo";"vzhledem k jeho nepochybným negativním konotacím vůbec neužívat . </s><s> U";"opomenutí bez výše";"zmíněných okolností ( vylučujících de facto protiprávnost ) také není"
"1";"cs: čeština";"NFC: oborová literatura";"PRO: profesní literatura";"SSC: sociální vědy";"ECO: ekonomie, obchod, logistika";"ZÁVĚR : Všichni v KC si přejeme : „ Méně";"zákazníků bez ID";"kódu ! “ „ Den je hned veselejší , když"
"1";"cs: čeština";"NMG: publicistika";"NEW: tradiční publicistika";"X: neuvedeno";"REG: regionální tisk";"komfortní zázemí - bezbariérovost - cena stavby do 65 milionů";"korun bez DPH";"</s><s> Rožmberk </s><s> Od pátku 14 . října do neděle 16 ."
"1";"cs: čeština";"NFC: oborová literatura";"PRO: profesní literatura";"FTS: formální a technické vědy";"ICT: výpočetní technika";"s 8 nebo 16 GB RAM za ceny okolo 19";"tisíc bez DPH";", resp . 23 tisíc bez DPH . </s><s> TS -"
"1";"cs: čeština";"NMG: publicistika";"NEW: tradiční publicistika";"X: neuvedeno";"NTW: celostátní tisk";"výši 98 milionů bez DPH , druhá ve výši 146";"milionů bez DPH";". </s><s> V tom ovšem nejsou započítány náklady na projektového manažera"
"1";"cs: čeština";"NMG: publicistika";"LEI: volnočasová publicistika";"X: neuvedeno";"MIX: společnost";"dávkách . </s><s> Gram konopí se Elkoplast zavázal dodávat za 68";"korun bez DPH";", takže by ho mělo být možné pořídit za solidních"
"1";"cs: čeština";"NMG: publicistika";"LEI: volnočasová publicistika";"X: neuvedeno";"INT: zajímavosti ze světa";"<s> Rozjaření z toho , že jsem se odvážil – bez";"klece , bez kovem";"vyztuženého neoprenového obleku , a dokonce i bez tyče opatřené"
"1";"cs: čeština";"NMG: publicistika";"NEW: tradiční publicistika";"X: neuvedeno";"NTW: celostátní tisk";"letošního podzimu . </s><s> Předpokládaná cena této stavby je 6,5 miliardy";"korun bez DPH";". </s><s> Dálnice D 11 ( Praha – Hradec Králové –"
"1";"cs: čeština";"NFC: oborová literatura";"SCI: odborná literatura";"HUM: humanitní vědy";"LAN: filologie";"aniž uzavírá . </s><s> K tomu mohou být zaktivizovány všechny složky";"díla bez předem";"dané hierarchie a všechny ve svých souhrách a protihrách ("
"1";"cs: čeština";"NMG: publicistika";"LEI: volnočasová publicistika";"X: neuvedeno";"SCT: společenský život";"levé straně . </s><s> „ Město za to zaplatí 6,5 milionu";"korun bez DPH";", “ řekla mluvčí magistrátu Romana Macová . </s><s> Dodala ,"
"1";"cs: čeština";"NMG: publicistika";"NEW: tradiční publicistika";"X: neuvedeno";"REG: regionální tisk";"aukce se do boje o zakázku za necelých 90 milionů";"korun bez DPH";"přihlásil už jenom jeden další zájemce , a to stavební"
"1";"cs: čeština";"NFC: oborová literatura";"POP: populárně naučná literatura";"FTS: formální a technické vědy";"TEC: technika";", což se stává profíkům , kteří mají najeto spousty";"kilometrů bez ABS";", “ míní instruktor . </s><s> Jenže , jak říká jeho"
"1";"cs: čeština";"FIC: beletrie";"VER: poezie";"X: neuvedeno";"X: neuvedeno";"umělý krásy </s><s> ruce bez obalu </s><s> Dívám se </s><s> na přerušovaná setkání </s><s>";"očí </s><s> bez";"</s><s> obočí . </s><s> Plné tašky </s><s> vtlačí vedle </s><s> sebe </s><s> Pak někde </s><s> vystoupí </s>"
"1";"cs: čeština";"NMG: publicistika";"NEW: tradiční publicistika";"X: neuvedeno";"NTW: celostátní tisk";"Hradiště za nový vizuální styl pro marketingovou prezentaci zaplatilo 400";"tisíc bez DPH";", Plzeň dokonce více než milion korun . </s><s> Viktor Chrást"
"1";"cs: čeština";"NMG: publicistika";"NEW: tradiční publicistika";"X: neuvedeno";"NTW: celostátní tisk";"o inteligentní domácnosti . </s><s> Pokrývači a malíři se neobejdou bez";"dronů , bez 3D";"tiskáren se brzy neobejde nikdo . </s><s> Pokrok nezastavíš . </s><s> Jenže"
"1";"en: angličtina";"FIC: beletrie";"NOV: próza";"X: neuvedeno";"X: neuvedeno";"napadne . </s><s> „ Ale jak — jak ses dostal kolem";"strážných bez Stockhamova";"výslovného dovolení ? </s><s> Myslím tím , když ses vydal pro"
"1";"cs: čeština";"NFC: oborová literatura";"POP: populárně naučná literatura";"FTS: formální a technické vědy";"TEC: technika";": 133,5 mm </s><s> Šířka : 36 mm </s><s> Hmotnost : 740";"gramů bez";"</s><s> zásobníku </s><s> 820 gramů se </s><s> zásobníkem </s><s> Kapacita zásobníku : 15 nábojů </s>"
"1";"cs: čeština";"NMG: publicistika";"LEI: volnočasová publicistika";"X: neuvedeno";"HOU: bydlení, zahrada, hobby";"166,14 m2 , obestavěný prostor : 995,40 m3 , cena";"stavebnice bez DPH";"599 000 Kč , </s><s> DŮM LUCIE 54 </s><s> Dispozice : 7"
"1";"cs: čeština";"NFC: oborová literatura";"SCI: odborná literatura";"SSC: sociální vědy";"PSY: psychologie";"vydán a ocitá se ve stavu bezmocné úzkosti , neutuchajícího";"stresu bez (";"biologické ) možnosti obrany . </s><s> Autoprotektivní reakce , jimiž jedinec"
"1";"cs: čeština";"NMG: publicistika";"NEW: tradiční publicistika";"X: neuvedeno";"NTW: celostátní tisk";"Přednádraží vybudovala . </s><s> Náklady by měly dosáhnout necelých 146 milionů";"korun bez DPH";", což byla nejnižší cena , kterou čtyři uchazeči o"
"1";"cs: čeština";"NMG: publicistika";"NEW: tradiční publicistika";"X: neuvedeno";"REG: regionální tisk";"děti . </s><s> Náklady na rekonstrukci bez interiérů jsou 139 milionů";"korun bez DPH";". </s><s> Čtrnáct milionů zaplatí dotace . </s><s> ZAHÁJENÍ SEZONY PAMÁTEK </s><s> Zámek"
"1";"cs: čeština";"NMG: publicistika";"NEW: tradiční publicistika";"X: neuvedeno";"NTW: celostátní tisk";". </s><s> Předpokládaná hodnota investiční akce je vyčíslena na 1,2 miliardy";"korun bez DPH";". </s><s> Jedná se o novostavbu dvoupruhové komunikace o délce 4,867"
"1";"cs: čeština";"NFC: oborová literatura";"PRO: profesní literatura";"NAT: přírodní vědy";"MED: lékařství";"oznámena v úhrado - pém dodatku . </s><s> V případě nové";"ambulance ( bez smluvně";"domluvenuho převzetíU je výše MPÚ stanovena z průměrných hodnot srovnatelných"
"1";"cs: čeština";"NMG: publicistika";"NEW: tradiční publicistika";"X: neuvedeno";"NTW: celostátní tisk";"okraji Plzně a začátkem obchvatu Třemošné mají stát 216 milionů";"korun bez DPH";". </s><s> „ To je zhruba o čtyři procenta méně ,"
"1";"cs: čeština";"NMG: publicistika";"NEW: tradiční publicistika";"X: neuvedeno";"REG: regionální tisk";"za ledkové . </s><s> Náklady se budou pohybovat kolem 800 tisíc";"korun bez DPH";". </s><s> VÝSTAVY </s><s> MUZEUM FOTOGRAFIE A MODERNÍCH OBRAZOVÝCH MÉDIÍ Jindřichův Hradec"
"1";"cs: čeština";"NMG: publicistika";"NEW: tradiční publicistika";"X: neuvedeno";"NTW: celostátní tisk";"<s> Za audity devíti obchodních společností město zaplatí zhruba 7,9 miliónu";"korun bez DPH";", u nemocnice pak necelý milión korun bez DPH . </s>"
"1";"cs: čeština";"NFC: oborová literatura";"POP: populárně naučná literatura";"SSC: sociální vědy";"LAW: právo";"je možné ji vyžadovat i při hovorech uskutečněných z mobilního";"zařízení bez SIM";"karty . </s><s> Soudní dvůr dovodil , že ze samotného znění"
