"1";"cs: čeština";"NFC: oborová literatura";"POP: populárně naučná literatura";"FTS: formální a technické vědy";"TEC: technika";"vytrvalé rostliny . </s><s> Vytrvalé druhy zpravidla kombinujeme a vyčleníme jim";"místo mimo běžně";"obhospodařovanou plochu ( rebarbora , zimní cibule , pažitka ,"
"1";"cs: čeština";"NFC: oborová literatura";"PRO: profesní literatura";"NAT: přírodní vědy";"MED: lékařství";"na lékařské fakultě již pregraduálně . </s><s> Povinné klinické stáže u";"lůžka mimo „";"mateřské “ fakultní nemocnice jsou v gesci garantů předmětů ,"
"1";"cs: čeština";"NMG: publicistika";"LEI: volnočasová publicistika";"X: neuvedeno";"SCT: společenský život";"zpěvák , který má před sebou šestou chemoterapii , si";"chvíle mimo »";"špitál « užívá s rodinou . </s><s> Svou ženu Ivanku ,"
"1";"cs: čeština";"NMG: publicistika";"NEW: tradiční publicistika";"X: neuvedeno";"NTW: celostátní tisk";"mají často svůj svět , ale tohle je dle mého";"názoru mimo .";"</s><s> V jiných zemích by taková věc byla nemyslitelná . </s><s> Vždy"
"1";"cs: čeština";"NFC: oborová literatura";"SCI: odborná literatura";"NAT: přírodní vědy";"BIO: biologie";"1996 vymezena kostra ekologické stability , která zachycuje přírodně nejcennější";"lokality mimo CHKO";"Moravský kras . </s><s> V širším území bylo vymezeno 29 významných"
"1";"de: němčina";"NFC: oborová literatura";"SCI: odborná literatura";"HUM: humanitní vědy";"HIS: historie, biografie";"posílily po sametové revoluci a pokračovali po vzniku samostatné České";"republiky , mimo i";"jiné v oblasti vojenství ( Dohoda o vojenské spolupráci v"
"1";"cs: čeština";"NFC: oborová literatura";"ADM: administrativa";"ADM: administrativa";"ADM: administrativa";"manželství nejsou zpoplatněny správními poplatky . </s><s> Za vydání povolení uzavřít";"manželství mimo úředně";"určenou místnost a ( nebo ) mimo stanovenou dobu se"
"1";"cs: čeština";"NMG: publicistika";"NEW: tradiční publicistika";"X: neuvedeno";"NTW: celostátní tisk";"i větší část světa . </s><s> Firmy pak musí držet tyto";"zisky mimo USA";", aby se vyhnuly jejich dodatečnému dodanění . </s><s> Jenže stovky"
"1";"en: angličtina";"FIC: beletrie";"NOV: próza";"X: neuvedeno";"X: neuvedeno";"dořekl své varování , Trisolaris vůbec poprvé navázala s lidstvem";"spojení mimo PTO";"a přerušila veškerou komunikaci s Adventisty . </s><s> Pak se do"
"1";"cs: čeština";"NMG: publicistika";"NEW: tradiční publicistika";"X: neuvedeno";"NTW: celostátní tisk";"musejí být zadrženi a odesláni . </s><s> Musíme založit velké uprchlické";"tábory mimo EU";"s ozbrojenou bezpečností a finanční podporou , kterou zajistí Unie"
"1";"cs: čeština";"NMG: publicistika";"NEW: tradiční publicistika";"X: neuvedeno";"NTW: celostátní tisk";"<s> Z celkového počtu odhalených nelegálních pracovníků bylo 3595 cizinců ze";"zemí mimo EU";", 763 českých občanů a 225 občanů EU , a"
"1";"en: angličtina";"NFC: oborová literatura";"POP: populárně naučná literatura";"FTS: formální a technické vědy";"MAT: matematika";"( muži ) a body ( ženy ) . </s><s> Z";"prostoru mimo Přímkozemi";"promlouvá k jejímu králi , který ovšem nechápe , s"
"1";"cs: čeština";"NFC: oborová literatura";"PRO: profesní literatura";"NAT: přírodní vědy";"MED: lékařství";"komora požaduje dodržování platných zákonů . </s><s> U všech cizinců ze";"zemí mimo EU";"musí být ověřena pravost jejich vysokoškolského diplomu , prověřena schopnost"
"1";"cs: čeština";"NMG: publicistika";"NEW: tradiční publicistika";"X: neuvedeno";"NTW: celostátní tisk";"právo neumožňuje Britům přivést si do země životního partnera ze";"zemí mimo EU";", pokud neprokáží , že mají dost peněz , aby"
"1";"cs: čeština";"NMG: publicistika";"NEW: tradiční publicistika";"X: neuvedeno";"NTW: celostátní tisk";"pracovníky z členských států Evropské unie , ale i ze";"zemí mimo EU";", například z Ukrajiny , Srbska či Filipín . </s><s> Nábor"
"1";"cs: čeština";"NMG: publicistika";"NEW: tradiční publicistika";"X: neuvedeno";"NTW: celostátní tisk";"zklamán . </s><s> Stejně tak si rozumný návštěvník Primorska z dovolené";"nic mimo pár";"suvenýrů nepřiveze . </s><s> Obchody jsou sice plné , ale v"
"1";"cs: čeština";"NMG: publicistika";"NEW: tradiční publicistika";"X: neuvedeno";"NTW: celostátní tisk";"<s> „ Měli jsme z Česka víc studentů než z kterékoliv";"země mimo USA";", “ pochvaluje si Kaiser , jenž dnes obdobné školicí"
"1";"cs: čeština";"NMG: publicistika";"NEW: tradiční publicistika";"X: neuvedeno";"NTW: celostátní tisk";"Mírné zvýšení daní ( na financování ochrany hranic , utečeneckých";"táborů mimo ČR";"apod . ) 25,6 % 74,4 % Omezení při cestách"
"1";"cs: čeština";"FIC: beletrie";"NOV: próza";"X: neuvedeno";"X: neuvedeno";"věky zabývá čímsi docela podobným vašemu buddhismu . </s><s> Převážná většina";"Pozemšťanů – mimo pár";"jedinců , co si doopravdy sáhlo – mi duchovně ,"
"1";"cs: čeština";"NFC: oborová literatura";"PRO: profesní literatura";"SSC: sociální vědy";"ECO: ekonomie, obchod, logistika";"se vyskytne nějaký problém . </s><s> S výjimkou zásilek určených do";"zemí mimo EU";", kdy je nutná komunikace s celním úřadem , je"
"1";"cs: čeština";"NFC: oborová literatura";"POP: populárně naučná literatura";"ITD: interdisciplinární";"ITD: interdisciplinární";"lokálnímu vymírání druhů , je potřeba upřít pozornost také na";"místa mimo zvláště";"chráněná území ( CHKO , přírodní rezervace ap . )"
"1";"en: angličtina";"NFC: oborová literatura";"SCI: odborná literatura";"SSC: sociální vědy";"SOC: sociologie";"tvůrci a obhájci usilovně bránili rozšíření volebního práva na kohokoli";"jiného mimo """;"bohaté "" . </s><s> Nikoli bezdůvodně byla vyhlídka na takovéto rozšíření"
"1";"cs: čeština";"NFC: oborová literatura";"SCI: odborná literatura";"NAT: přírodní vědy";"MED: lékařství";"aloTKD a proč ? </s><s> 7 . Vyjmenujte další geneticky podmíněné";"faktory ( mimo HLA";") významné pro úspěšnost aloTKD . </s><s> 2 . 7 MOLEKULÁRNÍ"
"1";"cs: čeština";"NFC: oborová literatura";"POP: populárně naučná literatura";"NAT: přírodní vědy";"BIO: biologie";"nerovných podmínkách , než nejistý výsledek v boji o prosazení";"se mimo komunu325";", 1243 , 1238 , 1239 . </s><s> A co samci"
"1";"cs: čeština";"NMG: publicistika";"NEW: tradiční publicistika";"X: neuvedeno";"NTW: celostátní tisk";"ještě před dvěma domácími výhrami však byly po sérii čtyř";"porážek mimo play";"off . </s><s> „ Nebylo tady dusno . </s><s> Kdybychom prohráli o"
"1";"cs: čeština";"NFC: oborová literatura";"PRO: profesní literatura";"FTS: formální a technické vědy";"TEC: technika";"rozdíl od zpracovatelského průmyslu nemají konkurenci v podobě dovozů ze";"zemí mimo EU";". </s><s> Oba druhy nákladů představují pro evropské a české firmy"
"1";"cs: čeština";"NFC: oborová literatura";"PRO: profesní literatura";"FTS: formální a technické vědy";"TEC: technika";") a skutečnost , že CECIMO exportuje asi 36 %";"produkce mimo EU";", činí sektor náchylným na oslabení na základě změn mezinárodních"
"1";"cs: čeština";"NFC: oborová literatura";"SCI: odborná literatura";"NAT: přírodní vědy";"BIO: biologie";"rezervací , národních přírodních památek , přírodních rezervací a přírodních";"památek mimo NP";", CHKO a jejich ochranná pásma , vyhlašují obecní úřady"
"1";"cs: čeština";"NMG: publicistika";"NEW: tradiční publicistika";"X: neuvedeno";"NTW: celostátní tisk";", nejvíce Slovenska , Německa a Polska . </s><s> Do 73";"zemí mimo EU";"se pak dostalo 22 tisíc hektolitrů českého piva . </s><s> Kdo"
"1";"cs: čeština";"NMG: publicistika";"NEW: tradiční publicistika";"X: neuvedeno";"NTW: celostátní tisk";"něco nechtějí . </s><s> Málo se ví , že cizinců ze";"zemí mimo EU";"( tedy například Indů , Pákistánců a Nigerijců ) stále"
"1";"cs: čeština";"NFC: oborová literatura";"PRO: profesní literatura";"FTS: formální a technické vědy";"ICT: výpočetní technika";". 95 / 46 / ES . </s><s> 2 . Ukládání";"dat mimo EU";"? </s><s> Předávání dat do zemí mimo EU , tzv ."
"1";"cs: čeština";"NFC: oborová literatura";"ADM: administrativa";"ADM: administrativa";"ADM: administrativa";"stavu a podmínek pobytu ( zejména o důvodu a místu";"pobytu mimo DM";"ve dnech školního vyučování a příčině neúčasti při výuce ve"
"1";"cs: čeština";"NMG: publicistika";"NEW: tradiční publicistika";"X: neuvedeno";"NTW: celostátní tisk";"cukru se vyrobilo obrovské množství . </s><s> Z těchto zásob se";"toho mimo EU";"moc vyvézt nepodařilo , “ řekl Havel . </s><s> ( Pokračování"
"1";"cs: čeština";"NFC: oborová literatura";"PRO: profesní literatura";"NAT: přírodní vědy";"MED: lékařství";"o ustanovení , které umožňuje , aby špičkový odborník ze";"země mimo EU";"mohl předávat své znalosti a dovednosti našim lékařům například tím"
"1";"cs: čeština";"NFC: oborová literatura";"PRO: profesní literatura";"FTS: formální a technické vědy";"TEC: technika";"agentury zaměstnávat pracovníky z tzv . třetích zemí , tedy";"zemí mimo EU";". </s><s> Typicky se jedná například o projekt Ukrajina a dovoz"
"1";"cs: čeština";"NFC: oborová literatura";"POP: populárně naučná literatura";"ITD: interdisciplinární";"ITD: interdisciplinární";"v uniformní , intenzivně obhospodařované krajině . </s><s> V agrární krajině";"nížin ( mimo CHKO";"a NP ) to dnes vlastně ani jinudy nejde . </s>"
"1";"cs: čeština";"NMG: publicistika";"NEW: tradiční publicistika";"X: neuvedeno";"NTW: celostátní tisk";"doktorů . </s><s> Jazykové testy museli dosud absolvovat jen zdravotníci ze";"zemí mimo EU";". </s><s> VETERÁNI SS NA POCHODU . </s><s> Na 1500 veteránů zbraní"
"1";"cs: čeština";"NFC: oborová literatura";"SCI: odborná literatura";"SSC: sociální vědy";"ECO: ekonomie, obchod, logistika";". </s><s> Můžete mít matice odpovědností i další přínosy pro řízení";"projektu mimo již";"uvedených ? </s><s> Pokuste se některé z nich pojmenovat . </s><s> 8"
"1";"cs: čeština";"NMG: publicistika";"NEW: tradiční publicistika";"X: neuvedeno";"NTW: celostátní tisk";"V ZAHRANIČÍ </s><s> Kvůli vysokým daním americké firmy často drží nahromaděné";"zisky mimo USA";". </s><s> Nově schválená daňová reforma jim umožní tyto peníze zdanit"
"1";"cs: čeština";"NMG: publicistika";"NEW: tradiční publicistika";"X: neuvedeno";"NTW: celostátní tisk";"vnímá divák , ale já vím , že v tuto";"chvíli mimo ČT";"a asi dvou studií , přišel dabing o 180 herců"
"1";"en: angličtina";"NFC: oborová literatura";"MEM: memoáry, autobiografie";"MEM: memoáry, autobiografie";"MEM: memoáry, autobiografie";"nové boty a nový účes a nové kamarády a nový";"život mimo neúprosně";"sevřené stěny našeho domu . </s><s> Slova můžou být zbraní ,"
"1";"cs: čeština";"NFC: oborová literatura";"PRO: profesní literatura";"NAT: přírodní vědy";"AGR: zemědělství, chovatelství";"ale část dovezeného drůbežího masa k nám směřuje i ze";"zemí mimo EU";", například z Brazílie . </s><s> Z toho vyplývá , že"
"1";"cs: čeština";"NMG: publicistika";"NEW: tradiční publicistika";"X: neuvedeno";"NTW: celostátní tisk";"oba rodiče jsou imigranti , kteří do Británie přišli ze";"zemí mimo EU";". </s><s> A já bych si přál , abychom se ke"
"1";"en: angličtina";"FIC: beletrie";"NOV: próza";"X: neuvedeno";"X: neuvedeno";"„ Když bůh vytvořil prvního nespokojeného člověka , umístil toho";"člověka mimo Central";". “ </s><s> Ale ten Lid jsme vytvořili my , pomyslel"
"1";"cs: čeština";"NMG: publicistika";"NEW: tradiční publicistika";"X: neuvedeno";"NTW: celostátní tisk";"obrátí se na krajské žalobce v Českých Budějovicích . </s><s> Pro";"země mimo EU";"platí odlišná pravidla . </s><s> Centrálním místem pro vyřízení žádosti je"
"1";"en: angličtina";"FIC: beletrie";"NOV: próza";"X: neuvedeno";"X: neuvedeno";"Mučedníka . </s><s> Všechno to byli kněží a všichni pocházeli z";"farností mimo Neilsville";". </s><s> I když byli bez výjimky o poznání starší než"
"1";"cs: čeština";"NMG: publicistika";"NEW: tradiční publicistika";"X: neuvedeno";"NTW: celostátní tisk";"států Schengenské dohody včetně Česka na sto milionů lidí ze";"zemí mimo EU";". </s><s> Členské státy chtějí každého nově příchozího důkladně prověřit . </s>"
"1";"cs: čeština";"NMG: publicistika";"NEW: tradiční publicistika";"X: neuvedeno";"NTW: celostátní tisk";"se tak stalo , vedení této teroristické organizace rozhodlo vystupňovat";"útoky mimo jí";"ovládané území . </s><s> Vnímat vzájemnou spojitost znesnadňují atentáty spáchané „"
"1";"cs: čeština";"NFC: oborová literatura";"PRO: profesní literatura";"FTS: formální a technické vědy";"TEC: technika";"mil . tun . </s><s> Ještě patrnější je nárůst dovozu ze";"zemí mimo EU";", kde meziroční změna činila 12 % . </s><s> „ Pozitivně"
"1";"cs: čeština";"NMG: publicistika";"NEW: tradiční publicistika";"X: neuvedeno";"NTW: celostátní tisk";"hlubinných dolů . </s><s> Nově budou moci přidělovat podnikatelům lidi ze";"zemí mimo EU";", kteří mají v Česku zaměstnaneckou a modrou kartu či"
"1";"cs: čeština";"NMG: publicistika";"NEW: tradiční publicistika";"X: neuvedeno";"NTW: celostátní tisk";"na Slovensko , do Německa a do Polska . </s><s> Ze";"zemí mimo EU";"se nejvíce českého piva vyvezlo do Ruska , Jižní Koreje"
"1";"es: španělština";"FIC: beletrie";"NOV: próza";"X: neuvedeno";"X: neuvedeno";"kerý ale nevyřešily metastáze . </s><s> Jednou z nich byl projekt";"evangelizace mimo USA";", jet a najít moje vznešený kumpány v jejich vlastní"
"1";"cs: čeština";"NFC: oborová literatura";"PRO: profesní literatura";"FTS: formální a technické vědy";"TEC: technika";"stavebních společností by navíc uvítaly zjednodušení procesu zaměstnávání pracovníků ze";"zemí mimo EU";". </s><s> I zde se pro tuto možnost vyslovilo více zástupců"
"1";"cs: čeština";"NFC: oborová literatura";"PRO: profesní literatura";"FTS: formální a technické vědy";"ICT: výpočetní technika";"<s> 2 . Ukládání dat mimo EU ? </s><s> Předávání dat do";"zemí mimo EU";", tzv . třetích zemí , je obecně považováno za"
"1";"en: angličtina";"FIC: beletrie";"NOV: próza";"X: neuvedeno";"X: neuvedeno";"jde ve škole , na Franin společenský život a její";"přátele mimo Ravenswick";". </s><s> Nezeptala se ho , kam směřuje . </s><s> Pro nalezení"
"1";"en: angličtina";"NFC: oborová literatura";"POP: populárně naučná literatura";"HUM: humanitní vědy";"HIS: historie, biografie";"přítele George Isaiaha , který mu pravděpodobně pomáhal propašovat takové";"věci mimo nepříliš";"bdělý zrak britské mandátní správy starající se víc o konfliktní"
"1";"cs: čeština";"NFC: oborová literatura";"PRO: profesní literatura";"FTS: formální a technické vědy";"ICT: výpočetní technika";"a jednak v souvislosti s předáváním osobních údajů do třetích";"zemí ( mimo EU";") , kdy mají představovat určitou záruku dostatečné ochrany osobních"
"1";"cs: čeština";"NMG: publicistika";"NEW: tradiční publicistika";"X: neuvedeno";"NTW: celostátní tisk";"schválil další balík opatření s cílem zjednodušit zaměstnávání cizinců ze";"zemí mimo EU";"v zemi pod Tatrami . </s><s> Nezaměstnanost na Slovensku klesla na"
"1";"cs: čeština";"NFC: oborová literatura";"POP: populárně naučná literatura";"HUM: humanitní vědy";"INF: knihovnictví, informatika";"konkrétní vědecký problém , ale velmi často zaregistruji i zajímavou";"kombinaci „ mimo “";"onen problém . </s><s> Samozřejmě si ji vyfotografuji – dnešní moderní"
"1";"cs: čeština";"NFC: oborová literatura";"SCI: odborná literatura";"HUM: humanitní vědy";"ANT: antropologie, etnografie";"tradiční organizaci klepání / hrkání patřilo také společné nocování starších";"chlapců mimo domov521";"a ranní umývání ve velkopáteční vodě ; chlapci ponořovali do"
"1";"cs: čeština";"NFC: oborová literatura";"SCI: odborná literatura";"NAT: přírodní vědy";"MED: lékařství";") . </s><s> Dvě třetiny cizinců v ČR jsou občané ze";"států mimo EU";"a většina jich pochází z Ukrajiny , Slovenska , Vietnamu"
"1";"en: angličtina";"NFC: oborová literatura";"POP: populárně naučná literatura";"SSC: sociální vědy";"ECO: ekonomie, obchod, logistika";"ostatních lidí . </s><s> Když se řekne rizikový kapitál , většina";"lidí mimo Silicon";"Valley si představí malý kroužek podivínů – něco jako ty"
"1";"cs: čeština";"NMG: publicistika";"LEI: volnočasová publicistika";"X: neuvedeno";"MIX: společnost";"spíš pro nás historiky , “ shrnuje Luboš Velek . </s><s>";"Koho mimo pár";"znalců může v době Facebooku , Twitteru a YouTube oslovit"
"1";"cs: čeština";"NFC: oborová literatura";"PRO: profesní literatura";"SSC: sociální vědy";"ECO: ekonomie, obchod, logistika";"li místo odeslání zásilky v České republice a místo přijetí";"zásilky mimo ČR";", uzavírají smlouvu o přepravě věci podle Úmluvy CMR ,"
"1";"cs: čeština";"NMG: publicistika";"NEW: tradiční publicistika";"X: neuvedeno";"NTW: celostátní tisk";". </s><s> Tou první je zrušení dovozní daně na umění ze";"států mimo EU";". </s><s> V zahraničí je dovozní daň většinou kolem pěti až"
"1";"cs: čeština";"NMG: publicistika";"NEW: tradiční publicistika";"X: neuvedeno";"NTW: celostátní tisk";"turisté v Česku loni poprvé utratili ze zahraničních návštěvníků ze";"zemí mimo EU";"nejvíce . </s><s> Jejich podíl na útratách turistů ze států mimo"
"1";"cs: čeština";"NFC: oborová literatura";"SCI: odborná literatura";"HUM: humanitní vědy";"ANT: antropologie, etnografie";") . </s><s> ( Jako by snad ani nebylo „ historických";"úloh “ mimo „";"elitního centra akce “ . </s><s> Jako by nebylo historie mimo"
"1";"cs: čeština";"NMG: publicistika";"NEW: tradiční publicistika";"X: neuvedeno";"NTW: celostátní tisk";"pohledu českého práva . </s><s> „ Každý cizinec , který vystudoval";"medicínu mimo EU";", musí složit aprobační zkoušku a v českém jazyce prokázat"
"1";"cs: čeština";"NFC: oborová literatura";"POP: populárně naučná literatura";"FTS: formální a technické vědy";"ICT: výpočetní technika";"organizace napříč všemi zdroji , mapuje i šedá data (";"data mimo IS";"organizace , která nejsou zdokumentovaná ) a poskytuje informaci o"
"1";"cs: čeština";"NFC: oborová literatura";"POP: populárně naučná literatura";"NAT: přírodní vědy";"BIO: biologie";"led tudíž na vodě plave . </s><s> Změnou teplotních / tlakových";"parametrů mimo výše";"uvedené rozmezí bylo dosaženo tvorby dalších forem ledu v odlišných"
"1";"cs: čeština";"NFC: oborová literatura";"SCI: odborná literatura";"SSC: sociální vědy";"SOC: sociologie";"ze stereotypního zobrazování ( pokud ne přímo z ignorování )";"měst mimo „";"západní svět “ . </s><s> Robinson a autoři a autorky ,"
"1";"cs: čeština";"NMG: publicistika";"NEW: tradiční publicistika";"X: neuvedeno";"NTW: celostátní tisk";". </s><s> Uvedla to společnost Global Blue , která turistům ze";"zemí mimo EU";"zprostředkovává vracení DPH . </s><s> HSBC rozhodla , že její sídlo"
"1";"cs: čeština";"NFC: oborová literatura";"SCI: odborná literatura";"SSC: sociální vědy";"SOC: sociologie";"je možné v teorii města zohlednit zkušenosti a poznatky z";"míst mimo „";"západní svět “ , například postsocialistických měst ( viz Sjöberg"
"1";"cs: čeština";"NFC: oborová literatura";"MEM: memoáry, autobiografie";"MEM: memoáry, autobiografie";"MEM: memoáry, autobiografie";"bohužel nemáme náhradní díly . </s><s> Druhý den cítím blahodárnost třídenního";"pobytu mimo Takeo";", mimo rezidenci a nemocnici , oproštění od problémů spojených"
"1";"cs: čeština";"NFC: oborová literatura";"SCI: odborná literatura";"FTS: formální a technické vědy";"ICT: výpočetní technika";"15 = 420,97 . </s><s> Tentýž princip platí i pro další";"funkce mimo již";"zmíněné tři problémové funkce , viz , ( Zelinka ,"
"1";"cs: čeština";"NMG: publicistika";"NEW: tradiční publicistika";"X: neuvedeno";"NTW: celostátní tisk";"asi dvě procenta celkového exportu piva z Česka do třetích";"zemí mimo EU";". </s><s> 11 procent O takový podíl stoupl meziročně český export"
"1";"cs: čeština";"NMG: publicistika";"NEW: tradiční publicistika";"X: neuvedeno";"NTW: celostátní tisk";"nelegálně , skoro 80 procent z nich tvořili cizinci ze";"zemí mimo EU";". </s><s> Proti roku 2017 tak významně vzrostl počet nelegálně zaměstnaných"
"1";"cs: čeština";"NFC: oborová literatura";"SCI: odborná literatura";"HUM: humanitní vědy";"ANT: antropologie, etnografie";"jedná se o jeden z výrazných případů použití nástrojů u";"zvířat , mimo třeba";"šimpanze a dalších primáty či rozmanité další ptáky - supi"
"1";"cs: čeština";"NMG: publicistika";"NEW: tradiční publicistika";"X: neuvedeno";"NTW: celostátní tisk";"eur , a na třetí prioritní osu - tedy Silniční";"infrastrukturu mimo TEN";"- T - pak 0,902 mld . eur . </s><s> Dalším"
"1";"cs: čeština";"NMG: publicistika";"NEW: tradiční publicistika";"X: neuvedeno";"NTW: celostátní tisk";"v pokoji rozdělá jako pravý Indián oheň ) , protože";"nic mimo tady";"a teď zkrátka nevnímá . </s><s> Gnarrovo poselství , ať už"
"1";"cs: čeština";"NFC: oborová literatura";"PRO: profesní literatura";"NAT: přírodní vědy";"GEO: geografie, geologie";"tyto údaje zadat . </s><s> Nadále bude možný i import výkresu";"vytvořeného mimo POZEM";", kdy se kromě přiřazení prvku ke správnému feature podle"
"1";"cs: čeština";"NFC: oborová literatura";"PRO: profesní literatura";"FTS: formální a technické vědy";"ICT: výpočetní technika";"nové verze jsme dali několik novinek týkajících se Enterprice Service";"Managementu mimo IT";". </s><s> Ukazuje se , že jde o aktuální téma ,"
"1";"en: angličtina";"NFC: oborová literatura";"POP: populárně naučná literatura";"NAT: přírodní vědy";"BIO: biologie";""" pozitivní "" výsledky vznikly pouze jako vedlejší produkt mechanismu";"působícího "" mimo """;"Božský záměr , přičemž navíc nejsou důsledkem nějakého "" záměru"
"1";"cs: čeština";"NFC: oborová literatura";"POP: populárně naučná literatura";"SSC: sociální vědy";"LAW: právo";"že potřebujeme vytvořit prostor pro sdílenou odpovědnost za kvalitu české";"legislativy mimo striktně";"vládní administrativu , a to v rámci celé právnické obce"
"1";"cs: čeština";"NMG: publicistika";"NEW: tradiční publicistika";"X: neuvedeno";"NTW: celostátní tisk";"vysušuje silný vítr , který zároveň odvádí oblačnost a potenciální";"srážky mimo ČR";", “ doplňuje tajemník agrární komory Jan Doležal . </s><s> Alespoň"
"1";"cs: čeština";"NFC: oborová literatura";"POP: populárně naučná literatura";"FTS: formální a technické vědy";"ICT: výpočetní technika";", protože jejich nabídka může být osekaná . </s><s> Co se";"cen mimo ČR";"týče , je to u každého operátora jinak . </s><s> Ti"
"1";"cs: čeština";"NFC: oborová literatura";"PRO: profesní literatura";"NAT: přírodní vědy";"MED: lékařství";"a EU za cyklus 26 000 korun , pacientka ze";"zemí mimo EU";"pak 40 000 Kč . </s><s> Zmražení a skladování embrya stojí"
"1";"cs: čeština";"NFC: oborová literatura";"SCI: odborná literatura";"SSC: sociální vědy";"ECO: ekonomie, obchod, logistika";"spojovala naději , že dokáže oslovit i nevyhraněné a mladé";"voliče mimo „";"tvrdé “ jádro své voličské základy . </s><s> Cameron s úzkým"
"1";"cs: čeština";"NFC: oborová literatura";"SCI: odborná literatura";"NAT: přírodní vědy";"MED: lékařství";". </s><s> Byl zaznamenán import divokého a vakcinačního viru ze 6";"zemí mimo EU";"a EEA / EFTA ( především z Afganistánu , Indie"
"3";"cs: čeština";"NMG: publicistika";"NEW: tradiční publicistika";"X: neuvedeno";"NTW: celostátní tisk";"dočetla solidně nabušené číslo s Langmajerem na obálce ( skvělý";"rozhovor mimo chodem";") a můžu s klidným srdcem říct : Reflex je"
"3";"de: němčina";"FIC: beletrie";"NOV: próza";"X: neuvedeno";"X: neuvedeno";"usnula ? “ </s><s> „ Ne . </s><s> Jen jsem byla na";"chvíli mimo .";"“ </s><s> Večer už přepnul světlo , lampy jsou rozsvícené . </s>"
"3";"cs: čeština";"NMG: publicistika";"LEI: volnočasová publicistika";"X: neuvedeno";"MIX: společnost";"již „ nevejdou “ do jeho tukové tkáně , ukládají";"se mimo ,";"takže má ztučnělá játra a slinivku . </s><s> Tuky ve slinivce"
"3";"cs: čeština";"NMG: publicistika";"LEI: volnočasová publicistika";"X: neuvedeno";"SCT: společenský život";"sval jsem si hodně poničil , takže zase budu delší";"dobu mimo .";"</s><s> Láme mi srdce , že nemůžu fanouškům vrátit podporu a"
