"1";"en: angličtina";"FIC: beletrie";"NOV: próza";"X: neuvedeno";"X: neuvedeno";", to vše od Valentina Couturea a špičaté dírkované kožené";"boty od Allen";"- Edmondse . </s><s> Hned jak zapadnem k Harrymu , zaregistrujeme"
"1";"en: angličtina";"FIC: beletrie";"NOV: próza";"X: neuvedeno";"X: neuvedeno";"to vše od Armaniho , plus krapet nevkusné modré bavlněné";"ponožky od Interwoven";". </s><s> Černé polobotky s úzkou špičkou od Ferragama má úplně"
"1";"en: angličtina";"FIC: beletrie";"NOV: próza";"X: neuvedeno";"X: neuvedeno";"účelu schovanou , použil k tomu otvírák ze skoro ryzího";"stříbra od Mulazoniho";", který mi koupil Peter Radloff poté , co jsme"
"1";"en: angličtina";"FIC: beletrie";"NOV: próza";"X: neuvedeno";"X: neuvedeno";"zakončeným korintskými sloupy . </s><s> Tenhle pseudořecký chrám stál jen pár";"kroků od Woolworth";"Building , obchodu podobnému gotické katedrále s věží strmě čnějící"
"1";"it: italština";"FIC: beletrie";"NOV: próza";"X: neuvedeno";"X: neuvedeno";", “ řekla a položila podnos na stolek vedle hromady";"knih od Biriana";"Birova . </s><s> Nina otevřela jedno oko a rozespale řekla tetě"
"1";"en: angličtina";"FIC: beletrie";"NOV: próza";"X: neuvedeno";"X: neuvedeno";"– </s><s> Na veřejné náměstí blízko Koloniálních archivů . </s><s> Byla tisíce";"mil od Průzkumníku";"a nad obzorem visel řetízek sluncí . </s><s> Vyjma mimořádných událostí"
"1";"cs: čeština";"FIC: beletrie";"NOV: próza";"X: neuvedeno";"X: neuvedeno";"v zorném úhlu . </s><s> Jindy se třepetá v poryvech větru";"přicházejícího od Maleconu";"jako svůdná tanečnice , a najednou je fuč ! </s><s> „"
"1";"da: dánština";"FIC: beletrie";"NOV: próza";"X: neuvedeno";"X: neuvedeno";"<s> „ Okamžik , prosím , “ pronesla a zvedla sluchátko";"telefonu od Bang";"a Olufsena na psacím stole . </s><s> Představila se jako Charlotte"
"1";"zh: čínština";"FIC: beletrie";"NOV: próza";"X: neuvedeno";"X: neuvedeno";"klidná , ale plná jasně zřetelných stínů v bohaté škále";"barev , od temně";"rudé po karmínovou červeň , oranžovou , pernatě žlutou ,"
"1";"sv: švédština";"FIC: beletrie";"NOV: próza";"X: neuvedeno";"X: neuvedeno";"a ulice Svatého Erika , a navíc to bylo kus";"cesty od Kronobergu";". </s><s> Ale neměl na vybranou . </s><s> Novináři ho honili po"
"1";"es: španělština";"FIC: beletrie";"NOV: próza";"X: neuvedeno";"X: neuvedeno";". </s><s> Jsme si jisti , že Aguilar si z té";"částky od Wua";"přisvojil přinejmenší dva miliony . "" </s><s> „ Bohatství lidi nemění"
"1";"fr: francouzština";"FIC: beletrie";"NOV: próza";"X: neuvedeno";"X: neuvedeno";"strany ji podpírala jedna žena z příbuzenstva . </s><s> Ale pár";"kroků od jásavě";"rudého svatebního palankinu udělala čelem vzad . </s><s> Všichni zůstali ohromeně"
"1";"en: angličtina";"FIC: beletrie";"NOV: próza";"X: neuvedeno";"X: neuvedeno";"ve sluneční , ale v pekelné soustavě . </s><s> Listí chřadnoucích";"stromů od Green";"Lanes po Champion Hill , kam se o večerech uchylují"
"1";"en: angličtina";"FIC: beletrie";"NOV: próza";"X: neuvedeno";"X: neuvedeno";"panna čistě jen díky vrozené tvrdohlavosti . </s><s> Poprvé za deset";"minut od Greysonova";"příchodu jsem mu začala věnovat skutečnou pozornost . </s><s> Ucítila jsem"
"1";"cs: čeština";"FIC: beletrie";"NOV: próza";"X: neuvedeno";"X: neuvedeno";"si mohl stoupnout s kytarou k mikrofonu a zazpívat pár";"písniček od Rolling";"Stones . </s><s> „ Súdruhovia ! “ </s><s> Kadlecová si významně odkašlala"
"1";"fr: francouzština";"FIC: beletrie";"NOV: próza";"X: neuvedeno";"X: neuvedeno";"před několika hodinami objevila pod vánočním stromkem . </s><s> Zázrak neskutečné";"ceny od Sabbie";"Rosy , dárek od její matky , které záleželo na"
"1";"fi: finština";"FIC: beletrie";"NOV: próza";"X: neuvedeno";"X: neuvedeno";"bylo jisté . </s><s> Ale měli ho obvinit z koupě sexuálních";"služeb od možná";"nezletilých a možná obětí obchodu s bílým masem , anebo"
"1";"en: angličtina";"FIC: beletrie";"NOV: próza";"X: neuvedeno";"X: neuvedeno";"nikoli však vzdálenost . </s><s> Země se mohla nacházet miliony světelných";"hodin od Trisolaris";", nebo třeba na opačném konci galaxie . </s><s> Tváří v"
"1";"ja: japonština";"FIC: beletrie";"NOV: próza";"X: neuvedeno";"X: neuvedeno";"<s> Okolo desáté ráno zpozoroval strážný plachetnici ve vzdálenosti asi šesti";"mil od nagasackého";"přístavu . </s><s> 2 . 8 . </s><s> Ráno jsme začali s"
"1";"en: angličtina";"FIC: beletrie";"COL: kratší próza";"X: neuvedeno";"X: neuvedeno";"patnáct minut později přistála Eloise Tři v poušti , několik";"kilometrů od AA";"6093 . </s><s> Pilot i oba pasažéři seděli v kabině ,"
"1";"cs: čeština";"FIC: beletrie";"COL: kratší próza";"X: neuvedeno";"X: neuvedeno";"došlo skoro před čtyřmi týdny . </s><s> Vzhledem k vzdálenosti Hradce";"Králové od P";". se totiž oba vyžívají jenom jednou měsíčně , a"
"1";"cs: čeština";"FIC: beletrie";"COL: kratší próza";"X: neuvedeno";"X: neuvedeno";"ve státě New Jersey , vzdálených jen něco přes sto";"kilometrů od New";"Yorku . </s><s> Z lodě se kouřilo , letadla s reportéry"
"1";"pl: polština";"FIC: beletrie";"COL: kratší próza";"X: neuvedeno";"X: neuvedeno";"Ivanov pochází z městečka Botoșani , což je sotva čtyřicet";"kilometrů od Crulicova";"rodného města ; v té oblasti všichni mluví s moldavskou"
"1";"cs: čeština";"FIC: beletrie";"COL: kratší próza";"X: neuvedeno";"X: neuvedeno";"běžců v historii československé královny sportu . </s><s> Nepřetržitě po pět";"let – od 1933";"až do 1937 – získával titul mistra Československa v běhu"
"1";"en: angličtina";"FIC: beletrie";"COL: kratší próza";"X: neuvedeno";"X: neuvedeno";"vědoucím úšklebkem , který matka později detekovala jako typický znak";"hochů od KGB";"a který já dnes vídám ve tváři prezidenta a lidí"
"1";"zh: čínština";"FIC: beletrie";"COL: kratší próza";"X: neuvedeno";"X: neuvedeno";"došlo k maléru , uměl si zavázat úplatky všechny zaangažované";"osoby , od výše";"postavených až po malé úředníčky . </s><s> Rozdvojené manželství Pchan Ťiaovo"
"1";"ru: ruština";"FIC: beletrie";"COL: kratší próza";"X: neuvedeno";"X: neuvedeno";", babice , které jsou jako mravenečci živy neznámo z";"čeho , od Kalinkova";"mostu na bleší trh vláčejí staré hadry a prádlo a"
"1";"cs: čeština";"FIC: beletrie";"COL: kratší próza";"X: neuvedeno";"X: neuvedeno";"podílel ) . </s><s> XX . sjezd KSSS tak představoval bod";"obratu od přetuhé";"diktatury a počátek politického „ tání “ ve všech sovětských"
"1";"en: angličtina";"FIC: beletrie";"COL: kratší próza";"X: neuvedeno";"X: neuvedeno";"Evening Post , dva omšelé soubory Dickensových děl a spoustu";"knih od H";". G . Wellse . </s><s> Na skladě bylo také množství"
"1";"sv: švédština";"FIC: beletrie";"SCR: drama";"X: neuvedeno";"X: neuvedeno";"tam pětadvacet světle červených růží , poněvadž uplynulo přesně pětadvacet";"let od Graceininy";"smrti . </s><s> Zrovna jsem přecházel ulici , když jsem si"
"1";"cs: čeština";"NFC: oborová literatura";"SCI: odborná literatura";"HUM: humanitní vědy";"PHI: filozofie, náboženství";"<s> Specializuje se na současnou religiozitu . </s><s> Kromě </s><s> četných závažných odborných";"studií od r";". 1999 vydal knižní </s><s> publikaci Sociologie nových náboženských hnutí . </s>"
"1";"cs: čeština";"NFC: oborová literatura";"SCI: odborná literatura";"HUM: humanitní vědy";"PHI: filozofie, náboženství";"? “ shrnuje již klasickou plejádu archaických strašáků , většinou";"polopravd – od „";"paraořechových alergií “ přes tzv . superplevely či superodolné škůdce"
"1";"cs: čeština";"NFC: oborová literatura";"SCI: odborná literatura";"HUM: humanitní vědy";"PHI: filozofie, náboženství";"se ve změněném chápání ctnosti pozvolna připravuje i projevuje přesun";"těžiště od vnějškově";"chápané cti a ctnosti ke zvnitřněnému pochopení mravnosti jako věci"
"1";"cs: čeština";"NFC: oborová literatura";"SCI: odborná literatura";"HUM: humanitní vědy";"PHI: filozofie, náboženství";"<s> V lese za stmívání je prvotním zkušenostním východiskem důstojnost světa";"přírody – od mechem";"porostlých balvanů přes starého jezevce až po mladé doubky . </s>"
"1";"cs: čeština";"NFC: oborová literatura";"SCI: odborná literatura";"HUM: humanitní vědy";"PHI: filozofie, náboženství";"prolnutí dvou rozměrů lidského bytí . </s><s> Jeden představuje linka pohybu";"času od „";"bylo “ k „ bude “ , druhý linka morálních"
"1";"it: italština";"NFC: oborová literatura";"POP: populárně naučná literatura";"HUM: humanitní vědy";"PHI: filozofie, náboženství";"výuku v křesťanské víře </s><s> 1593 Jindřich IV . , král";"Francie od r";". 1589 , veřejně ohlásil svoji konverzi z kalvinismu ke"
"1";"fr: francouzština";"NFC: oborová literatura";"POP: populárně naučná literatura";"HUM: humanitní vědy";"PHI: filozofie, náboženství";", jejíž počátky sahají až do antiky , zejména do";"období od 2";". století př . Kr . V té době vzniká"
"1";"fr: francouzština";"NFC: oborová literatura";"SCI: odborná literatura";"HUM: humanitní vědy";"HIS: historie, biografie";"bezpečnosti , stáhnou se postupně izraelské obranné síly z oblastí";"okupovaných od 28";". září 2000 a oba tábory přistoupí ke statutu quo"
"1";"fr: francouzština";"NFC: oborová literatura";"SCI: odborná literatura";"HUM: humanitní vědy";"HIS: historie, biografie";"<s> Vláda Mikátího se zavázala , že volby proběhnou do čtyř";"týdnů od 29";". května a že budou kontrolovány misí evropských pozorovatelů . </s>"
"1";"cs: čeština";"NFC: oborová literatura";"SCI: odborná literatura";"HUM: humanitní vědy";"HIS: historie, biografie";"a zaznělo Salve Regina , k čemuž byla za vyzvánění";"zvonů od sv";". Valentina přidána závěrečná kolekta ( modlitba ) . </s><s> Po"
"1";"cs: čeština";"NFC: oborová literatura";"POP: populárně naučná literatura";"HUM: humanitní vědy";"HIS: historie, biografie";"jiní , ale mně se od těch na pohled pěkných";"kluků od SS";"snad ještě hůř snášelo to , jak se k nám"
"1";"cs: čeština";"NFC: oborová literatura";"POP: populárně naučná literatura";"HUM: humanitní vědy";"HIS: historie, biografie";"bibliografii slovenských novin a časopisů , vycházela slovenská mutace Rudého";"práva od 1";". 1 . 1960 do roku 1969 , kdy zanikla"
"1";"en: angličtina";"NFC: oborová literatura";"POP: populárně naučná literatura";"HUM: humanitní vědy";"HIS: historie, biografie";"dadždžálovi a mahdím vážné pochybnosti řada významných muslimských myslitelů hlavního";"proudu od Ibn";"Chaldúna až po Rašída Ridu . </s><s> Přesto se toto náboženské"
"1";"cs: čeština";"NFC: oborová literatura";"SCI: odborná literatura";"HUM: humanitní vědy";"LAN: filologie";"hlas , orchestr a recitaci na část 3 . zpěvu";"Máje od J";". B . Foerstera . </s><s> Ta se někdy reprizuje v"
"1";"pl: polština";"NFC: oborová literatura";"SCI: odborná literatura";"HUM: humanitní vědy";"LAN: filologie";". bis 12 . </s><s> Jahrhundert ( Památky německé poezie a";"prózy od 8";". do 12 . století , 1864 ) . </s><s> Ve"
"1";"cs: čeština";"NFC: oborová literatura";"SCI: odborná literatura";"HUM: humanitní vědy";"LAN: filologie";", ale i jako o období , ve kterém řada";"badatelů od W";". Humboldta po G . von der Gabelentz připravovala vznik"
"1";"cs: čeština";"NFC: oborová literatura";"SCI: odborná literatura";"HUM: humanitní vědy";"LAN: filologie";"mozek ( což není tolik , soudě podle pokroku neurolingvistického";"výzkumu od 50";". let 19 . století ) . </s><s> Podobně lze říci"
"1";"de: němčina";"NFC: oborová literatura";"SCI: odborná literatura";"HUM: humanitní vědy";"LAN: filologie";"a matematické logice , jak ukazuje celá tradice formálních sémantických";"teorií od Frega";"po Montagua , které s intenzionálními významy pracují . </s><s> Přijatelné"
"1";"cs: čeština";"NFC: oborová literatura";"SCI: odborná literatura";"HUM: humanitní vědy";"LAN: filologie";"mluvčí M2 , který má na první pohled malý odstup";"průměru od ZH";"( obr . 3 - 5 ) a zároveň nízkou"
"1";"cs: čeština";"NFC: oborová literatura";"POP: populárně naučná literatura";"HUM: humanitní vědy";"INF: knihovnictví, informatika";". </s><s> Nečekané vlastnosti se objevily i u Maxwellových rovnic ,";"známých od r";". 1864 . </s><s> Mysleli jsme si , že o nich"
"1";"cs: čeština";"NFC: oborová literatura";"SCI: odborná literatura";"HUM: humanitní vědy";"ART: umění, architektura";"( před ) románské tradice , které byly v repertoáru";"iluminátorů od 13";". století dále rozvíjeny ve variantách stylizujících monstrum do tvaru"
"1";"cs: čeština";"NFC: oborová literatura";"SCI: odborná literatura";"SSC: sociální vědy";"ECO: ekonomie, obchod, logistika";"pod tlakem svých kabinetních ministrů s ohledem na věrohodnost labouristického";"programu od politicky";"motivovaného napadání „ toryovských škrtů “ ustoupil a připustil ,"
"1";"en: angličtina";"NFC: oborová literatura";"POP: populárně naučná literatura";"SSC: sociální vědy";"ECO: ekonomie, obchod, logistika";"bohatých – viz 13 . věc ) zažila většina rozvojových";"zemí od 80";". let značné zpomalení ekonomického růstu . </s><s> Růst národního produktu"
"1";"cs: čeština";"NFC: oborová literatura";"PRO: profesní literatura";"SSC: sociální vědy";"POL: politika, vojenství";"pro přihlašování se k úřednické zkoušce , budou uvedeny do";"provozu od 1";". července 2015 tak , aby s „ překlopením “"
"1";"cs: čeština";"NFC: oborová literatura";"SCI: odborná literatura";"SSC: sociální vědy";"PSY: psychologie";"největší pravděpodobností usnadňují proces formování identity . </s><s> V období pozdní";"adolescence od 17";"do 22 let dodává , že intrapsychické změny v druhém"
"1";"cs: čeština";"NFC: oborová literatura";"SCI: odborná literatura";"SSC: sociální vědy";"PSY: psychologie";"v Moravskoslezském kraji </s><s> Wojnarová ( 2017 ) získala vyplněnou škálu";"deprese od 511";"středoškolských studentů a studentek . </s><s> Tito adolescenti studovali na středních"
"1";"cs: čeština";"NFC: oborová literatura";"SCI: odborná literatura";"SSC: sociální vědy";"PSY: psychologie";", pasivity , tíhy , zavírání očí a na závěr";"počítání od 1";"do 20 umocňující nástup hypnotického spánku . </s><s> Výhodou verbálně fixační"
"1";"en: angličtina";"NFC: oborová literatura";"POP: populárně naučná literatura";"SSC: sociální vědy";"PSY: psychologie";"myšlením obecně nabízí kniha The Art of Memory ( Umění";"paměti ) od Frances";"A . Yatesové , která prvně vyšla v roce 1966"
"1";"cs: čeština";"NFC: oborová literatura";"SCI: odborná literatura";"SSC: sociální vědy";"SOC: sociologie";"například samotná geografie ( viz články k problematice „ geografie";"geografie “ od Simonsen";"[ 2004 ] či Berg [ 2004 ] ) . </s>"
"1";"cs: čeština";"NFC: oborová literatura";"POP: populárně naučná literatura";"SSC: sociální vědy";"SOC: sociologie";"pak rozdíl mezi vzrušením z vysokých podpatků , podvazků ,";"punčoch od stejně";"silné přitažlivosti ženského prsu nebo klína ? </s><s> Pak se nedivme"
"1";"cs: čeština";"NFC: oborová literatura";"SCI: odborná literatura";"SSC: sociální vědy";"REC: sport, rekreace, hobby";"fázi pohybu . </s><s> Variace : při cvičení lze měnit šíři";"úchopu , od velmi";"úzkého , jímž je zatěžována vnitřní část prsních svalů a"
"1";"cs: čeština";"NFC: oborová literatura";"SCI: odborná literatura";"SSC: sociální vědy";"EDU: pedagogika";"připomenout ten naposledy zmíněný . </s><s> Tento přístup znamená pojetí evaluačních";"procesů od „";"evaluace něčeho “ ( oblasti … ) , přes „"
"1";"cs: čeština";"NFC: oborová literatura";"PRO: profesní literatura";"SSC: sociální vědy";"EDU: pedagogika";". </s><s> Z testových metod můžeme použít např : </s><s> Soubor specifických";"zkoušek od Z";". Žlaba ( zahrnuje pravolevou orientaci na ploše , na"
"1";"cs: čeština";"NFC: oborová literatura";"SCI: odborná literatura";"NAT: přírodní vědy";"BIO: biologie";"<s> Morfologicky i ekologicky velmi různorodá skupina , s širokým rozpětím";"velikosti : od 0,5";"mm ( někteří mravenci a hbitěnky ) do 70 mm"
"1";"cs: čeština";"NFC: oborová literatura";"SCI: odborná literatura";"NAT: přírodní vědy";"BIO: biologie";"et al . 2007 a ) . </s><s> Po prodloužení doby";"obmýtí od 18";". století a následném ukončení výmladkového hospodaření v lesích ve"
"1";"cs: čeština";"NFC: oborová literatura";"SCI: odborná literatura";"NAT: přírodní vědy";"BIO: biologie";"kultur třepenitky svazčité byla zjištěna také přítomnost řady dalších sesquiterpenoidů";"odvozených od lanosterolu";"– fasciculových kyselin D , E , a F ,"
"1";"cs: čeština";"NFC: oborová literatura";"POP: populárně naučná literatura";"NAT: přírodní vědy";"BIO: biologie";"byla jeho matka , Anna Maria Kirchner , dcera významného";"varhaníka od sv";". Mikuláše na Malé Straně . </s><s> Ignaz Macha , narozený"
"1";"en: angličtina";"NFC: oborová literatura";"POP: populárně naučná literatura";"NAT: přírodní vědy";"PHY: fyzika";"bylo zachytit slabounké gravitační vlny , které se šíří tkaninou";"prostoročasu od navzájem";"se srážejících černých děr . </s><s> * Nehmotnou částicí se rozumí"
"1";"cs: čeština";"NFC: oborová literatura";"PRO: profesní literatura";"NAT: přírodní vědy";"GEO: geografie, geologie";", na místa odlišná od rohů budov ( pro každého";"viditelných ) , od generacemi";"respektovaných zdí a plotů nebo i od později dodatečně „"
"1";"cs: čeština";"NFC: oborová literatura";"PRO: profesní literatura";"NAT: přírodní vědy";"GEO: geografie, geologie";"až 20 km / h , kdy lze dosáhnout prostorového";"rozlišení od 3";"cm do několika milimetrů na zemi ( ! ) s"
"1";"cs: čeština";"NFC: oborová literatura";"PRO: profesní literatura";"NAT: přírodní vědy";"GEO: geografie, geologie";", čím jsem přispěl v bádání k lepšímu poznání mapy";"Moravy od J";". A . Komenského ( KMM ) . </s><s> V prvé"
"1";"cs: čeština";"NFC: oborová literatura";"SCI: odborná literatura";"NAT: přírodní vědy";"CHE: chemie";"používá tzv . Rf - hodnota ( poměr vzdálenosti </s><s> těžiště";"skvrny od „";"startu "" a vzdálenosti „ čela rozpouštědla "" od startu"
"1";"cs: čeština";"NFC: oborová literatura";"SCI: odborná literatura";"NAT: přírodní vědy";"CHE: chemie";". </s><s> Tabulka 7 . 11 : Znaky umožňující odlišení koliformních";"bakterií od";"</s><s> E . coli </s><s> Na misce se po konfirmaci spočítají potvrzené"
"1";"cs: čeština";"NFC: oborová literatura";"SCI: odborná literatura";"NAT: přírodní vědy";"CHE: chemie";"Nesslerova činidla . </s><s> Tento návod lze použít ke stanovení koncentrace";"amoniaku od 1";"do 400 mg · m - 3 ( 0 °"
"1";"cs: čeština";"NFC: oborová literatura";"SCI: odborná literatura";"NAT: přírodní vědy";"MED: lékařství";"na věk se pohybuje prevalence ED u diabetiků podle různých";"výzkumů od 35";"% do 90 % . </s><s> Většina studií uvádí stejnou pravděpodobnost"
"1";"cs: čeština";"NFC: oborová literatura";"SCI: odborná literatura";"NAT: přírodní vědy";"MED: lékařství";"glomerulosklerózy . </s><s> Od 50 let věku postupně stoupá podíl hyalinizovaných";"glomerulů od 1";"do 30 % . </s><s> Na změnách glomerulu mohou mít podíl"
"1";"cs: čeština";"NFC: oborová literatura";"PRO: profesní literatura";"NAT: přírodní vědy";"MED: lékařství";"svém oboru jako lékař . </s><s> Zakoupila jsem knihu Kompendium očního";"lékařství od H";". Krause , otevřela jsem ji a začala číst ,"
"1";"cs: čeština";"NFC: oborová literatura";"PRO: profesní literatura";"NAT: přírodní vědy";"MED: lékařství";"současně s farmakoterapií a dochází k oddělování mýtů a neprokázaných";"tvrzení od velmi";"exaktních studií založených na moderních nutričních postupech , včetně využití"
"1";"cs: čeština";"NFC: oborová literatura";"POP: populárně naučná literatura";"NAT: přírodní vědy";"MED: lékařství";"lék v ředění 15 CH , 2 x denně 5";"granulí , od 7";". do 15 . dne cyklu . </s><s> Průvodce těhotenstvím i"
"1";"cs: čeština";"NFC: oborová literatura";"POP: populárně naučná literatura";"NAT: přírodní vědy";"MED: lékařství";"<s> Akce čisté ruce Zpěňovací mýdlo pro rychlé a efektivní čištění";"rukou od Union";"Cosmetic je k dostání ve třech variantách . </s><s> Sakura flowers"
"1";"cs: čeština";"NFC: oborová literatura";"PRO: profesní literatura";"NAT: přírodní vědy";"AGR: zemědělství, chovatelství";"že letos se o Regionální potravinu Kraje Vysočina ucházelo 65";"výrobků od 20";"výrobců , což byl největší počet za dobu trvání soutěže"
"1";"cs: čeština";"NFC: oborová literatura";"PRO: profesní literatura";"NAT: přírodní vědy";"AGR: zemědělství, chovatelství";"<s> Letos se o ocenění Regionální potravina Moravskoslezského kraje ucházelo 82";"produktů od 34";"výrobců , nejsilnější zastoupení měly pekařské výrobky včetně těstovin v"
"1";"cs: čeština";"NFC: oborová literatura";"PRO: profesní literatura";"NAT: přírodní vědy";"AGR: zemědělství, chovatelství";"<s> Členské příspěvky nejsou tak vysoké . </s><s> Pohybují se podle velikosti";"firmy od 1000";"do 6000 korun ročně . </s><s> Nečlenové se s námi vezou"
"1";"cs: čeština";"NFC: oborová literatura";"PRO: profesní literatura";"NAT: přírodní vědy";"AGR: zemědělství, chovatelství";"techniky . </s><s> K vidění byly samozřejmě traktory Iseki v rozmezí";"výkonu od 15";"do 100 koní a nechyběla ani žací technika této značky"
"1";"en: angličtina";"NFC: oborová literatura";"POP: populárně naučná literatura";"FTS: formální a technické vědy";"MAT: matematika";"najít všechna prvočísla nižší než n , začněte sepsáním všech";"čísel od 1";"po n v řadě . </s><s> Potom vyškrtejte všechny násobky dvou"
"1";"en: angličtina";"NFC: oborová literatura";"POP: populárně naučná literatura";"FTS: formální a technické vědy";"MAT: matematika";"Notification ( explicitní upozornění na zahlcení ) . </s><s> Úplné osvobození";"internetu od bufferbloatu";"bude vycházet z výše uvedených změn a bude nutné na"
"1";"cs: čeština";"NFC: oborová literatura";"PRO: profesní literatura";"FTS: formální a technické vědy";"TEC: technika";"<s> OPATŘENÍ PRO NOVÉ EMISNÍ LIMITY </s><s> Vzhledem k platnosti nových emisních";"limitů od 1";". 1 . 2018 , stávající uhelný výrobní blok již"
"1";"cs: čeština";"NFC: oborová literatura";"PRO: profesní literatura";"FTS: formální a technické vědy";"TEC: technika";"<s> Podle typu komponentů lze garantovat použití systému TS2plus pro třídu";"čistoty od 100";"do 10 000 . </s><s> Díky množství stavebnicových prvků lze bez"
"1";"cs: čeština";"NFC: oborová literatura";"PRO: profesní literatura";"FTS: formální a technické vědy";"TEC: technika";"oceli pevně upne . </s><s> To platí zvláště pro malé průměry";"stopek od 1";"mm . </s><s> Během upínacího procesu se polygonální upínače deformují výhradně"
"1";"cs: čeština";"NFC: oborová literatura";"PRO: profesní literatura";"FTS: formální a technické vědy";"TEC: technika";"ve sklopném i pevném provedení a může nabídnout přepravní objemy";"nástaveb od 22";"do 54 m3 ( nesklopné ) , respektive 26 až"
"1";"cs: čeština";"NFC: oborová literatura";"PRO: profesní literatura";"FTS: formální a technické vědy";"TEC: technika";"různých modifikací protokolu TCP / IP v současnosti komunikují stovky";"zařízení od PLC";"přes systémy HMI / SCADA až po poměrně jednoduché komponenty"
"1";"cs: čeština";"NFC: oborová literatura";"PRO: profesní literatura";"FTS: formální a technické vědy";"TEC: technika";"testovacích napětí od 10 do 500 V při rozsazích izolačních";"odporů od 2";"k ? do 50 G ? . </s><s> Standardní přístroje pro"
"1";"cs: čeština";"NFC: oborová literatura";"PRO: profesní literatura";"FTS: formální a technické vědy";"TEC: technika";"k analýze kyslíku , dusíku a vodíku v široké škále";"koncentrací od 0,1";"ppm dál . </s><s> Během analýzy koncentrace kyslíku , dusíku a"
"1";"cs: čeština";"NFC: oborová literatura";"PRO: profesní literatura";"FTS: formální a technické vědy";"TEC: technika";"okna vůči parapetům ; ** vhodné pro všechny tloušťky vnějších";"stěn od 380";"do 500 mm ; ** umožňují ruční manipulaci a montáž"
"1";"cs: čeština";"NFC: oborová literatura";"PRO: profesní literatura";"FTS: formální a technické vědy";"TEC: technika";") . </s><s> podle podkladů společnosti Den Braven </s><s> Protipožární řešení tepelné";"izolace od HPI";"- CZ splňuje i novou normu o požární bezpečnosti staveb </s>"
