"1";"en: angličtina";"FIC: beletrie";"NOV: próza";"X: neuvedeno";"X: neuvedeno";"v Londýně , ale ... "" </s><s> "" Bylo těžký sehnat";"stůl v Propheteers";"? "" přeruším ho . </s><s> "" Ne , vůbec ne"
"1";"cs: čeština";"NMG: publicistika";"NEW: tradiční publicistika";"X: neuvedeno";"NTW: celostátní tisk";"k výhře 3 : 2 po samostatných nájezdech . </s><s> Třetí";"start v NHL";"si připsal Ondřej Kaše z Anaheimu při domácí prohře s"
"1";"cs: čeština";"NMG: publicistika";"NEW: tradiční publicistika";"X: neuvedeno";"NTW: celostátní tisk";"jednoduše mlčí . </s><s> A to byla druhá věc , kdy";"se v chelmsfordském";"divadle neklidně vrtěl . </s><s> Nechce se tomu věřit , ale"
"1";"cs: čeština";"NMG: publicistika";"NEW: tradiční publicistika";"X: neuvedeno";"NTW: celostátní tisk";"v londýnské Wigmore Hall , ve filharmoniích v Lucemburku a";"Hamburku , v Alte";"Oper ve Frankfurtu a také u České filharmonie . </s><s> Únorové"
"1";"cs: čeština";"NMG: publicistika";"NEW: tradiční publicistika";"X: neuvedeno";"NTW: celostátní tisk";"světě stále žádanější Adam Plachetka se po debutech v Metropolitní";"opeře v New";"Yorku a v Lyrické opeře v Chicagu před několika dny"
"1";"cs: čeština";"NMG: publicistika";"NEW: tradiční publicistika";"X: neuvedeno";"NTW: celostátní tisk";"Al - Monitor Alího , výzkumníka z institutu pro veřejnou";"politiku v Komu";". </s><s> V roce 2009 Íránci protestovali proti opětovnému zvolení Mahmúda"
"1";"cs: čeština";"NMG: publicistika";"NEW: tradiční publicistika";"X: neuvedeno";"NTW: celostátní tisk";"od 10 do 12 hodin . </s><s> Samotný závod startuje na";"Zbraslavi ve 13";"hodin . </s><s> Obraz Elišky Junkové </s><s> ARCHIV </s><s> Téma . </s><s> Prokletý panovník </s>"
"1";"cs: čeština";"NMG: publicistika";"NEW: tradiční publicistika";"X: neuvedeno";"NTW: celostátní tisk";"<s> Letci s nejvyšší hodností britského RAF Air Marshall . </s><s> Za";"zásluhy v 2";". světové válce ji dostal od krále Jiřího VI . </s>"
"1";"cs: čeština";"NMG: publicistika";"NEW: tradiční publicistika";"X: neuvedeno";"NTW: celostátní tisk";"debat , které chtěla Hillary omezit na minimum a zařadit";"je v méně";"sledovaném čase ( až od 21 hodin ) . </s><s> O"
"1";"cs: čeština";"NMG: publicistika";"NEW: tradiční publicistika";"X: neuvedeno";"NTW: celostátní tisk";"režisér Alejandro González Inárritu ( na snímku ) získal v";"sobotu v Los";"Angeles od americké Asociace filmových režisérů ( DGA ) cenu"
"1";"cs: čeština";"NMG: publicistika";"NEW: tradiční publicistika";"X: neuvedeno";"NTW: celostátní tisk";", “ kroutila hlavou na středečním zastupitelstvu . </s><s> Svaz vítá";"změny v IPR";"</s><s> Ne všichni kritizují změny , které se týkají Institutu plánování"
"1";"cs: čeština";"NMG: publicistika";"NEW: tradiční publicistika";"X: neuvedeno";"NTW: celostátní tisk";"přes vnější schengenskou hranici ČR a 8323 osob při nelegálním";"pobytu v ČR";", “ konstatuje doslova vnitro ve zprávě . </s><s> Jen za"
"1";"cs: čeština";"NMG: publicistika";"NEW: tradiční publicistika";"X: neuvedeno";"NTW: celostátní tisk";"? </s><s> Ale vůbec ne , už letos na jaře by";"se v USA";"měl dostat do prodeje první homologovaný „ tištěný “ automobil"
"1";"cs: čeština";"NMG: publicistika";"NEW: tradiční publicistika";"X: neuvedeno";"NTW: celostátní tisk";"českou graffiti špičku doplňuje Jiří Georg Dokoupil . </s><s> V MICHALOVĚ";"ATELIÉRU v MeetFactory";"si uvědomíte , jak široce se rozkročil hned od několika"
"1";"cs: čeština";"NMG: publicistika";"NEW: tradiční publicistika";"X: neuvedeno";"NTW: celostátní tisk";"července navštívil asi tisíc pět set zajatců , které na";"louce v Sandićích";"hlídali povětšinou příslušníci speciálních policejních jednotek , Ratko Mladić . </s>"
"1";"cs: čeština";"NMG: publicistika";"NEW: tradiční publicistika";"X: neuvedeno";"NTW: celostátní tisk";"apa rtmánů . </s><s> Tolik by jich mělo vyrůst na umělém";"poloostrově v Monte";"Carlu . </s><s> Cena za metr čtvereční ale činí sto tisíc"
"1";"cs: čeština";"NMG: publicistika";"NEW: tradiční publicistika";"X: neuvedeno";"NTW: celostátní tisk";"vítaná , ale vlastně i nutná . </s><s> Netvořivý učitel v";"praxi v 21";". století neobstojí . </s><s> Myslím si , že studenti tvořiví"
"1";"cs: čeština";"NMG: publicistika";"NEW: tradiční publicistika";"X: neuvedeno";"NTW: celostátní tisk";"byla první průmyslová revoluce ve znamení využití páry v parním";"stroji v 18";". století , druhá znamenala zavedení hromadné výroby na začátku"
"1";"cs: čeština";"NMG: publicistika";"NEW: tradiční publicistika";"X: neuvedeno";"NTW: celostátní tisk";"Muellera , který zkoumá možný ruský vliv na loňské prezidentské";"volby v USA";", chce prověřit některé kroky nynějšího prezidenta Donalda Trumpa a"
"1";"cs: čeština";"NMG: publicistika";"NEW: tradiční publicistika";"X: neuvedeno";"NTW: celostátní tisk";"ovšem nebude nabízet kontinuální obchodování , ale obchodování jednou za";"čtvrtletí v předem";"ohlášených aukcích . </s><s> „ Myslet si , že s akciemi"
"1";"cs: čeština";"NMG: publicistika";"NEW: tradiční publicistika";"X: neuvedeno";"NTW: celostátní tisk";"vybavení “ . </s><s> Teď začínají poprvé pečovat i o ochranářské";"značení v CHKO";"Labské pískovce . </s><s> Podle zákona o ochraně přírody totiž správa"
"1";"cs: čeština";"NMG: publicistika";"NEW: tradiční publicistika";"X: neuvedeno";"NTW: celostátní tisk";"vztahů ( ÚMV ) . </s><s> Předtím řadu let působil na";"univerzitě v New";"Yorku , radil britskému ministerstvu zahraničí , poskytoval bezpečnostní briefingy"
"1";"cs: čeština";"NMG: publicistika";"NEW: tradiční publicistika";"X: neuvedeno";"NTW: celostátní tisk";"SVĚTOVÁ BANKA Kde bída přetrvává </s><s> Počet lidí žijících v absolutní";"chudobě * , v mld";"</s><s> subsaharská Afrika </s><s> jižní Asie </s><s> východní Asie & Tichomoří </s><s> Latinská Amerika"
"1";"cs: čeština";"NMG: publicistika";"NEW: tradiční publicistika";"X: neuvedeno";"NTW: celostátní tisk";"a muži – ochránci , škola genderového stereotypu . </s><s> Ženy";"se v ryze";"mužském umění stávají pouze pasivním dekorativním předmětem , tvrdí kurátorka"
"1";"cs: čeština";"NMG: publicistika";"NEW: tradiční publicistika";"X: neuvedeno";"NTW: celostátní tisk";"postavení významného konkurenta a soupeře . </s><s> Toto vysvětluje , proč";"se v SPD";"během jediného krátkého týdne , kdy vyjednavači o třístranné koalici"
"1";"cs: čeština";"NMG: publicistika";"NEW: tradiční publicistika";"X: neuvedeno";"NTW: celostátní tisk";"o čtyři procenta . </s><s> Bankéři zajišťující úpis přitom obvykle stanovují";"ceny v IPO";"s cílem , aby akcie dané společnosti v prvních dnech"
"1";"cs: čeština";"NMG: publicistika";"NEW: tradiční publicistika";"X: neuvedeno";"NTW: celostátní tisk";"městského plánování ( tzv . CAMP ) , nebo tematickou";"výstavu v tamtéž";". </s><s> CAMP sídlí v areálu Emauz kousek od Karlova náměstí"
"1";"cs: čeština";"NMG: publicistika";"NEW: tradiční publicistika";"X: neuvedeno";"NTW: celostátní tisk";"která je publikem oceňována pro energický temperament , vystoupí na";"náplavce v (";"A ) VOID Floating Gallery . </s><s> Koncert začíná od 20"
"1";"cs: čeština";"NMG: publicistika";"NEW: tradiční publicistika";"X: neuvedeno";"NTW: celostátní tisk";"z dlužné částky a poplatků exekutorům . </s><s> Zájem o tuto";"službu v Mark2";"Corporation Czech je , využilo ji už přes deset lidí"
"1";"cs: čeština";"NMG: publicistika";"NEW: tradiční publicistika";"X: neuvedeno";"NTW: celostátní tisk";"milionech , které v roce 2011 získal Martin Staszko na";"turnaji v Las";"Vegas . </s><s> Kabrhel ale nynějším vítězstvím překonal Staszka na první"
"1";"cs: čeština";"NMG: publicistika";"NEW: tradiční publicistika";"X: neuvedeno";"NTW: celostátní tisk";"na olympiádě něco směrem k mistrovství světa ? </s><s> Budeme monitorovat";"situaci v NHL";". </s><s> Jsem zvědavý , jak na tom budou kluci z"
"1";"cs: čeština";"NMG: publicistika";"NEW: tradiční publicistika";"X: neuvedeno";"NTW: celostátní tisk";"vyhýbá nejenom na ministerstvu , ale i v jeho předchozí";"práci v ČSOB";". </s><s> „ Na ministerstvu jsem už čtyři roky . </s><s> Přišel"
"1";"cs: čeština";"NMG: publicistika";"NEW: tradiční publicistika";"X: neuvedeno";"NTW: celostátní tisk";"se světu bude ještě stýskat . </s><s> Luděk Vainert , </s><s> Když";"se v „";"Zemanově “ Kolíně bojuje za Prahu </s><s> Kolínská výzva k podání"
"1";"cs: čeština";"NMG: publicistika";"NEW: tradiční publicistika";"X: neuvedeno";"NTW: celostátní tisk";"? </s><s> V České republice je učitelů nedostatek … </s><s> Na některých";"školách v USA";"je také nedostatek dobrých učitelů , zejména v oblastech ,"
"1";"cs: čeština";"NMG: publicistika";"NEW: tradiční publicistika";"X: neuvedeno";"NTW: celostátní tisk";"v té době studovala světlé horniny , v nichž lze";"vznik v tak";"velké hloubce obtížně prokázat . </s><s> Najít malé diamanty je podle"
"1";"cs: čeština";"NMG: publicistika";"NEW: tradiční publicistika";"X: neuvedeno";"NTW: celostátní tisk";"III , který v minulé sezoně odehrál deset zápasů za";"Brooklyn v NBA";". </s><s> Stromy padaly , vlaky stály </s><s> Vydatná sněhová nadílka v"
"1";"cs: čeština";"NMG: publicistika";"NEW: tradiční publicistika";"X: neuvedeno";"NTW: celostátní tisk";"v Červeném Kostelci v kině Luník , promítání začíná v";"pátek v 18";". 30 hodin . </s><s> Nadšená kapitánka : Čekaly jsme dlouho </s>"
"1";"cs: čeština";"NMG: publicistika";"NEW: tradiční publicistika";"X: neuvedeno";"NTW: celostátní tisk";"v epicentru dění . </s><s> Mohl by se stát jedničkou pro";"kostky ve Sky";"nebo Astaně , v bohatých stájích , které vítězné typy"
"1";"cs: čeština";"NMG: publicistika";"NEW: tradiční publicistika";"X: neuvedeno";"NTW: celostátní tisk";"devětaosmdesátého roku změnila . </s><s> Například legendární debakl Miroslava Štěpána při";"projevu v ČKD";". </s><s> Štěpán nebyl politik , s jehož názorem by lidé"
"1";"cs: čeština";"NMG: publicistika";"NEW: tradiční publicistika";"X: neuvedeno";"NTW: celostátní tisk";"Klebold a Harris se v týdnech před masakrem promenovali na";"škole v téměř";"ěř identických úborech , jaké bylo o pár měsíců předtím"
"1";"cs: čeština";"NMG: publicistika";"NEW: tradiční publicistika";"X: neuvedeno";"NTW: celostátní tisk";"proti kocovině zabírá a co ne . </s><s> Ve speciálních kocovinových";"klinikách v USA";"i v Evropě si nechává přímo do žil vstříknout chemické"
"1";"cs: čeština";"NMG: publicistika";"NEW: tradiční publicistika";"X: neuvedeno";"REG: regionální tisk";"účinkovala v Bruselu , Amsterdamu , Barceloně , Tokiu ,";"Londýně , v New";"Yorku v Carnegie Hall nebo v Paříži v La Cigale"
"1";"cs: čeština";"NMG: publicistika";"NEW: tradiční publicistika";"X: neuvedeno";"REG: regionální tisk";"<s> Byla jsem tam jen jednou v knihovně a málem jsem";"se v tak";"velkém komplexu ztratila . </s><s> Snad se mi to tentokrát nestane"
"1";"cs: čeština";"NMG: publicistika";"NEW: tradiční publicistika";"X: neuvedeno";"REG: regionální tisk";"uvedl zkušený kouč . </s><s> Byl to právě Slovan , kdo";"se ve 38";". minutě dostal do vedení . </s><s> Po rohovém kopu Šmahaje"
"1";"cs: čeština";"NMG: publicistika";"NEW: tradiční publicistika";"X: neuvedeno";"REG: regionální tisk";"pak druhého nebo třetího srpna . </s><s> V případě postupu čekají";"Viktorii ve 4";". předkole například Borisov , Legie Varšava , Dinamo Záhřeb"
"1";"cs: čeština";"NMG: publicistika";"NEW: tradiční publicistika";"X: neuvedeno";"REG: regionální tisk";"Kernen ze Švýcarska . </s><s> Patrně pro nás uspořádal sbírku po";"sousedech v Reutigenu";". </s><s> Dvě knížky k nám doputovaly ze Slovenska . </s><s> Jednu"
"1";"cs: čeština";"NMG: publicistika";"NEW: tradiční publicistika";"X: neuvedeno";"REG: regionální tisk";". </s><s> Otázky občanů by měly na zasedání zastupitelů přijít na";"řadu v 18";"hodin . </s><s> Krnovští zastupitelé se letos sejdou ještě dvakrát ,"
"1";"cs: čeština";"NMG: publicistika";"NEW: tradiční publicistika";"X: neuvedeno";"REG: regionální tisk";"<s> Domů se vracím rád . </s><s> Občas také nastupujete za Smetanovu";"Lhotu v I";". B třídě . </s><s> Trénujete před zápasem ? </s><s> Fotbalu už"
"1";"cs: čeština";"NMG: publicistika";"NEW: tradiční publicistika";"X: neuvedeno";"REG: regionální tisk";"jsme s Bárou spolu nespočetněkrát trénovaly a jsme v jednom";"týmu ve Fed";"cupu . </s><s> Snažila jsem se oprostit od faktu , že"
"1";"cs: čeština";"NMG: publicistika";"NEW: tradiční publicistika";"X: neuvedeno";"REG: regionální tisk";"zápase hraje Liberec Handball dnes od 18 hodin v Železném";"Brodě v 2";". kole Českého poháru s tradičním rivalem z Jablonce . </s>"
"1";"cs: čeština";"NMG: publicistika";"NEW: tradiční publicistika";"X: neuvedeno";"REG: regionální tisk";"TJ Sokol Lukavice . </s><s> Čtvrteční finále na rychnovském stadionu má";"výkop v 16";"hodin , rozhodovat bude trio Luboš Jedlinský – Ladislav Špaček"
"1";"cs: čeština";"NMG: publicistika";"NEW: tradiční publicistika";"X: neuvedeno";"REG: regionální tisk";"hostinské činnosti za rok 2015 zrušili dva podnikatelé a přerušili";"živnost ve 24";"případech . </s><s> V následujícím roce ji zrušili také dva podnikatelé"
"1";"cs: čeština";"NMG: publicistika";"NEW: tradiční publicistika";"X: neuvedeno";"REG: regionální tisk";"pryč ! </s><s> Aktuální hořká komedie . </s><s> Hra se odehrává na";"podzim v 5";". třídě základní školy , kde se sešlo pět rodičů"
"1";"cs: čeština";"NMG: publicistika";"NEW: tradiční publicistika";"X: neuvedeno";"REG: regionální tisk";"při kterém bude pokřtěn sborník Modrá krev Sobotecka . </s><s> V";"sobotu v 16";"hodin očekávejte na náměstí příjezd historické družiny krále Vladislava Jagellonského"
"1";"cs: čeština";"NMG: publicistika";"NEW: tradiční publicistika";"X: neuvedeno";"REG: regionální tisk";"OFS 2 . </s><s> Zprávy STK </s><s> Dne 11 . 4 .";"se ve St";". Městě na Rybníčku uskuteční v 16 . 30 soustředění"
"1";"cs: čeština";"NMG: publicistika";"NEW: tradiční publicistika";"X: neuvedeno";"REG: regionální tisk";"města . </s><s> „ Co může být brněnštějšího než dát si";"pivo ve Štatlu";"? </s><s> Jsem rád , že Svoboďák není jenom místo ,"
"1";"cs: čeština";"NMG: publicistika";"NEW: tradiční publicistika";"X: neuvedeno";"REG: regionální tisk";"způsobem , jakým ji dnes provozují mladé skupiny na britských";"ostrovech , v USA";"a v Evropě . </s><s> AKCE </s><s> STATEK BERNARD KRÁLOVSKÉ POŘÍČÍ Pátek"
"1";"cs: čeština";"NMG: publicistika";"NEW: tradiční publicistika";"X: neuvedeno";"REG: regionální tisk";"Au pair / osobní příběh bývalé Au pair o dvouletém";"životě v USA";"17 </s><s> Jihočeské muzeum </s><s> Cyklus přednášek Akademické půlhodinky Genové manipulace –"
"1";"cs: čeština";"NMG: publicistika";"NEW: tradiční publicistika";"X: neuvedeno";"REG: regionální tisk";"<s> Po komplikovaném zranění nohy , kvůli němuž nemohla absolvovat prosincové";"koncerty v Lucerna";"Music Baru , se na jarní turné obzvlášť těší zpěvačka"
"1";"cs: čeština";"NMG: publicistika";"NEW: tradiční publicistika";"X: neuvedeno";"REG: regionální tisk";"vydat na prohlídku zdarma a ještě k tomu získat pěknou";"cenu v právě";"probíhající soutěži . </s><s> Návštěvníky nemine ani možnost vyfotit se přímo"
"1";"cs: čeština";"NMG: publicistika";"NEW: tradiční publicistika";"X: neuvedeno";"REG: regionální tisk";"státech na popud tamější socialistické strany . </s><s> Osmého března 1908";"se v New";"Yorku pořádalo velké shromáždění za volební právo pro ženy . </s>"
"1";"cs: čeština";"NMG: publicistika";"LEI: volnočasová publicistika";"X: neuvedeno";"HOU: bydlení, zahrada, hobby";"jednoduchých tvarů , nejlépe kombinující různé funkce . </s><s> A tak";"se ve zdánlivě";"obyčejné pohovce může skrývat praktický úložný prostor a zároveň opěrka"
"1";"cs: čeština";"NMG: publicistika";"LEI: volnočasová publicistika";"X: neuvedeno";"HOU: bydlení, zahrada, hobby";"Kesseböhmer ) poskytuje díky sklápěcímu mechanismu snadný přehled o zásobách";"uložených v obtížně";"přístupných místech , cena podle provedení , </s><s> Snadné otevírání bezúchytkového"
"1";"cs: čeština";"NMG: publicistika";"LEI: volnočasová publicistika";"X: neuvedeno";"HOU: bydlení, zahrada, hobby";"pracuje s úhlem rybího oka 170 ° , takže monitoruje";"prostor v opravdu";"širokém záběru . </s><s> Obraz z kukátka si můžete nechat přenášet"
"1";"cs: čeština";"NMG: publicistika";"LEI: volnočasová publicistika";"X: neuvedeno";"HOU: bydlení, zahrada, hobby";"bude potřeba , jednoduše nastavíte do požadované délky . </s><s> Dělají";"se v tvarově";"zajímavých provedeních a barvách . </s><s> JAKOU ZVOLIT MATRACI </s><s> To ,"
"1";"cs: čeština";"NMG: publicistika";"LEI: volnočasová publicistika";"X: neuvedeno";"LIF: životní styl";"A NOVINÁŘ NAPSAL PUBLIKACI SLAVNÉ DNY </s><s> Pavel Zuna pokřtil svou";"knihu v Neoluxoru";"ve středu 21 . ledna se svým bratrem Janem Zunou"
"1";"cs: čeština";"NMG: publicistika";"LEI: volnočasová publicistika";"X: neuvedeno";"LIF: životní styl";"době konzumovatelný výsledek . </s><s> Každý rok trávíte s celou rodinou";"dovolenou ve Vasiliki";"na Lefkádě . </s><s> Čím vás tak uchvátila , že se"
"1";"cs: čeština";"NMG: publicistika";"LEI: volnočasová publicistika";"X: neuvedeno";"LIF: životní styl";"2015 nadchla především sportovně založené módní fajnšmekry . </s><s> Na přehlídkovém";"mole v New";"Yorku byly k vidění nositelné kousky v čele s kosmickými"
"1";"cs: čeština";"NMG: publicistika";"LEI: volnočasová publicistika";"X: neuvedeno";"LIF: životní styl";"silní , odolní a v kondici . </s><s> Vyzkoušejte také jeho";"sílu ve 100";"% šťávě Virde . </s><s> V nabídce na za 110 Kč"
"1";"cs: čeština";"NMG: publicistika";"LEI: volnočasová publicistika";"X: neuvedeno";"LIF: životní styl";"řády a ošetřovatelská bratrstva , jejichž posláním byla starost o";"nemocné . * V 16";". století nastal úpadek , nemocnice byly zanedbané . </s><s> Ošetřovatelů"
"1";"cs: čeština";"NMG: publicistika";"LEI: volnočasová publicistika";"X: neuvedeno";"LIF: životní styl";"dobách se podvádělo jak na Tour de France . </s><s> Na";"olympiádě v St";". </s><s> Louis v roce 1904 proběhl jako první cílem maratonu"
"1";"cs: čeština";"NMG: publicistika";"LEI: volnočasová publicistika";"X: neuvedeno";"LIF: životní styl";"když jsem lampy viděla při jedné z mých řídkých návštěv";"Miloše v New";"Yorku . </s><s> Moc se mi líbily , a když jsem"
"1";"cs: čeština";"NMG: publicistika";"LEI: volnočasová publicistika";"X: neuvedeno";"LIF: životní styl";"u prvního cviku . </s><s> Paže leží volně podél těla . </s><s>";"Nohy v trojflexi";"zdvihejte k břichu a vracejte zpět do výchozí pozice . </s>"
"1";"cs: čeština";"NMG: publicistika";"LEI: volnočasová publicistika";"X: neuvedeno";"LIF: životní styl";"si , že letos pracovní nápor zvládne jako JLo svá";"vystoupení v Las";"Vegas . </s><s> Bude makat a makat a nakonec ji to"
"1";"cs: čeština";"NMG: publicistika";"LEI: volnočasová publicistika";"X: neuvedeno";"LIF: životní styl";"ÚTERÝ A SOBOTA , VSTUP ZDARMA 15 . 6 .";"se ve 21";": 30 můžete těšit na Dítě Bridget Jonesové , 18"
"1";"cs: čeština";"NMG: publicistika";"LEI: volnočasová publicistika";"X: neuvedeno";"SCT: společenský život";"kufru , navíc omotaný bezpečnostním pásem . </s><s> Vůz stál na";"parkovišti v Holešické";"ulici . </s><s> „ I když bylo ráno , začínalo být"
"1";"cs: čeština";"NMG: publicistika";"LEI: volnočasová publicistika";"X: neuvedeno";"SCT: společenský život";"jich bylo celkem 40 . </s><s> Požár vypukl v noci na";"čtvrtek v 6";". patře domu . </s><s> Ačkoliv část obyvatel stihla vyběhnout ven"
"1";"cs: čeština";"NMG: publicistika";"LEI: volnočasová publicistika";"X: neuvedeno";"SCT: společenský život";"stejně brali i Pavlásek a Štefková ) není za hodinový";"výprask v 1";". kole kvalifikace k zahození ... </s><s> Z celkové dotace 908"
"1";"cs: čeština";"NMG: publicistika";"LEI: volnočasová publicistika";"X: neuvedeno";"SCT: společenský život";", leč v letech a bez formy , načež naštili";"se v play";"off roztříštili o průměrný kyperský Apoel Nikósie . </s><s> Slavia prostě"
"1";"cs: čeština";"NMG: publicistika";"LEI: volnočasová publicistika";"X: neuvedeno";"SCT: společenský život";"stavebním vývojem Švihova i s podobou šlechtického života na tomto";"sídle v 16";". století . </s><s> V komnatách je k vidění i výstava"
"1";"cs: čeština";"NMG: publicistika";"LEI: volnočasová publicistika";"X: neuvedeno";"SCT: společenský život";"Martin Frk se vrátil do slavné soutěže stylově , při";"debutu v Los";"Angeles zařídil výhru dvěma góly . </s><s> V létě skončil v"
"1";"cs: čeština";"NMG: publicistika";"LEI: volnočasová publicistika";"X: neuvedeno";"SCT: společenský život";", “ doplňuje Honsová . </s><s> Polák zdolal na kole nejvyšší";"dům v ČR";"! </s><s> BRNO – Necelých devět minut stačilo v sobotu Poláku"
"1";"cs: čeština";"NMG: publicistika";"LEI: volnočasová publicistika";"X: neuvedeno";"SCT: společenský život";"zneucťující význam . </s><s> Navíc ještě osle a slone . </s><s> Vůl";"se v 50";". a 60 . letech stalo napopulárním , že vytlačilo"
"1";"cs: čeština";"NMG: publicistika";"LEI: volnočasová publicistika";"X: neuvedeno";"SCT: společenský život";"bakteriemi . </s><s> Podobně se šíří také cholera , se kterou";"se v méně";"rozvinutých destinacích bohužel můžeme setkat také . </s><s> Obě nemoci jsou"
"1";"cs: čeština";"NMG: publicistika";"LEI: volnočasová publicistika";"X: neuvedeno";"SCT: společenský život";". </s><s> Takhle šťastný nebyl už mnoho let , “ psalo";"se v Sunday";"Express . </s><s> Téhož dne Markle sdílela fotku dvou banánů na"
"1";"cs: čeština";"NMG: publicistika";"LEI: volnočasová publicistika";"X: neuvedeno";"SPO: sport";"a tam dokázal nadaný útočník svoje předpoklady rozvinout , rozhodnout";"zápasy v play";"off . </s><s> Z toho musel do prvoligové Třebíče na probrání"
"1";"cs: čeština";"NMG: publicistika";"LEI: volnočasová publicistika";"X: neuvedeno";"INT: zajímavosti ze světa";"konzervy Zajímavost : tzv . otrava klobásami byla běžná v";"Německu v 18";". a 19 . století Bakterie Clostridium botulinum produkují jed"
"1";"cs: čeština";"NMG: publicistika";"LEI: volnočasová publicistika";"X: neuvedeno";"INT: zajímavosti ze světa";"údolí platí pro celkem 132 lanovek a vleků v 30";"místech v Bregenzském";"lese , parku Großes Walsertal a Lechtalu ( celkem 330"
"1";"cs: čeština";"NMG: publicistika";"LEI: volnočasová publicistika";"X: neuvedeno";"INT: zajímavosti ze světa";"<s> V roce 2004 tito dva badatelé odkryli několik hrobek v";"pyramidě v Dzibanché";". </s><s> V nich našli - uprostřed jadeitových masek , obsidiánů"
"1";"cs: čeština";"NMG: publicistika";"LEI: volnočasová publicistika";"X: neuvedeno";"INT: zajímavosti ze světa";"více a že na konci sezony bude muset opustit své";"působiště v Nyae";"Nyae . </s><s> „ Sanové mi budou chybět , “ řekl"
"1";"cs: čeština";"NMG: publicistika";"LEI: volnočasová publicistika";"X: neuvedeno";"INT: zajímavosti ze světa";"Australia , dlouhodobě věnovala hlasovým projevům u samců delfínů skákavých";"Aus v Shark";"Bay , uvědomila si , že konkrétní jedinci používají unikátní"
"1";"cs: čeština";"NMG: publicistika";"LEI: volnočasová publicistika";"X: neuvedeno";"INT: zajímavosti ze světa";"patří k těm s nejnižší hustotou městské zástavby . </s><s> Když";"se v 80";". letech devatenáctého století začaly ve velkoměstech stavět mrakodrapy ,"
"1";"cs: čeština";"NMG: publicistika";"LEI: volnočasová publicistika";"X: neuvedeno";"INT: zajímavosti ze světa";"v horském středisku Alpensia , alpské lyžování bude mít své";"centrum v Jongpchjongu";", halové sporty jako hokej , curling , krasobruslení a"
"1";"cs: čeština";"NMG: publicistika";"LEI: volnočasová publicistika";"X: neuvedeno";"INT: zajímavosti ze světa";"<s> Ale i přesto se jim vyplatilo díky vidinám bohatých úlovků";"se v takto";"nehostinných místech usídlit . </s><s> Dnes dováží do všech osad přibližně"
"1";"cs: čeština";"NMG: publicistika";"LEI: volnočasová publicistika";"X: neuvedeno";"INT: zajímavosti ze světa";"navrhl odkoupení USA . </s><s> Původně chtěl Thomas Jefferson koupit pouze";"přístav v New";"Orleans , nakonec však pro Spojené státy získal území o"
