"1";"cs: čeština";"NMG: publicistika";"NEW: tradiční publicistika";"X: neuvedeno";"NTW: celostátní tisk";"na 45 metrů , což by znamenalo částku 457 milionů";"korun bez DPH";". </s><s> „ Tato možnost ovšem neřeší zvýšení doletu za plného"
"1";"cs: čeština";"NFC: oborová literatura";"PRO: profesní literatura";"SSC: sociální vědy";"ECO: ekonomie, obchod, logistika";"<s> TravelMassive za přípravu akce a organizační zajištění účtoval 199 tisíc";"korun bez DPH";", dodala Veselá . </s><s> Za dobu trvání akce , kdy"
"1";"cs: čeština";"NMG: publicistika";"NEW: tradiční publicistika";"X: neuvedeno";"NTW: celostátní tisk";"Největší položkou je vznik koupacího biotopu za cenu 36,5 miliónu";"korun bez DPH";", “ řekl mluvčí magistrátu Vít Hofman . </s><s> Koupací plocha"
"1";"cs: čeština";"NMG: publicistika";"NEW: tradiční publicistika";"X: neuvedeno";"REG: regionální tisk";"jen drobných změn . </s><s> Předpokládané náklady jsou do jednoho milionu";"korun bez DPH";". </s><s> Vše má pokrýt dotace . </s><s> „ Žádost o ni"
"1";"cs: čeština";"NMG: publicistika";"NEW: tradiční publicistika";"X: neuvedeno";"REG: regionální tisk";"zhotovitele vypsala radnice letos v dubnu . </s><s> Projektovou cenu 25,7";"milionů bez DPH";", kterou schválili zastupitelé , se ale městu dodržet nepodařilo"
"1";"cs: čeština";"NMG: publicistika";"NEW: tradiční publicistika";"X: neuvedeno";"REG: regionální tisk";"zde začíná růst klubovna . </s><s> Stavbu v hodnotě 4,4 milionu";"korun bez DPH";"začíná budovat firma LAS z Bludova . </s><s> „ Ještě letos"
"1";"cs: čeština";"NMG: publicistika";"NEW: tradiční publicistika";"X: neuvedeno";"NTW: celostátní tisk";"je v plném proudu . </s><s> Opravy za zhruba 165 miliónů";"korun bez DPH";"budou hotové do konce letošního roku . </s><s> Kanalizační systém pod"
"1";"cs: čeština";"NMG: publicistika";"NEW: tradiční publicistika";"X: neuvedeno";"NTW: celostátní tisk";"stavět osmikilometrový úsek dálnice D3 . </s><s> Stát bude 1,2 miliardy";"korun bez DPH";"a otevřen pro dopravu by mě být v roce 2018"
"1";"cs: čeština";"NFC: oborová literatura";"POP: populárně naučná literatura";"FTS: formální a technické vědy";"ICT: výpočetní technika";"je jen 6 20 l , velká hlavní komora ,";"organizéru bez 8";"</s><s> přihrádka u zad 7 přihrádka u zad 7 </s><s> nepraktické tlustší"
"1";"es: španělština";"FIC: beletrie";"NOV: próza";"X: neuvedeno";"X: neuvedeno";"jasný koncept , protože nakonec šlo o zásun a gejzíry";"spermatu bez opravdu";"výrazných scénářů . </s><s> I přes úvodní zaškobrtání končí můj příběh"
"1";"cs: čeština";"NMG: publicistika";"NEW: tradiční publicistika";"X: neuvedeno";"NTW: celostátní tisk";". </s><s> Maximální výše zakázky byla nově upravena na 1,3 miliardy";"korun ( bez DPH";") . </s><s> Předmětem zakázky jsou stavební práce 1 . etapy"
"1";"cs: čeština";"NMG: publicistika";"NEW: tradiční publicistika";"X: neuvedeno";"REG: regionální tisk";"r První etapa rozšíření by měla stát zhruba šest milionů";"korun bez DPH";". </s><s> VÝHERCI TIP LIGY </s><s> VÍTĚZEM jarní části TIP Ligy čtenářů"
"1";"cs: čeština";"NMG: publicistika";"NEW: tradiční publicistika";"X: neuvedeno";"REG: regionální tisk";"Zaspal . </s><s> Zasíťování pozemků vyjde podle odhadu na 6,48 milionu";"korun bez DPH";", obec je investorovi prodá za podmíněně sníženou cenu 1"
"1";"cs: čeština";"NMG: publicistika";"NEW: tradiční publicistika";"X: neuvedeno";"NTW: celostátní tisk";"<s> „ Náklady na nutná opatření se pohybují v rozmezí 600";"miliónů bez DPH";"až po 909 miliónů korun , “ dodal Olyšar . </s>"
"1";"cs: čeština";"NMG: publicistika";"NEW: tradiční publicistika";"X: neuvedeno";"NTW: celostátní tisk";"na Velkých Novosadech v Přerově by měla stát 18,9 milionu";"korun bez DPH";". </s><s> Částku nabídla firma , která vyhrála výběrové řízení města"
"1";"cs: čeština";"NMG: publicistika";"NEW: tradiční publicistika";"X: neuvedeno";"NTW: celostátní tisk";"brněnské novostavbě dosáhla v roce 2014 na 2 560 000";"korun bez DPH";". </s><s> Průměrná cena za metr čtvereční byla 43 200 korun"
"1";"ru: ruština";"FIC: beletrie";"NOV: próza";"X: neuvedeno";"X: neuvedeno";"a začne rozsévat palčivou bolest . “ </s><s> Z dosti nejasného";"výroku „ bez manitou";"jsou hovno , kdežto s manitou maj pocit , že"
"1";"cs: čeština";"NMG: publicistika";"NEW: tradiční publicistika";"X: neuvedeno";"NTW: celostátní tisk";"konkurencí . </s><s> V nabídce je za cenu od 589 990";"korun bez DPH";". </s><s> Novela zákona o účetnictví většině podniků uleví </s><s> Díky novele"
"1";"cs: čeština";"NMG: publicistika";"NEW: tradiční publicistika";"X: neuvedeno";"NTW: celostátní tisk";"výplatě mohl koupit pouhých 99 kilogramů kachen ( I .";"jakosti , bez drůbek";") . </s><s> Většina produktů tedy byla před sametovou revolucí levnější"
"1";"cs: čeština";"NMG: publicistika";"NEW: tradiční publicistika";"X: neuvedeno";"REG: regionální tisk";"práce . </s><s> Zakázku realizuje s cenou 39 , 5 milionu";"korun bez DPH";"pardubická firma Chládek a Tintěra , která má do konce"
"1";"cs: čeština";"NMG: publicistika";"NEW: tradiční publicistika";"X: neuvedeno";"REG: regionální tisk";"<s> Na Českolipsku naplánovala letos SVS 21 staveb za 123 milionů";"korun bez DPH";". </s><s> Úpravnu ve Svoru postaví vedle stávajícího vodojemu . </s><s> „"
"1";"cs: čeština";"NFC: oborová literatura";"PRO: profesní literatura";"FTS: formální a technické vědy";"TEC: technika";"podmínka , nazývaná „ + AR “ znamená tvarování za";"tepla bez „";"řízeného válcování “ a tedy bez dopadu na mikrostrukturu oceli"
"1";"cs: čeština";"FIC: beletrie";"NOV: próza";"X: neuvedeno";"X: neuvedeno";"<s> Přemítala o tom , jak si Marie odjakživa vybírá od";"života bez „";"zbytečných “ ohledů právě jen to , co na první"
"1";"cs: čeština";"NMG: publicistika";"NEW: tradiční publicistika";"X: neuvedeno";"NTW: celostátní tisk";"roku odcizen v Itálii . </s><s> Za částku 2 230 000";"korun ( bez DPH";") jej na internetovém inzertním portálu nabízel k prodeji jeho"
"1";"cs: čeština";"NMG: publicistika";"NEW: tradiční publicistika";"X: neuvedeno";"REG: regionální tisk";"a modernizace této dopravní tepny má vyjít na 35 milionů";"korun bez DPH";". </s><s> Škrdlová : Integraci mají jednodušší Ukrajinci a Rusové </s><s> Rozhovor </s>"
"1";"cs: čeština";"NFC: oborová literatura";"POP: populárně naučná literatura";"FTS: formální a technické vědy";"ICT: výpočetní technika";"k článkům . </s><s> To mimochodem umožňuje použít programy i u";"počítačů bez DVD";"mechanik . </s><s> Seznam dat ke stažení najdete na s50 ("
"1";"cs: čeština";"NFC: oborová literatura";"PRO: profesní literatura";"FTS: formální a technické vědy";"TEC: technika";"rok to bude 1300 l a investice ve výši 999";"eur bez DPH";"se více než zaplatí . </s><s> Ač je to jinak celkem"
"1";"cs: čeština";"NFC: oborová literatura";"POP: populárně naučná literatura";"FTS: formální a technické vědy";"TEC: technika";"nových iPhonů , rozhodně nad 20 000 Kč u základní";"verze bez LTE";". </s><s> Ve stručnosti dodejme , že Apple přestavil i chytré"
"1";"cs: čeština";"NMG: publicistika";"NEW: tradiční publicistika";"X: neuvedeno";"NTW: celostátní tisk";". </s><s> Automobil z limitované série 499 vozů stojí přes milión";"eur bez DPH";"a firma si jeho vlastníky pečlivě vybírá . </s><s> Vyplývá to"
"1";"cs: čeština";"NMG: publicistika";"NEW: tradiční publicistika";"X: neuvedeno";"NTW: celostátní tisk";"<s> Investorem projektu je Pardubický kraj a s částkou 150 miliónů";"korun bez DPH";"se jedná o největší veřejnou investici ve městě od roku"
"1";"cs: čeština";"NFC: oborová literatura";"POP: populárně naučná literatura";"FTS: formální a technické vědy";"ICT: výpočetní technika";"Controller Elite . 1 100 Kč Zdržte se nákupu levného";"volantu bez force";"feedbacku – vedle odezvy bude chybět i dostatečný rozsah otáčení </s>"
"1";"cs: čeština";"NMG: publicistika";"NEW: tradiční publicistika";"X: neuvedeno";"REG: regionální tisk";"Vsetína Tomáš Pifka . </s><s> Čtvrtá etapa opravy stála 16,3 milionu";"korun bez DPH";". </s><s> „ Zaplatili jsme ji z rozpočtu města , dotací"
"1";"cs: čeština";"NFC: oborová literatura";"SCI: odborná literatura";"SSC: sociální vědy";"REC: sport, rekreace, hobby";"i v zahraničí by ED mohlo sloužit pro zdravotní prevenci";"populace , bez ohlednu";"na věk . </s><s> Vhodné využití vidíme zejména u starší populace"
"1";"cs: čeština";"NMG: publicistika";"NEW: tradiční publicistika";"X: neuvedeno";"REG: regionální tisk";"osvětlená a 2,5 kilometru dlouhá cyklostezka má stát 8,5 milionu";"korun bez DPH";". </s><s> S Brazilcem na špici , fotbalový Hradec už je"
"1";"cs: čeština";"NMG: publicistika";"NEW: tradiční publicistika";"X: neuvedeno";"REG: regionální tisk";"uměle vybudovaného koryta a další související práce činí 125 milionů";"korun bez DPH";", práce by měly trvat do podzimu . </s><s> Rekonstrukce přiváděče"
"1";"cs: čeština";"NFC: oborová literatura";"POP: populárně naučná literatura";"FTS: formální a technické vědy";"ICT: výpočetní technika";"dlouhý numerického Shift , střední malý blok , Enter ,";"bloku bez 8";"krátký kompletní Shift , střední velký Enter , blok 8"
"1";"cs: čeština";"NMG: publicistika";"NEW: tradiční publicistika";"X: neuvedeno";"NTW: celostátní tisk";"2018 až 2021 munici v maximální cenové výši 743 miliónů";"korun bez DPH";". </s><s> Obrana se podle vládního materiálu rozhodla nevypsat výběrové řízení"
"1";"cs: čeština";"NFC: oborová literatura";"SCI: odborná literatura";"NAT: přírodní vědy";"MED: lékařství";". </s><s> I . stupeň ( O I ) : protržení";"kůže bez anebo";"s nepatrnou kontuzí a bezvýznamná bakteriální kontaminace . </s><s> Kůže je"
"1";"cs: čeština";"NFC: oborová literatura";"POP: populárně naučná literatura";"FTS: formální a technické vědy";"ICT: výpočetní technika";"stránek . </s><s> Jde o řešení , které ocení zejména majitelé";"počítačů bez DVD";"mechaniky i ti , kterým se z jakéhokoliv důvodu už"
"1";"cs: čeština";"NFC: oborová literatura";"POP: populárně naučná literatura";"FTS: formální a technické vědy";"ICT: výpočetní technika";"stránek . </s><s> Jde o řešení , které ocení zejména majitelé";"počítačů bez DVD";"mechaniky i ti , kterým se z jakéhokoliv důvodu nechce"
"1";"cs: čeština";"NFC: oborová literatura";"PRO: profesní literatura";"SSC: sociální vědy";"ECO: ekonomie, obchod, logistika";"<s> Základní cena skříňové varianty je na českém trhu 645 748";"korun bez DPH";". </s><s> Nový vůz má nově vyvinutý podvozek , dostal také"
"1";"cs: čeština";"NMG: publicistika";"NEW: tradiční publicistika";"X: neuvedeno";"NTW: celostátní tisk";"<s> Miliardový spor mezi Škodou Transportation a Českými drahami 2,7 miliardy";"korun bez DPH";"činí hodnota zakázky na 20 lokomotiv řady 380 . </s><s> O"
"1";"cs: čeština";"NMG: publicistika";"NEW: tradiční publicistika";"X: neuvedeno";"NTW: celostátní tisk";"předloni zvýšil tržby o 22 procent na rekordních 17,4 miliardy";"korun bez DPH";". </s><s> Za rok 2017 očekává překonání hranice 20 miliard korun"
"1";"cs: čeština";"NMG: publicistika";"NEW: tradiční publicistika";"X: neuvedeno";"NTW: celostátní tisk";"596 milionů bez DPH . </s><s> Třetí varianta v částce 734";"milionů bez DPH";"je podle Martina Hurajčíka maximální . </s><s> „ Jedná se o"
"1";"cs: čeština";"NMG: publicistika";"LEI: volnočasová publicistika";"X: neuvedeno";"HOU: bydlení, zahrada, hobby";"noc s velmi výraznou slevou . </s><s> Nejste - li zastánci";"cestování bez předem";"zajištěného ubytování , zkuste alespoň kombinaci , kdy si na"
"1";"cs: čeština";"NFC: oborová literatura";"ADM: administrativa";"ADM: administrativa";"ADM: administrativa";"bez DPH v případě úspěšné aukce 70 % celková výše";"nákladů bez DPH";"v případě neúspěšné aukce 30 % </s><s> Pro hodnocení kritérií bude"
"1";"cs: čeština";"NMG: publicistika";"NEW: tradiční publicistika";"X: neuvedeno";"NTW: celostátní tisk";"oddlužení nebo insolvenční návrh budou moci účtovat nejvýše čtyři tisíce";"korun bez DPH";", v případě společného oddlužení manželů maximálně šest tisíc korun"
"1";"cs: čeština";"NFC: oborová literatura";"POP: populárně naučná literatura";"HUM: humanitní vědy";"LAN: filologie";"mužského pohledu sleduje . </s><s> Vedle záměru ponechat ryze ženské vnímání";"světa bez genderově";"protichůdné korekce tím dosáhla efektu ztajení některých faktů . </s><s> Nemám"
"1";"cs: čeština";"NMG: publicistika";"NEW: tradiční publicistika";"X: neuvedeno";"NTW: celostátní tisk";"se navíc z odhadovaných osmi milionů vyšplhal na zhruba dvanáct";"milionů bez DPH";". </s><s> Přestože na rozhlednu přislíbil přispět třeba také Svazek obcí"
"1";"cs: čeština";"NFC: oborová literatura";"SCI: odborná literatura";"HUM: humanitní vědy";"LAN: filologie";", která svou zvukovou podobou odpovídá „ základní “ podobě";"slovesa bez to";", a v češtině je za 3 . os ."
"1";"ro: rumunština";"FIC: beletrie";"SCR: drama";"X: neuvedeno";"X: neuvedeno";"<s> Paula : Hovno . </s><s> Rolando : Bez velkých slov …";"bez … bez …";"</s><s> Maria : Je mi sedmadvacet a mám tři zaměstnání . </s>"
"1";"cs: čeština";"FIC: beletrie";"NOV: próza";"X: neuvedeno";"X: neuvedeno";"vlnu . “ </s><s> „ To musí být tvrdý život ,";"bez ... bez ...";"</s><s> “ Eadulf upadl do rozpaků . </s><s> „ Bez muže ?"
"1";"cs: čeština";"NFC: oborová literatura";"POP: populárně naučná literatura";"FTS: formální a technické vědy";"TEC: technika";"<s> Baterie vydrží minimálně 10 let . </s><s> Nové aktuálně stojí 42";"tisíc bez DPH";". </s><s> U převodovky e - CVT měňte olej nejpozději každých"
"1";"cs: čeština";"NFC: oborová literatura";"PRO: profesní literatura";"NAT: přírodní vědy";"GEO: geografie, geologie";"2007 nové prvky do krajiny v celkovém objemu 6 miliard";"korun bez DPH";". </s><s> Byly budovány nejen hlavní a vedlejší polní cesty ,"
"1";"cs: čeština";"NMG: publicistika";"NEW: tradiční publicistika";"X: neuvedeno";"REG: regionální tisk";"že podpora z MD je 906 . 950 , -";"korun bez DPH";". </s><s> Dotaci ve výši zhruba 85 % ceny díla město"
"1";"cs: čeština";"NFC: oborová literatura";"SCI: odborná literatura";"SSC: sociální vědy";"REC: sport, rekreace, hobby";". </s><s> U chodících to může být i účast na závodech";"osob bez TP";"na okresní úrovni . </s><s> Účast na závodech je pro sportovce"
"1";"cs: čeština";"NMG: publicistika";"LEI: volnočasová publicistika";"X: neuvedeno";"LIF: životní styl";"chtěla , aby měly v rámci možností aspoň trochu normální";"dětství bez neustále";"cvakajících fotoaparátů a zástupů novinářů , kteří ve dne v"
"1";"cs: čeština";"NMG: publicistika";"NEW: tradiční publicistika";"X: neuvedeno";"REG: regionální tisk";"montují skoro automatiky . </s><s> LETÁK UVNITŘ </s><s> U klasických či integrovaných";"zámků bez TSA";"může teoreticky dojít při otevření k jejich poškození . </s><s> V"
"1";"cs: čeština";"NMG: publicistika";"NEW: tradiční publicistika";"X: neuvedeno";"NTW: celostátní tisk";"IROP . </s><s> Hodnota prvních deseti zamýšlených akcí je 466 milionů";"korun bez DPH";". </s><s> „ K těmto projektům už krajská rada schválila podání"
"1";"cs: čeština";"NFC: oborová literatura";"SCI: odborná literatura";"SSC: sociální vědy";"REC: sport, rekreace, hobby";"nezávodí jen v jedné disciplíně , jak je tomu u";"atletů bez TP";", ale jsou úspěšní ve více dráhových disciplínách . </s><s> Trochu"
"1";"cs: čeština";"NMG: publicistika";"LEI: volnočasová publicistika";"X: neuvedeno";"MIX: společnost";"provizorní výrobou topení či pece na chleba zo nebo zprovozněním";"rádia bez b";"e elektřiny už určitě neporadil . </s><s> Mnozí ten chléb neupečou"
"1";"cs: čeština";"NMG: publicistika";"NEW: tradiční publicistika";"X: neuvedeno";"NTW: celostátní tisk";"veřejné zakázky , vedení města počítá s cenou 10,87 milionu";"korun bez DPH";". </s><s> Stavba se buduje v několika etapách , nyní jsou"
"1";"en: angličtina";"NFC: oborová literatura";"SCI: odborná literatura";"HUM: humanitní vědy";"MUS: hudba";"roce 1835 oznámil Mendelssohn svůj úmysl obnovit Händelovu původní instrumentaci";"Mesiáše bez „";"únavných imitací a sentimentálních disonancí “ nebo „ fléten a"
"1";"cs: čeština";"NMG: publicistika";"NEW: tradiční publicistika";"X: neuvedeno";"NTW: celostátní tisk";"stavbě metra D . </s><s> Předpokládaná hodnota zakázky je 450 milionů";"korun bez DPH";", vyplývá ze zadávací dokumentace . </s><s> Zájemci se mohou hlásit"
"3";"cs: čeština";"NMG: publicistika";"NEW: tradiční publicistika";"X: neuvedeno";"NTW: celostátní tisk";"v sebe sama můžete začít sušit na zimu : Květy";"Černý bez -";"při nachlazení , migrénách . </s><s> Heřmánek pravý - podporuje pocení"
"3";"cs: čeština";"FIC: beletrie";"COL: kratší próza";"X: neuvedeno";"X: neuvedeno";"zcela oprávněné je úsloví o „ Rabasově čtverečném kilometru “";"z bez -";"prostředního okolí Krušovic , odkud prý čerpal inspiraci i motivy"
"3";"cs: čeština";"NFC: oborová literatura";"PRO: profesní literatura";"SSC: sociální vědy";"EDU: pedagogika";"že stovky studentů si zaslepeně kupovaly pouze k bezcenný cár";"papíru , “ bez ilustruje";"Hromádka “ příběhy ze života . </s><s> „ Kdo si může"
"3";"cs: čeština";"NFC: oborová literatura";"POP: populárně naučná literatura";"NAT: přírodní vědy";"BIO: biologie";"společenských přelomů všech dob . </s><s> Nechceme - li upadnout do";"ubíjejícího bez -";"časí , které sice osvobozuje , ale také ohlupuje skoro"
"3";"en: angličtina";"FIC: beletrie";"NOV: próza";"X: neuvedeno";"X: neuvedeno";"jestli je pro tebe bezpečný . </s><s> Ale ani jsme nebyli";"u - bez -";"pečeni , je - li dobře upečený . </s><s> Kde vzít"
"3";"cs: čeština";"NMG: publicistika";"NEW: tradiční publicistika";"X: neuvedeno";"NTW: celostátní tisk";"hektické , ale nebojíme se , “ řekl strok lehké";"čtyřky bez Miroslav";"Vraštil . </s><s> „ Chce to od startu za to pořádně"
