"1";"cs: čeština";"NFC: oborová literatura";"SCI: odborná literatura";"SSC: sociální vědy";"EDU: pedagogika";"MŠMT , bude mít toto osvědčení obecnou platnost i pro";"působnost mimo OSH";"a tato okolnost bude na osvědčení výslovně uvedena . </s><s> Všechny"
"1";"cs: čeština";"NFC: oborová literatura";"PRO: profesní literatura";"NAT: přírodní vědy";"AGR: zemědělství, chovatelství";"živočišných produktů do třetích zemí . </s><s> České firmy vyvezly do";"zemí mimo EU";"v loňském roce více mléka a mléčných výrobků , krmiv"
"1";"cs: čeština";"NFC: oborová literatura";"SCI: odborná literatura";"NAT: přírodní vědy";"MED: lékařství";"zóně mimo HR . </s><s> Jeden třídící tým NLZP doprovází obě";"skupiny mimo TPT";"do bezpečné zóny , kde je zahájeno vlastní třídění . </s>"
"1";"cs: čeština";"NFC: oborová literatura";"PRO: profesní literatura";"FTS: formální a technické vědy";"TEC: technika";"diverzifikované tržní portfolio </s><s> Proexportní aktivity státu mají směřovat zejména do";"zemí mimo EU";"</s><s> Hlavním tématem letošního ročníku Strojírenského fóra , které se konalo"
"1";"cs: čeština";"NMG: publicistika";"NEW: tradiční publicistika";"X: neuvedeno";"NTW: celostátní tisk";"administrativu při zakládání nových firem a při zaměstnávání cizinců ze";"zemí mimo EU";"a zesílit podporu technologického vzdělávání ve školství . </s><s> Začít by"
"1";"cs: čeština";"NMG: publicistika";"NEW: tradiční publicistika";"X: neuvedeno";"NTW: celostátní tisk";"si podle průzkumu myslí , že by zahrnutí cizinců ze";"zemí mimo EU";"do veřejného zdravotního pojištění znamenalo zhoršení péče . </s><s> PRAHA Postoj"
"1";"cs: čeština";"NFC: oborová literatura";"SCI: odborná literatura";"NAT: přírodní vědy";"MED: lékařství";"<s> Zdravotní politika představuje důležitý rámec preventivních programů – realizace preventivních";"programů mimo zdravotně";"politický kontext , ať už na úrovni státu , nebo"
"1";"cs: čeština";"NFC: oborová literatura";"PRO: profesní literatura";"NAT: přírodní vědy";"AGR: zemědělství, chovatelství";"obou stranách a stará se o zpracování ne - domlácených";"klásků mimo hlavni";"mláticí systém . </s><s> Přemlácený materiál je rovnoměrně rozprostřen po vynášecí"
"1";"cs: čeština";"NMG: publicistika";"NEW: tradiční publicistika";"X: neuvedeno";"REG: regionální tisk";". </s><s> Pokud nedojde k uvolnění pracovního trhu pro pracovníky ze";"zemí mimo EU";", je pravděpodobné , že budeme svědky růstu mezd i"
"1";"cs: čeština";"NMG: publicistika";"NEW: tradiční publicistika";"X: neuvedeno";"REG: regionální tisk";"koncovce ovšem přesný nebyl . </s><s> Riedl po rohu pálil z";"voleje mimo ,";"Rubík po dalším úprku střílel vedle . </s><s> Hosté mohli své"
"1";"de: němčina";"NFC: oborová literatura";"PRO: profesní literatura";"FTS: formální a technické vědy";"ICT: výpočetní technika";"AVR . </s><s> Jak je vidět , je nabízena široká paleta";"produktů , mimo C";"také Pascal a Basic . </s><s> Největší praktický význam pro aplikace"
"1";"cs: čeština";"NFC: oborová literatura";"SCI: odborná literatura";"SSC: sociální vědy";"EDU: pedagogika";"<s> Z hlediska výkyvů ve váze zaznamenáváme pozvolný nástup závažnosti všech";"paradigmat mimo P";". somatopatologického a integračního , které se z nulové pozice"
"1";"cs: čeština";"NFC: oborová literatura";"SCI: odborná literatura";"NAT: přírodní vědy";"MED: lékařství";"omezený rozsah péče a je pro cizince , zejména ze";"zemí mimo EU";", nevýhodný a diskriminující . </s><s> Lékaři v ČR většinou v"
"1";"cs: čeština";"NFC: oborová literatura";"PRO: profesní literatura";"FTS: formální a technické vědy";"TEC: technika";"snížení tloušťky skla . </s><s> Například výplně zábradlí schodišť a šikmých";"ramp mimo podeset";"mohou být testovány jen nárazem z výšky pádu zkušebniho tělesa"
"1";"cs: čeština";"NMG: publicistika";"NEW: tradiční publicistika";"X: neuvedeno";"NTW: celostátní tisk";"nesmějí používat , ale pokud jsou obsaženy v textilu z";"dovozu mimo EU";", zákaz se na ně nevztahuje . </s><s> Zdá se ,"
"1";"cs: čeština";"NFC: oborová literatura";"MEM: memoáry, autobiografie";"MEM: memoáry, autobiografie";"MEM: memoáry, autobiografie";"pobolívá . </s><s> Velvyslanec nařídil vedoucímu týmu , aby hlásil náš";"pohyb mimo Takeo";"tamnímu veliteli vietnamské jednotky . </s><s> Proč dal velvyslanec tento příkaz"
"1";"cs: čeština";"NFC: oborová literatura";"PRO: profesní literatura";"SSC: sociální vědy";"ECO: ekonomie, obchod, logistika";"„ employer brand leadership “ manažery napříč týmy . </s><s> Zvýšení";"kompetence mimo HR";"oddělení má velký vliv na to , jak si značka"
"1";"cs: čeština";"NFC: oborová literatura";"PRO: profesní literatura";"FTS: formální a technické vědy";"ICT: výpočetní technika";"založili pobočku v Cambridge ( UK ) , která řídí";"business mimo ČR";", a vývoj zůstal nadále v Ostravě . </s><s> Takže CNI"
"1";"cs: čeština";"NFC: oborová literatura";"SCI: odborná literatura";"SSC: sociální vědy";"SOC: sociologie";". </s><s> Faktem však zůstává , že přes tuto kritiku výzkum";"měst mimo „";"západní svět “ je – na rozdíl od výzkumu měst"
"1";"cs: čeština";"NMG: publicistika";"NEW: tradiční publicistika";"X: neuvedeno";"NTW: celostátní tisk";"<s> Čtyři desítky medailí převzalo z rukou krajského ředitele HZS Ústeckého";"kraje mimo dnes";"sloužících také několik dříve sloužících příslušníků HZS . </s><s> Medaile byla"
"1";"cs: čeština";"NFC: oborová literatura";"SCI: odborná literatura";"NAT: přírodní vědy";"BIO: biologie";"hnízdní paraziti kladou vajíčka do plicních vaků jinými hrabalkami ochromených";"pavouků mimo nebo";"přímo v plodové komůrce – do cizích hnízd se aktivně"
"1";"cs: čeština";"NFC: oborová literatura";"MEM: memoáry, autobiografie";"MEM: memoáry, autobiografie";"MEM: memoáry, autobiografie";"politická pravice se měla pokusit o konstituování vlastní strany nebo";"hnutí mimo OF";", pokud byla nespokojena s podporou OF pro reformy . </s>"
"1";"cs: čeština";"NMG: publicistika";"NEW: tradiční publicistika";"X: neuvedeno";"NTW: celostátní tisk";"péče . </s><s> PRAHA Postoj české veřejnosti k začlenění cizinců ze";"zemí mimo EU";"pod plášť veřejného zdravotního pojištění přitvrzuje . </s><s> Čím dál více"
"1";"cs: čeština";"NMG: publicistika";"NEW: tradiční publicistika";"X: neuvedeno";"NTW: celostátní tisk";"účely a z části na financování zařízení k jímání vřídelní";"vody mimo staticky";"ohrožený podzemní prostor kolonády . </s><s> „ Celá ta akce je"
"1";"cs: čeština";"NMG: publicistika";"NEW: tradiční publicistika";"X: neuvedeno";"NTW: celostátní tisk";": je členkou nejužšího vedení firmy a nejvýše postavenou manažerkou";"firmy mimo USA";". </s><s> Právě ona loni vyrazila na spanilou jízdu po evropských"
"1";"cs: čeština";"NMG: publicistika";"NEW: tradiční publicistika";"X: neuvedeno";"NTW: celostátní tisk";"týmu na cestě za olympijským zlatem , a nálepku nejlepšího";"hokejisty mimo NHL";"si tak vysloužil zcela oprávněně . </s><s> S vedením se rodák"
"1";"cs: čeština";"NFC: oborová literatura";"PRO: profesní literatura";"NAT: přírodní vědy";"AGR: zemědělství, chovatelství";". </s><s> SVS vydává také osvědčení pro vývozy veterinárního zboží do";"zemí mimo EU";". </s><s> Za loňský rok to bylo takových případů více než"
"1";"cs: čeština";"FIC: beletrie";"NOV: próza";"X: neuvedeno";"X: neuvedeno";"tiše a odešel . </s><s> Bylo s ním – ve většině";"případů , mimo třeba";"výše zmíněného – příjemné a mimořádně zajímavé povídání . </s><s> Ale"
"1";"cs: čeština";"NMG: publicistika";"NEW: tradiční publicistika";"X: neuvedeno";"NTW: celostátní tisk";"lidech . </s><s> Oni si vždy poradí . </s><s> Nezůstane velká část";"lidí mimo organicky";"vznikající malá společenství ? </s><s> Vždy žili někteří lidé mimo společenství"
"1";"cs: čeština";"NMG: publicistika";"NEW: tradiční publicistika";"X: neuvedeno";"NTW: celostátní tisk";", pokud se tedy výrazně neuvolní podmínky pro zaměstnávání občanů";"zemí mimo EU";", pro něž může být i třináctitisícová mzda a nocleh"
"1";"cs: čeština";"NFC: oborová literatura";"SCI: odborná literatura";"NAT: přírodní vědy";"BIO: biologie";") , který však často jen přesahuje částí korun a";"koření mimo takto";"vymezené porosty . </s><s> Účast smrku ztepilého ( Picea abies )"
"1";"cs: čeština";"NMG: publicistika";"LEI: volnočasová publicistika";"X: neuvedeno";"HOU: bydlení, zahrada, hobby";"vzteklině a očkování nesmí být starší jednoho roku . </s><s> Řada";"zemí mimo EU";"navíc požaduje aktuální veterinární potvrzení o tom , že je"
"1";"en: angličtina";"FIC: beletrie";"NOV: próza";"X: neuvedeno";"X: neuvedeno";"na výpomoc . </s><s> Dalším důvodem byla otcova snaha ukázat Declanovi";"svět mimo Mount";"Merrion Avenue . </s><s> A navíc se tam mohl naučit irsky"
"1";"cs: čeština";"NFC: oborová literatura";"SCI: odborná literatura";"HUM: humanitní vědy";"PHI: filozofie, náboženství";"se konvenčně </s><s> označuje jako synkretismus a považuje se za vedlejší";"větev , mimo";"</s><s> hlavní náboženské proudy . </s><s> To však vyžaduje upřesnění . </s><s> To"
"1";"cs: čeština";"NFC: oborová literatura";"PRO: profesní literatura";"FTS: formální a technické vědy";"TEC: technika";"měl proto podle průmyslníků směrovat své proexportní aktivity zejména do";"zemí mimo EU";"a zde posílit a stabilizovat síť ekonomických diplomatů a kanceláří"
"1";"cs: čeština";"NMG: publicistika";"NEW: tradiční publicistika";"X: neuvedeno";"NTW: celostátní tisk";"– ta získá třeba pravomoc rušit pracovní povolení přednášejících ze";"zemí mimo EU";". </s><s> Jiný úhel nabízí Helen Pluckroseová v magazínu Areo . </s>"
"1";"cs: čeština";"NMG: publicistika";"NEW: tradiční publicistika";"X: neuvedeno";"NTW: celostátní tisk";"účelem , pro který byla zřízena , nakupovala med ze";"zemí mimo EU";"a v konkrétním případě nakoupila med obsahující farmakologicky účinné antimikrobiální"
"1";"cs: čeština";"NMG: publicistika";"NEW: tradiční publicistika";"X: neuvedeno";"REG: regionální tisk";"si jde sám zacvičit do tělocvičny , případně dělá jiný";"sport mimo eBRÁNU";", většinou vyznává i hodnoty respektu , tolerance a fairplay"
"1";"cs: čeština";"NMG: publicistika";"NEW: tradiční publicistika";"X: neuvedeno";"NTW: celostátní tisk";"<s> Vojenská spolupráce se prohloubila , Izrael byl prohlášen za hlavního";"spojence mimo NATO";", byla podepsána dohoda o volném obchodu . </s><s> Za Bushe"
"1";"cs: čeština";"NFC: oborová literatura";"PRO: profesní literatura";"FTS: formální a technické vědy";"TEC: technika";"očekávat že závěry o BAT budou sloužit jako reference pro";"legislativce mimo EU";". </s><s> Revize referenčního dokumentu EU BREF pro zpracování železných kovů"
"1";"sv: švédština";"FIC: beletrie";"COL: kratší próza";"X: neuvedeno";"X: neuvedeno";", společensky i milostně úspěšný . </s><s> Edvardson dále napsal několik";"knih mimo winterovskou";"sérii . </s><s> Kromě knih pro mládež zahrnuje jeho tvorba samostatné"
"1";"cs: čeština";"NFC: oborová literatura";"POP: populárně naučná literatura";"FTS: formální a technické vědy";"TEC: technika";"obou vylisován medailon s logem České zbrojovky . </s><s> Ocelové díly";"pistole , mimo „";"přírodní "" jazýček spouště , mají povrchovou úpravu , provedenou"
"1";"cs: čeština";"NMG: publicistika";"NEW: tradiční publicistika";"X: neuvedeno";"NTW: celostátní tisk";"po bližším zkoumání ukáže jako neoprávněná . </s><s> Například jde o";"let mimo EU";"nebo zpoždění nedosáhlo nejméně tří hodin . </s><s> Případně šlo o"
"1";"cs: čeština";"NFC: oborová literatura";"SCI: odborná literatura";"NAT: přírodní vědy";"BIO: biologie";"prostřednictvím stovek drobných projektů ZO ale i jiných ochranářských sdružení";"stojících mimo ČSOP";". </s><s> Tyto projekty jsou zaměřeny především na mapování výskytu organismů"
"1";"cs: čeština";"NFC: oborová literatura";"PRO: profesní literatura";"NAT: přírodní vědy";"GEO: geografie, geologie";"kontrola a případná oprava polohy všech importovaných definičních bodů stavebních";"parcel mimo KM";"- D , protože se z nich odvozovala poloha definičních"
"1";"cs: čeština";"NMG: publicistika";"NEW: tradiční publicistika";"X: neuvedeno";"NTW: celostátní tisk";"mezinárodní mobilitu , je určen na podporu zahraničním studentům ze";"zemí mimo EU";", kteří chtějí studovat na některé z vysokých škol v"
"1";"cs: čeština";"NFC: oborová literatura";"PRO: profesní literatura";"SSC: sociální vědy";"ECO: ekonomie, obchod, logistika";"Pokračující koncentrace car policy u velkých korporací a posun rozhodovacích";"pravomocí mimo ČR";". • Rostoucí povědomí zákazníků o trhu a jeho principech"
"1";"cs: čeština";"NFC: oborová literatura";"PRO: profesní literatura";"SSC: sociální vědy";"ECO: ekonomie, obchod, logistika";"let . · </s><s> 3 min S výjimkou zásilek určených do";"zemí mimo EU";"je za standardních okolností řidič schopen odbavit se do tří"
"1";"cs: čeština";"NFC: oborová literatura";"MEM: memoáry, autobiografie";"MEM: memoáry, autobiografie";"MEM: memoáry, autobiografie";") a mnoho dalších drahokamů a ozdobných kamenů . </s><s> Z";"oblasti mimo pegmatitová";"tělesa se získával smaragd ( v roce 1981 téměř 300"
"1";"cs: čeština";"NFC: oborová literatura";"PRO: profesní literatura";"SSC: sociální vědy";"ECO: ekonomie, obchod, logistika";"pro správce nezanedbatelné reputační riziko . </s><s> Při předávání údajů do";"zemí mimo EU";"je třeba sledovat , zda v návaznosti na rozhodnutí Komise"
"1";"cs: čeština";"NFC: oborová literatura";"PRO: profesní literatura";"SSC: sociální vědy";"ECO: ekonomie, obchod, logistika";"li místo odeslání zásilky v České republice a místo přijetí";"zásilky mimo ČR";", uzavírají smlouvu o přepravě věci podle Úmluvy CMR ,"
"1";"cs: čeština";"NMG: publicistika";"NEW: tradiční publicistika";"X: neuvedeno";"NTW: celostátní tisk";"příslušné k vyřízení žádosti a zefektivnit návraty neúspěšných žadatelů do";"států mimo EU";". </s><s> Systém musí být nastaven tak , aby dokázal odlišit"
"1";"cs: čeština";"NMG: publicistika";"NEW: tradiční publicistika";"X: neuvedeno";"NTW: celostátní tisk";"po současnost Podobně jako Kronos Quartet rádo interpretuje i repertoár";"povstalý mimo „";"západní “ kulturní okruh , vstřebalo vlivy indických rág či"
"1";"cs: čeština";"NFC: oborová literatura";"SCI: odborná literatura";"SSC: sociální vědy";"ECO: ekonomie, obchod, logistika";"mimo síť TEN - T . </s><s> Modernizace silnic I .";"třídy mimo TEN";"- T . </s><s> Modernizace a rozvoj pražského metra a systémů"
"1";"cs: čeština";"NFC: oborová literatura";"ADM: administrativa";"ADM: administrativa";"ADM: administrativa";"v areálu festivalu atp . ) . </s><s> 7 . Rozdělávat";"oheň mimo k";"tomu vyhrazená místa , zapalovat nebo odstřelovat ohňostroj či světlice"
"1";"cs: čeština";"NMG: publicistika";"NEW: tradiční publicistika";"X: neuvedeno";"NTW: celostátní tisk";"dva tisíce lidí s právem na mezinárodní ochranu z uprchlických";"táborů mimo EU";"více než původně předpokládaných 20 tisíc . </s><s> Chybějících osm tisíc"
"1";"cs: čeština";"NMG: publicistika";"LEI: volnočasová publicistika";"X: neuvedeno";"SCT: společenský život";"bude zastupovat , jen musí mít vyřízené náležitosti pro možnost";"zastupování mimo ČR";", což je obvyklé . </s><s> Ale hlavní důraz bych kladla"
"1";"cs: čeština";"NMG: publicistika";"NEW: tradiční publicistika";"X: neuvedeno";"NTW: celostátní tisk";"své výzkumné aktivity ukončily nebo se soustřeďují na produkty pro";"země mimo EU";", kde se tyto rostliny nepovažují za GMO , jako"
"1";"cs: čeština";"NFC: oborová literatura";"POP: populárně naučná literatura";"NAT: přírodní vědy";"BIO: biologie";"zběsile narážejí na rozeklané pobřeží s lávovými balvany a možnost";"koupání mimo zcela";"chráněné zátoky či přirozené bazény se limitně blíží nule a"
"1";"cs: čeština";"NFC: oborová literatura";"PRO: profesní literatura";"SSC: sociální vědy";"ECO: ekonomie, obchod, logistika";"proto , že jim na rozdíl od zájemců z jiných";"zemí mimo EU";"stačilo absolvovat jednodušší administrativní proceduru . </s><s> To se ale postupně"
"1";"cs: čeština";"NMG: publicistika";"NEW: tradiční publicistika";"X: neuvedeno";"NTW: celostátní tisk";"na jednu stranu přináší třeba ochotu investovat do tvorby a";"talentu mimo USA";". </s><s> Vznikají seriály jako německý Dark , španělský La Casa"
"1";"cs: čeština";"NFC: oborová literatura";"PRO: profesní literatura";"FTS: formální a technické vědy";"TEC: technika";"zátěž , jež dramaticky ohrožuje jejich konkurenceschopnost vůči výrobcům ze";"zemí mimo EU";". </s><s> I ve světle dalších faktorů tuto skutečnost potvrzují i"
"1";"cs: čeština";"NMG: publicistika";"NEW: tradiční publicistika";"X: neuvedeno";"NTW: celostátní tisk";"aktivistů , aby Evropská unie zakázala vývoz živých zvířat do";"zemí mimo EU";". </s><s> Zvířata podle nich při delší přepravě trpí , navíc"
"1";"no: norština";"FIC: beletrie";"NOV: próza";"X: neuvedeno";"X: neuvedeno";"k záhubě ve chvíli , kdy jsi odsoudil k smrti";"všechno mimo Ymslandu";". “ </s><s> Graal si dřepl , naklonil hlavu na stranu"
"1";"cs: čeština";"NMG: publicistika";"NEW: tradiční publicistika";"X: neuvedeno";"NTW: celostátní tisk";"Východoevropanů do Velké Británie nebo více než milionu uprchlíků z";"prostoru mimo EU";"do Německa . </s><s> Finanční krize obnažila nedostatky nedokončené stavby eurozóny"
"1";"cs: čeština";"NFC: oborová literatura";"POP: populárně naučná literatura";"FTS: formální a technické vědy";"ICT: výpočetní technika";"/ SCADA síti a internetu . </s><s> Infikování notebooků nebo vyměnitelných";"médií mimo ICS";"/ SCADA sítě , následné infikování vnitřních systémů při připojení"
"1";"cs: čeština";"NFC: oborová literatura";"PRO: profesní literatura";"FTS: formální a technické vědy";"TEC: technika";"stavebních společností by navíc uvítaly zjednodušení procesu zaměstnávání pracovníků ze";"zemí mimo EU";". </s><s> Vyplývá to z Kvartální analýzy českého stavebnictví zpracované analytickou"
"1";"cs: čeština";"NMG: publicistika";"NEW: tradiční publicistika";"X: neuvedeno";"NTW: celostátní tisk";"mld . Kč . </s><s> K vývozu střelných zbraní do 73";"zemí mimo EU";"bylo uděleno 720 povolení s hodnotou 9,1 mld . Kč"
"1";"cs: čeština";"NFC: oborová literatura";"SCI: odborná literatura";"NAT: přírodní vědy";"MED: lékařství";"na legislativní úrovni existující bariéru vedoucí k diskriminaci cizinců ze";"států mimo EU";", která tyto cizince nutí k povinnému komerčnímu pojištění a"
"1";"cs: čeština";"NFC: oborová literatura";"ADM: administrativa";"ADM: administrativa";"ADM: administrativa";"rozhodování , včetně profilování , o vhodných zárukách při předání";"údajů mimo EU";", </s><s> • kopii osobních údajů , a to pouze za"
"1";"cs: čeština";"NFC: oborová literatura";"PRO: profesní literatura";"NAT: přírodní vědy";"MED: lékařství";"nemocnicích nelegálně . </s><s> A je úplně jedno , z jaké";"země mimo EU";"přišli . </s><s> Symbolem se stali Ukrajinci , kterých v rámci"
"1";"cs: čeština";"NMG: publicistika";"NEW: tradiční publicistika";"X: neuvedeno";"NTW: celostátní tisk";"pro Evropu : jde o postoj amerických korporací k placení";"daní mimo USA";". </s><s> Na rozdíl od Spojených států jim tu nenabízejí jednorázovou"
"1";"cs: čeština";"NFC: oborová literatura";"PRO: profesní literatura";"FTS: formální a technické vědy";"TEC: technika";"vyčerpán , a tak jedinou cestou je zaměstnávání pracovníků ze";"zemí mimo EU";". </s><s> Proto je třeba okamžitě zjednodušit a podstatně zkrátit dotyčný"
"1";"cs: čeština";"NMG: publicistika";"NEW: tradiční publicistika";"X: neuvedeno";"NTW: celostátní tisk";"letišť na území EU i pro lety evropských dopravců z";"letišť mimo EU";") </s><s> občerstvení a dva telefonní hovory při zpoždění letu nad"
"1";"cs: čeština";"NFC: oborová literatura";"POP: populárně naučná literatura";"SSC: sociální vědy";"LAW: právo";"otázce profilování ( sériových ) vrahů se samozřejmě věnujePanoptikum sexuálních";"vražd , mimo jinév";"1 . díle , v kapitoleSmrtv čase vánočním . </s><s> 12"
"1";"cs: čeština";"NFC: oborová literatura";"PRO: profesní literatura";"FTS: formální a technické vědy";"TEC: technika";"však v rámci specializace skupiny v budoucnu přesunou do jiného";"závodu mimo ČR";". </s><s> Vývoj sortimentu se velmi rychle odehrává také ve skupině"
"1";"cs: čeština";"NFC: oborová literatura";"PRO: profesní literatura";"FTS: formální a technické vědy";"TEC: technika";"? </s><s> Obě instituce jsou určeny především pro financování vývozu na";"trhy mimo EU";". </s><s> Jejich činnost však dnes brzdí problémy související s nepříliš"
"1";"cs: čeština";"NFC: oborová literatura";"SCI: odborná literatura";"NAT: přírodní vědy";"BIO: biologie";"však ve skutečnosti není Betula carpatica , která – ta";"se mimo oreofytikum";"nevyskytuje ( Sýkora 1983 , Kříž in Hejný et al"
"1";"cs: čeština";"NMG: publicistika";"NEW: tradiční publicistika";"X: neuvedeno";"NTW: celostátní tisk";"tak znovu narazili na fenomén poslední doby – cizinci ze";"zemí mimo EU";"si opatřují falešné rumunské občanky . </s><s> „ Nejprve se sami"
"1";"cs: čeština";"NMG: publicistika";"NEW: tradiční publicistika";"X: neuvedeno";"NTW: celostátní tisk";"získá . </s><s> Je s námi připraveno se spojit mnoho dalších";"osobností mimo ODS";". </s><s> Například v Plzeňském regionu kandidátku s největší pravděpodobností povede"
"1";"cs: čeština";"NMG: publicistika";"NEW: tradiční publicistika";"X: neuvedeno";"NTW: celostátní tisk";"rozhlasová pauza potrvá dvacet let . </s><s> Nenaříkal , hledal nová";"odbytiště mimo přísně";"střežená média , pro něž se stal personou non grata"
"1";"cs: čeština";"NFC: oborová literatura";"SCI: odborná literatura";"NAT: přírodní vědy";"BIO: biologie";"do něj , jak již bylo řečeno , zapojena řada";"organizací mimo ČSOP";"a v jeho čele stojí Rada , která je sice"
"1";"cs: čeština";"NFC: oborová literatura";"PRO: profesní literatura";"FTS: formální a technické vědy";"TEC: technika";"č . 3 : Dovozy zemního plynu EU od hlavních";"partnerů mimo EU";"( podíl ( % ) obchodu v hodnotě ) </s><s> Obrázek"
"1";"cs: čeština";"NFC: oborová literatura";"POP: populárně naučná literatura";"FTS: formální a technické vědy";"ICT: výpočetní technika";"autem . </s><s> Bez připojení k internetu můžete použít i ostatní";"navigace , mimo Waze";", samozřejmě ale nebudete mít k dispozici aktuální data o"
"1";"cs: čeština";"NMG: publicistika";"NEW: tradiční publicistika";"X: neuvedeno";"NTW: celostátní tisk";"zároveň politickým stranám ztížit možnost financování z Ruska a dalších";"zemí mimo EU";". </s><s> Nebýt užitečnými </s><s> pitomci </s><s> Zprávu zástupce největší lidovecké frakce v"
"1";"cs: čeština";"NMG: publicistika";"NEW: tradiční publicistika";"X: neuvedeno";"NTW: celostátní tisk";"odvádějí osoby samostatně výdělečně činné . </s><s> Mají být cizinci ze";"zemí mimo EU";", kteří zde nemají trvalý pobyt , součástí veřejného zdravotního"
"1";"cs: čeština";"NFC: oborová literatura";"SCI: odborná literatura";"HUM: humanitní vědy";"HIS: historie, biografie";"křižovnického řádu , byly zabíleny . </s><s> Z dalšího původního zařízení";"se mimo pár";"artefaktů zachovalo třináct portrétů místních proboštů a několik obrazů a"
"1";"cs: čeština";"NMG: publicistika";"NEW: tradiční publicistika";"X: neuvedeno";"NTW: celostátní tisk";", že by přednost měl dostat rakouský plán na záchytná";"centra mimo EU";". </s><s> „ Jestli si myslí , že v Bruselu budeme"
"1";"cs: čeština";"NMG: publicistika";"LEI: volnočasová publicistika";"X: neuvedeno";"LIF: životní styl";"sýr rozmíchejte se žloutkem a špetkou soli . </s><s> Rozetřete na";"těsto , mimo řezem";"oddělené okraje . </s><s> Na sýrovou vrstvu poskládejte plátky plísňového sýra"
"1";"cs: čeština";"NFC: oborová literatura";"PRO: profesní literatura";"FTS: formální a technické vědy";"TEC: technika";"pochází z České republiky , některé země EU anebo ze";"státu mimo EU";". </s><s> Veřejnost stále volá po lepší informovanosti při nákupu potravin"
