"cs: čeština";"NFC: oborová literatura";"POP: populárně naučná literatura";"FTS: formální a technické vědy";"TEC: technika";"přehrávače a receivery až k televizorům ,  o počítačích ani";"nemluvě";"- a nesmíme zapomenout ani na USB hard disky . </s>"
"cs: čeština";"NMG: publicistika";"NEW: tradiční publicistika";"X: neuvedeno";"NTW: celostátní tisk";"Bez dogmatu nebo Rodina Połanieckých ,  o antisocialistických Vírech ani";"nemluvě";", pak rovnou odsoudili k zapomnění . </s><s> Švy ideologického korzetu"
"cs: čeština";"NMG: publicistika";"NEW: tradiční publicistika";"X: neuvedeno";"NTW: celostátní tisk";"šátek , který zakrývá jen vlasy . </s>  <s> O burce ani";"nemluvě";". </s>  <s> Muslimky s šátky ale Češi do budoucna určitě potkávat"
"cs: čeština";"NMG: publicistika";"NEW: tradiční publicistika";"X: neuvedeno";"NTW: celostátní tisk";": klidně žít , klidný spánek dětí (  o matkách";"nemluvě";") . </s><s> To jsou oblíbené obraty a rekvizity českých popových"
"cs: čeština";"FIC: beletrie";"COL: kratší próza";"X: neuvedeno";"X: neuvedeno";"Denali z toho nemám vůbec radost . </s>  <s> O dobrém pocitu";"nemluvě";". </s>  <s> Vítr zesiluje . </s><s> Vrchol je na dosah . </s><s> Zbývá"
"en: angličtina";"FIC: beletrie";"SCR: drama";"X: neuvedeno";"X: neuvedeno";"pokožku a taky ti narostly víc vlasy ,  o břichu";"nemluvě";". </s>  <s> HENRY Neříkej ? </s><s> Máš dneska zase svůj den Jak"
"cs: čeština";"NMG: publicistika";"LEI: volnočasová publicistika";"X: neuvedeno";"LIF: životní styl";"zmrzlina nebo jste se umazala při tankování . </s>  <s> O dětech";"nemluvě";". </s>  <s> Navíc při čekání v zácpě můžete setřít prach z"
"cs: čeština";"NMG: publicistika";"NEW: tradiční publicistika";"X: neuvedeno";"NTW: celostátní tisk";"základní škole nebo na gymnáziu ,  o rodičích a učitelích";"nemluvě";", většina z nich vám řekne , že je potřeba"
"cs: čeština";"NFC: oborová literatura";"MEM: memoáry, autobiografie";"MEM: memoáry, autobiografie";"MEM: memoáry, autobiografie";"zimních večerech přepočítají pomocí vlašské praktiky . </s>  <s> O oleji ani";"nemluvě";". </s>  <s> A i tak se to pořád vyplatilo jezdit do"
"cs: čeština";"NFC: oborová literatura";"POP: populárně naučná literatura";"FTS: formální a technické vědy";"TEC: technika";", tablet či přehrávač zasouvat do doku (  o MacBooku";"nemluvě";") . 2 . 1 systém se ukrývá v oku"
"cs: čeština";"NFC: oborová literatura";"POP: populárně naučná literatura";"NAT: přírodní vědy";"MED: lékařství";", dermatologii , neurologii a kardiologii ,  o všeobecné interně";"nemluvě";". </s>  <s> Mnohem větší „ promořenost “ psychosomatickými myšlenkami už dnes"
"cs: čeština";"NFC: oborová literatura";"POP: populárně naučná literatura";"HUM: humanitní vědy";"HIS: historie, biografie";"že Biľak je i na Slovensku (  o českých zemích";"nemluvě";") krajně nepopulární . </s><s> Na rozdíl od Husáka se pro"
"cs: čeština";"FIC: beletrie";"NOV: próza";"X: neuvedeno";"X: neuvedeno";", no ta je možná fajn . </s>  <s> O miminku ani";"nemluvě";", to je pro ni prostě jako nějaký zvířátko ,"
"cs: čeština";"NMG: publicistika";"NEW: tradiční publicistika";"X: neuvedeno";"NTW: celostátní tisk";"bylo tvrdě zasaženo i zemědělství ,  o terciární sféře ani";"nemluvě";". </s>  <s> Reakce československé politiky na krizi byla poměrně rozpačitá . </s>"
"en: angličtina";"FIC: beletrie";"NOV: próza";"X: neuvedeno";"X: neuvedeno";"ve sněhu ho nabila energií ,  o kávě a čokoládě";"nemluvě";". </s>  <s> Posadil se k psacímu stolu a začal psát Henrymu"
"cs: čeština";"NMG: publicistika";"LEI: volnočasová publicistika";"X: neuvedeno";"SCT: společenský život";"uzlíky ! </s><s> Kompletně se jí zhoršilo zdraví ,  o psychice";"nemluvě";". </s>  <s> Rajee léta trpěla bolestmi , od operace nikdy nebyla"
"cs: čeština";"NMG: publicistika";"NEW: tradiční publicistika";"X: neuvedeno";"NTW: celostátní tisk";"sebevraždou , velké výtvarné i hudební pochopení . </s>  <s> O hercích";"nemluvě";"; bylo až dojemné , když se po skončení projekce"
"en: angličtina";"NFC: oborová literatura";"POP: populárně naučná literatura";"SSC: sociální vědy";"ECO: ekonomie, obchod, logistika";"si ovšem „ jedou to své “ ,  o politicích";"nemluvě";", je tedy nesmírně obtížné na tomto přeplněném poli provádět"
"cs: čeština";"NFC: oborová literatura";"POP: populárně naučná literatura";"FTS: formální a technické vědy";"TEC: technika";"80 cm pohodlné a dostačující ,  o toaletě a bidetu";"nemluvě";". </s>  <s> Budete potřebovat i více volné obslužné plochy . </s><s> U"
"cs: čeština";"NMG: publicistika";"LEI: volnočasová publicistika";"X: neuvedeno";"INT: zajímavosti ze světa";"příjemnými teplotami a pomeranči na stromech . </s>  <s> O výborném jídlu";"nemluvě";"! </s>  <s> Podvečerní výhled z „ Kozího vrchu “ </s><s> „ Pekelná"
"cs: čeština";"NMG: publicistika";"LEI: volnočasová publicistika";"X: neuvedeno";"SCT: společenský život";", medvěda , z kozu ,  o psech a kočkách";"nemluvě";". </s>  <s> Tentokrát našel Jan Šťastný coby veterinář Petr Vymeš v"
"cs: čeština";"NMG: publicistika";"LEI: volnočasová publicistika";"X: neuvedeno";"MIX: společnost";"<s> Samozřejmě návštěvu pedikérky nestíháte , o každodenní péči  o nohy";"nemluvě";". </s>  <s> Řešení je přitom nasnadě - hydratační gelové návleky ,"
"cs: čeština";"NMG: publicistika";"NEW: tradiční publicistika";"X: neuvedeno";"NTW: celostátní tisk";"se zatím na nic jiného nezmůže ,  o omluvě ani";"nemluvě";". </s>  <s> Naopak , demokraté chtějí Trumpa dál vyšetřovat . </s><s> Antonín"
"de: němčina";"NFC: oborová literatura";"MEM: memoáry, autobiografie";"MEM: memoáry, autobiografie";"MEM: memoáry, autobiografie";"dodnes jsem se nic nepřiučila ,  o zkracování kalhot ani";"nemluvě";") , který s oblibou pronášela : „ Hezcí lidé"
"cs: čeština";"NMG: publicistika";"NEW: tradiční publicistika";"X: neuvedeno";"NTW: celostátní tisk";"životopisy často zůstávají bez odpovědi ,  o pozvánkách k pohovorům";"nemluvě";". </s>  <s> A nedostává se na ně ani při povyšování anebo"
"cs: čeština";"FIC: beletrie";"COL: kratší próza";"X: neuvedeno";"X: neuvedeno";"protože je to svým způsobem prestižní džob . </s>  <s> O nosičích";"nemluvě";". </s>  <s> Kdo ve Vysokých Tatrách nenosil , jako by nebyl"
"cs: čeština";"NFC: oborová literatura";"SCI: odborná literatura";"HUM: humanitní vědy";"PHI: filozofie, náboženství";"škodlivého účinku na lidské zdraví . </s>  <s> O tom živočišném ani";"nemluvě";". </s>  <s> To bychom se teprve dočkali masových antiGM protestů ! </s>"
"en: angličtina";"FIC: beletrie";"NOV: próza";"X: neuvedeno";"X: neuvedeno";"pochopil . </s><s> Může za to léto —  o malé smrti";"nemluvě";". </s>  <s> Přemýšlel jsem dnes večer o těch letních dnech strávených"
"de: němčina";"FIC: beletrie";"NOV: próza";"X: neuvedeno";"X: neuvedeno";"; nezvládl by bez pomoci ani Otčenáš ,  o Zdrávasu";"nemluvě";". </s>  <s> I Teo ho v tom přetrumfl , i když"
"cs: čeština";"FIC: beletrie";"NOV: próza";"X: neuvedeno";"X: neuvedeno";"Zápalkové , to by byl nářez . </s>  <s> O bigoších ani";"nemluvě";". </s>  <s> Absa o tom věděl svoje . </s><s> Když v únoru"
"cs: čeština";"NMG: publicistika";"LEI: volnočasová publicistika";"X: neuvedeno";"HOU: bydlení, zahrada, hobby";"on a jejich tři děti ,  o kočce Jůlii ani";"nemluvě";". </s>  <s> Když se do soutěže před mnoha měsíci přihlašovali ,"
"cs: čeština";"NMG: publicistika";"NEW: tradiční publicistika";"X: neuvedeno";"NTW: celostátní tisk";"začal trénink , jel jako pila . </s>  <s> O zápasech ani";"nemluvě";". </s>  <s> Co provedl s Barcelonou , na to se vzpomíná"
"cs: čeština";"NMG: publicistika";"NEW: tradiční publicistika";"X: neuvedeno";"REG: regionální tisk";", kteří by je měli obsluhovat . </s>  <s> O řadě rozhodčích";"nemluvě";". </s>  <s> Pro případ technických potíží prý je připravený plán B"
"ru: ruština";"FIC: beletrie";"NOV: próza";"X: neuvedeno";"X: neuvedeno";"příkladu chrámového porna jako je facial . </s>  <s> O kosmetice ani";"nemluvě";". </s>  <s> Naše potomstvo s jistými ženami má vynikající šance na"
"cs: čeština";"FIC: beletrie";"COL: kratší próza";"X: neuvedeno";"X: neuvedeno";", jediná puška , jediný samopal ,  o dělostřeleckém nadělení";"nemluvě";". </s>  <s> Rozeběhli jsme se . </s><s> Po pár desítkách metrů –"
"cs: čeština";"FIC: beletrie";"COL: kratší próza";"X: neuvedeno";"X: neuvedeno";". </s><s> Ale on nesměl ani Karel Čapek ,  o Durychovi";"nemluvě";". </s>  <s> A jak se ženské bály nosit klobouky , připomíná"
"cs: čeština";"NFC: oborová literatura";"POP: populárně naučná literatura";"SSC: sociální vědy";"LAW: právo";"chvíli pod značný časový tlak . </s>  <s> O eventuální naprogramovanosti činu";"nemluvě";". </s>  <s> Co se ale ukázalo při detailnějším prověřování alibi ? </s>"
"cs: čeština";"FIC: beletrie";"COL: kratší próza";"X: neuvedeno";"X: neuvedeno";"a způsobují mnohem větší škody na životech ,  o majetku";"nemluvě";". </s>  <s> Politické dění se vyznačuje nepředvídatelností a docela často katastrofálními"
"cs: čeština";"NMG: publicistika";"LEI: volnočasová publicistika";"X: neuvedeno";"MIX: společnost";"bývá i ve Středomoří pořádně nevlídno ,  o severních krajích";"nemluvě";". </s>  <s> Takže kam v zimě vyplout ? </s><s> Karibská klasika </s><s> V"
"cs: čeština";"NMG: publicistika";"LEI: volnočasová publicistika";"X: neuvedeno";"LIF: životní styl";"70 % vody oproti celoplošnému zalévání ,  o úspoře času";"nemluvě";". </s>  <s> EFEKTNÍ : Novinku , která potěší nejen děti ,"
"de: němčina";"FIC: beletrie";"NOV: próza";"X: neuvedeno";"X: neuvedeno";"byli fyzicky poznamenaní na celý život ,  o psychických následcích";"nemluvě";". </s>  <s> Kevinovi se ty scény živě promítaly před očima . </s>"
"en: angličtina";"NFC: oborová literatura";"MEM: memoáry, autobiografie";"MEM: memoáry, autobiografie";"MEM: memoáry, autobiografie";"se dvěma svými druhy v proutěném koraklu :  o vlku";"nemluvě";". </s>  <s> Zohledníme - li rozdíly v nedůležitých detailech , něco"
"en: angličtina";"FIC: beletrie";"COL: kratší próza";"X: neuvedeno";"X: neuvedeno";"že nedosáhne na polovinu ovládacích prvků ,  o palubní přihrádce";"nemluvě";". </s>  <s> Tohle auto tedy , eufemisticky řečeno , není bez"
"ja: japonština";"FIC: beletrie";"NOV: próza";"X: neuvedeno";"X: neuvedeno";"ale hudba pořádně poslouchat nedala (  o chovu psů ani";"nemluvě";") , a proto se vždycky stavil s pár cédéčky"
"cs: čeština";"NFC: oborová literatura";"PRO: profesní literatura";"FTS: formální a technické vědy";"TEC: technika";"života se rapidně zkrátí ) ,  o kvalitě emitovaného světla";"nemluvě";". </s>  <s> Pokud je osvětlovací systém instalován např . uvnitř nábytku"
"cs: čeština";"NFC: oborová literatura";"POP: populárně naučná literatura";"FTS: formální a technické vědy";"ICT: výpočetní technika";"přes službu Hudba Google Play ,  o dalších službách Googlu";"nemluvě";". </s>  <s> Skutečný dopad zablokování účtu Google si uvědomíte až ve"
"cs: čeština";"NMG: publicistika";"LEI: volnočasová publicistika";"X: neuvedeno";"SCT: společenský život";"koupelně - zvuk sprchy leccos zamaskuje ,  o ždímající pračce";"nemluvě";". </s>  <s> VYRAZTE DO PŘÍRODY </s><s> Někdy je prostě jedinou možností vyklizení"
"cs: čeština";"NMG: publicistika";"LEI: volnočasová publicistika";"X: neuvedeno";"MIX: společnost";"výpravě jsem v Praze marně toužil ,  o Brnu ani";"nemluvě";". </s>  <s> Maxe Broda , který seděl vedle mne v lóži"
"zh: čínština";"FIC: beletrie";"COL: kratší próza";"X: neuvedeno";"X: neuvedeno";"Siao-mej a poznal , že není ošklivá ,  o inteligenci";"nemluvě";", vždyť mu odpovídala v rýmech jako když bičem mrská"
"en: angličtina";"FIC: beletrie";"COL: kratší próza";"X: neuvedeno";"X: neuvedeno";"spíš takový westhajlendský teriér než kokršpaněl ,  o německém ovčákovi";"nemluvě";". </s>  <s> Znamená to , že motor je neustále ve varu"
"cs: čeština";"NFC: oborová literatura";"POP: populárně naučná literatura";"ITD: interdisciplinární";"ITD: interdisciplinární";"rozmazané a mnohdy jen černobílé obrázky ,  o zvuku ani";"nemluvě";". </s>  <s> Možná bychom se dost divili , pokud bychom se"
"cs: čeština";"NMG: publicistika";"LEI: volnočasová publicistika";"X: neuvedeno";"LIF: životní styl";"výšky a maminky u toho křičí hrůzou (  o babičkách";"nemluvě";") . </s><s> To je v pořádku ? </s><s> Naprosto ! </s><s> Dětem"
"cs: čeština";"NMG: publicistika";"LEI: volnočasová publicistika";"X: neuvedeno";"LIF: životní styl";", manžetové knofl íčky nebo i šle . </s>  <s> O obličeji";"nemluvě";"… </s>  <s> BLEJZR GANG </s><s> Tahle partička blejzrů umí zabrnkat jak na"
"cs: čeština";"NMG: publicistika";"NEW: tradiční publicistika";"X: neuvedeno";"NTW: celostátní tisk";"se takové úsilí přímo finančně vyplatilo ,  o společenských dopadech";"nemluvě";". </s>  <s> VÝSLEDKOVÝ SERVIS </s><s> Hokej </s><s> Fotbal </s><s> Liga mistrů – 6 ."
"cs: čeština";"NMG: publicistika";"LEI: volnočasová publicistika";"X: neuvedeno";"HOU: bydlení, zahrada, hobby";"bude kout udržovat v čistotě ,  o vizuálním pořádku ani";"nemluvě";"… * </s><s> Díky různým možnostem zkosení a výřezů skla si"
"cs: čeština";"NFC: oborová literatura";"PRO: profesní literatura";"FTS: formální a technické vědy";"TEC: technika";"z jejich obsahu už neplatí ,  o starších materiálech ani";"nemluvě";". </s>  <s> Nebývá to však jejich chyba . </s><s> Je to dáno"
"en: angličtina";"NFC: oborová literatura";"SCI: odborná literatura";"HUM: humanitní vědy";"HIS: historie, biografie";"proti Pétainovi by nevyžadovalo pouze značnou předvídavost ,  o odvaze";"nemluvě";"; vyžadovalo by to též ochotu hájit ( byť třeba"
"cs: čeština";"NMG: publicistika";"NEW: tradiční publicistika";"X: neuvedeno";"REG: regionální tisk";"trochu na vyšší úrovni než to jablonecké ,  o občerstvení";"nemluvě";". </s>  <s> Na koláč paní Prejzové ale v Praze nemají . </s>"
"cs: čeština";"FIC: beletrie";"COL: kratší próza";"X: neuvedeno";"X: neuvedeno";", jak moc musel chybět on jí . </s>  <s> O psech";"nemluvě";". </s>  <s> Už je to nějaké to století , kdy vychovával"
"cs: čeština";"FIC: beletrie";"COL: kratší próza";"X: neuvedeno";"X: neuvedeno";"aby zvedli oči a zaznamenali ji . </s>  <s> O ženách ani";"nemluvě";", ty vždycky evidovaly konkurenci jako první . </s><s> Smíchovské nábřeží"
"cs: čeština";"NFC: oborová literatura";"POP: populárně naučná literatura";"NAT: přírodní vědy";"BIO: biologie";"- psů , koček , papoušků ,  o opicích vůbec";"nemluvě";") . </s><s> Dostaneme - li se na rozhraní dvou prostředí"
"en: angličtina";"NFC: oborová literatura";"POP: populárně naučná literatura";"HUM: humanitní vědy";"INF: knihovnictví, informatika";"nebýt Dieselovy vytrvalosti a odhodlání ,  o jeho hustilce ani";"nemluvě";". </s>  <s> To si dobře uvědomoval i sám vynálezce , když"
"cs: čeština";"NFC: oborová literatura";"POP: populárně naučná literatura";"ITD: interdisciplinární";"ITD: interdisciplinární";"kdy ještě neexistovala fotografie a letecké snímkování ,  o satelitním";"nemluvě";". </s>  <s> Obdobný úžas se mne zmocnil při listování objemnou učebnicí"
"cs: čeština";"NFC: oborová literatura";"POP: populárně naučná literatura";"NAT: přírodní vědy";"GEO: geografie, geologie";"porosty třezalek , váleček a zvonků ,  o chřadnoucích jalovcích";"nemluvě";". </s>  <s> Do toho všeho vstupují akáty , netýkavky malokvěté a"
"cs: čeština";"NMG: publicistika";"LEI: volnočasová publicistika";"X: neuvedeno";"SCT: společenský život";"divného materiálu , špatně barevná ... </s>  <s> O transparentním topu ani";"nemluvě";". </s>  <s> Tohle nemá styl . </s><s> Světlana Nálepková Celek vyznívá divně"
"cs: čeština";"FIC: beletrie";"NOV: próza";"X: neuvedeno";"X: neuvedeno";"mohlo docela účinně nahlodat jakoukoli podlahu ,  o lidské kůži";"nemluvě";". </s>  <s> Strýc Enyk se zul a prošel se po podlaze"
"ru: ruština";"FIC: beletrie";"NOV: próza";"X: neuvedeno";"X: neuvedeno";"od začátku až do konce ,  o Starých filmech ani";"nemluvě";". </s>  <s> Musíš zkrátka vyrůst v objetí vizuální kultury a nasáknout"
"cs: čeština";"NFC: oborová literatura";"SCI: odborná literatura";"HUM: humanitní vědy";"LAN: filologie";"pochybnost o vývojové povaze historických dějů ,  o dějinách literatury";"nemluvě";": soustředění k obdobím tzv . předělů , rozhraní jako"
"en: angličtina";"NFC: oborová literatura";"POP: populárně naučná literatura";"NAT: přírodní vědy";"PHY: fyzika";". </s><s> Některé otázky již nejsou pokládány ,  o odpovědích ani";"nemluvě";". </s>  <s> Tato útlá kniha odhaluje poetickou kosmologii , která se"
"cs: čeština";"NFC: oborová literatura";"POP: populárně naučná literatura";"FTS: formální a technické vědy";"ICT: výpočetní technika";"také tam , kde se platí librou ,  o dolaru";"nemluvě";". </s>  <s> Zajímavou volbou je Norsko , jehož koruna stále vyjde"
"cs: čeština";"NFC: oborová literatura";"POP: populárně naučná literatura";"FTS: formální a technické vědy";"TEC: technika";", podzim doprovází plískanice a mlhy ,  o zimě ani";"nemluvě";") . </s><s> To je sice v protikladu s dalším krokem"
"cs: čeština";"NMG: publicistika";"NEW: tradiční publicistika";"X: neuvedeno";"NTW: celostátní tisk";"dav , který za hilsneriády proklínal Masaryka (  o Hilsnerovi";"nemluvě";") , za druhé republiky navrhoval či obhajoval vyloučení Židů"
"cs: čeština";"NFC: oborová literatura";"POP: populárně naučná literatura";"ITD: interdisciplinární";"ITD: interdisciplinární";"plazů , ptáků i savců ,  o všemožných domácích zvířatech";"nemluvě";". </s>  <s> Z tohoto úhlu pohledu pak není objev alely pro"
"cs: čeština";"FIC: beletrie";"NOV: próza";"X: neuvedeno";"X: neuvedeno";"se děje . </s><s> Je toho plný internet ,  o ulici";"nemluvě";". </s>  <s> Stačí se jen podívat z okna . </s><s> Dole ve"
"en: angličtina";"NFC: oborová literatura";"SCI: odborná literatura";"HUM: humanitní vědy";"HIS: historie, biografie";"od trajektorie francouzského sociálního myšlení ,  o francouzských dějinách ani";"nemluvě";". </s>  <s> Za těchto okolností se německé myšlení od Hegela po"
"cs: čeština";"NFC: oborová literatura";"POP: populárně naučná literatura";"SSC: sociální vědy";"LAW: právo";". </s><s> Na okolí to ovšem působilo –  o podezřívavé policii";"nemluvě";"– dojmem , že schválně brzdil pátrání po Michaele . </s>"
"cs: čeština";"NFC: oborová literatura";"MEM: memoáry, autobiografie";"MEM: memoáry, autobiografie";"MEM: memoáry, autobiografie";""" dobrodružného v rámci zdánlivě tradičního veršování -  o Magorovi";"nemluvě";". </s>  <s> Morava , která pro mě byla podstatná už v"
"en: angličtina";"NFC: oborová literatura";"MEM: memoáry, autobiografie";"MEM: memoáry, autobiografie";"MEM: memoáry, autobiografie";"než jako věčné pokušení pro chudáka Adama ,  o Evě";"nemluvě";". </s>  <s> Aby svých potíží neměli málo , za Evou směl"
"sv: švédština";"NFC: oborová literatura";"POP: populárně naučná literatura";"NAT: přírodní vědy";"MED: lékařství";"záchod . </s><s> Virózy jsou nemilosrdné . </s>  <s> O žaludečních potížích ani";"nemluvě";". </s>  <s> Jedna takováto kombinace a člověk si přeje , aby"
"cs: čeština";"NFC: oborová literatura";"POP: populárně naučná literatura";"ITD: interdisciplinární";"ITD: interdisciplinární";"se nedalo orientovat ani podle Slunce ,  o hvězdách ani";"nemluvě";". </s>  <s> Přitom prokazatelně neměli kompas . </s><s> Přišlo se na to"
"cs: čeština";"NFC: oborová literatura";"PRO: profesní literatura";"SSC: sociální vědy";"ECO: ekonomie, obchod, logistika";"ještě naruší i týdenní odpočinek ,  o odloučení od rodiny";"nemluvě";". </s>  <s> Například ve studii Generálního ředitelství pro mobilitu a dopravu"
"cs: čeština";"NMG: publicistika";"NEW: tradiční publicistika";"X: neuvedeno";"REG: regionální tisk";"si méně hrají v ulicích ,  o dvorech snad ani";"nemluvě";". </s>  <s> Hledám důvod . </s><s> Že by byl v tom ,"
"en: angličtina";"FIC: beletrie";"NOV: próza";"X: neuvedeno";"X: neuvedeno";"McGrayovi , jehož odloučenost a nešťastná situace —  o prstech";"nemluvě";"— se té jejich trochu podobaly … </s><s> Na Edinburgh se"
"de: němčina";"FIC: beletrie";"NOV: próza";"X: neuvedeno";"X: neuvedeno";"potřebovat neustálou péči , neúnavnou pozornost ,  o finanční stránce";"nemluvě";"! </s>  <s> Náklady na terapie , případné operace , pobyty v"
"en: angličtina";"FIC: beletrie";"NOV: próza";"X: neuvedeno";"X: neuvedeno";"bez nějakých dramatických scén či hrdinství —  o míze ani";"nemluvě";". </s>  <s> Je zvláštní , když si vzpomenu , že toto"
"cs: čeština";"FIC: beletrie";"NOV: próza";"X: neuvedeno";"X: neuvedeno";"je časově třikrát déle než u nás ,  o intenzitě";"nemluvě";". “ </s><s> Následovat měla notoricky známá přednáška , Magda mu"
"cs: čeština";"NFC: oborová literatura";"POP: populárně naučná literatura";"HUM: humanitní vědy";"LAN: filologie";"obchody , hotely a restaurace . </s>  <s> O tamních lidech ani";"nemluvě";". </s>  <s> Na základě takovéhoto iniciačního zážitku se navíc může Kohoutkovu"
"cs: čeština";"NMG: publicistika";"NEW: tradiční publicistika";"X: neuvedeno";"REG: regionální tisk";"drsným podmínkám , chorobám a škůdcům ,  o třech armádách";"nemluvě";", “ upozornila Růžičková . </s><s> Podle ní jsou oproti těm"
"en: angličtina";"FIC: beletrie";"SCR: drama";"X: neuvedeno";"X: neuvedeno";"žít jeden nudný den za druhým ,  o nudných nocích";"nemluvě";", a nikdy jsem se do nikoho nezamilovala . </s><s> A"
"cs: čeština";"NMG: publicistika";"LEI: volnočasová publicistika";"X: neuvedeno";"SPO: sport";"zápasy v sedmi dnech je pořádná porce ,  o pěti";"nemluvě";". “ </s><s> V tomhle NHL není zrovna spravedlivá , v"
"cs: čeština";"NMG: publicistika";"NEW: tradiční publicistika";"X: neuvedeno";"NTW: celostátní tisk";"začnou pochybovat o vaší racionalitě . </s>  <s> O Polsku pak ani";"nemluvě";"– Poláci jsou v EU dobře známí tím , že"
"cs: čeština";"NFC: oborová literatura";"POP: populárně naučná literatura";"FTS: formální a technické vědy";"ICT: výpočetní technika";"když chcete mobil používat k fotografování ,  o přehrávání hudby";"nemluvě";". </s>  <s> POSLECH NAHLAS </s><s> Pro častější poslech hudby nahlas ( bez"
"cs: čeština";"NFC: oborová literatura";"POP: populárně naučná literatura";"NAT: přírodní vědy";"BIO: biologie";"jachtaření a jiné vodní sporty ;  o ucpávání vodovodních trubek";"nemluvě";". </s>  <s> V současné době jeho populace obecně stagnuje , na"
"cs: čeština";"NFC: oborová literatura";"PRO: profesní literatura";"NAT: přírodní vědy";"MED: lékařství";"nemocný lékař nebo gynekologem každá žena ,  o pediatrii ani";"nemluvě";". </s>  <s> Můžete připomenout , kdo je „ geriatrický pacient “"
"cs: čeština";"NMG: publicistika";"NEW: tradiční publicistika";"X: neuvedeno";"NTW: celostátní tisk";", že nepřišel ani jiný ministr . </s>  <s> O prezidentu Zemanovi";"nemluvě";". </s>  <s> NEPROJDOU ! </s><s> Pohraničník je symbolem režimu , který u"
"cs: čeština";"NMG: publicistika";"LEI: volnočasová publicistika";"X: neuvedeno";"HOU: bydlení, zahrada, hobby";"kamarádi vesele nasávají prach všemi póry . </s>  <s> O knihách ani";"nemluvě";"... </s>  <s> Se společným soužitím zatím sourozenci problém nemají , dokonce"
"cs: čeština";"FIC: beletrie";"COL: kratší próza";"X: neuvedeno";"X: neuvedeno";", včetně kouření , alkoholu včetně piva ,  o drogách";"nemluvě";". </s>  <s> Jíst střídmě , vést pravidelný život a vytrvale ,"
"es: španělština";"FIC: beletrie";"NOV: próza";"X: neuvedeno";"X: neuvedeno";"se nedostávalo zeleniny a vajec ,  o kuřecím mase ani";"nemluvě";". </s>  <s> „ Neruda se tam přátelil s muralisty Davidem Alfarem"
"en: angličtina";"NFC: oborová literatura";"POP: populárně naučná literatura";"NAT: přírodní vědy";"MED: lékařství";". </s><s> Snižuje riziko srdečního infarktu a mrtvice ,  o diabetu";"nemluvě";". </s>  <s> Díky této léčbě se budete cítit spokojenější , méně"
"cs: čeština";"FIC: beletrie";"COL: kratší próza";"X: neuvedeno";"X: neuvedeno";"a poskytují až hříšnou porci pohodlí ,  o technických vychytávkách";"nemluvě";". </s>  <s> Vaněk byl poprvé úplně vyděšený , když vlezl do"
