"en: angličtina";"FIC: beletrie";"SCR: drama";"X: neuvedeno";"X: neuvedeno";"Místní nás nesnášejí , počasí je hrozné ,  o škole";"nemluvě";". </s>  <s> A my je teď můžeme dát do nějaké solidní"
"en: angličtina";"NFC: oborová literatura";"MEM: memoáry, autobiografie";"MEM: memoáry, autobiografie";"MEM: memoáry, autobiografie";"je východ a kde západ ,  o nějakém triangulačním bodu";"nemluvě";". </s>  <s> Až teď nám Kločko prozradil , že k setkání"
"cs: čeština";"NMG: publicistika";"LEI: volnočasová publicistika";"X: neuvedeno";"MIX: společnost";"obzvlášť do schodů , vystupování z auta ,  o ohýbání";"nemluvě";". </s>  <s> Instinktivně si začnete ulevovat kývavým krokem , takže přetížíte"
"cs: čeština";"NMG: publicistika";"LEI: volnočasová publicistika";"X: neuvedeno";"MIX: společnost";"<s> No a on mezitím umře . </s>  <s> O nějaké etice ani";"nemluvě";". </s>  <s> Za ta léta , co se Himálaj začal komercionalizovat"
"no: norština";"FIC: beletrie";"NOV: próza";"X: neuvedeno";"X: neuvedeno";"<s> Někdy proklínala Číslo jedna i Poutníka ,  o Bratchardovi ani";"nemluvě";", copak si myslí , že to je to jediné"
"zh: čínština";"FIC: beletrie";"NOV: próza";"X: neuvedeno";"X: neuvedeno";"sežrali , mrtvé tělo nešlo ani zrekonstruovat ,  o vypreparování";"nemluvě";". </s>  <s> Toto je vlastně služební cesta , počká si u"
"cs: čeština";"NMG: publicistika";"LEI: volnočasová publicistika";"X: neuvedeno";"LIF: životní styl";"mám víc než třicet kilometrů ,  o převýšení raději ani";"nemluvě";". </s>  <s> Do vsi doškobrtám až ve chvíli , kdy vládu"
"cs: čeština";"FIC: beletrie";"COL: kratší próza";"X: neuvedeno";"X: neuvedeno";"je spolehlivější než budík na mobilu ,  o zdravotní nezávadnosti";"nemluvě";". </s>  <s> 7 Trvá to celou jednu minutu : to je"
"en: angličtina";"NFC: oborová literatura";"MEM: memoáry, autobiografie";"MEM: memoáry, autobiografie";"MEM: memoáry, autobiografie";"States nevěděl , jestli závod dokončí ,  o vítězství ani";"nemluvě";". </s>  <s> Spousta lidí v životě ničeho úžasného nedosáhne . </s><s> Mnozí"
"cs: čeština";"NMG: publicistika";"NEW: tradiční publicistika";"X: neuvedeno";"NTW: celostátní tisk";"ve státním rozpočtu na investice ,  o evropských penězích ani";"nemluvě";". </s>  <s> Zatímco většina evropských zemí hledá zdroje a v EU"
"en: angličtina";"FIC: beletrie";"NOV: próza";"X: neuvedeno";"X: neuvedeno";"a sotva se na nich udržím ,  o tancování ani";"nemluvě";". </s>  <s> Všechny tyhle činnosti jsou prý pro moje dobro ,"
"de: němčina";"NFC: oborová literatura";"MEM: memoáry, autobiografie";"MEM: memoáry, autobiografie";"MEM: memoáry, autobiografie";"dne se to tam hemží štěnicemi ,  o noci ani";"nemluvě";". </s>  <s> Spánek venku není špatný , ale teď je deštivé"
"cs: čeština";"NMG: publicistika";"LEI: volnočasová publicistika";"X: neuvedeno";"LIF: životní styl";"něco stojí , natož třeba chemoterapie ,  o biologické léčbě";"nemluvě";". </s>  <s> Ale pokud přičteme náklady na likvidaci následků zbytečného nadměrného"
"cs: čeština";"NMG: publicistika";"LEI: volnočasová publicistika";"X: neuvedeno";"LIF: životní styl";"je výroba nádobí , různých pomůcek ,  o uměleckých disciplínách";"nemluvě";". </s>  <s> Mají i Češi svou specifikou přípravu ? </s><s> My známe"
"cs: čeština";"NMG: publicistika";"LEI: volnočasová publicistika";"X: neuvedeno";"LIF: životní styl";"Na královský stůl nesmí ani šunka ,  o jiných uzeninách";"nemluvě";". </s>  <s> Letizia vaří dokonce sama , nejraději připravuje saláty ,"
"cs: čeština";"NMG: publicistika";"LEI: volnočasová publicistika";"X: neuvedeno";"LIF: životní styl";"neženou do svatby a společného života ,  o potomcích ani";"nemluvě";", hledají něco jiného . </s><s> Ale co vlastně , když"
"cs: čeština";"NFC: oborová literatura";"POP: populárně naučná literatura";"NAT: přírodní vědy";"BIO: biologie";"alma mater také nejmenuje náhodou ,  o matičce straně ani";"nemluvě";") . </s><s> O Pilgrimově knize o mužích , pohlcených matkou"
"cs: čeština";"NMG: publicistika";"LEI: volnočasová publicistika";"X: neuvedeno";"LIF: životní styl";". </s><s> Ten naprostý nedostatek invence (  o nějaké empatii ani";"nemluvě";") drtí . </s><s> Posílil i Úsvit a Tomio Okamura ("
"cs: čeština";"FIC: beletrie";"NOV: próza";"X: neuvedeno";"X: neuvedeno";"uzná Muawa . </s><s> „ No a  o suché posteli ani";"nemluvě";". “ </s><s> Kývnu a nechám toho divného pavouka , aby"
"nl: nizozemština";"FIC: beletrie";"NOV: próza";"X: neuvedeno";"X: neuvedeno";"nedělá “ . </s><s> Špagety se nejí lžící ,  o noži";"nemluvě";". </s>  <s> Zajímavé bylo také zjištění , že Jahve neřekl ,"
"en: angličtina";"FIC: beletrie";"NOV: próza";"X: neuvedeno";"X: neuvedeno";"by před ním ztratili respekt ,  o jeho vlastních lidech";"nemluvě";". </s>  <s> Dal poplašné znamení na beraní roh a lidé se"
"cs: čeština";"NFC: oborová literatura";"PRO: profesní literatura";"NAT: přírodní vědy";"MED: lékařství";", kde si vystojí další frontu (  o objednacím termínu";"nemluvě";") , aby dostal to , co jsem mohl okamžitě"
"cs: čeština";"NFC: oborová literatura";"PRO: profesní literatura";"SSC: sociální vědy";"EDU: pedagogika";"? </s><s> Proč se školáci kreslení bojí ,  o mnoha dospělých";"nemluvě";"? </s>  <s> Je to zase normální součástí vývoje . </s><s> Děti prochází"
"cs: čeština";"NMG: publicistika";"LEI: volnočasová publicistika";"X: neuvedeno";"HOU: bydlení, zahrada, hobby";"než na obrazovku . </s><s> Český fotbal nevyjímaje a  o politicích";"nemluvě";", “ usmívá se mírně hořce Olda , který už"
"cs: čeština";"FIC: beletrie";"NOV: próza";"X: neuvedeno";"X: neuvedeno";"než všechny ostatní posvátné hřbitovy ,  o těch neposvátných ani";"nemluvě";". </s>  <s> Doteď se mu ale vyhýbala . </s><s> Pozorovala z dálky"
"cs: čeština";"FIC: beletrie";"COL: kratší próza";"X: neuvedeno";"X: neuvedeno";"uprostřed salónu a ty jeho knihy . </s>  <s> O nějaké výzdobě";"nemluvě";". </s>  <s> A přestože byl instalatér , nikdy nic doma neopravil"
"cs: čeština";"FIC: beletrie";"COL: kratší próza";"X: neuvedeno";"X: neuvedeno";"aniž vhodné , rozvinouti naplno rejstřík schopností ,  o vědomostech";"nemluvě";", tupost připadala mu zjevem bohumilým a lhostejnost takřka rozkoší"
"cs: čeština";"NMG: publicistika";"NEW: tradiční publicistika";"X: neuvedeno";"NTW: celostátní tisk";"herbalista či poradce přes výživu . </s><s> A  o Číně ani";"nemluvě";": tam se spousta zdravotních potíží řeší pouze těmito pro"
"en: angličtina";"NFC: oborová literatura";"POP: populárně naučná literatura";"SSC: sociální vědy";"POL: politika, vojenství";"celostátních zpráv . </s><s> Avšak regionální představitelé –  o Kremlu ani";"nemluvě";"– nenaslouchali . </s><s> Požadované referendum o navrhované těžbě bylo blokováno"
"cs: čeština";"NFC: oborová literatura";"PRO: profesní literatura";"FTS: formální a technické vědy";"ICT: výpočetní technika";"že program nepatří k nejrychlejším ,  o obsazené paměti ani";"nemluvě";"? </s>  <s> Tak se prostě na krabici napíší odpovídající systémové požadavky"
"cs: čeština";"NMG: publicistika";"LEI: volnočasová publicistika";"X: neuvedeno";"HOU: bydlení, zahrada, hobby";"na zemi na pohled dřevo nebo kámen ,  o barvách";"nemluvě";". </s>  <s> Slibuje výbornou odolnost vůči vlhkosti a snadno se udržuje"
"cs: čeština";"FIC: beletrie";"NOV: próza";"X: neuvedeno";"X: neuvedeno";", v Hydroprojektu už to vážně přeháněli ,  o Metrostavu";"nemluvě";"— a ta smlouva s Veolií rozzuřila dokonce i Evropskou"
"en: angličtina";"NFC: oborová literatura";"SCI: odborná literatura";"HUM: humanitní vědy";"HIS: historie, biografie";"konce čtyřicátých let , o zprávách  o generaci později ani";"nemluvě";", byla novinkou výhradně v tom smyslu , že se"
"cs: čeština";"NMG: publicistika";"LEI: volnočasová publicistika";"X: neuvedeno";"SPO: sport";"hlavě zmatek , jak s videem pracovat . </s>  <s> O veřejnosti";"nemluvě";". </s>  <s> Práce s VARem přešla v Česku od zřídkavého zasahování"
"no: norština";"FIC: beletrie";"NOV: próza";"X: neuvedeno";"X: neuvedeno";"tak důkladně . </s><s> Mě . </s><s> A Franka . </s>  <s> O Gøranovi";"nemluvě";". “ </s><s> „ Jenže ty jsi měl u sebe kufr"
"en: angličtina";"NFC: oborová literatura";"POP: populárně naučná literatura";"SSC: sociální vědy";"ECO: ekonomie, obchod, logistika";"a nahodilé okolnosti můžou nastat ,  o jejich pravděpodobnosti ani";"nemluvě";", jak mezi jinými na začátku dvacátého století zdůrazňoval pronikavý"
"cs: čeština";"NFC: oborová literatura";"POP: populárně naučná literatura";"NAT: přírodní vědy";"BIO: biologie";"druhů můr nežli například ptáků ,  o množství jedinců ani";"nemluvě";". </s>  <s> Všechny , ostatně zhruba z jedné velikostní kategorie ,"
"cs: čeština";"NMG: publicistika";"LEI: volnočasová publicistika";"X: neuvedeno";"LIF: životní styl";"přes média a Facebook k herním automatům ,  o drogách";"nemluvě";". </s>  <s> Proč by lidé měli zase chtít prožitky ? </s><s> To"
"cs: čeština";"NMG: publicistika";"NEW: tradiční publicistika";"X: neuvedeno";"NTW: celostátní tisk";"všechna pravidla . </s><s> Corbyn nevypadá jako poslanec ,  o premiérovi";"nemluvě";". </s>  <s> Nikdy nebyl ministrem . </s><s> Ani stínovým . </s><s> Jeho politický"
"cs: čeština";"NFC: oborová literatura";"POP: populárně naučná literatura";"HUM: humanitní vědy";"LAN: filologie";"„ Zůstala neplodnou . </s><s> Neměla děti ,  o synovi ani";"nemluvě";". "" </s><s> Tato verze o Kateřinině neplodnosti byla vyvrácena roku"
"cs: čeština";"NMG: publicistika";"NEW: tradiční publicistika";"X: neuvedeno";"REG: regionální tisk";"Rastislav Štefánik a jejich nejbližší spolupracovníci ,  o politicích doma";"nemluvě";", s vysokou pravděpodobností ničeho nedosáhli . </s><s> To se také"
"cs: čeština";"NMG: publicistika";"NEW: tradiční publicistika";"X: neuvedeno";"NTW: celostátní tisk";"Václava Klause se ministři neúčastnili jednání sněmovny ,  o interpelacích";"nemluvě";". </s>  <s> O interpelacích bych řekl ještě jedno – mají hlubší"
"cs: čeština";"NMG: publicistika";"NEW: tradiční publicistika";"X: neuvedeno";"NTW: celostátní tisk";"než je průměrná mzda v zemi ,  o té mediánové";"nemluvě";". </s>  <s> Jenže ani to nestačí . </s><s> Bylo by řešením radikální"
"cs: čeština";"FIC: beletrie";"NOV: próza";"X: neuvedeno";"X: neuvedeno";"všechny ty roztříštěný a zlámaný kosti ,  o tržných ranách";"nemluvě";". </s>  <s> Po šestým úderu hasičákem má dost . </s><s> Kopnutím ho"
"cs: čeština";"NFC: oborová literatura";"SCI: odborná literatura";"HUM: humanitní vědy";"PHI: filozofie, náboženství";": nedočká se patrně ani polévky ,  o kavalci ani";"nemluvě";". </s>  <s> Že je ovšem každá svoboda nějakou možností a nikoli"
"en: angličtina";"NFC: oborová literatura";"SCI: odborná literatura";"HUM: humanitní vědy";"MUS: hudba";", které se Žid stěží odváží vyslovit ,  o knězi";"nemluvě";") – neřeknu v lehké árii ( neboť jelikož ji"
"cs: čeština";"NMG: publicistika";"NEW: tradiční publicistika";"X: neuvedeno";"NTW: celostátní tisk";"povede , si všichni umíme představit ,  o kvalitě vína";"nemluvě";". </s>  <s> To není nějaké teoretizování nebo strašení , už teď"
"cs: čeština";"NMG: publicistika";"NEW: tradiční publicistika";"X: neuvedeno";"NTW: celostátní tisk";", přesahovaly jakoukoli zkušenost a představivost ,  o znění paragrafů";"nemluvě";". </s>  <s> Když se například roznesly zprávy o hromadách mrtvol ,"
"fi: finština";"FIC: beletrie";"NOV: próza";"X: neuvedeno";"X: neuvedeno";", polibek nebo letmý dotyk ruky . </s>  <s> O sexu ani";"nemluvě";". </s>  <s> Rauno na to měl chuť . </s><s> Pomyslel na nevěru"
"cs: čeština";"NFC: oborová literatura";"POP: populárně naučná literatura";"FTS: formální a technické vědy";"ICT: výpočetní technika";"máme například Project Cars či Forzu ,  o Driveclubu ani";"nemluvě";") hra stále o krok , v případě druhého jmenovaného"
"en: angličtina";"FIC: beletrie";"NOV: próza";"X: neuvedeno";"X: neuvedeno";". </s><s> Tak zip na kalhotách nedopne ,  o knoflíku ani";"nemluvě";", že by sako mělo dostatečnou vůli , to ani"
"cs: čeština";"NFC: oborová literatura";"MEM: memoáry, autobiografie";"MEM: memoáry, autobiografie";"MEM: memoáry, autobiografie";"doktorovi , platí veliké částky za vyšetření ,  o operaci";"nemluvě";", na tu je třeba spořit . </s><s> Žila u nás"
"cs: čeština";"NMG: publicistika";"NEW: tradiční publicistika";"X: neuvedeno";"NTW: celostátní tisk";"jako veřejnost v České republice ,  o anglosaských teritoriích ani";"nemluvě";", a snaží se rozkotat kolektivní správu za každou cenu"
"de: němčina";"FIC: beletrie";"COL: kratší próza";"X: neuvedeno";"X: neuvedeno";"klíně , příboru se ještě netknula ,  o žebírku ani";"nemluvě";". </s>  <s> Podívala se na Antona a zamyslela se , o"
"en: angličtina";"FIC: beletrie";"NOV: próza";"X: neuvedeno";"X: neuvedeno";"je celá naše sluneční soustava –  o samotné planetě vůbec";"nemluvě";"– v porovnání se zbytkem vesmíru menší . </s><s> Dokážeš si"
"en: angličtina";"FIC: beletrie";"COL: kratší próza";"X: neuvedeno";"X: neuvedeno";"lze nepředstavitelně ušetřit čas a námahu ,  o uhlí ani";"nemluvě";"; a hned na místě ženu této metodě naučil ,"
"cs: čeština";"NMG: publicistika";"LEI: volnočasová publicistika";"X: neuvedeno";"SPO: sport";"je ukrutně lákavé pro každého byznysmena ,  o politicích ani";"nemluvě";". </s>  <s> Slavný muž otevírá dveře . </s><s> A on sám těm"
"cs: čeština";"FIC: beletrie";"NOV: próza";"X: neuvedeno";"X: neuvedeno";", jak jsem se oháněl lopatkou ,  o zraněném rameni";"nemluvě";", a on měl u sebe celou dobu klíč . </s>"
"cs: čeština";"FIC: beletrie";"COL: kratší próza";"X: neuvedeno";"X: neuvedeno";"a do divadla jezdí tamtéž ,  o školách pro děti";"nemluvě";". </s>  <s> Sociální kontakty jim ale nechybí , už jen proto"
"cs: čeština";"NMG: publicistika";"LEI: volnočasová publicistika";"X: neuvedeno";"LIF: životní styl";"klín . </s><s> Neoholené můžete nechat i podpaží ,  o nohou";"nemluvě";". </s>  <s> Kosmetické sekce slavných módních časopisů hlásají , že zarostlá"
"cs: čeština";"NMG: publicistika";"LEI: volnočasová publicistika";"X: neuvedeno";"HOU: bydlení, zahrada, hobby";"heslo univerzální , nastavené právě výrobcem ,  o dalším zabezpečení";"nemluvě";". </s>  <s> Co to znamená ? </s><s> Třeba hrubé narušení soukromí . </s>"
"cs: čeština";"NMG: publicistika";"NEW: tradiční publicistika";"X: neuvedeno";"NTW: celostátní tisk";"jen čtyři body z matematiky . </s>  <s> O středních odborných školách";"nemluvě";". </s>  <s> Když letos přišel ministr školství Robert Plaga ( ANO"
"en: angličtina";"FIC: beletrie";"NOV: próza";"X: neuvedeno";"X: neuvedeno";"v ulicích čtvrti Marunouči nejspíš nepotká ,  o tygrech ani";"nemluvě";", ale ten chlapík u stánku s nudlemi se kaboní"
"cs: čeština";"NMG: publicistika";"NEW: tradiční publicistika";"X: neuvedeno";"NTW: celostátní tisk";", Telička či Zaorálek vědět ,  o úřednících z ministerstev";"nemluvě";". </s>  <s> Přesto jsou pod větou „ přeřadíme pleny “ podepsáni"
"cs: čeština";"NMG: publicistika";"LEI: volnočasová publicistika";"X: neuvedeno";"LIF: životní styl";"snáze než plátno a olejové barvy ,  o kameni pak";"nemluvě";". </s>  <s> Kdo se však jednou seznámí s jejími pracemi ,"
"cs: čeština";"NFC: oborová literatura";"SCI: odborná literatura";"HUM: humanitní vědy";"PHI: filozofie, náboženství";"pesticidy či jinak ošetřenými kontrolami (  o těch neošetřených ani";"nemluvě";") , vykazuje MONA 851 propastně nižší – v podstatě"
"cs: čeština";"FIC: beletrie";"COL: kratší próza";"X: neuvedeno";"X: neuvedeno";"zlosti , neměl k dispozici motorku ,  o automobilu ani";"nemluvě";". </s>  <s> Přece tam nepojede na kole ! </s><s> Vyšel před stanici"
"cs: čeština";"NMG: publicistika";"LEI: volnočasová publicistika";"X: neuvedeno";"LIF: životní styl";"pravidelně . </s><s> Dřív jsem šidila snídaně ,  o svačinách ani";"nemluvě";". </s>  <s> Zato po návratu z práce jsem to pečlivě doháněla"
"en: angličtina";"NFC: oborová literatura";"MEM: memoáry, autobiografie";"MEM: memoáry, autobiografie";"MEM: memoáry, autobiografie";"<s> Další literární reminiscence </s><s> Tři muže ve člunu (  o psu";"nemluvě";") jsem napsal v Chelsea Gardens , v bytě ,"
"en: angličtina";"FIC: beletrie";"NOV: próza";"X: neuvedeno";"X: neuvedeno";"by , jak se jmenuje ,  o mém jméně ani";"nemluvě";". </s>  <s> „ O co ti jde , Petere ? </s><s> Proč"
"cs: čeština";"NMG: publicistika";"LEI: volnočasová publicistika";"X: neuvedeno";"MIX: společnost";"sladší než náplně krabiček příbuzenských . </s>  <s> O krabičkách nízkokaloricky manželských";"nemluvě";". </s>  <s> Pár jsem takových ochutnal . </s><s> Čtvrtý den po sobě"
"cs: čeština";"NFC: oborová literatura";"MEM: memoáry, autobiografie";"MEM: memoáry, autobiografie";"MEM: memoáry, autobiografie";"takových počtech a ne všechny druhy . </s>  <s> O focení ani";"nemluvě";", to byl ryzí smutek . </s><s> Nějaký odonatologický zápis do"
"nl: nizozemština";"FIC: beletrie";"NOV: próza";"X: neuvedeno";"X: neuvedeno";"co nedokázal přimhouřit oči nad potraty –  o euthanasii ani";"nemluvě";"– , zato dal nemilosrdně střílet na molučany při vlakových"
"cs: čeština";"NMG: publicistika";"NEW: tradiční publicistika";"X: neuvedeno";"NTW: celostátní tisk";"už tam jsem mohl bojovat o medaili ,  o Amsterdamu";"nemluvě";". </s>  <s> Byla to moje blbost , na druhou stranu diskvalifikace"
"cs: čeština";"FIC: beletrie";"COL: kratší próza";"X: neuvedeno";"X: neuvedeno";"<s> Prostředí maloměsta se jim neosvědčilo . </s>  <s> O všudypřítomných havranech ani";"nemluvě";". </s>  <s> Nicméně ještě potřeboval čas . </s><s> Musel dodělat jednu zakázku"
"cs: čeština";"NFC: oborová literatura";"PRO: profesní literatura";"SSC: sociální vědy";"POL: politika, vojenství";"opraveným kapličkám a zrestaurovaným sochám ,  o obytných domech ani";"nemluvě";". </s>  <s> Myšlenky na prosazení památkové zóny se nevzdáváte ? </s><s> Patřím"
"en: angličtina";"NFC: oborová literatura";"POP: populárně naučná literatura";"SSC: sociální vědy";"REC: sport, rekreace, hobby";"žen mého věku pravděpodobně nikdy nevidělo ,  o použití ani";"nemluvíc";", irigátor na výplach pochvy . </s><s> Intimní hygiena vyšla z"
"en: angličtina";"FIC: beletrie";"NOV: próza";"X: neuvedeno";"X: neuvedeno";"ale není zrovna snadné najít si přítele ,  o manželovi";"nemluvě";", když žijete jako neplacená ošetřovatelka pracující od nevidím do"
"en: angličtina";"FIC: beletrie";"NOV: próza";"X: neuvedeno";"X: neuvedeno";"kopání do lidí , o příležitostném pokusu  o vraždu ani";"nemluvě";". </s>  <s> Předseda jejích odborů tvrdil , že řidič autobusu je"
"ru: ruština";"FIC: beletrie";"NOV: próza";"X: neuvedeno";"X: neuvedeno";"mlčela dokonce i Svobodná encyklopedie ,  o školních učebnicích ani";"nemluvě";". </s>  <s> Pomohly mu ekranoslovníky . </s><s> Zkratka S . N ."
"cs: čeština";"NFC: oborová literatura";"POP: populárně naučná literatura";"HUM: humanitní vědy";"LAN: filologie";"<s> A větší peníze přebíjejí ty menší ,  o hrdosti ani";"nemluvě";". </s>  <s> Evropské firmy kvapně opouštějí Írán , případně od USA"
"en: angličtina";"FIC: beletrie";"NOV: próza";"X: neuvedeno";"X: neuvedeno";"člověka , jako je Filey ,  o rodičích slečny Laxtonové";"nemluvě";". </s>  <s> Dále vyjádřila nezvratné přesvědčení , že její neteř musela"
"cs: čeština";"FIC: beletrie";"VER: poezie";"X: neuvedeno";"X: neuvedeno";"<s> A žádný turista </s><s> ho nikdy neuvidí </s><s> (  o turistkách </s><s> ani";"nemluvě";") </s>  <s> Ordnung muss sein </s><s> Alles klar ?! </s><s> Also mach weiter"
"cs: čeština";"NFC: oborová literatura";"POP: populárně naučná literatura";"NAT: přírodní vědy";"BIO: biologie";": výkaly , peří , dřevo ,  o mršinách ani";"nemluvě";". </s>  <s> U těch , kteří připomínají pomalu se sunoucí exkrementy"
"cs: čeština";"NMG: publicistika";"LEI: volnočasová publicistika";"X: neuvedeno";"INT: zajímavosti ze světa";", která vám předpoví budoucnost . </s>  <s> O cukrové vatě ové";"nemluvě";". </s>  <s> Všechny tvůrčí děti "" vydejte se na Kampu ! </s>"
"cs: čeština";"NMG: publicistika";"NEW: tradiční publicistika";"X: neuvedeno";"NTW: celostátní tisk";"u bot , neumějí držet tužky ,  o příboru ani";"nemluvě";". </s>  <s> Neumějí mluvit , a když ano , tak bez"
"cs: čeština";"FIC: beletrie";"COL: kratší próza";"X: neuvedeno";"X: neuvedeno";"odjede , tátu to bude mrzet . </s>  <s> O Tomáškovi ani";"nemluvě";". </s>  <s> Skoro litovala , že se na mobil podívala už"
"cs: čeština";"NFC: oborová literatura";"POP: populárně naučná literatura";"NAT: přírodní vědy";"BIO: biologie";"s téměř půl metrákem váhy ,  o velkých ještěrech ani";"nemluvě";". </s>  <s> A co teprve obří klokani rodu Procoptodon se zkrácenou"
"en: angličtina";"FIC: beletrie";"COL: kratší próza";"X: neuvedeno";"X: neuvedeno";"tři nebo čtyři malé děti –  o jejich matkách ani";"nemluvě";"– , starého vypaseného pána srazíte na kočárek a seminaristky"
"cs: čeština";"NMG: publicistika";"NEW: tradiční publicistika";"X: neuvedeno";"NTW: celostátní tisk";"šéfův smích byl okaté předvádění se ,  o jeho věrných";"nemluvě";". </s>  <s> Já sama , jelikož jsem nechtěla dopadnout jako Lotova"
"cs: čeština";"NMG: publicistika";"NEW: tradiční publicistika";"X: neuvedeno";"NTW: celostátní tisk";"hřbitov , ale ani na zahrádky ,  o velkém hřbitovu";"nemluvě";". </s>  <s> Velké kosti se v kostnici století vyskládávaly pod desku"
"cs: čeština";"NFC: oborová literatura";"PRO: profesní literatura";"FTS: formální a technické vědy";"ICT: výpočetní technika";"příponou wma ) a také MPEG ,  o formátu AVI";"nemluvě";". </s>  <s> Prvek nazvaný MediaplayerAx je umístěn v projektu PrehravacAx ,"
"cs: čeština";"NFC: oborová literatura";"POP: populárně naučná literatura";"FTS: formální a technické vědy";"ICT: výpočetní technika";". </s><s> Chytré a velmi praktické ,  o úspoře energie ani";"nemluvě";". </s>  <s> Revogi Power strip cena 3 490 Kč </s><s> Telefonní powerbanka </s>"
"zh: čínština";"FIC: beletrie";"NOV: próza";"X: neuvedeno";"X: neuvedeno";"oficiální doporučení , o malých soukromých ubytovnách zápasících  o hosty";"nemluvě";", honosí jménem toho kterého posvátného místa . </s><s> Nepřijel sis"
"nl: nizozemština";"FIC: beletrie";"NOV: próza";"X: neuvedeno";"X: neuvedeno";"kdyby se to v Nizozemsku rozkřiklo ? </s>  <s> O Kubě ani";"nemluvě";", protože to by s tebou mohlo dopadnout zatraceně ošklivě"
"sv: švédština";"FIC: beletrie";"NOV: próza";"X: neuvedeno";"X: neuvedeno";"a Heisenberg byli ve skutečnosti malíři . </s>  <s> O Paracelsovi ani";"nemluvě";". </s>  <s> Je možné , že jí při psaní eseje pomáhal"
"da: dánština";"FIC: beletrie";"NOV: próza";"X: neuvedeno";"X: neuvedeno";"nabídnout . </s><s> Mzda je ubohá ,  o pracovní době ani";"nemluvě";". </s>  <s> Snížili stavy a práci se jim daří vykonávat jen"
"cs: čeština";"NFC: oborová literatura";"PRO: profesní literatura";"SSC: sociální vědy";"ECO: ekonomie, obchod, logistika";"Řecko atd . jsou servisně dobře pokryty ,  o Turecku";"nemluvě";". </s>  <s> A v kuloárech jsem zaslechnul , že prostřednictvím našeho"
"sv: švédština";"FIC: beletrie";"NOV: próza";"X: neuvedeno";"X: neuvedeno";"Austenové , nebo vlastně knihy obecně ,  o opravdových mužích";"nemluvě";". </s>  <s> Byl to tak dokonale uspořádaný svět , že muset"
"cs: čeština";"NMG: publicistika";"LEI: volnočasová publicistika";"X: neuvedeno";"MIX: společnost";": to ve velkých městech nestačí ,  o Praze ani";"nemluvě";". </s>  <s> Pořád tedy nezbývá než čekat , kdy se stát"
"en: angličtina";"FIC: beletrie";"NOV: próza";"X: neuvedeno";"X: neuvedeno";"mor ? </s><s> To si nemohl vybrat třeba …  o psu";"nemluvě";"? </s>  <s> Tam je aspoň jakýs takýs milostný příběh . “ </s>"
"cs: čeština";"NMG: publicistika";"LEI: volnočasová publicistika";"X: neuvedeno";"LIF: životní styl";"<s> Nesnáším , když mě kouše hlava ,  o mastných vlasech";"nemluvě";". </s>  <s> Myji si je denně , maximálně obden , nechám"
"cs: čeština";"NMG: publicistika";"LEI: volnočasová publicistika";"X: neuvedeno";"LIF: životní styl";"je takovou velkou inspirativní ženou ,  o jejích jedenácti zpovídaných";"nemluvě";". </s>  <s> Nejsou činné ve vrcholných patrech veřejného života , ale"
