"cs: čeština";"FIC: beletrie";"COL: kratší próza";"X: neuvedeno";"X: neuvedeno";"spousta míst je stále bez signálu . </s>  <s> O horách ani";"nemluvě";", tam není signál vůbec žádný . </s><s> Jen občas se"
"cs: čeština";"NMG: publicistika";"NEW: tradiční publicistika";"X: neuvedeno";"NTW: celostátní tisk";"prchající do Německa za trojnásobným platem . </s>  <s> O ocenění lékařů";"nemluvě";". </s>  <s> Když připustíme , že Babišovi vedle soukromého byznysu opravdu"
"cs: čeština";"NFC: oborová literatura";"POP: populárně naučná literatura";"FTS: formální a technické vědy";"ICT: výpočetní technika";"stojí mnohdy více než elegantní notebook ,  o levných tabletech";"nemluvě";". </s>  <s> Jenže v dlouhodobém měřítku jsou právě stolní počítače tím"
"es: španělština";"NFC: oborová literatura";"MEM: memoáry, autobiografie";"MEM: memoáry, autobiografie";"MEM: memoáry, autobiografie";"pak druhou , předtím nohu ,  o rozbité hlavě ani";"nemluvě";". </s>  <s> Tyhle vášně mě nikdy nepřešly , ale naučil jsem"
"ru: ruština";"FIC: beletrie";"COL: kratší próza";"X: neuvedeno";"X: neuvedeno";". </s><s> Lidé nemají moc zdravé žaludky . </s>  <s> O zubech ani";"nemluvě";". </s>  <s> Ruské zuby , to jsou zuby za všechny drobný"
"cs: čeština";"NMG: publicistika";"LEI: volnočasová publicistika";"X: neuvedeno";"SCT: společenský život";"nikdy neměl mít krátké kalhoty ,  o trekových sandálech ani";"nemluvě";". </s>  <s> Tak příště snad lépe . </s><s> Matej Ruppert Heidi :"
"cs: čeština";"FIC: beletrie";"NOV: próza";"X: neuvedeno";"X: neuvedeno";"neřekla ani Ule . </s><s> Možná ani mámě –  o Janině";"nemluvě";". </s>  <s> Tajná kamarádka se jmenuje Julča . </s><s> Je tak tajná"
"cs: čeština";"NMG: publicistika";"LEI: volnočasová publicistika";"X: neuvedeno";"LIF: životní styl";"ze zeměžluči , řebříčku , pampelišky ,  o pelyňku ani";"nemluvě";". </s>  <s> I když tyto bylinky výrazně pomáhají , nedoporučuje se"
"en: angličtina";"FIC: beletrie";"COL: kratší próza";"X: neuvedeno";"X: neuvedeno";"v módu „ Žula “ . </s>  <s> O hlasových pokynech navigace";"nemluvě";". </s>  <s> Nejde mi na rozum , proč si lidé ,"
"en: angličtina";"FIC: beletrie";"NOV: próza";"X: neuvedeno";"X: neuvedeno";", jenže podezření není totéž co jistota ,  o důkazech";"nemluvě";". </s>  <s> Vypáčil jsem z Čepele všechno , co byl ochotný"
"cs: čeština";"NFC: oborová literatura";"MEM: memoáry, autobiografie";"MEM: memoáry, autobiografie";"MEM: memoáry, autobiografie";"ani v Dubrovníku jsem nikdy nebyl ,  o Španělsku ani";"nemluvě";", o čemž jsem ostatně jednou napsal písničku . </s><s> Čili"
"en: angličtina";"NFC: oborová literatura";"POP: populárně naučná literatura";"HUM: humanitní vědy";"INF: knihovnictví, informatika";"potravy pro jejich rostoucí populace ,  o jejich armádách ani";"nemluvě";". </s>  <s> Francouzský král Ludvík XVI . ( 1754 – 1793"
"en: angličtina";"FIC: beletrie";"NOV: próza";"X: neuvedeno";"X: neuvedeno";"Metarey udělali pro vašeho otce , pane . </s>  <s> O vás";"nemluvě";". ” </s><s> Jednoho zasněženého víkendu jsme si s Holly vyrazili"
"fr: francouzština";"FIC: beletrie";"NOV: próza";"X: neuvedeno";"X: neuvedeno";"příliš snadno nechávají inspirovat pařížským parlamentem ,  o anglickém ani";"nemluvě";". </s>  <s> A královna Anna Rakouská připomněla synovi , že nastal"
"cs: čeština";"NFC: oborová literatura";"POP: populárně naučná literatura";"FTS: formální a technické vědy";"TEC: technika";"předčí i svůj vzor Nissan Qashqai ,  o Kie Sportage";"nemluvě";". </s>  <s> Jenže to nejsou jediní soupeři , s nimiž se"
"cs: čeština";"NMG: publicistika";"NEW: tradiční publicistika";"X: neuvedeno";"NTW: celostátní tisk";", než je zvykem venku . </s>  <s> O složitém místním jazyku";"nemluvě";". </s>  <s> I liga je jiná . </s><s> Běhavá , uspěchaná ,"
"cs: čeština";"NFC: oborová literatura";"POP: populárně naučná literatura";"FTS: formální a technické vědy";"ICT: výpočetní technika";"stává i u dvakrát dražších sluchátek . </s>  <s> O mechanické výdrži";"nemluvě";", kvalitní provedení působí odolně . </s><s> Sluchátka Xiaomi zde zabodují"
"cs: čeština";"NFC: oborová literatura";"MEM: memoáry, autobiografie";"MEM: memoáry, autobiografie";"MEM: memoáry, autobiografie";"hlasité výdechy tě nachytají na švestce . </s>  <s> O běžné řeči";"nemluvě";". </s>  <s> Kdyby to bylo poškozený , nemohl bych si dělat"
"cs: čeština";"NMG: publicistika";"NEW: tradiční publicistika";"X: neuvedeno";"NTW: celostátní tisk";"na tom podstatně hůře než Němci ;  o Ukrajincích ani";"nemluvě";". </s>  <s> Loňská dohoda , jež umožnila dodávky suroviny na Ukrajinu"
