"cs: čeština";"NFC: oborová literatura";"PRO: profesní literatura";"SSC: sociální vědy";"EDU: pedagogika";"s přítelem a dědeček s přítelkyní . </s>  <s> O škole ani";"nemluvě";", tam se o sociální vazby v rodinách začínají zajímat"
"cs: čeština";"NMG: publicistika";"LEI: volnočasová publicistika";"X: neuvedeno";"LIF: životní styl";"mělo by přispívat na domácnost ,  o rozdělení prací ani";"nemluvě";". </s>  <s> K vlastnímu bydlení můžete potomka také motivovat tím ,"
"cs: čeština";"FIC: beletrie";"NOV: próza";"X: neuvedeno";"X: neuvedeno";"udržet byt nebo domek útulný a čistý ,  o vaření";"nemluvě";". </s>  <s> Zamilovaný jsem byl dvakrát a dvakrát nastal kolaps organismu"
"cs: čeština";"NMG: publicistika";"NEW: tradiční publicistika";"X: neuvedeno";"REG: regionální tisk";"evropských pohárech odpískal celkem 130 zápasů . </s>  <s> O Česku ani";"nemluvě";", po sudím Pavlu Královcovi drží druhé místo v počtu"
"cs: čeština";"NFC: oborová literatura";"POP: populárně naučná literatura";"HUM: humanitní vědy";"INF: knihovnictví, informatika";", Uranu a Neptunu , jsou fantastické ,  o Merkuru";"nemluvě";". </s>  <s> Snímky zachycují podivuhodné detaily , dokonce i v případě"
"cs: čeština";"NMG: publicistika";"NEW: tradiční publicistika";"X: neuvedeno";"NTW: celostátní tisk";"rádií ( s výjimkou Proglasu ) ,  o Radiožurnálu vůbec";"nemluvě";", nezaměstnávala hluchoněmé redaktory po lobotomii , okamžitě po vynikající"
"sv: švédština";"FIC: beletrie";"NOV: próza";"X: neuvedeno";"X: neuvedeno";"žádný rozdíl mezi hmotou a duchem ,  o nadsmyslnu ani";"nemluvě";". </s>  <s> Všechno bylo sešité a sestehované . </s><s> Zvolil si lehce"
"cs: čeština";"FIC: beletrie";"NOV: próza";"X: neuvedeno";"X: neuvedeno";"oslabení po porodu stačila nějaká nákaza ,  o strašnějších nemocech";"nemluvě";". </s>  <s> Spalničky , černý kašel , neštovice . </s><s> To všechno"
"cs: čeština";"NFC: oborová literatura";"POP: populárně naučná literatura";"FTS: formální a technické vědy";"TEC: technika";"vzduchu v normálně vysokých autech . </s>  <s> O crossoverech a SUV";"nemluvě";". </s>  <s> Strmý nárůst spotřeby ze 110 na 130 km /"
"cs: čeština";"FIC: beletrie";"NOV: próza";"X: neuvedeno";"X: neuvedeno";"<s> Stále perfektní angličtina , němčina i francouzština (  o ruštině";"nemluvě";") a pověst progresivního osmašedesátníka mu pomohly až do horních"
"de: němčina";"NFC: oborová literatura";"MEM: memoáry, autobiografie";"MEM: memoáry, autobiografie";"MEM: memoáry, autobiografie";"<s> Nedokážou tu vyhodnotit ani otisky prstů ,  o zkouškách DNA";"nemluvě";". </s>  <s> Doznání je tedy třeba z někoho vyrazit . </s><s> Jiná"
"cs: čeština";"FIC: beletrie";"NOV: próza";"X: neuvedeno";"X: neuvedeno";"a přilákat novináře je čím dál těžší ,  o televizních";"nemluvě";". </s>  <s> Podle Karla jim je jedno , že se z"
"cs: čeština";"NMG: publicistika";"LEI: volnočasová publicistika";"X: neuvedeno";"HOU: bydlení, zahrada, hobby";"a „ zlepšovatelem nálady “ . </s>  <s> O afrodiziakálních účincích ani";"nemluvě";"– možná právě proto se bez ní obejde málokterý svátek"
"cs: čeština";"NFC: oborová literatura";"POP: populárně naučná literatura";"ITD: interdisciplinární";"ITD: interdisciplinární";"- homosexuální a pedofilní sklony ,  o skupinovém sexu ani";"nemluvě";". </s>  <s> Později přišlo i další žhavé téma - feromony . </s>"
"cs: čeština";"NMG: publicistika";"NEW: tradiční publicistika";"X: neuvedeno";"NTW: celostátní tisk";"jejich disciplíny nebyly popularizovány olympiádou ,  o televizních komentátorech ani";"nemluvě";"? </s>  <s> Thomas Bach si je dobře vědom toho , že"
"cs: čeština";"NFC: oborová literatura";"SCI: odborná literatura";"SSC: sociální vědy";"PSY: psychologie";"velké části na implicitní rovině a rodič (  o dítěti";"nemluvě";") většinu z nich vědomě vůbec neregistruje . </s><s> Prostřednictvím percepčního"
"cs: čeština";"NMG: publicistika";"LEI: volnočasová publicistika";"X: neuvedeno";"SCT: společenský život";"<s> Nechyběly lyžařské kukly či brýle ,  o teplém spodním prádle";"nemluvě";"... </s>  <s> A hráči ? </s><s> Kouřilo se jim z úst i"
"en: angličtina";"FIC: beletrie";"NOV: próza";"X: neuvedeno";"X: neuvedeno";"náturu . </s><s> Navíc má výhodu ve výšce ,  o váze";"nemluvě";". </s>  <s> Na staršího chlapa je v dobré kondici . </s><s> Pod"
"en: angličtina";"FIC: beletrie";"COL: kratší próza";"X: neuvedeno";"X: neuvedeno";", o smlouvě na knihu a  o cyklu přednášek ani";"nemluvě";". </s>  <s> Neuškodí ani to , že jsme na planetě našli"
"cs: čeština";"NFC: oborová literatura";"POP: populárně naučná literatura";"ITD: interdisciplinární";"ITD: interdisciplinární";"přesvědčivě předat našim západním sousedům ,  o těch východních ani";"nemluvě";". </s>  <s> Ani dosud silné zaměření naší civilizace na vědu bychom"
"cs: čeština";"NMG: publicistika";"NEW: tradiční publicistika";"X: neuvedeno";"NTW: celostátní tisk";"náklady pohodlím a úsporou času ,  o radosti prarodičů ani";"nemluvě";". </s>  <s> Tiskárna Pixma MG2450 od Canonu </s><s> MIRO NE T </s><s> Wi-fi"
"en: angličtina";"FIC: beletrie";"NOV: próza";"X: neuvedeno";"X: neuvedeno";"zde byla jeho žena a dcera . </s>  <s> O Dierdre ani";"nemluvě";", ta už si těchhle věcí musela zažít dosyta . </s>"
"cs: čeština";"NFC: oborová literatura";"POP: populárně naučná literatura";"FTS: formální a technické vědy";"TEC: technika";"korejskou konkurenci ( rozuměj Samsung ) ,  o japonské ani";"nemluvě";". </s>  <s> Aby ne , když na výstavě CES firma prozradila"
"de: němčina";"NFC: oborová literatura";"POP: populárně naučná literatura";"HUM: humanitní vědy";"HIS: historie, biografie";"nikoho mimo ghetto jedinou pistoli ,  o těžkých zbraních ani";"nemluvě";". </s>  <s> Nenašli jsme ani jedinou skupinu , která by se"
"cs: čeština";"NFC: oborová literatura";"POP: populárně naučná literatura";"FTS: formální a technické vědy";"TEC: technika";"uživateli zpříjemní práci s phabletem . </s>  <s> O dotykovém peru ani";"nemluvě";", natož o přehršli příslušenství – včetně chytrých hodinek a"
"cs: čeština";"NMG: publicistika";"LEI: volnočasová publicistika";"X: neuvedeno";"MIX: společnost";"jsme čekali ! </s><s> Peří bylo všude ,  o zápachu ani";"nemluvě";". </s>  <s> Ale když jsme úklid skončili , „ obytňák “"
"cs: čeština";"FIC: beletrie";"NOV: próza";"X: neuvedeno";"X: neuvedeno";"ani fotbal obvykle nekončí před půl sedmou ,  o hokeji";"nemluvě";". </s>  <s> Šéf kýval hlavou a sterilně se usmíval . </s><s> Co"
"cs: čeština";"NFC: oborová literatura";"POP: populárně naučná literatura";"HUM: humanitní vědy";"PHI: filozofie, náboženství";"<s> Akupunktura by zde měla své místo ,  o psychosomatice ani";"nemluvě";". </s>  <s> Je v rozporu s křesťanstvím skutečně i fytoterapie ? </s>"
"cs: čeština";"NFC: oborová literatura";"POP: populárně naučná literatura";"FTS: formální a technické vědy";"TEC: technika";"malty od hlavy až k patě ,  o nástrojích ani";"nemluvě";". </s>  <s> Se speciální maltou a patřičným náčiním se zedničina promění"
"en: angličtina";"NFC: oborová literatura";"MEM: memoáry, autobiografie";"MEM: memoáry, autobiografie";"MEM: memoáry, autobiografie";"Keanem , Macreadym , Phelpsem a Boothem ,  o mně";"nemluvě";". </s>  <s> Spolu jsme vystupovali v Astley’s , když byla na"
"cs: čeština";"NMG: publicistika";"LEI: volnočasová publicistika";"X: neuvedeno";"MIX: společnost";"zastínila i sestru Kate u oltáře ,  o princi Williamovi";"nemluvě";". </s>  <s> Kam se poděl tenhle „ nejkrásnější zadeček světa “"
"cs: čeština";"NMG: publicistika";"LEI: volnočasová publicistika";"X: neuvedeno";"SCT: společenský život";"a … </s><s> Kůže kolem očí je tenčí (  o citlivosti";"nemluvě";") a až pětkrát více pórovitá než na zbytku těla"
"nl: nizozemština";"FIC: beletrie";"NOV: próza";"X: neuvedeno";"X: neuvedeno";"a přáteli o tom nikdy nemluvil ,  o přítelkyních ani";"nemluvě";", a sám na to také skoro nemyslel . </s><s> Bylo"
"sv: švédština";"FIC: beletrie";"NOV: próza";"X: neuvedeno";"X: neuvedeno";", aby náš systém nikdo nezneužil ,  o napíchnutí ani";"nemluvě";", a dnes stačí sebemenší odchylka od normálu , sebemenší"
"en: angličtina";"FIC: beletrie";"NOV: próza";"X: neuvedeno";"X: neuvedeno";"protože každý pátek otiskuje celou stranu kuponů ,  o křížovce";"nemluvě";". </s>  <s> Mobil v kapsičce u košile spustil slavnostní pochod . </s>"
"cs: čeština";"NMG: publicistika";"NEW: tradiční publicistika";"X: neuvedeno";"NTW: celostátní tisk";"se starými pořádky jen někam vytratila krása . </s>  <s> O nesmrtelnosti";"nemluvě";". </s>  <s> Prezident má vůči ČNB pravomoci takřka absolutistické </s><s> Výměna guvernéra"
"cs: čeština";"NFC: oborová literatura";"POP: populárně naučná literatura";"SSC: sociální vědy";"EDU: pedagogika";"daleko sebevědoměji než generace jejich rodičů ,  o prarodičích ani";"nemluvě";", a jestli jsou to jedináčci , starší či mladší"
"cs: čeština";"NFC: oborová literatura";"POP: populárně naučná literatura";"NAT: přírodní vědy";"BIO: biologie";"<s> Ulice Dzeržinského , Urického a dalších přízraků ,  o Leninově";"nemluvě";", jsou stále , kde bývaly ( v Znamenském monastýru"
"ru: ruština";"NFC: oborová literatura";"MEM: memoáry, autobiografie";"MEM: memoáry, autobiografie";"MEM: memoáry, autobiografie";"jich padne už před útokem ,  o útoku samotném ani";"nemluvě";". </s>  <s> No a ten tresťák s kulometem najednou povídá :"
"en: angličtina";"FIC: beletrie";"NOV: próza";"X: neuvedeno";"X: neuvedeno";"v zákulisí věnovala sotva pohled ,  o vlídném slově ani";"nemluvě";". </s>  <s> Vzhledem k tomuto nezájmu Rosa , stejně jako většina"
"ru: ruština";"FIC: beletrie";"COL: kratší próza";"X: neuvedeno";"X: neuvedeno";"hlupáček a Oblomov jsou tuláci . </s>  <s> O Ostapovi Benderovi ani";"nemluvě";". </s>  <s> A sovětská turistika s kytarou , to je rovněž"
"en: angličtina";"FIC: beletrie";"NOV: próza";"X: neuvedeno";"X: neuvedeno";"prasečkář nebude na podzim nosit šortky ,  o zimě ani";"nemluvě";". </s>  <s> 4 . Žádný prasečkář nebude nikdy přistižen , jak"
"cs: čeština";"NFC: oborová literatura";"POP: populárně naučná literatura";"FTS: formální a technické vědy";"TEC: technika";"jejím součástem málokdo dobře rozumí . </s>  <s> O finančních nákladech ani";"nemluvě";". </s>  <s> Bez vody , elektřiny ani topení se neobejdete . </s>"
"cs: čeština";"FIC: beletrie";"COL: kratší próza";"X: neuvedeno";"X: neuvedeno";"už samotné vyslovení jejího titulu . </s>  <s> O mé rodné řeči";"nemluvě";". </s>  <s> „ Dá se uplatit sexem ? “ zeptala se"
"zh: čínština";"FIC: beletrie";"NOV: próza";"X: neuvedeno";"X: neuvedeno";". </s><s> Ani ve velkoměstech tohle všechno nemají ,  o vnitrozemí";"nemluvě";". “ </s><s> Její tvář naplňuje starostlivost a péče . </s><s> Těžko"
"cs: čeština";"NMG: publicistika";"NEW: tradiční publicistika";"X: neuvedeno";"NTW: celostátní tisk";"jen čtyři body z matematiky . </s>  <s> O středních odborných školách";"nemluvě";". </s>  <s> Jak dopadli uchazeči o čtyřleté obory ( percentilové skóre"
"cs: čeština";"NFC: oborová literatura";"PRO: profesní literatura";"FTS: formální a technické vědy";"ICT: výpočetní technika";"obsazených nějakých 40 MB paměti ,  o dalších systémových zdrojích";"nemluvě";". </s>  <s> A není rozhodně vizitkou kvality a profesionality programátora ,"
"cs: čeština";"NMG: publicistika";"LEI: volnočasová publicistika";"X: neuvedeno";"LIF: životní styl";"mužstvu nebo týmu jihoafrických ragbistů ,  o německých fotbalistech ani";"nemluvě";". </s>  <s> Jde vlastně o to , jít jen o kousek"
"cs: čeština";"FIC: beletrie";"COL: kratší próza";"X: neuvedeno";"X: neuvedeno";"se zbytky vlasů sčesanými do patky ,  o obličeji raději";"nemluvě";". </s>  <s> Dlouhý talár na zem naštěstí skrýval vše ostatní až"
"cs: čeština";"NMG: publicistika";"LEI: volnočasová publicistika";"X: neuvedeno";"SCT: společenský život";"tak jí jakožto benjamínkovi leccos prošlo ,  o nejrůznějších privilegiích";"nemluvě";". </s>  <s> „ Všichni byli o dost starší , takže mě"
"en: angličtina";"FIC: beletrie";"NOV: próza";"X: neuvedeno";"X: neuvedeno";", Burra i svého vlastního bratrance Samuela . </s>  <s> O Jeffersonovi";"nemluvě";"- - jen taktak . </s><s> Neměl nic z Washingtonova charismatu"
"cs: čeština";"NMG: publicistika";"NEW: tradiční publicistika";"X: neuvedeno";"REG: regionální tisk";"v dešti , začíná být nebezpečné . </s>  <s> O extrémní hlučnosti";"nemluvě";". </s>  <s> Jakýkoliv dobře udělaný asfalt bude zásadně tišší , bezpečnější"
"cs: čeština";"NMG: publicistika";"LEI: volnočasová publicistika";"X: neuvedeno";"HOU: bydlení, zahrada, hobby";"na roztápění velkého krbu či krbových kamen ,  o kotli";"nemluvě";". </s>  <s> U peletových kamen asi bude trochu pokulhávat romantika hravých"
"en: angličtina";"FIC: beletrie";"NOV: próza";"X: neuvedeno";"X: neuvedeno";"jestli jste už dost zralí ,  o finanční stránce ani";"nemluvě";". “ </s><s> „ Ano , “ odpověděl James , ačkoli"
"cs: čeština";"NMG: publicistika";"NEW: tradiční publicistika";"X: neuvedeno";"NTW: celostátní tisk";"bezprostředně ohrožují . </s><s> Naopak Ukrajina nikoho nezajímá . </s>  <s> O Krymu";"nemluvě";". </s>  <s> Dochází dokonce ke sbližování s Putinem a myslím ,"
"en: angličtina";"FIC: beletrie";"NOV: próza";"X: neuvedeno";"X: neuvedeno";"to neusnadňovala . </s><s> Špatně se mu dýchalo ,  o jídle";"nemluvě";". </s>  <s> Isabella byla svěží jako rybička a pusa jí jen"
"ja: japonština";"FIC: beletrie";"NOV: próza";"X: neuvedeno";"X: neuvedeno";"<s> A Edvard je moc hodný ,  o jeho rodině ani";"nemluvě";". </s>  <s> A dobře jsem se tu i zapracovala . “ </s>"
"ru: ruština";"FIC: beletrie";"NOV: próza";"X: neuvedeno";"X: neuvedeno";"a lesby tam ale samozřejmě mají ,  o animalistech ani";"nemluvě";"– ti na venkově tvoří polovinu populace . </s><s> Pokud mezi"
"cs: čeština";"NMG: publicistika";"NEW: tradiční publicistika";"X: neuvedeno";"NTW: celostátní tisk";"rozsáhlá témata vhodná pro antologii (  o hudebním materiálu vůbec";"nemluvě";") nejsou ani zdaleka pokryta . </s><s> Vzhledem ke kvalitě výběrů"
"no: norština";"FIC: beletrie";"NOV: próza";"X: neuvedeno";"X: neuvedeno";"? </s><s> Takové , vedle kterého já ,  o tobě ani";"nemluvě";", vypadám jako somálský přistěhovalec , co umývá záchody tamhle"
"cs: čeština";"FIC: beletrie";"NOV: próza";"X: neuvedeno";"X: neuvedeno";"dokonce i malé automatizované továrny ,  o restauracích všeho druhu";"nemluvě";". </s>  <s> Není nutno vystrčit nos , když prší nebo fouká"
"cs: čeština";"FIC: beletrie";"COL: kratší próza";"X: neuvedeno";"X: neuvedeno";"nedají uspěchat a strouhání brambor chvíli trvá ,  o vaření";"nemluvě";". </s>  <s> Bohužel i když si dá kuchař na čas ,"
"cs: čeština";"NFC: oborová literatura";"PRO: profesní literatura";"NAT: přírodní vědy";"MED: lékařství";"toho nebyl šťastný a uspokojený ,  o smyslu toho ani";"nemluvě";". </s>  <s> Lobby a trh jsou ale vždycky silnější . </s><s> MUDr"
"cs: čeština";"NMG: publicistika";"NEW: tradiční publicistika";"X: neuvedeno";"NTW: celostátní tisk";"rodina , to vlastní recept ,  o krajových zvyklostech ani";"nemluvě";". </s>  <s> Někde se připravuje s uzeným vepřovým masem , jinde"
"cs: čeština";"FIC: beletrie";"NOV: próza";"X: neuvedeno";"X: neuvedeno";"než dejme tomu gymnaziální studium ,  o tý debilní brigádě";"nemluvě";". </s>  <s> Jarda dnes začal svůj den rovnou v lese . </s>"
"cs: čeština";"NFC: oborová literatura";"POP: populárně naučná literatura";"SSC: sociální vědy";"SOC: sociologie";"masa , do kterého se zakousl ,  o vlkovi ani";"nemluvě";"... </s>  <s> Je jistá obava , že vše , co žádáme"
"sv: švédština";"FIC: beletrie";"NOV: próza";"X: neuvedeno";"X: neuvedeno";"by to byl bůhvíjak zábavný vtip . </s><s> „  O Idgie";"nemluvě";". </s>  <s> Zvát vandráky na kořalku , navíc před obědem . </s>"
"cs: čeština";"NMG: publicistika";"LEI: volnočasová publicistika";"X: neuvedeno";"LIF: životní styl";"každé vesnici objevíte nějaký poklad . </s>  <s> O přírodních krásách ani";"nemluvě";". </s>  <s> Je tímto naprosto jedinečná . </s><s> Život v jiné zemi"
"cs: čeština";"FIC: beletrie";"COL: kratší próza";"X: neuvedeno";"X: neuvedeno";"jak uniknout stereotypu zdejších dní ,  o jiných únicích ani";"nemluvě";". </s>  <s> Takže : Říká se , že za naším ředitelem"
"cs: čeština";"NMG: publicistika";"LEI: volnočasová publicistika";"X: neuvedeno";"LIF: životní styl";"tak mohli dostat úplavici nebo tyfus ,  o nejrůznějších vyrážkách";"nemluvě";". </s>  <s> SMETÁNKA V PLAVKÁCH </s><s> Velkoryse pojatá plovárna představovala perfektní místo"
"en: angličtina";"NFC: oborová literatura";"SCI: odborná literatura";"HUM: humanitní vědy";"HIS: historie, biografie";"by se ostatní katolíci a intelektuálové ,  o zbytku národa";"nemluvě";", mohli opřít při rozhodování , zda skutky lidí kolem"
"cs: čeština";"NMG: publicistika";"LEI: volnočasová publicistika";"X: neuvedeno";"HOU: bydlení, zahrada, hobby";"kusy nemůžete přirozeně nechat stát na dešti ,  o zimě";"nemluvě";". </s>  <s> Ale když je hezky , není nic lepšího než"
"sv: švédština";"FIC: beletrie";"SCR: drama";"X: neuvedeno";"X: neuvedeno";"a totálním tělesným i duševním rozkladem . </s>  <s> O srdci ani";"nemluvě";"! </s>  <s> Výtah je váš nejhorší nepřítel . </s><s> Horší než vepřové"
"cs: čeština";"NMG: publicistika";"LEI: volnočasová publicistika";"X: neuvedeno";"LIF: životní styl";"podprsenky , jednu pohodlnější než druhou . </s>  <s> O hudbě ani";"nemluvě";"! </s>  <s> Kdysi jsem měla přehrávač na CD v podprsence a"
"cs: čeština";"NFC: oborová literatura";"POP: populárně naučná literatura";"NAT: přírodní vědy";"BIO: biologie";"srovnatelné se souostrovím na evropském kontinentě ,  o subtropech ani";"nemluvě";". </s>  <s> Jen deset původních dřevin dorůstá více než do metru"
"en: angličtina";"NFC: oborová literatura";"SCI: odborná literatura";"HUM: humanitní vědy";"HIS: historie, biografie";"časopisech Preuves nebo Liberté de l’esprit ,  o zahraničních periodikách";"nemluvě";", publikovali Denis de Rougemont , Nicola Chiaromonte , Arthur"
"en: angličtina";"NFC: oborová literatura";"POP: populárně naučná literatura";"SSC: sociální vědy";"PSY: psychologie";"přístupu k vašemu času a pozornosti (  o osobních údajích";"nemluvě";") , by měla být mnohem přísnější , a většina"
"cs: čeština";"NFC: oborová literatura";"POP: populárně naučná literatura";"FTS: formální a technické vědy";"ICT: výpočetní technika";". </s><s> Chytré a velmi praktické ,  o úspoře energie ani";"nemluvě";". </s>  <s> Revogi Power strip cena 2 990 Kč </s><s> Subtilní konvertibl </s>"
"en: angličtina";"NFC: oborová literatura";"MEM: memoáry, autobiografie";"MEM: memoáry, autobiografie";"MEM: memoáry, autobiografie";"bych rozbitou ústní dutinu vypláchl ,  o uhašení mučivé žízně";"nemluvě";". </s>  <s> Dveře do pokoje se náhle rozlétly a dovnitř vešel"
"cs: čeština";"NFC: oborová literatura";"POP: populárně naučná literatura";"HUM: humanitní vědy";"LAN: filologie";"takové přízně od vévodkyně nedostalo ,  o jiných dětech ani";"nemluvě";". </s>  <s> Vztah vévodkyně Zaháňské k Barunce bezpochyby nebyl náhodný a"
"cs: čeština";"NMG: publicistika";"LEI: volnočasová publicistika";"X: neuvedeno";"HOU: bydlení, zahrada, hobby";"věšák z kroucené vrby . </s><s> A  o jarním úklidu ani";"nemluvě";"! </s>  <s> Inspirativní čtení vám přeje </s><s> Velikonoční probouzení </s><s> LETOŠNÍ VELIKONOČNÍ SVÁTKY"
"cs: čeština";"NFC: oborová literatura";"POP: populárně naučná literatura";"FTS: formální a technické vědy";"ICT: výpočetní technika";"lépe chráněn než váš počítač domácí ,  o mobilním telefonu";"nemluvě";". </s>  <s> Vzdálený přístup k vašemu internetovému účtu je chráněn heslem"
"cs: čeština";"NFC: oborová literatura";"PRO: profesní literatura";"FTS: formální a technické vědy";"TEC: technika";"provozní náklady a funkčnost stavby ,  o výtvarném řešení ani";"nemluvě";". </s>  <s> Pokud chcete něco dělat poctivě a slušně , máte"
"cs: čeština";"NMG: publicistika";"LEI: volnočasová publicistika";"X: neuvedeno";"HOU: bydlení, zahrada, hobby";"vás každoročně utrácet za nový adventní věnec ,  o stromečku";"nemluvě";"? </s>  <s> Vadí vám , když pak ještě stále pěkné „"
"cs: čeština";"NFC: oborová literatura";"POP: populárně naučná literatura";"FTS: formální a technické vědy";"TEC: technika";"lehký a pevný kov vykazuje oproti titanu (  o hliníku";"nemluvě";") při srovnatelné tvrdosti dvaapůlkrát nižší měrnou hustotu , ale"
"cs: čeština";"NMG: publicistika";"LEI: volnočasová publicistika";"X: neuvedeno";"LIF: životní styl";"životě stále své pevné místo . </s>  <s> O mastných vlasech ani";"nemluvě";", někdy se z pyžama převléknu až odpoledne , když"
"cs: čeština";"NFC: oborová literatura";"SCI: odborná literatura";"HUM: humanitní vědy";"PHI: filozofie, náboženství";"kulturu a civilizaci nelze vůbec představit ,  o filosofii ani";"nemluvě";". </s>  <s> Když Whitehead napsal , že celá západní filosofie je"
"cs: čeština";"NMG: publicistika";"LEI: volnočasová publicistika";"X: neuvedeno";"LIF: životní styl";"kilometry jsou na začátek příliš ,  o desetikilometrovém závodě ani";"nemluvě";". </s>  <s> „ Pokud by nebyl člověk opatrný a hned se"
"cs: čeština";"FIC: beletrie";"NOV: próza";"X: neuvedeno";"X: neuvedeno";"budu taky příšerně nápadný , napadlo mě ,  o plísňácích";"nemluvě";". </s>  <s> Yveta mi ťukla do ramene a prstem ukázala na"
"cs: čeština";"NMG: publicistika";"NEW: tradiční publicistika";"X: neuvedeno";"NTW: celostátní tisk";"kvalitě . </s><s> Často jsou zatíženy nějakým břemenem ,  o nájmu";"nemluvě";". </s>  <s> Ukáže se třeba , že někdo má právo odebírat"
"cs: čeština";"FIC: beletrie";"VER: poezie";"X: neuvedeno";"X: neuvedeno";"podrážek . </s><s> Taky vánice už nejsou TAKOVÉ . </s>  <s> O Vánocích";"nemluvě";"! </s>  <s> Což teprve andělé ! </s><s> Andělé či andělové ? </s><s> TEN"
"en: angličtina";"NFC: oborová literatura";"SCI: odborná literatura";"HUM: humanitní vědy";"ART: umění, architektura";"řeckou pravoslavnou a římsko-katolickou církví -  o mnoha protestantských vyznáních";"nemluvě";". </s>  <s> "" Křesťanství "" také nezastírá změny , jichž doznaly"
"cs: čeština";"NMG: publicistika";"LEI: volnočasová publicistika";"X: neuvedeno";"INT: zajímavosti ze světa";"nebo pořizovat jakýkoliv další obrazový materiál -  o výrobě plánků";"nemluvě";". </s>  <s> Pod povrchem se údajně ukrývá zařízení , které na"
"cs: čeština";"NMG: publicistika";"NEW: tradiční publicistika";"X: neuvedeno";"NTW: celostátní tisk";", a zpravidla za mnohem méně peněz ,  o prestiži";"nemluvě";". </s>  <s> Mnozí z nich však už jen od rána sedí"
"cs: čeština";"NMG: publicistika";"NEW: tradiční publicistika";"X: neuvedeno";"NTW: celostátní tisk";"o dům dál okurky a melouny . </s>  <s> O milých lidech";"nemluvě";". </s>  <s> Příjemným překvapením byly i nové dálnice přes Rumunsko . </s>"
"cs: čeština";"NMG: publicistika";"LEI: volnočasová publicistika";"X: neuvedeno";"SCT: společenský život";"šmrncu , provokativního - náboje . </s>  <s> O konceptu epostylistického masakru";"nemluvě";". </s>  <s> Smysl špinavých lodiček a nohavic zasunutých do ponožek mně"
"cs: čeština";"NMG: publicistika";"LEI: volnočasová publicistika";"X: neuvedeno";"INT: zajímavosti ze světa";"je společností prakticky bez brannou . </s>  <s> O demografických dopadech ani";"nemluvě";". </s>  <s> Jaroslav Zvěřina , dlouholetý předseda české Sexuologické společnosti ,"
"de: němčina";"FIC: beletrie";"NOV: próza";"X: neuvedeno";"X: neuvedeno";", je mu od té doby jasné . </s>  <s> O strachu";"nemluvě";". </s>  <s> Kurt byl rád , že je připraven . </s><s> Že"
"cs: čeština";"NMG: publicistika";"LEI: volnočasová publicistika";"X: neuvedeno";"SCT: společenský život";"My ženy věčně nemáme co na sebe ,  o botách";"nemluvě";"! </s>  <s> A že chceme být stylové za všech okolností ,"
"cs: čeština";"NFC: oborová literatura";"POP: populárně naučná literatura";"NAT: přírodní vědy";"MED: lékařství";"mlhavou , nebo dokonce žádnou představu ,  o zkušenostech ani";"nemluvě";". </s>  <s> Každý lékař by měl být dopředu upozorněn , že"
